year,sentence,key_word
1933,"phosph. total 28 — Nitrate le soûle, 16 7. l'azote 95 » à 115 — Nitrate le chaux, 13 7« l'azote 90 » à 115 — Nitrate le cMx ammoniacal, 16,5°/o 1 azote",soûle
1878,"Tu es soûle comme une... fi C'est pour le coup que Mlle Thérèse, ouvrait de grands yeux, et je n'oublierai jamais l'accent avec lequel elle répondit : « — Non, monsieur, vous vous trompez",soûle
1936,Les souches sont alors soule' vées au passage par l'appareil de culture,soule
1927,"Français, réuni en séance plénière, Considérant l'émotion qu'ont soûle",soûle
1928,"Le Comte Dupont fait opérer une brusque intrusion domiciliaire chez Mabel, par un policier qui se soûle séance tenante, naturellement, et par un grand juge de la Cour suprême (pas moins) qui se trouve être un tout petit homme mais le seul de tous ces personnages qui ait au moins- l'apparence d'un Américain",soûle
1876,"Nous auons beu t'eau d'angoisse à plain verre, et tu nous as soulés d'amertume",soulés
1919,"1° Lo vido des vapeurs do la Compagnie Havraiso Péninsulaire et do la Compagnie des Messageries Maritimes ost toujours réparti moitié pour la Réunion et moitié pour Madag«iscar: cetto répartition no tient aucun compto des rétpjisitions nécessitées par los transports militaires, lesquelles sont supportées par la colonio do Madagascar soûle pour tout le groupe do l'océan Indien(...)",soûle
1964,Les résultats obtenus en ce qui concerne l'effet Hall de ces mêmes échantillons (fig. 3) sont sensiblement différents de ceux publiés pour des monocristaux de graphite dopés au bore par Soule (2) (qui a seulement mesuré le coefficient de Hall à 2g5 et 77°K(...),soule
1964,"606-6I3. (2) D. E. SOULE, Proceeding of the 5th Conference on Garboa, 1, p",soule
1870,"La salle, garnie d'une estrade, ne formait qu'une soûle pièce avec la chambre du Conseil et la salle du Musée, où était placée la musique",soûle
1920,"7 - SOULE IL (Maurice), Os rue du Fort",soule
1992,"b) Sociétés de crédits différé Retrait d'agrément e Compagnie française d'épargne et de crédit - CFEC, S.A., Paris c) Sociétés anonymes de crédit immobilier Retrait d'agrément e Société anonyme de crédit immobilier de Mauléon-Soule, S",soule
1932,"ltendu que les prévenus ne sont pas davantage fondés à soule- nir que le décret ne se suffit pas à lui-même et qu’il est inapplicable faute d’un règlement d’administration publique précisant les modalités de son application, que ce règlement(...)",soule
1839,382 Soleil 120 Souet 278 Soulé 379 Suchet,soulé
1839,Soulé C. Laffont.) ARRÊT,soulé
1928,t fond Dit l'incompétence ratione loci soule,soule
1899,"Si la pente longitudinale de ces terrasses est à peu près parallèle au profil actuel des cours d'eau, il y aura lieu de conclure à un soulè- vement uniforme",soulè
1936,Which latter 1 should conceived to be thé way that seperated soules know all that is done in this world by joining and diving into thé species they carry from hence,soules
1880,"il s'agit donc pour la Colonie, comme l'explique fort bien Mgr Soulé dans sa lettre à M. lo Directeur de l'intérieur, do",soulé
1939,"temps le gouvernement des Etats-Unis a considéré les comme susceptibles d'être modifiés, mais il a toujours soules modifications ne peuvent s'effectuer légitimement que ~procédures régulières de négociation et d'accord entre les ~En des nombreuses occasions, le gouvernement japonais a -qu, Il avait la même façon de voir",soules
1904,"Villemln, président do la Chambre syndicale do Maçonnerie, à M. Soulê, président du Groupe des Chambres syndicales : « Paris, loO avril 1001",soulê
1895,"DEUX NOUVEAUX CHEVALIERS DE LA LEGION D HONNEUR Sur la proposition du Ministre des colonies, Mgr Soulé, archevêque de Léontopolis, administrateur du diocèse de la Basse-Terre (Guadeloupe), et Mme Brière (Soeur Elise), de la Congrégation de Saint-Paul de Chartres, supérieure de la léproserie de la(...)",soulé
1898,"269 ment Soulé, qu'on croit être Kachgar), les Asi (Parthes) et plus de trente autres petits royaumes, se trouvèrent placés dans leur dépendance, et ils formèrent un empire puissant qui s'unit par des mariages avec les Jouan-Jouan",soulé
1865,Soûlés. lajan,soûlés
1913,"Aux quatrièmes : Le voyage d'agrément, et m'ine le pieux p*leri« nasje ne profiteront qu'à vous soûle",soûle
1997,"GOLSE Bernard, et SOULÉ Michel (sous la direction de), Origines, identités destinées",soulé
1901,"18 Art et Décoration on remarquera particulièrement les envois de MM. Charpentier, Soulès,Guilloux, Rispal et Seysses",soulès
1886,"Places, promenades, jeux (jeux de paume, de boule. soule, etc.). — Tirs à l'arc, à l'arbalète, aux armes à feu",soule
1883,"L’année militaire se terminant après les grandes manœuvres, il a paru inutile de maintenir juste une année soûles drapeaux les hommes de la 2 me postion de la classe 1882, appelés l’an dernier le 8 décembre",soûles
1883,Impérialistes du peuple on voulait soule- « ver le hls contre le père,soule
1873,Soulé,soulé
1873,"Soulé, place Strasbourg",soulé
1873,"Cabaretiers. - Claude Allard, Appap Fidelli, Appap Luidji, veuve André, Soules (Pierre), veuve Laurent, Gaëtan Ponchini, veuve Teulon, Salvator Gsabiel",soules
1892,"Soulé, prop , faub. st-jean 77",soulé
1880,effacer les ruines morales produites dans les âmes par l'erreur et pour amortir les haines soule,soule
1933,11 n'est plus possible d'écrire comme dans la note américaine eue « toute nation est soûle compétente pour décider quelles circonstances requièrent le recours à la guerre pour sa légitime défense(...),soûle
1929,"été soule- * vés, gonflés par un souffle venu d'en bas",soule
1915,30. — La loi recouuail Irois espèces de soûlés commerciales : Li société en nom collectif,soûlés
1865,"Les régions des Pyrénées et des Corbières percées par les ophites présentent des exemples de cette configuration particulière du sol, que Léopold de Buch appelle cratère de soulè(1) Durocher, Essai depétrologie comparée",soulè
1865,"d'Ancille, dans la vallée de Cize, et de divers endroits de la Vallée de Soule, indiqués(...)",soule
1865,"L'ophite formé encore de nombreux pointements dans les vallées de Soule, de Baigorry, de Sin, de Cinca, dans le pays de Cize",soule
1909,"Dame-de-Charité avant et pendant la Terreur, du soulè",soulè
1861,Leur importation dans ces montagnes constitue à elle soûle un fait dont l'intérêt sera facilement apprécié(...),soûle
1912,"Soûlé (Marius), 57, boulevard de Strasbourg",soûlé
2007,"Parmi les sauveteurs, signalons les deux adjoints au maire, Calmette et Carrère, ainsi que le commandant des pompiers de Moissac, Soulès",soulès
1891,"Il a été Iriiino par moi, et par moi soule, dans l'obscurité",soule
1891,H. (Avec énergie.) J'étais soûle,soûle
1848,auxquelles sera soule service de la publication du compte u remanié,soule
1898,Mgr Soulé,soulé
1831,le comte Soulès. le cou: te d'Alton-Shée. le comte de Tascher,soulès
1802,"Ses effets , on a soule tout n a soti e tout à la distil",soule
1909,"Albert SOULES, vice-président de l'Union des Sociétés de Préparation Militaire de France",soules
1942,Soulé (général(...),soulé
1826,"Soulas (décorateur), 197» Soulé-Limendoux (laines) , 368",soulé
1826,"Breveté d'importation pour la machine écossaise à ""fabriquer le papier avec dit soules",soules
1826,"SOULÉ-LIMENDOUX , rue Thévenot, n. 10",soulé
1846,"Soulès, p. m., rue Neuve-des-Petits-Chanips, 69",soulès
1979,Soulé et Lebovici,soulé
1913,"l'a signalé M. Albin Haller, dans le Jura français, le Jura suisse et la Forêt Noire, elle est aujourd'hui à peu près entièrement limitée au Jura bernois et particulièrement aux forêts communales de Soulee et de Traraelan, dans la vallée de Delémonl",soulee
1913,"ce sont principalement les procédés E. Kenberg, Passburg, Campbell, Bénôvot de Neveu, Morrell-Soule, Just-Katmaker, Gabler-Saliter,Mignot-P",soule
1950,"militant coopératif, Louis Soulé, pour défendre l'idéal de la Coopération, en étudier les problèmes et pour enseigner au grand public la valeur de la doctrine coopérative",soulé
1950,"Louis Soulé écrivait dans le numéro de décembre 1949 de « La Coopération de Production » : « L'enseigne coopérative étant aujourd'hui une excellente couverture morale et quelquefois, à l'égard du fisc notamment, un expédient juridique de tout repos, on pense bien que les intéressés n'ont pas laissé passer l(...)",soulé
1849,"212. — La lutte de la paume ou le jeu de la soûle, en mars 1830, à Caligny, frontière de l'Orne et du Calvados, pai le même",soûle
1926,"il est), que nous supposons avoir existé, répondait */ï~('a' (je suis), que nous retrouvons dans la forme M<'r, usitée aujourd'hui en Soule, dans la Basse-Navarre et dans une bonne partie du Labourd",soule
1880,"1 63 111.1 68^ Finderexpérienc' - Au total, en 238 minutes, 46 contractions du muscle utérin ont soule 111"" colonne de 2,148 millimètres de mercure",soule
1880,"en haut, de manière à soule col de la matrice plus au centre de la cavité pelvienne",soule
1880,"mais une le parvenue dans sa cavité, rien ne fut plus facile que d'en soûle parvenue dans sa cav(...)té, rien ne fut plus facile que d'en soule""etO",soûle
1932,"LES PRIMAIRES Et puis il n'a jamais fait de mal à personne ce petit vin-là, mais il a soûlé Bordain",soûlé
1908,soule' principal. fr. fr. fr. fr. fr,soule
1899,"j u matiere est pourtant très petite, car la soûle parcelle de Seigle de nrintemnsT",soûle
1897,"Paillet (C.), commis de régie, Mauléon Soûle (Basses-Pyrénées(...)",soûle
1823,"Soules, garde-magasin",soules
1904,"LES SILLONS DIAPHRAGMATIQUES DU FOIE Par le Docteur Jean BUY Il n'e^ pas rare de constater sur la face convexe du foie des dépressions plus ou moins profondes les unes, sous-jacentes aux côtes, sont transversales et ont pour siège la face droite du foie elles ont été étudiées d'une façon complète par Soulé qui, dans sa Thèse inaugurale (1902), en a donné un grand nombre de dessins les autres sont placées sur la face supérieure du foie leur direction est à peu près sagittale elles contiennent(...)",soulé
1904,"déiorniations du squelette costal, rétrécissement du diamètre transversal de la poitrine, étroitesse de l'angle xiphoidien 2° Caractères du foie de constriction foie en dôme, à diamètre vertical exagéré sillons costaux cicatriciels lobe marginal de coustriction déformations de la face inférieure tous caractères étudiés et figurés dans la thèse de Soulé 3° Déformations concomitantes des viscères abdominaux estomac biloculaire, sillons costaux de la rate, entéroptose et néphroptose 4° Absence(...)",soulé
1864,"SOULÉ (Louis), représentant du commerce, r",soulé
1901,"Dans la Soule il n'y eut que celui d'Arrast(...)Au xiv° siècle. cette famille répondait, vis-à-vis des vicomtes du Béarn, de la province de Soule",soule
1901,"SOULE (pays basque) : Ecartelé: aux 1 et 4 d'azur, au serpent d'argent(...)",soule
1901,"dont : 1° Jeanne, née en 1866, mariée en 1888 à Ludovic SOULÈS, petit-neveu du général Cte SOULÈS, pair de France,lieutenant général du royaume sous Louis-Philippe",soulès
1901,"SARRIEU (DE). — ~ de Siradan, ✉ ~ Mauléon - Soulé, e Saléchan (Basses-Pyrénées(...)",soulé
1901,"SOULÈS(...)aux 2 et 3 d'or, à deux épis de sable en sautoir accompagnés de quatre étoiles de gueules (armes octroyées par l'Empereur, le 20 mai.1808, au général, comte Soulès, sénateur, nommé pair de Franoe, le 4 juin 1814 et lieutenant général des armées du Roi(...)SOULÈS (LUDOVIC), marié en mai 1888, à Jeanne MILLOX DE MONTHERLAUT(...)",soulès
1901,"PAYS DE SOÛLE : D'azur, semé de fleurs de lis d'or, à la tour ouverte ajourée et crénelée d'argent, fnaçonnée de sable",soûle
1901,"MARTÈNE, dont 3 enfants. — Mauléon-Soule (Basses-Pyrénées(...)",soule
1901,"La famille d'Abbadie est celle des «Abbés Laies » d'Arrast, en Soule, province du Pays Basque",soule
1924,"incompétence des tribunaux roumains de statuer sur les questions déférées au tribunal arbitral mixte, peut être soule- vée, par conséquent, pour La première fois en appel",soule
1933,"Renseignements : S'adresser à M. Soulé, caissier-principal de la Société des Auteurs et Compositeurs dramatiques, 9, rue Ballu",soulé
1824,"ce dernier caraclèri y est très-distinctement marqué, comme l'a fort, bien observé M. Palassou , près de Saint-Jean-Pied-de-Port, au sud d'Alaxa , et près de l'église de Saint-Engrace, dans le pays de Soûle, etc",soûle
1929,"i i- , i ii i ■ ~î "" 7T~ 4.877 » // Augmentation due aux relèvements des soûles et indemnités",soûles
1864,un dernier effort le soulè\e et le porte au pied du coteau,soulè
1899,"mais rien de pratique ne parut jusqu’à la coopération de MM. Sholes, Soulé et Glidden, en 1867",soulé
1922,Services d'administration générale (Per-/ ^ ^ SoUle et relevcment provisoire de M. Russier. kOlUCl j(...),soule
1930,"Notes bibliographiques SUR LES QUESTIONS ET LES AUTEURS DES PROGRAMMES D'AGREGATION (1931) AGRÉGATION D'HISTOIRE ET DE GÉOGRAPHIE L'ÉGLISE DE L'AVÈNEMENT DE LÉON LE GrUND JUSQU'A LA MORT DE JEAN VIII (440-882) Le libellé de la question, rédigé sous une forme très générale, impose aux candidats l'obligation d'étudier les problèmes très variés que soulè%e l'histoire de l'Eglise chrétienne et les diverses manifestations de la vie religieuse au sein de cette même église durant la période envisagée",soulè
1872,Leurtault (H. Ve) et fils et Soulé,soulé
1885,"Au point de vue simplement juridique, l'hymen indissoluble soulè",soulè
1914,50 — Ei soulé intran queil la mounlanbo nigro De Saint-Sestiers s'en vai saiqu'a Tarnats,soulé
1934,L'affectation des crédits employés aux dépenses sanitaires n'a soule\é aucune objection de la part de votre,soule
1934,"Y compris les indemnités de charges militaires, pour charges de j. ,er __ SoUle (iu personnel européen. . . 4 120 lamille, de logement, le supplément de logement, l'abondement, 2 _ Inueninilé spéciale de fonctions à 1 I indemnité différentielle et les charges de famille garanties par 1er maître mécanicien 4X0 la Colonie Indemnité de compensation au même: 1",soule
1937,19 Japonais - & soûle Japon — Corée 83 navires dont 12 chargés 6 Norvégiens — Canada de 29.764 TA de Port — Japon j Courbet — Chine 5,soûle
1931,"Une soûle question peut soulever une hésitation cette indemnité CWJlér rera-t-clle la Compagnie d'assurances P L'article 7 prévoit l'exonération du chef d'entreprise, et l'assureur n'est lui-même exonéré que parce qu'il lUI est substitué",soûle
1931,"à la Compagnie La Nationale de ce qu'elle rétracte les conclusions par elle signifiées le 23 octobre 1929 et qui soule-^ vaient un- moyen de déchéance sur lequel il a été statué par juge-1 ment du 28 juin 1928, devenu définitif(...)",soule
1878,La recon^tructio© de ce marché s'impose Õ. une administration municipale soucieuse des intérêts du commerce et de l'embelhssement de la ville Le projet présenté paraît répondre à tous les besoins et n'a soule,soule
1878,L'une des faces est réservée à l'adresse soule,soule
1969,"Divers individus du détachement qui se porta au hameau de Soule par suite de notre arrêté du 29 prairial dernier se sont permis (111) « Quant à la nullité de la gendarmerie, je crois depuis longtemps qu'elle doit être connue car on ne peut se dissimuler que si elle était en activité, des hommes revêtus d'uniformes(...)",soule
1894,"Soulé, ff A., économe(...)",soulé
1957,ur les opérations des Source d'épargne privées G 9 N Q M B R E FQRTUNE PERSOII- VERSEMENTS ET RETRAI TS et SOUlE DU AUX NCJMIIRE DE MOYENNE NOMBRE DE MOYENNE 1 A N NEE S «ELLE DES CAISSCS — - ACHATS DE RENTES,soule
1897,Le Puy Simon 3 mai Bourges Labiche 4 mai Chartres Janvier de la Motte 31 mai Troyes Lemaire 28 juin Le Mans Le Roy 8 juil Carcassonne Escalier de Ladevèze 27 oct Avignon 1889 Blume 17 jan St-Quentin Loison 19 mars Orléans Berlaud 20 juil Dijon Comte 20 juil Chambéry Carbonel 20 août Roanne Bernard 20 août Cherbourg Picard 7 nov Blois Boulangé 28 nov Troyes Thiénard 28 nov Nevers Viala 28 nov Béziers 1890 Bellet 4 jan Boulogne Guesdon 28 jan Rennes Soulé 21 fév Pau Mazeaud 21 fév Limoges Prax 1(...),soulé
1897,"40,19mai84 Soulé, juge, 33, 21 fév no Ducastaing, juge, 51, 23 nov 95 Privât, sup, 64, 26 juil 93 Sarthou, sup, 64, 16 mars 95 Aris, pro, 53, 23 oct 94 Vidai, sub, 63, 27 juin 96 Périgueux",soulé
1897,Soulé(François)Pau31 oct 33 — Av.anc.avoué,soulé
1892,"GUÉRISON COMPLÉTÉ del’ALBUMINURIE.del’ECZEMA, et de TOUS VICES dn SANG en général, par la TISANE de PLANTES DÉPURATIVES du Docteur SOULÊS. — Le Klacon 5 francs",soulês
1989,"2391 Soûle, Dominique Réd",soûle
1989,"réd. par Dominique Soûle et Laura Perrin. — Paris : CFCE, 1988. — 425 p. : ill(...)",soûle
1937,"Ets Soulé, à Bagnères-deBigorre(...)",soulé
1928,"SOULE JEAN, Négociant, Suppléant du Juge de paix, Paulhaguet",soule
1928,"Traduit de l'anglais par F. S. (SouLÈs), 2* édit., Paris, Buisson, 1794, 3 vol. in 8° T",soulès
1894,"Soulé, admin. apost(...)",soulé
1885,Ce tableau de la misère humaine est fait pour soule,soule
1885,"364 LES ANNALES DU THÉÂTRE tement à son travail et qui ne se soûle point: « Vous, le peuple dit Goujet aux ivrognes et aux fainéants, qui ont la prétention de représenter la classe populaire, vous n'en êtes que la honte",soûle
1905,"Le Basque du Labourd ou de la Soule était, en effet, censé savoir quelque peu notre idiome national",soule
1905,N'est-ce rien pour un Basque du Labourd ou de la Soule que d'être compris en Guipuzcoa,soule
1863,"ces plaines, dont la largeur est médiocre entre le fleuve et les premicres montées de la chaîne abrupte des montagnes de Momon(Soule'iman-koh), portent depuis Attok jusqu'à la frontière du Sindhi le nom indien de Déradjàt",soule
1892,"La soûle opérations indispensable consiste à laisser tremper la pellicule, après le dernier lavage, dans nn bain de glycérine à GO centimètres cube par litre, puis faire sécher sur un égouttoir",soûle
1843,"Duchatel, ministrpf répond d'abord à la réclamation qui a soule\é l'incident",soule
1843,"A cet égard, M. le Garde des sceaux a proposé d'ajouter deux exceptions dans le texte de la loi nouvelle, que le membre qui a soule'é la difficulté a paru accepter",soule
1909,"C’est de ces principes que se sont inspirés les membres du Conseil supérieur du travail, MM. Touro'n, Dévillette, Soulé, Bor- derel, Heurteau, Caute, Potin",soulé
1901,"Congressistes ont été voir l'abside de cette église chez des négociants en drogueries, MM. Pouy-Desseau et Soules",soules
1914,"L'Crc emis des timbres « Sou- venez-vous a émis des timbres ( Soules b -VOUS! n, qu'on trouve dans tous Unl bureauv de tabac au prix de 5 cen",soules
1899,"Il nous suffira de dire : Le foot-ball est un jeu de ballon issu de l'ancien jeu français nommé soule, ou barrette, ou pelote, selon les pays, et que nos ancêtres jouaient avec fureur",soule
1869,"Soulé, de pleins pouvoirs « pour conclure une convention ou un traité ayant pour objet l'achat de Cuba(...)Soulé, qui avait sondé le terrain, ne paraît pas avoir -osé, engager formellement les négociations, malgré l'appui que devaient lui donner ses collègues de Londres et de Paris",soulé
1869,"un armistice pendant lequel, l'assemblée nationale .et la commune étant dis-soules, on procéderait »aux élections ^municipales à Paris, et dans toute la France à l'élection d'une -constituante",soules
1869,Ces deux articles soûle,soûle
1869,"Pierre Soulé, celui de tous les Français naturalisés aux États-Unis qui a joué le rôle le plus brillant: sénateur de l'état la Louisiane au congrès en 1847, et riiinistre en '"" Espagne de 1853 à 1855(...)",soulé
1873,I COMPOSITION ZOUAVE II I pour noircir moustaches et favoris. - - --- - - -- EAU D ALBION pom U TOILETTE Préféréo au Vinaigre dont ellr ne contient pas les principes irritants PARFUMS EXQUIS CÉPHALINE Soûle Composition qui détruise sans retour les Pellicules de la téte -------- ----- -- ----~ Ce Savon 6e recommande par ses qualités(...),soûle
1861,"Plusieurs des nôtres furent atteints, entre autres M. de Casai qui eut la cuisse traversée sans fracture, Soulé, sergent de tirailleurs indigènes., ek",soulé
1861,"Au nom de Sa Majesté Napoléon III, Empereur des Français, Le traité de paix suivant a, été conclu entre le lieutenantcolonel du génie Foidherbe, officier de la Légion d'honneur, Goure) neur du Sénégal, et le tonka du Guoy, Boubakar-Soulé : Le tonka (roi) du Guoy, reconnaissant qu'en 'dehors de l'alliance française, il n'y a pour(...)Signature du tonka Boubakar,Soulé",soulé
1861,"Les nommes : Siré-Boye, Soulé-Awa, Galadi-Dialla , ne sachant signer, ont fait leur marque",soulé
1930,Le jeu piatiqué généralement dans la région de Château-Thierry et qui se trouvait ainsi interdit par le roi était la soûle ou choule (de solea : sandale(...),soûle
1853,"Soûles et Hardon, brevetés s. g. d. g",soûles
1853,"Soûles (H.) et Hardon, flambeaux, lustres , suspensions, candélabres, trépieds, etc. — Cerisaie(...)",soûles
1858,chaque periode de 4 ans sera soule mode,soule
1858,"SoULÈS. - inspection de Chaumont G. gén. adj., remplissant les fonc(Haute-Marne). lions de brigadier sans triage à Prémery (Nièvre(...)",soulès
1908,Et l’âcre exhalaison de ce charnier putride La délecte et la soûle ainsi qu’un rouge encens. — Las des chastes amours et des claires prunelles Tu vois(...),soûle
1905,la course ne se borna pas toujours aux soûles côtes d'Espagne,soûles
1904,C'était la soûle qui se soignât,soûle
1904,"Anl.oiiin Dubosl, rapporteur de la Commission desiinances.au Sénat, remettant les choses au point, déclarait que le déficit s'élevait, pour les deux soûles années 1901 ot 1902, à plus de(...)",soûles
1990,"18 - ROCK M.G., PRITCHARD D.J., REIMAN H.M., SOULE E.H., BREWSTER R.C. - Extra abdominal desmoid tumors",soule
1990,"51 - RANQUE P., TOURE T.Y., SOULE G., LE Du, DIALLO Y., TRAORE O., DUFLO B. et BALIQUE H. - Etude expérimentale sur l'utilisation de moustiquaires imprégnées de deltaméth(...)",soule
1879,Soulé,soulé
1879,"SOULÉ, ancien Bâtonnier. — 17 oct. 1879, Cons. à Pau",soulé
1879,"549 Soulé, Pau",soulé
1882,3. bis. ® (à l'avant » » 80 » » 80 Soule avant.. < l'avant. 80 )) 80 (à l'arrière » 80 » 48 » 128 Soute arrière lil'avaat 84 12 tribord l'arrière 20 4 24 I arrlere(...),soule
1824,Le comte Soulès,soulès
1927,"Touristes soûlés de doctrines et de chants, vous at-on dit que ce commissaire-priseur vend tout sans contrôle(...)",soûlés
1883,"montant contre Mont jusqu'à une petite reze, qui départ du bout dessus jusqu'au fié du prieur d'Anés, et puis s'en revient tout au long desdites vignes par debas jusqu'au dit chemin par où l'en vat dudit lieu de Frezes jusqu'à Guignemore et jusqu'au fié de Guillaume Viau, et d'illec s'en va en une cornière dudit fié et membre d'icelluy, qui s'appelle le Fourioul, et le fié apellé le fié aux Berloins, qui se tient d'un costé au chemin par où l'on vat du truil aux Ribotaux à Sainte-Soule jusque à(...)",soule
1883,"puissant seigneur monsire Jean Harpadenne, chevallier, seigneur de Nuaillé et de Montandre, à cause de son châtel de Nuaillé, et de sa chatellenie dudit lieu, les chouses qui s'ensuivent: c'est asçavoir un fié apellé le fié de Grastefuil avec touttes ses appartenences et apendences parséant ledit fié, ès parroiches de Verinnes, d'Angliers et de Sainte-Soule",soule
1880,"Mais avant d'y rentrer, déjà soûle de crimes, Comme elle choisissait et triait ses victimes, il te fallut(...)",soûle
1859,"de garde turc, soule",soule
1865,"Un soir, dit sôh biographe, cet ouvrier trouva par la Soûle force de sa volonté le polit ressort définitif qui devait mettre en mouvement sa machine et révolutionner lo monde",soûle
1877,"Soulé, place d'Armes",soulé
1845,emblème dominant les pics des pays de Soule et de Labour s'éternisa dans ces contrées reculées et presque inconnues,soule
1935,"Disons-le tout de sfaite, la soûle solution possible est, à l'origine, INEXISTENCE(...)",soûle
1849,Il ordonne qu'on se soûle Au moins une fois par mois,soûle
1850,"partout elles ont précédé les autres, dont elles sont le préliminaire, et qu'elles sont les soûles que le gouvernement songe sérieusement à établir",soûles
1937,"Schneider, licencié, ù Metz (dél. Serres, de Mont-de-Marsan à Pau; Sins. licencié, il Sarreguemines (dél.) : ~M Soulé-Tholy, du lycée de j",soulé
1937,"24 septembre. — M. Soulé-Tholy, à Air ger-Ben-Aknoun (dél",soulé
1893,"Le même jour, à cinq heures, Mgr Soulé, primicier du chapitre de Saint-Denis, a donné, dans la chapelle du grand Collège, la bénédiction apostolique, accordée au collège Stanislas, en vertu d’un induit",soulé
1920,"de Saint-Quentin ne pourrait être réalisée que « par l'inversion complète des horaires sur les deux « lignes Compiègne-Soissons et Compiégnc-Villers« Cotterêts, mesure qui ne manquerait pas de soule« ver des protestations de la part du public, car les « relations de ces lignes avec Paris ont été prévues « via Soissons et via ViIIers-Cotterêts, donnant ainsi « toute satisfaction",soule
