year,sentence,key_word
1843,"s’il se trouve plus de trois personnes, la calèche est considérée comme berline(...)coupés, et calèches à brancard y une, deux et trois personnes, trois chevaux, à 1 fr",calèche
1874,"Aussi, la fortune sourit-elle à plusieurs d'entr'eux, et tels qui étaient partis de leur village en sabots, y reviennent dix ans plus tard en calèche",calèche
1887,"ses équipages venaientd'y arriver quand la foule, se voyant trompée, se porta rapidement au relai, oÙ l'on s'occupait il changer les chevaux, et voulut assaillir la calèche impériale",calèche
1887,"Sire, fit le en faisant la calèche de » 1'1""tiiipei-eLi i-, il y va de votre vie",calèche
1887,"Quoi que nous puissioils retenir des détails de ces incidents lamentables, il demeure acquis qu'au-delà d'Oryon l'Empereur n'était plus dans sa calèche et voyageait presque seul, en avant sur la route(...)ées, ct, quand les chevaux s'arrêtèrent à quelques kilomètres d'Aix, les glaces de la calèche étaient brisées",calèche
1887,"un aide-de-camp russe avait pris la place de l'Empereur dans sa voiture, et l'Empereur lui-même était monté dans la calèche du commissaire autrichien: Quelques individus munis de lanternes, plus tenaces que le reste de la foule, avaient attendu SUI' la route ils se contentèrent de manifester une curiosité indiscrète, que les précautions prises dépistèrent presque entièrement(...)il venait au devant du cortège, composé de 6 ou 7 calèches, et assura que toutes les dispositions étaient prises pour les(...)",calèche
1887,"calèche du général autrichien, ct il commanda » au cocher de fumer, alln que cette familiarité pilt dissimuler sa » présence(...)C'est ainsi qu'il poursuivit sa route, caché dans un » des coins de la calèche, faisant semblant de dormir, bercé par » l'agréable IllUSllllle du général, et encensé par la fulüée dit cocher",calèche
1939,"je vous voyais en cinquième dans notre calèche, ou bien nous étions aux Coques, sur le canapé, ou dans le bois, ou dans la laiterie, enfin ensemble, vous en moi et moi en vous",calèche
1915,"il aime à le prendre dans sa calèche pour faire avec lui une promenade en ville(...)Lorsque l'évêque arrive à Hiroshima, la calèche du général va le chercher au port et l'y reconduit à son départ",calèche
1915,"Le jour où la femme du consul d'Angleterre dut arrêter sa belle calèche, pour laisser passer le lourd camion de M. de Rotz, le Punch, journal anglais, raconta l'incident(...)",calèche
1929,"de fer P.-L.-M. Tant et si bien qu'un beau jour, le comte A. de Montai et Noblemaire arrivaient en calèche à la Grave, où nous les rencontrâmes,et franchirent les admirables prairies du Lautaret, alors en pleine(...)",calèche
1925,travers les vitres de la calèche du roi des poignées de sable et des « cailloux qu'elle ramassait dans les Tuileries,calèche
1925,clans une calèche du temps de la reine Berthe et qui s'asseyaient dans un mobilier vraiment royal en tapisserie de Bèauvais,calèche
1896,"cocher et ses chevaux sont partis le matin même pour obéir à une réquisition, et que le cocher a emporté la clef de la remise où était la calèche(...)De Marcennay de Rotalieu n'a qu'une calèche, mais, quoique bonne, elle n'est pas belle",calèche
1950,On est si ratatiné dans cette calèche,calèche
1847,"allons, notre calèche est en bas, je vous enlève",calèche
1847,"Le municipal sourit, un des sergens de ville fronça le soiiunUTdi^' tre poussa un grognement équivoque, mais l’intrépide débawbpr,^^^ traînant son nouveau compagnon, s’élança dans une calèche f&PWlVW où étaient plusieurs masques qui poussèrent les acclamaü(M bruyantes et les plus fantastiques. Les(...)A peine la calèche eut-elle remonté la rue Montmartre qu’elle fut arrêtée en face d’un marchand de vin par deux voitures(...)",calèche
1847,"Aussitôt les quatre chevaux fringans emportèrent la calèche au milieu de tous ces gens, dont la plupart la regardaient avec plus d’envie que de curiosité(...)La calèche s'arrêta, et les brillans dandies qui s’y trouvaient firent commencer uno distribution de dragées et versèrent M profusion du(...)",calèche
1898,"Parmi les ponts-aqueducs, le plus remarquable est celui de Calèche, qui mesure 1,105 mètres",calèche
1895,"Voici la reproduction textuelle des deux passages en question, se trouvant aux pages 242 et 255 du tome n des intéressants mémoires du général de Marbot « Il fut convenu que Masséna irait sur le champ de bataille dans sa « calèche découverte, ayant auprès de(...)calèche",calèche
1890,"On a fait, dans les journaux qui se donnent le rôle de discréditer cette assemblée, un récit de calèche à deux chevaux, enrubanés, etc",calèche
1843,"il put voir aussi là une .calèche arrCtéc(...), et dans cette calèche il reconnut, malgré Péloignement, la figure méphistophélique du vicomte dont les yeux lançaient des éclairs et exprimaient un affreux triomphe",calèche
1843,"BULLETIN. de l'échafaud, il trouva Pierre le remercia par un solennel et dernier serrement de main lui montra du regard la calèche arrêtée et monta d'un pas ferme les degrés de l'échelle",calèche
1843,entendirent le roulement d'une voiture c'était une élégante calèche qui s'arrêta près d'eux,calèche
1807,Cependant la petite calèche est relevée d’un coup d’épaule(...),calèche
1807,"saute à la tète des chevaux, fait cent toufs, dit mille choses à sa manière, et finit par s’élancer dans la calèche, 11c sachant quelle fête faire à sa maîtresse",calèche
1807,"On lui répond par un éclat de rire-, c’était M iue de Saint-Yictor qui, tourmentée des petits scrupules dont ses petits caprices étaient ordinairement suivis, et curieuse en même tems de cette prétendue cousine , était montée en calèche deux minutes après le départ de son ami , disposée à l’aller chercher à Chérazile, à le poursuivre , s’il le fallait , jusqu’au bout du monde(...)descendue ensuite de calèche à quelque distance de la place , elle avait tout vu , tout obst-rvé,et au moment où M(...)",calèche
1807,"bois, ils n’y avaient pas fait deux cerits pas, qu’ils aperçoivent une calèche à demi-versée dans une allée de traverse(...)Une femme s’élance lestement de la calèche en riant aux éclats, eHe se retourne, : c’était Teresilla",calèche
1807,"Cep ndant M rae de Saint-Victor se promenant un jour seuîr en calèche avec M. Lamb rt, croit voir ses chevaux prendre""tout à coup le mors aux dents, et tourner à toutes jambes dans un",calèche
1935,Il descendit vivement et fit signe au cocher de l'autre calèche d'arrêter,calèche
1921,"avare, a ses satisfactions de puissance lorsque, misérablement perdu dans la foule, il voit passer l'une de ses filles étendue dans sa calèche fleurie « J'entends dire alors autour de moi Voilà une belle femme, explique-t-il Ça me réjouit le cœur",calèche
1921,"Le 8 novembre cette calèche ne put gravir une côte et le 9, l'actrice montait dans le charriot d'une vivandière(...)Le 10, à Smolensk, la calèche de Taintegnies la rejoignit",calèche
1921,"dans des calèches ou montés sur de beaux coursiers les conseillers du prélat, les membres du chapitre, les vassaux de l'évêché qui s'étaient(...)",calèches
1823,"A cinquante pas de l'hôtel, lé nouveau cocher, ne sachant pas conduire, accroche une diligence qui renverse la calèche au beau milieu du ruisseau",calèche
1878,"plus à circuler que dans une allée battue, n'étant plus exposé à endommager les pieds de vigne, le cheval peut être dételé de la calèche, de la jardinière, pour être attelé à la corde du tractoir au moyen d'un palonnier",calèche
1927,"I1 fut reçu'.', continue le récit, „à la Cour impériale et on lui rendit sa visite. /. - - Et, à cette occasion, Dudescul, de son hôtel, ordonna de parsemer de sucre cassé la rue pour la calèche de l'empereur",calèche
1860,"9 LA SIC t~)Ch grande route qui menait au château, je ne tardai pas à rattraper les voitures dans lesquelles on avait enmse les enfants sur les parents: ils étaient une quinzaine dans les deux calèches",calèches
1860,"quoiqu'il fit très-beau temps, la calèche était attelée pour mener l'enfant avec sa nourrice, le parrain et la marraine(...)Quand la calèche arrêta à la porte de l'église, tous mes petits maîtres et maîtresses étaient déjà descendus de voiture, et moi, je m'étais rangé le long d'une haie pour avoir de l'ombre j'avais chaud, j'étais essoufflé",calèche
1860,"Retourne au plus vite avec les chevaux, et reviens promptement me chercher avec une calèche au village de Hosenlhal",calèche
1860,"mais il n'est pas tout à fait perverti, il redeviendra digne de votre bonté.' ~N Le baron ne répondit à son fils que par une douce caresse et, en ce moment, la calèche",calèche
1860,"il arrive en calèche découverte avec son épouse., Mme la baronne, et avec son fils, votre futur seigneur(...)Et haletante, éperdue, elle plonge an loin ses regards sur la route où bientôt une calèche parait, amenée au galop par six chevaux superbes",calèche
1963,"Outre ces « ancêtres », les clubs utilisent aussi on le sait des matériels récents mais dont la vocation aéronautique ressort plus de la calèche de tourisme que de l’attelage de trait",calèche
1869,"Calèche mignonne des familles, à locomotion humaine. — 83795 (5 janvier) GARCIN",calèche
1886,"Plus loin, figure la calèche de voyage de Sa Majesté, voiture dont elle se servait dans les premières années de son règne avant la vulgarisation des chemins de fer",calèche
1833,"Deux longues files de voitures marchent à pas lents sur les deux côtés de la chaussée du milieu : ici une calèche ouverte, remplie de dames enveloppées de cachemires et de fourrures précieuses(...)cette calèche est suivie par une citadine qui renferme l’honnête bourgeois de la rue Saint- Denis avec ses six enfans(...)",calèche
1833,La reine montait en calèche pour suivre une chasse,calèche
1833,"En ce moment une calèche à quatre chevaux traversa la grande cour. — C’est le duc de Reindall, dit madame de Yertbourg, et elle se leva pour aller au-devant de lui",calèche
1997,"calèche du général(...)Je dépose la calèche chez M. Deaume, aubergiste à l'enseigne de",calèche
1997,"LES QUATRE GRANDES PÉRIODES DU RECIT 1) Du 3 au 7 mai, un rapide voyage en calèche, entrecoupé d'arrêts aux relais de poste, conduit le narrateur et le général Martel, de Paris à Belfort",calèche
1997,"5 mai - Nous nous remettons en route avec la calèche mal assurée et, avec la grâce de Dieu, nous arrivons sans malencontre à Troyes à 9 heures du soir",calèche
1924,"L'âttelâgë des mules de Sarah Bemhardt, la calèche du .prince Troubetzkoï(...)",calèche
1874,"La calèche découverte était à la porte du jardin et nous nous hâtions d'achevernotre premier déjeuner(...)Quand elle entendit la calèche s'éloigner, elle ne pouvait pas la voir de la fenêtre, elle pria Dieu pour elle, pour Menton et pour nous",calèche
1874,"IX Quand nous allons en Italie, ce n'est ni sur Montebello, ni sur aucun des autres scélérats qui composent la bande de Mlle Philippine, c'est dans une grande calèche conduite par un cocher vêtu de noir, ganté de blanc et d'un maintien si grave qu'on le prendrait pour un ministre plénipotentiaire en retraite",calèche
1874,"A peine arrivé dans la rue basse, Charles fit un signe à une calèche vide qui passait devant nous et nous-força d'y monter(...)Une heure après notre calèche s'arrêtait à la porte de la villa Santa Maria",calèche
1874,Ici les voitures circulent librement et notre guide nous a bientôt trouvé une calèche dans laquelle nous continuons notre excursion,calèche
1874,"Sa voiture à quatre chevaux ressemble à à l'une de ces calèches qui font le service des fiacres dans nos villes de province, et son cocher n'est évidemment pas bien au fait du maniement des four in hand",calèches
1839,bis.) Celte calèche où cet homme s'étale Et dont la pose est celle d'un sultan,calèche
1908,"L'architecture des façades et la distribution intérieure des hôtels subirent, de ce chef, des modifications profondes. * * * Calèches et cabriolets. — En même temps, les types de voitures se diversifièrent(...)A côté du pesant carrosse, naquirent des voitures légères pour la promenade : la calèche, qui date du XVIIe siècle, et le cabriolet, dont le nom a été si bien trouvé, dit Maxime du Camp, car il saute sur les",calèches
1908,"Givry, qui obtint, en 1657, des lettres patentes qui lui accordaient le droit de « faire établir dans les carrefours, lieux publics et commodes de la ville et des » faubourgs de Paris, tel nombre de carrosses, calèches et chariots attelés de deux » chevaux qu'il jugerait à propos",calèches
1908,"Si vous venez, nous prendrons la voiture et la calèche(...)demanda Boris à madame .Goréline. — Mais, si vous venez, je pourrais vous mettre avec Eugène dans la calèche",calèche
1908,"ambassadeurs et des généraux, les uns à cheval, les autres en calèche, les autres en berline, avec des habits galonnés, des plumets, des fourrures et des décorations de tous les pays",calèche
1908,"il ouvrit la fenêtre et cria à son cocher: — Efime, la calèche est-elle en bon état(...)Il sauta dans la calèche et se roula dans son manteau. — A la ville, dit-il au cocher",calèche
1908,"Il avala le thé bouillant qu’on lui présenta, mit dans sa poche deux ou trois bons petits pains blancs tous chauds que venaient lui offrir les paysannes jusque dans sa calèche, et dit au postillon qui sc hissait sur le siège: — Rattrape la diligence, et tu seras content(...)Boris dégringola lestement et sauta dans la calèche",calèche
1908,"Une heure après le dîner, vers six heures, une calèche attelée de quatre superbes chevaux noirs, aux harnais étincelants, s’arrêta devant le perron des Goréline",calèche
1908,La calèche roulait toujours,calèche
1908,"V1 596 VVV MON BONHEUR Armianof monta lestement dans sa superbe calèche, à la grande admiration des domestiques et des paysans accourus pour le voir, et disparut aux regards ébahis de cette foule",calèche
1908,"Sur la place, il n’y en avait qu’une de disponible, une calèche à deux chevaux dont le cocher n’était autre qu’Alexandre, ou service d’un loueur",calèche
1891,"Venaient dans d'autres calèches la reine de Naples, la comtesse de Meltemiek, la duchesse de Montebello(...)Quand la calèche portant « César et sa fortune » franchit au pas le pont(...)",calèches
1891,"Leurs Majestés et toute la Cour étant montées dans leurs calèches, se rendirent au palais impérial escortées(...)",calèches
1891,"Puis Napoléon et Marie-Louise montèrent dans la première calèche attelée de quatre chevaux blancs, la crinière tressée et la queue relevée de rubans bleus, blancs et rouges",calèche
1938,Dans leur calèche exposée(...),calèche
1924,"18 jeunes gens, vêtus de robes blanches et ceints de rubans verts, voulaient s'atteler à sa calèche pour la conduire à la Préfecture",calèche
1924,"En calèche découverte elle se rend au milieu des troupes, puis réunit les officiers. — « Etes-voûs disposés à me seconder(...)",calèche
1924,"Un groupe de jeunes filles lui exprime « les sentiments de la cité fidèle » et lui offre les présents d'usage, Elle refuse l'hommage du dais, monte dans une calèche, et le cortège s'ébranle(...)On dételle les chevaux, et quarante jeunes gens, « costumés avec élégance, se disputent l'honneur de traîner la calèche de la princesse(...)",calèche
1933,"324 L'ARCHER dame Cardinal, les rats et les marcheuses en attendant que lancées, ces dernières y défilent en calèche, chaussées de satin(...)",calèche
1977,"Dans sa calèche, achetée au Prince de Bénévent, le Vicomte de Chateau- I briant allait à Prague ou à Venise, en couvrant 130 à 140 km par jour, quatre fois plus qu’un piéton",calèche
1928,La reine arrive en calèche à la daumont et s’installe dans la tribune devant laquelle se trouve le roi à cheval et son état- major,calèche
1911,"Le Roi fit son entrée dans la calèche découverte du Comte Mural, ayant à sa gauche le prince d'Orange et à sa droite le Dauphin",calèche
1911,"Après un repos de quelques instants, le Roi remonta en calèche pour se rendre aux travaux du port et au bassin des chasses(...)",calèche
1911,M. monta dans une calèche traînée par le peuple,calèche
1876,Lem-peureur y etoit avec une des archiduchesse en calèche(...)sa caleche s'arrèta,calèche
1854,J'étais en calèche,calèche
1854,La calèche s'élança au galop vers la buvette la plus voisine,calèche
1854,"mais elle ne voulut rien entendre et se pendit au bras de son mari qui, voyant remontét un peu de vermillon aux joues, céda et l'aida à regagner leur calèche",calèche
1854,"madame de T *** roulaient sur la route de Versailles, dans une élégante calèche, au galop hâté de deux magnifiques chevaux, pleins de feu et de vigueur",calèche
1854,"Après la chasse, où tous sont allés en calèche , à cheval, à pied, selon leur commodité ou leur fantaisie, on revient éreinté",calèche
1854,"La calèche de M. de Basprey, arrivée à Satory, avait pris la file à quelques pas de la route, dans un champ qui occupait le centre de la position",calèche
1923,"princesse Juliana, fit son rntrée dans son aimahle résidence de La Haye, en simple calèche atte(...)",calèche
1906,"calèche garnie de damas, cramoisi cette fois, avança devant l'auberge",calèche
1906,"Tandis que la calèche traversait les rues d'Asolo, toutes fraîches encore au réveil, Avertie se pencha vers ces choses charmantes que jamais, sans doute, elle ne reverrait",calèche
1893,"On a même l’avantage de pouvoir prendre une charrette, une calèche, un landau, le jour que cela vous plait. — Oui, comme celui-là, n’est ce pas",calèche
1893,"une douairière, le soir, des gestes du valet qui lui tendit ses mules le matin, en avait, maintenant, à une matrone aux sourcils outrageusement allongés et noircis de khôl qui passait sans riposter, affalée sur les capitons verts-jaunis d’une calèche à l’heure",calèche
1905,"Elle indique sa manière de voyager : « Je vais à deux calèches(...)je serai dans ma calèche, tirée par mes deux beaux chevaux(...)",calèches
1905,"Si le maître des cérémonies de la Cour avait profité des conseils pratiques de Mme de Sévigné, une reine de France n'eût pas été exposée, comme nous allons, l'apprendre, à rester « en panne » dans son carrosse, au milieu de notre province de Brie, alors que la surintendante de sa maison, dotée d'une calèche légère — la voiture choisie par la marquise — circulait librement",calèche
1831,line calèche traversait rapidement une ville de la Vendée(...),calèche
1858,Nous la gravissions péniblement quand nous avons été rejoints par une magnifique calèche derrière la,calèche
1858,a dit un homme à figure bourgeonnée en avançant la tète hors de la calèche(...)Le malheur voulut que la splendide calèche de M. Bihan de Pencoat s arrêtât en,calèche
1858,"Li voix de M. Bihan de .Peiicoat parvint au même moment à notre oreille.. —^ Il est arrivé malheur à la belle calèche(...)vous donnerez cette nuit l'hospitalité à nos bêtes, et vous nous renverrez le charà-bancs quand votre calèche lui aura permis de continuer son chemin",calèche
1844,"pied, le sac sur le dos, le même chemin que j'avais fait autrefois en calèche",calèche
1844,"11 voit passer devant lui, dans une calèche, un des heureux du monde",calèche
1844,"mais la calèche est déjà bien loin, et l'artiste continue sa route tout en suivant de l'oeil les tourbillons de poussière que font voler les pieds des chevaux, et que le vent du soir déroule dans la prairie comme un immense rideau de gaze",calèche
1844,"Ici on la voyait au bois de Boulogne, se promenant en calèche avec le marquis de D(...)",calèche
1844,"il se laisse bercer avec délices dans la molle calèche, tout en jetant au paysan qui salue un regard et un signe de main protecteur",calèche
1911,Pierre avait exigé l'emploi d'une calèche,calèche
1942,"170 étant à moitié gelée, s'attachait aux roues de ma calèche et aux pieds des chevaux, ce qui rendait la marche de ceux-ci très pénible",calèche
1942,"Grenoble, 9 mars 1815, à midi Départ de Napoléon, voyageant dans la calèche acquise à Gap",calèche
1942,"Ma calèche avait été remisée en sûreté et on nous prépara à souper, en attendant le capitaine Vautrin, qui arriva, comme je l'ai dit, tout couvert de neige et(...)Vautrin, pour nous acheminer sur Gap, le Prussien, mon domestique, restant à Corps avec ma calèche, ayant l'ordre de me rejoindre le plus tôt possible",calèche
1942,"Le lundi à 6 heures du matin, la princesse a passé en calèche découverte la revue de la garde nationale à pied et à cheval et de toutes les troupes de(...)",calèche
1942,J'ai fait conduire à Antibes trois pièces de canon et 6 caissons chargés de beaucoup de munitions et j'ai amené ici la calèche de Buonaparte,calèche
1942,"Gap, 6 mars 1815 Achat, pour Napoléon, de la calèche de Mr Aubert, maître de poste et son employé, Olivier, suit la troupe de l'île d'Elbe(...)Achat de voitures : à Gap, une calèche 1.400",calèche
1855,"jeune, serruriers à Châlons. — Calèche avec siége élevé, non peinte et non garnie(...)calèche char-à-banc, avec siége couvert, également non terminée. — Ces deux voitures dont les ferrures étaient apparentes laissaient voir le travail des deux forgerons qui secondent parfaitement M",calèche
1988,"Visite de Varsovie en calèche... pour Daniel Hager, Pascal Mahé et Philippe Gardent, de gauche à droite",calèche
1929,Serge Czerefkow a dessiné pour le Jrœu une calèche en raccourci que traînent des chevaux incroyablement étirés(...),calèche
1939,"J'ai fait une promenade en calèche à demi-découverte, mais des bonnes femmes des faubourgs ont voulu me fêter et m'ont si fort émotionnée avec leurs cris, leurs hélas, leur pécaires, leurs enfants et leurs fleurs qu'elles poussaient pSle-mêle sur moi, que, j'ai failli (1) Ces « Quinze jours » datent la présente lettre comme la précédente",calèche
1851,Il désirait beaucoup en avoir un semblable pour sa calèche,calèche
1994,Et ils se retournent dans leur calèche pour se sourire,calèche
1918,138 Lectures pour Tous « La calèche. il faut la vendre,calèche
1918,"lui dit-il avec ce brin de céré monie qu'il avait toujours pour parler à une femme, m A sept heures, une calèche, qui roulait sans bruit sur les allées boueuses de l'ancien parc, vint s'arrêter devant le perron des bureaux(...)Pour aller plus vite, on arrêta la calèche devant la grille et M. Martin d'Oyse entra par la petite porte",calèche
1918,"sans peine, M. Martin d'Oyse à troquer sa calèche contre une élégante auto, à remplacer un directeur incapable par un autre collaborateur, M",calèche
1918,"Pour troquer la calèche contre l'auto, il lutta plus longtemps(...)Enfin le carrossier de Rodan prit un soir la calèche",calèche
1918,calèche,calèche
1918,"Xavier vint les y cueillir toutes deux dans une calèche qui roulait au pas pour ne point éveiller les soupçons, tout ce romanesque disparaissait pour Marthe et sa mère devant le geste du gentilhomme qui semblait avoir ennobli à jamais leur race(...)Le banquier le reconduisit jusqu'à sa calèche",calèche
1918,"Nous devons la lui renvoyer, car il en a l'habitude, il vous en faudrait une à quatre places. — J'ai la calèche,objecta M",calèche
1829,"rencontroit en calèche, sur la grande route, dans ces momens où, seul avec soi-même, on ne cherche point à se composer un visage",calèche
1829,"A midi, accompagné d'un domestique, il montait en calèche et alloit voir les princesses",calèche
1829,"Un grand chasseur galonné annonce la voiture de madame la comtesse de Lowenstein : on voit paroître la calèche et les chevaux blancs du ballet de Cendrillon, et la toile tombe au milieu des applaudissemens auxquels se mêlent quelques sifflets",calèche
1983,Les invités se rassemblaient sur la place de la station appelée Cour de la gare et partaient en calèche vers le château,calèche
2001,"On distingue vaguement une calèche, mais c’est surtout la voix ojf qui nous indique la présence de ce dernier élément : « Il me proposa sa calèche",calèche
1904,"congé du P. prieur et des autres religieux, qui nous avoient comblés d’honnêtetez, nous partîmes en calèche pour Lorette",calèche
1904,"Ce même jour, après avoir dîné, nous prîmes congé de nos confrères, qui nous reconduisirent jusqu’à nos calèches avec beaucoup de témoignages d’affection de part et d’autre, et nous vinmes coucher à Regio, ville du duché de Modène",calèches
1904,"Avant d’entrer dans Na^ni, je descendis de calèche et je fus à pied voir un pontbâti sur la Nera, à ce qu’on dit par Auguste",calèche
1904,"Et le lundy 9, nous vînmes, en sa compagnie, à Avignon, où nous prîmes une calèche pour Marseille",calèche
1872,Toute voiture de place (calèches de 4 places et au,calèches
1872,"Pour une calèche à 2 chevaux faisant un parcours de 66 kilomètres à 90 kilomètres, aller et retour, 20 francs(...)Pour une calèche à 2 chevaux faisant un parcours de 65 kilomètres et audessous, aller et retour compris, 15 francs",calèche
1891,"en calèche chauffée et, à deux chevaux",calèche
