year,sentence,key_word
1897,il avait quitté Huningue en calèche par la porte de Strasbourg plusieurs heures av ant le défilé qui se fit par la porte de France,calèche
1864,"beaux, voyez-les plutôt. — Effectivement, ce sont de beaux chevaux de luxe, des chevaux de calèche",calèche
1849,"Lorsque nous sortions du Retiro, la calèche de la reine entrait au grand trot de ses six chevaux café au lait",calèche
1900,"Elles étaient à bout de forces, car elles aussi avaient d& ÍI quitter leur calèche et cheminer à pied",calèche
1900,"Un Instant plus tard nous abordons à l'embarcadère de Fagerstrand, où déjà une confortable calèche, retenue pour nous par l'amabilité du bureau Cook(...)",calèche
1900,La musique militaire nous salua à la descente du train des calèches étaient M) pour nous,calèches
1809,"L'empereur d'Autriche , le prince Antoine , une suite d'environ 200 calèches, carosses et autres voitures ont couché , le 6, à Erensbrunn(...)",calèches
1877,"il occupait le fond d’une immense calèche, tandis que sa mère se tenait respectueusement sur le ‘devant",calèche
1877,"89 « Quelquefois, dit-il, le soir, quand l’ombre du crépuscule couvrait les routes et servait de v oile à ces infractions do l’étiquette des cours, une modeste calèche s'arrêtait à la porte(...)",calèche
1892,"BULLETIN DU COMITE à travers le vrai désert, sur la piste de Berriane, uue calèche emporta M. Cambon, Mmo Camhon et le général vers les républiques puritaines des Mozabites",calèche
1904,"Elle eut même fort souvent l'occasion de l’ouvrir pour laisser passer la calèche de la reine Victoria, (pii résidait, en hiver, au château d’Osborne, où elle mourut. Aussi la vieille souveraine témoignait-elle de l’affection à la slalionmislrcss",calèche
1904,"et que ce monde a l’air heureux de vivre, songe Benjamine en se rejetant dans le fond de la calèche(...)",calèche
1904,"2poatiUonsd& chaise, 70 palefreniers, 11 ouvriers, 5 muletiers, 160 chevaux, 34 chevaux de carrosse, 40 chevaux de calèche, 36 chevaux de chaise, 10 mulets de litière",calèche
1867,"75 — Leurs jeunes femmes vinrent me chercher dans une grande calèche, de ces voitures qui, au besoin, peuvent contenir toute une famille, pour me conduire à leur campagne, assise sur une magnifique terrasse plantée de marronniers formant une voûte impénétrable au soleil",calèche
1894,"Belle dame qui passez, (leste lent, regards lassés, En calèche, Un guidon dans votre main De vous aurait fait demain Une flèche(...)",calèche
1898,"Il est évident que le petit propriétaire, le commerçant qui sc servent d'un titbury, ou d'un breack, ou d'uue voiture ordinaire capotée pour vaquer à leurs affaires peuvent rester imposées à la 1/2 taxe, mais pour celui qui va à sa campagne, ou à ses afïaires, en calèche, en coupé ou dans toute autre voiture de luxe ne devrait pas être taxé de la même façon(...)Il est facile de décréter que les coupés, calèches, landaus, breacks de chasses, mail-coach, voitures de mai 1res(...)",calèche
1863,"Après cette cérémonie, et au retour du cortège, qui se composait d'au moins quinze carrosses (53), d'archers, de hallebardiers, des gardes du gouvernement, des bannerots, de tous les officiers de la garde bourgeoise, le maître sergent de la ville, la toque en tête, debout dans sa calèche, ne cessa de jeter au peuple des dragées de Verdun et des médailles commémoratives, à l",calèche
1836,"La commission persiste dans sa rédaction, surtout parce que, la prestation en nature étant de droit r achetable en argent, il est bien à présumer que le propriétaire , s'il a un cheval de luxe, ne voudra pas l'envoyer sur les chemins, el, s'il a une calèche Ou une voiture suspendue, il ne consentira pas à ce qu'on y mette des matériaux pour la réparation des chemins(...)prestation en nature de sa calèche on de sa voiture suspendue, sous prétexte qu'elle n'est pas propre aux travaux",calèche
1847,"IÍJ"" tV'"" piéton seul ses beautés agrestes, qu'il consent aujourd'hui à laisser y tager au voyageur qui, frappé par le temps ou les infirmités, doit rec rir à la calèche",calèche
1898,Tout à coup il aperçut Saint-Georges dans une calèche escortée par une meute de loups.Georges semblait donner des ordres à chacun d'eux et tous partirent dans différentes directions,calèche
1888,"Aussitôt qu'il entend venir cette voiture (de 4 ou 500 mètres de loin), si on ne le surveille pas, il se prépare à avoir une rencontre avec son adversaire, Par une belle et sèche journée du mois de juin, en voulant se jeter sur son ennemi, il se trouva roulé entre les jambes du cheval et passa sous les roues de la calèche",calèche
1912,"voitures, la chaise de poste et la calèche de seryice ""ger (2), la première servait pour les traites de longue haeIIle l eine la seconde pour se transporter d'un corps à un autre ou Pourr ^re en quelques heures ce que les troupes mettaient la e a parcourir (3(...)",calèche
1880,"Nous sautâmes tous deux dans une calèche qui stationnait non loin de là, en expliquant à notre automédon que nous désirions aller acheter des fleurs, et",calèche
1880,"Des voitures, des calèches, plus élégantes que celles de Londres et que celles de Paris, sont rangées autour de cette place",calèches
1893,"froid et humide, elle avait tenu à sortir en calèche découverte",calèche
1905,"A Paris, faites remarquer au gamin de la rue un duc ou un marquis qui passe en calèche « Oh là là un duc » « Ce n'est pas une tare d'avoir des aïeux, me disait un autre, aristocrate à tous crins, ni une preuve d'incapacité, comme vous semblez le croire en France",calèche
1887,"Mais, vois, là-bas, le long du vert sillon, Une calèche arrive, et, comme un tourbillon, Dans la poudre du soir qu'à ton front tu secoues, Mêle l'éclair du fouet au tonnerre des roues",calèche
1878,"Tel autre fonctionnaire a disposé ""sur les deniers publics d'une somme de 77 francs pour location d'une calèche et de voitures pour les visites",calèche
1888,"L'adjoint du consul était venu en calèche, je m'assis avec lui et nous continuâmes noire route vers la ville où nous nous arrêtâmes au consulat",calèche
1890,"Ce n’est pas un bræk, ni une calèche, ni une charrette anglaise, mais un lourd chariot, une maison roulante, dans laquelle se trouvent le lit et les ustensiles de première nécessité : une marmite, la voilà(...)",calèche
1940,"Oui, mon cher Ami, vous pourriez faire au Bois, au seul bruit des sabots sur les feuilles mortes, cette promenade en calèche dont vous rêvez en regardant des films sur la Vienne(...)",calèche
1840,Aussitôt nous aperçûmes dans une calèche découverte un des plus jolis hommes que pussent choisir un coeur et des yeux de reine,calèche
1920,"Xysette trouve que le cocher ressemble à Guignol et pas du tout à Valentin, le cocher stylé de M me Villars qui se tenait très droit, un peu gourmé sur le siège de la calèche",calèche
1927,"Tl lui propose de gagner avec lui, en calèche, l’embouchure de la Gironde, pour s ’y embarquer sur un navire américain",calèche
1912,"Il_ fit de brillantes études, atteignit successivement jusqu'au grade de maréchal, fut nommé gouverneur général à Sivas, et. obtint même la faveur d'avoir une calèche à quatre chevaux",calèche
1913,"calèche à droite du vieux Louis III, à la barbe de neige, qui salue et sourit avec une bonhomie charmante",calèche
1913,la reine se trouvait dans une des petites calèches légères,calèches
1901,au carrossier qui ondule le sicge d'une calèche,calèche
1910,Elles avaient frété à l’hôtel une calèche,calèche
1887,"Ici on passe quand même, les voyageurs en calèche à deux chevaux (car il n'existe(...)",calèche
1891,"shuit calèches s’ébranlèrent(...)Mon cher duc, dit l’Empereur à Lucenay, qui av ait encore pris place dans la calèche, nous devons, Madame et moi, vous adresser, en môme femps(...)",calèches
1891,"qui s’écarta pour livrer passage à huit calèches du meilleur style, attelées en poste(...)L’Empereur et l’Impératrice prirent place dans la première calèche ot Lucenay fut invité à y monter",calèches
1897,Quinzième jour. — Départ en calèches pour Sartène. — Déjeuner à Bicchisano. — A 6 h. du soir arrivée à Sartène 6.000 habitants(...)Seizième jour. — Départ en calèches. — On traverse de grands vignobles dont les vins sont renommés,calèches
1906,"serait, après un avis qui serait donné à l'amiable, d'employer le cabriolet ou la calèche à transporter de la terre ou des pierres",calèche
1912,"pendant qu'on cherchait à la réparer, les prisonnières s'étaient assises tristement sur le bord de la route, quand elles virent arriver à toute vitesse une calèche venant d'Arras et renfermant les sœurs de charité de cette ville",calèche
1834,"savoir : Meubles etjAmenblemens , Articles d’Ebénisterie , — Chaises et Fauteuils communs et de fantaisie , — Pianos et Orgues d’églises et de Salles , — Carrosses , Calèches , Omnibus et Charriots pour les routes de fer , — Selles et Harnois, — Services d’Or etd’Argeut, et Services plaqués , —Montres Bijouterie , Feuilles d’Or d’Argent et de Bronze, — Verres simples, taillés, moulés, et Verrerie en toutîgenre ,— Caractères d’imprimerie, Presses, Papier à imprimer et à écrire(...)",calèches
1834,"C’est le Sultan qm passera le premier sur le pont, en calèche. —- Immédiatement après l’inauguration du pont de Galata, Muschir Ahmet pacha se mettra en route pour Isnikmid où il et attendu et où son palais est déjà tout prêt pour le recevoir",calèche
1834,"savoir : Meubles çt Ameublemens Articles d'Ehénisterie, — Chaises et Fauteuils communs et de fantaisie , — Pianos et Orgues d’églises et de Salles , — Carrosses , Calèches , Omnibus ej Charriots pour les routes de fer , —■ Selles et Harnois , — Ser- vicesfd’Or et d’Argeut, et Services plaqués, —Montres Bijouterie , Feuilles d’Or d’Argent'et de Bronze, — Verres simples, taillés, moulés, et Verrerie en tout genre ,— Caractères d'imprimerie, Presses, Papier à imprimer(...)",calèches
1834,"Une calèche attelée de six cbei aux contenait deux caisses, en argent massif, qu vert es et dans lesquelles on voyait uhe quantité prodigieuse de bijoux précieux",calèche
1834,"Une calèche parut ensuite dans laquelle le peuple contempla avec enthousiasme les enfans de la Turquie, qu’un page mettait â l’abri du soleil en tenant(...)",calèche
1834,"Fauteuils communs et de fantaisie, — Pianos et Orgues d’églises et de Salles , — Carrosses , Calèches, Omnibus et Charriots pour les routes de fer , — Selles et Harnois , — Services d’Or etd’Argeut, et Services plaqués, —Montres Bijouterie , Feuilles d’Or d’Argent et de Bronze, — Verres simples, taillés, moulés, et Verrerie en toutjgenre,— Caractères d’imprimerie , Presses , Papier 4 imprimer et à écrire , et encre pour impression , — Marchandises de Coton , — Chapcaux-Castoj, et Chapeaux de(...)",calèches
1901,"On y voit l'impératrice et une dame d'honneur, avec sept personnes de leur suite la calèche à six chevaux, des gardes à cheval et, dans le loin, la foule",calèche
1844,J~ ~t'< par u)t parUcxttcr d'aMxr pott< avec sa calèche dans un champ tntrtxf~ M toM~ant le chemin ne c<)Hs(...)eant )e chemin traversant ladite ~f'ce. une toiture suspendue dite calèche attelée de deux chevaux,calèche
1937,"Puis il monte dans une calèche attelée de deux superbes chevaux gris qu'entourent alors, sous la conduite de M. de",calèche
1862,je mettrai une botte de céleri dans ma calèche et je ne payerai pas l'impôt. (Hilarité générale.) Il M. Roques-Salvaza avait cru devoir revenir éga- lement(...),calèche
1854,"passer une calèche, repartir, sans empressement toutefois, car l'équipage qui traverse, empêche souvent de s'apercevoir de l'arrivée d'un autre en sens inverse",calèche
1904,"Du haut de la calèche qui m'emportait vers la station thermale, je reconnaissais presque à chaque pas les traces d'un ancien glacier qui avait en des temps éloignés encombré de sa masse cristal",calèche
1894,"ou quand encore défilent les équipages, landaus et calèches, Les amateurs citent le nom des propriétaires en regardant les armoiries peintes sur les panneaux ou repoussées sur les cuirs des brides et des œillières(...)chèque : la calèche de la duchesse défilant devant le jury, après la charrette anglaise de la demoiselle de la rue Marbeuf ou le landau de l’israélite enrichi",calèches
1911,"Kreuk* pour endurciion*. #ïwpi1i»ii$$ rie JKauilllrft, Calèches f*b flrlfi Spécialité de Coupé biâD. pour Noce Voitures et Calèches pour exüur",calèches
1894,"446 LA FRANCE MÉDICALE 11 de sa calèche attelée de fougueux coursiers(...)même heure, et qu'il est mort à la porte parce qu'il n'avait pas eu la chance d'être écrasé par une calèche",calèche
1919,"Nulle voiture n'aurait pu y circuler, aussi n'existait-il pas de véhicules dans le pays, sauf une calèche archaïque appartenant au chérif de Ouezzân et qui, remisée dans une maison du Marshan, ne s'était jamais aventurée au dehors de ce plateau uni",calèche
1919,cabèche et surtout couper cabèche,cabèche
1933,"entretint deux maîtresses dans sa maison et six chevaux dans son écurie, vendit le vieux landaw de son père, et acheta une magnifique calèche(...)",calèche
1894,"Une « vieille patraque de voiture a le mène à l'église de Saint-Pierre et Saint-Marcellin, où le comte de Spaur l'attendait en calèche, et à six heures le souverain pontife franchissait les murs de Rome",calèche
1882,"de jours à Angervilliers, où elle va se trouver seule avec la maîtresse de la maison (Mm° de Catellan) et avec Ballanche qu'elle a emmené dans sa calèche",calèche
1882,"Rien de mieux compris, de plus lestement troussé que la rencontre sur. la plage de la jolie blonde, Mme Perreux, sortant de l'eau demi-nue, et du duc de Villiers-Doncourt, la lorgnant du haut de sa calèche, en compagnie'de sa première maîtresse, une Italienne trop jalouse dont il(...)",calèche
1902,"Espagne, Mmo Dupin et sa famille se mirent en route dans une calèche à travers l'Espagne en feu et arrivèrent à Nohant",calèche
1864,"On voyait qu'ils avaient laissé leur calèche à une barrière de champ, pour exercer leurs jambes",calèche
1913,"La calèche, montait, montait toujours(...)",calèche
1913,"Pourtant lorsqu'un kodak, à l'arrivée du train à la station de Trikala, est braqué sur la calèche qui va l'emmener « à l'ombre », il se retourne vers nous et dans sa pose se trahit de la satisfaction et de l'orgueil",calèche
1896,"Service Particulier. ervice spècial de Voitures de V Hôtel, en Gare de St-Girons à Aulus les-Bains : Landaus, Calèches, Viclorias pour Promenades et Voyahes(...)Service spécial de Voitures de l’Hôtel, en Gare de Saint-Girons à Aulus-les-Bains : Landaus, Breaeks, Calèches, Victorias pour Promenades",calèches
1896,"calèches, landaus et berlines",calèches
1875,"effectivement, quelques instants après, il entrait par un boulevard, dans une calèche, et était reçu par la foule aux cris mille fois répétés de : Vive la République(...)",calèche
1875,Arriverai par calèche,calèche
1860,"L'affluence est énorme sur le passage de Napoléon III, qui traverse la ville en tenue de voyage, dans une calèche découverte, et va s'embarquer immédiatement à bord du yacht la Reine-Hortense",calèche
1868,"orgueil, il théorie du bonheur. s'écrie, devançant et combattant d'avance les contra- Toutes ses études premières de l'homme physique et dictions hypocrites et routinières qu'il prévoit de l'homme moral, toutes ses recherches et ses obser« L'homme qui écrit ces lignes a parcouru toute l'Eu- vations en physiologie, en idéologie, en histoire, dans rope, de Naples à Moscou, avec cent auteurs, tous la vie si variée et si cosmopolite qu'il a menée, abouoriginaux dans sa calèche",calèche
1867,"le grand coupé pour le soir, la calèche à huit ressorts pour(...)",calèche
1867,"ils se rendirent ensuite en calèche découverte à la rési.. dencë impériale, toujoursàcclamésparle peuple",calèche
1907,"J'estime qu'à notre époque de progrès les préfets de la République doivent marcher de l'avant et ne plus se servir de chevaux quand ils ont à leur disposition des automobiles de tous genres, calèche, coupé, berline, etc",calèche
1861,"Yvon a vieilli ce frais visage et donné trop d'importance aux deux épagneuls, qui pouvaient en avoir plus que la calèche de service et M",calèche
1927,"Une dame, richement et noblement vêtue, sortit effrayée de sa calèche accrochée par un omnibus, reçut un nouveau choc, glissa et tomba en plein, ruisseau",calèche
1903,"Réplique d'un cocher Frédéric II, se promenant un jour en calèche aux environs de Potsdam, sous la conduite de son fidèle cocher Grumwell, qui était aussi, à ses heures, son conseiller privé, sentit tout à coup sa royale personne glisser assez brusquement dans un fossé",calèche
1903,"UNE EXCEPTION U y a quelque temps, la marquise de M...s une respectable et vénérable châtelaine se présentait en calèche devant un passage à niveau, situé aux portes d(...)",calèche
1875,"Un matin donc, une calèche tre deux rochers",calèche
1875,Et si vous ) le c -La calèche est pour les grands seigneurs,calèche
1914,"Occasion, petite calèche découverte 100 fi. ( S irthe(...)",calèche
1930,"A Tétuan alternèrent Caliche et Nei-Ia sous la clarté des globes électriques(...)Caliche vaillant, Neila malheureux à l’épée",caliche
1838,"3 2 6 1 Petite calèche à un seul fond, avec timon(...)Voitures fermées ou non, à deux fonds égaux, et calèches à deux fonds avec timon",calèche
1895,"Deux heures de trajet à travers des rizières, des champs de manioc, des plantations de cafiers, de cacaoyers, de canne à sucre, et les voyageurs descendent, a Buitenzorg, en français Sans-Souci, où ils trouvent des charrettes et une calèche qui les emportent, eux et leurs(...)",calèche
1908,Aucun des personnages de la calèche ne broncha,calèche
1883,"4 » — de deux chevaux attelés à une voiture suspendue, telle que calèche, omnibus, etc io » Tarif de rachat ce la prestation en nature",calèche
1904,"On retrouve dans L'Héritière de Birague, L'Israélite, Le Centenaire, Le Sorcier, Wan-Chlore, premières oeuvres de Balzac, les mêmes intrigues compliquées, à péripéties sans nombre les souterrains, les diligences arrêtées par les voleurs, les calèches versées, les empoisonnements, les assassinats(...)",calèches
1904,"équipages de Ions genres, depuis le baquet, le camion, la brouette, le tombereau, jusqu'à la calèche, le tonneau, le cab",calèche
1904,"mouvements de ses modèles, nous décrit d'un Irait rapide et fidèle le sens intime de la rencontre entre la biche et le lion, sorti comme par hasard de t'ombre des fourrés au passage de la calèche attendue",calèche
1904,"ses voitures, d'une structure si précise et presque vivante : calèches, tilburys, phaélons, dorsays, breaks, araignées, carrosses de gala. échappés des(...)Enfin la mort vint, et, par un clair soleil de printemps, à l'heure où les scelles amazones galopaient rieuses dans les allées du Bois, à l'heure où dans la poussière des Champs-Elysées les roues des rapides calèches miroitaient innombrables, à l'heure où Les femmes de plaisir, la paupière livide",calèches
1869,"Malhias Goblet a loué à Simon père, docteur en médecine, pour trois années, de mars 1867 à mars 1870, moyennant 650 fr. par mois, une calèche et un coupé avec l'équipement nécessaire, se chargeant, en outre, de lui fournir un cocher, il n'est aucunement établi que les parties aient entendu restreindre l'application de cette convention au service du docteur Simon comme médecin(...)",calèche
1867,Le préfet sortit de son palais en calèche découverte pour aller à la rencontre de son souverain,calèche
1867,"Le roi arriva à Fontainebleau le 4 octobre « Vendredi 5, le roi courut le cerf dans sa calèche à son ordinaire il devait ensuite aller tirer, mais la pluie l'en empêcha",calèche
1841,"Que sera-ce donc le jour où le chemin de fer aura, lui aussi, ses élégantes calèches à ressorts anglais",calèches
1841,"et pourtant ce bateau, presque aussi grand et aussi lourd qu'un navire de l'Océan, portait, indépendamment de ses nombreux passagers, des troupeaux de boeufs et de moulons, des ballots énormes de marchandises, et des rouliers presque aussi volumineux, et dix ou douze calèches tout attelées et remplies d'Anglais raides, qui avaient probablement été emballés ainsi sur la Tamise, et qui n'ayaient pas bougé depuis",calèches
1841,"Dans la cour, dont la grille venait de s'ouvrir, se ruait avec un fracas solennel une calèche escortée de deux gendarmes à cheval, le sabre nu à la main",calèche
1901,"Le tour de l'Inspection, c'est la promenade classique que fait chaque jour l'Européen de Saigon, en landau, calèche ou charelle anglaise, à bicyclette ou à cheval, ou pour les gens modestes, en Isidore à deux chevaux",calèche
1907,Elle se trouvait dans une calèche très confortable qui roulait rapidement sur une route solitaire,calèche
1985,"C'est à cette époque que la concurrence internationale entre les fabricants de moteurs, de véhicules motorisés et de tracteurs commença : le premier véhicule motorisé fut une moto construite par Maybach et Daimler, puis la calèche motorisée de Daimler et le véhicule à trois roues de Benz (1886(...)",calèche
1878,"On s’y rend en voiture par une route splendide, c’est de Saint-Laurent-du-Pont que l’on part pour la grande Chartreuse, située à neuf kilomètres dans la montagne Notre calèche en arrivant met en déroute un troupeau de dind s",calèche
1882,"Les deux frères Elissamburu, épiciers rue Poissonnerie, à Bayonne, revenaient avec leur beau-frèro Duhart de la fête de Bpssussary, dans une calèche à deux chevaux conduite par le cocher Timothée Milliôre, lorsque à la descente de la côte d’Urdainx, colui-ci est tombé de son(...)",calèche
1835,"Vitriol. (V. Couperose.) Voitures, à quatre places, à deux places, calèches, phaëtons, cabriolets et autres équipages sur ressorts et sans ressorts, boit entiers ou démontés,excepté ceux qui sont importés sur lesjsyroscaphea et dénommés dans le S 7 de l onzième article des règlemens concernant les passagers, publiés avec les arlicles supplémentaires au règlement de douanes et revêtus de la sanction(...)",calèches
1835,pour une calèche 80 roubles,calèche
1835,"calèches et phaétons à quatre roues, vieilles ou neuves, venant par mer, la pièce, 00 » — vieilles, venant par terre, M exemptes",calèches
1905,"Toujo 1 * 1 est-il que l’enfant n’avait guère deux semaines lorsque l’armée frança 1 ' quittant l’Espagne, Mme Dupin et r famille se mirent en route dans ^ calèche à travers l’Espagne en ‘ arrivèrent à Nohant",calèche
1913,à gauche de la calèche et sa course précipitée l’empêcha de voir avec sûreté,calèche
1889,"autrefois, la Calèche et le Roi des Gnomes",calèche
1923,Calèche,calèche
1885,"Le 28 novembre dernier, M. van M... sortait de chez lui en calèche à deux chevaux",calèche
1861,"l'atteler à une calèche, l'employer pour des courses très-rapidement faites, et même pour le voyage de Versailles aux portes de Paris le trajet a eu lieu en une heure vingt minutes",calèche
1883,Sans doute/en passant dans sa calèche devant la Maison Doréa 30,calèche
1938,BOBO-LALA (distribuant des pièces aux gardes) Cadeau de massa Lebouc pour bons gardes faire pas trop mal quand couperont cabèche,cabèche
1904,"Calèche(...)Doit être considérée comme voiture de luxe dans le sens de ce tarif une calèche appartenant à un propriétaire qui exploite une certaine étendue de terres, mais servant le plus habituellement à le transporter de(...)",calèche
1882,"Elle i=e compose d'une caisse de calèche reposant sur six ou huit pièces de bois longues et flexibles, supportées par quatre roues basses",calèche
1889,"Attendu qu'un procès-verbal régulier dressé par deux aployés de la Régie, le 7 février 1888, constate que, la lille, les employés ayant vu une calèche attelée de deux levaux et pleine de voyageurs, paraissant faire un serce public, s'arrêter devant le portail de l'église Saint,ienne à Fécamp, ont demandé au cocher qui la conduiit, ses nom et prénoms et le laisser-passer dont il devait re porteur(...)habituelle, le 30 juin 1888, sans (1) Etant donné que de la déclaration même du cocher il résulit que(...)",calèche
1887,"les barrières blanches des allées tranchaient gaiement sur le vert naissant des pelouses et on èût cru assister à l’inauguration d’un second Parc-Bordelais, quand la calèche du Président vint s’arrêter devant le pavillon central",calèche
1931,"Aujourd’hui. — Voitures à deux roues, à quatre roues, cabriolet, char à bancs, calèche, landau(...)",calèche
1931,Des calèches (voitures découvertes(...),calèches
1931,"Les rats Dimanche matin, nous avons sorti la calèche pour aller nous promener",calèche
1824,"M. Van Hoorick a fait l'application de sa flèche mobile à une calèche que nous avons vue franchir une chaise ordinaire sans être renversée, et cet obstacle(...)",calèche
1905,"des calèches, des landaus, des coupés amènent les jeunes femmes, anémiques un peu, de la colonie étrangère — aristocratie très select(...)",calèches
1905,"Une vieille calèche, retapée pour la circonstance, à laquelle s’attelle un bidet emprunté à ta ferme, promène Mme Taupinier et ses(...)",calèche
