year,sentence,key_word
1846,"Trois jours après ce pansement, journellement renouvelé, j'applique les sabots de Vénel, que j'ai fait modifier en en faisant une espèce de brodequin lacé et parfaitement rembourré, de manière à éviter les excoriations résultant constamment de tout appareil trop contentif",brodequin
1957,"2. — Vote de la proposition de résolution (n° 2616) de M. GautierChaumet et plusieurs de ses collègues tendant à inviter le Gouvernement à équiper nos troupes de brodequins militaires en cuir (nos 41284605-4683. — M. Jean-Paul David, rapporteur) (Sous réserve(...)",brodequins
1957,1. — Nomination de rapporteurs. i 2. — Attribution de brodequins en cuir (rapport supplémentaire 3. — Réforme de l'artisanat. i Commission de l'Agriculture,brodequins
1898,"hommes seraient blessés au pied et 10 % ne pourraient plus marcher , chiffre peut-être exagéré avec le brodequin actuel, mais restant néanmoins vrai en partie pour les réservistes et les territoriaux",brodequin
1881,"Vendredi Ier .5uîHet. — Sénat. — Vole de la loi substituant lé brodequin au godillot, et de la loi autorisant l'exécution d'un canal'd'irrigation(...)",brodequin
1905,"C’est à moi son beau col qui penche Quand elle dort dans son boudoir, Et sa basquina sur sa hanche, Son bras dans la mitaine blanche, Son pied noir dans son brodequin noir(...)",brodequin
1907,Le pied vif et cambré moulant son brodequin(...),brodequin
1929,"Neufs au départ, leurs brodequins n'avaient plus de semelles et leurs capotes élimées flottaient en loques autour de leurs corps anémiés",brodequins
1929,"Il arriva pourtant, pas debout, mais plié sur l'échiné d'un légionnaire qui, se laissant tomber du parapet, l'était allé chercher à vingt mètres des murs où une balle, dansée à contre-temps, avait empli son brodequin d'une bouillie sanglante",brodequin
1929,"s'il vous plaît, laissez mon brodequin",brodequin
1881,"et par l'autre porte, voilà qu'il se présentait une belle dame, la taille sous les aisselles, une robe blanche collante, tenant une ombrelle d'une main, de l'autre relevant sa robe pour montrer un bas blanc bien tiré, sur lequel se croisaient, en façon de 8, les rubans noirs qui maintenaient un fin brodequin",brodequin
1911,"C’est que je n’ai pas mes sabots... et mes brodequins sont pleins de boue... — Entrez tout de même(...)Si vous aviez une entorse, votre pied serait enflé et ne pourrait entrer dans un brodequin(...)",brodequins
1855,"Une dame, —avec blanches plumes, Et dont le brodequin verni A trottiné sur nos bitumes, De Breda-Street à Tortoni, — Traverse le pauvre village, Souriant sous son front pâli, Et répandant sur son passage Des flots d'ambre et de patchouli(...)",brodequin
1833,"Malheureux qui, poussé d'un orgueilleux espoir, 1 Du brillant laliclave et du brodequin noir Désiras les honneurs et briguas la parure(...)",brodequin
1926,"La botte caoutchouc, grâce à son talon évidé, permet de porter n'importe quel amour de brodequin ajouré et de tendre couleur. ( Outre la botte « militaire », c'est-à dire d'une seule pièce, certains modèles se lacent, se boutonnent ou forment des croisillons",brodequin
1842,C'est qu'à vrai dire le cothurne et le brodequin ont besoin de relever leurs talons éculés pour marquer le pas d'une autre ère(...),brodequin
1905,"Réclamer à Mme Pichard, 1, me Efoupée un brodequin neuf, trouvé le 18 courant, passage de la Levrette. — Récompense à qui rapportera à M",brodequin
1907,"Pierre de Marbeuf, écuyer, ne manqua donc point d'écrire une ode sur la Vierge envoyée par la Reine, et on lui doit, en outre, un éloge agréable de la Normandie : Sa jupe d'un vert salin La vêt jusqu'au brodequin, De divers filets bordée",brodequin
1854,"que Phidias, le sculpteur fécond, travaillait lentement et employait un temps considérable à ciseler le brodequin d'une déesse",brodequin
1939,Il faillit confondre à un moment donné sa tasse de café avec son brodequin(...),brodequin
1904,"D’après la Topographie historique de Berty et Tisserand, cette maison aurait été bâtie au xvi e siècle, à la place d’une simple grange qui, en 1515, appartenait à Jean Bart dit Brodequin, puis serait devenue la propriété d’un sieur de Vailly",brodequin
1907,"La source disait « bois » et la mousse câline Se faisait de velours sous son brodequin d’or, La forêt s’inclinait, conquise et la colline Disait(...)",brodequin
1901,"C’est un énorme brodequin à quintuple semelle, pesant pour le moins trois kilos, et qu’un cordonnier de la fin du seizième siècle exposait comme modèle à sa montre",brodequin
1927,son brodequin pointu perce le ciel comme un vol d'hirondelle,brodequin
1906,Aux pieds se voient les mêmes brodequins qu’à ceux du personnage précédent,brodequins
1906,Le pied est chaussé d’un brodequin carré du bout avec une forte semelle sans talon,brodequin
1906,"réduit à une petite jupe plissée, à une sorte de pagne descendant de la taille, où il est retenu par un ceinturon, jusqu’à mi-cuisses, les pieds avaient la même chaussure, le brodequin, ou plutôt l’espadrille attachée au-dessus du cou-de-pied",brodequin
1906,"elles sont nues, mais les pieds sont chaussés de brodequins à bouts pointus et relevés, que serre au-dessus de là cheville un triple lien plat",brodequins
1941,41 fixant le prix de vente au public des chaussures nationales (cuir : 150 (brodequin) à 85 (enfants Richelieu(...),brodequin
1935,350 paires de brodequin(...),brodequin
1867,"Aujourd'hui mademoiselle Patti chausse à volonté le cothurne et le brodequin, et le public, charmé de la petitesse du pied de Rosine, se refuse à voir que Lucie perd ses socques en route : ce qui revient à dire qu'on ne demande plus autre chose à mademoiselle Patii que de chanter(...)",brodequin
1862,"On peut exprimer la même chose en disant qu'il n'a jamais chaussé ni le cothurne ni le brodequin, ou bien encore qu'il a toujours tenu rigueur à Melpomène et à Thalie",brodequin
1939,"Dessin de Ordner.) FRICK — Votre feutre émaillé On a certainement n ’ es t p as m al, mais moi, oublié de prévenir le gibier pour pété, je préfère le que la chasse était ouverte, canotier-brodequin",brodequin
1922,Le temps ou leur pensée 'tant bien que mal s'efforçait à conquérir le monde et à le comprendre sans qu'on leur mit la tête par force dans un de ces assemblables de concepts qui figurent exactement le brodequin déformateur des pieds de chinoises,brodequin
1934,"Pot-pourri sur des airs de « La Fille de Madame Angot », de a Véronique » et de « Ciboulette, ». b) Le brodequin et le petit soulier P",brodequin
1911,"Les jambes, placées dans l'attitude la plus simple et la plus gracieuse, sont parées du brodequin antique(...)",brodequin
1993,"Les chaussures étaient de cuir et solides, genre brodequin",brodequin
1900,brodequin,brodequin
1868,"Petit brodequin d'enfant, en tapisserie (voir aux petits travaux(...)",brodequin
1868,"10, 11, 12. — Brodequin d'enfant en coutil blanc (voiraux petits travaux). — 13, 14,15.—Lettres demandées. - i6, 17(...)N08 10, Ii, 12. - Brodequin d'enfant du premier âge en piqué blanc et brodé en soutache",brodequin
1868,"N° 11. — Brodequin d'enfant, en tapisserie : Il se fait de deux nuances, blanc et bleu, ou tout blanc en soie et laine(...)on double ce petit brodequin de molleton, en passant un fil au milieu pour soutenir la doublure(...)",brodequin
1907,"Dieu sait quels souliers je vois, depuis le sabot fendu jusqu'au brodequin dont la semelle bâille(...)",brodequin
1853,on pourrait se servir également d'un brodequin dont le pied serait(...),brodequin
1930,Rennes produit le brodequin militaire et le chiffre d'affaires de cette région est évalué à 250 millions de francs,brodequin
1937,"Un brodequin entamé d'éraflures fraîches rencontre le manche du piolet, le tâte, s(...)Un tremblement convulsif secoue le brodequin. le détourne les yeux(...)",brodequin
1835,"72 ) C'est à moi son beau col qui penche Quand elle dort dans son boudoir, Et sa basquine sur sa hanche, Son bras dans sa mitaine blanche, Son pied dans son brodequin noir",brodequin
1913,des brodequins avec des patins de carton collés à la pâte de farine ou cousus au fil blanc,brodequins
1913,Le fantassin aurait le brodequin actuel,brodequin
1913,"en Autriche c'est un brodequin léger en cuir souple avec tige en(...)en Allemagne, un brodequin de même nature, mais avec tige en cuir",brodequin
1913,"Malgré que cette opinion soit basée sur des faits récents, le casque en métal, en raison de son poids, ne me 1 La description de ce brodequin figure au fascicule rectificatif des uniformes n° 10, 23 septembre 1912, p",brodequin
1905,"Droit, les yeux dans la nuit, j’avançais sur la colline, mon brodequin tâtant avec confiance les cailloux de la ponte familière Je ne voyais rien, mais dans leboisclair- semé je savais les endroits où le ciel reparaissait sur ma tête, et ceux où il était de nouveau caché",brodequin
1937,V.P. — qui répond à toutes les questions de détail : Comment est faite la semelle d'un brodequin d'alpiniste,brodequin
1984,"Après avoir coupé le cuir du brodequin cet éclat, peu profond, je pus l'enlever à la main",brodequin
1871,"V Une paire de brodequins en vache molle, avec semelles dé plomb",brodequins
1871,Chausser alors les brodequins et boucler la ceinture,brodequins
1986,"jupe n'étoit pas fendüe jusqu'aux genoux, ut qu'elle n'avoit pas L'arc en la main, le brodequin chaussé, Le carquois sur le dos, et le bras retroussé",brodequin
1903,"Le sculpteur a nettement indiqué la haute tige de cuir souple qui protège le bas de la jambe comme un brodequin, et s'arrête au-dessous du mollet(...)",brodequin
1858,"Et pourtant deux petits défauts font tache à-cet enseh> » ble, mais le khemar (fichu de la tête) cache l'un, et le brodequin » dissimule l'autre : elle aie pied et l'oreille-un peu forts",brodequin
1896,"Sch. rien de sûr. il Brodequin, au sens(...)fr. broissequin (aussi brodequin),' espèce d'étoffe dont la nature est mal déterminée",brodequin
1941,"Chaque fois qu'un maladroit heurte de son brodequin une pierre, je me retourne et ie crie(...)intérieurs impénétrables, et des armes brisées, des capotes, des brodequins, çà et là jonchent la route autour de larges et profondes excavations",brodequin
1950,"elle s’associait dans son souvenir à celui de l’eau glacée d’une cuvette, du cuir rigide d’un brodequin trop grand pour un pied d’enfant transi",brodequin
1912,"Les jeunes gens ont le brodequin lacé, écrivait récemment M. Gabriel Hanotaux",brodequin
1936,"Là, passent des échos de jazz. tin somme, M. Françaix chaussa non point le brodequin, mais, si l'on peut dire, les pantoufles de Chabrier",brodequin
1928,1 1 BRODEQUIN 1 1 du Docteur Jean Charcot I 1 à Semelle de eaoutehoue I * A Semelle de caoutchouc(...),brodequin
1923,"Il manquait une harmonieuse liaison entre le brodequin bas et le pantalon haut, irop souvent la chaussette vert-jade, archevêque ou bleu-paon troublait(...)",brodequin
1926,"Li freina mé la feramenta (lu bijou) e la rúùba de jaeouna, à la moda d'aloura, mé li mancha « à la juivp », la couifa e lu brodequin que grignavon(...)",brodequin
1932,"Battements des mains, claquements des doigts, roulement des castagnettes ou du tambourin, chocs du talon, de In semelle ou de la pointe du brodequin, tout s'en mêle",brodequin
1930,"Pour évoquer l’idée de ville, de route, de chasse, de voyage, de soirée ou de sport, le signe du brodequin ou de la bottine n’est pas, à lui tout seul, assez explicite",brodequin
1860,"Sur l'une d'elles, où l'on arrive ens'aidant des mains et des genoux, se creuse une empreinte en formé de pied quela légende dit avoir été laissée par le brodequin de l'Archange guerrier lorsqu'il combattit le démon",brodequin
1908,"A vingt mètres du cadavre, on a trouvé après sa découverte un brodequin, ayant ap¬ partenu d'une façon certaine à la victime",brodequin
1863,"nous devrions presque dire aussi le grand évènement politique, car M. Augier a chaussé le brodequin d'Aristophane, et sous des noms divers, il a mis en scène ses contemporains légitimistes et cléricaux, entre autres M",brodequin
1913,"Lors, avisant un cireur de bottes, il le pria de lui cirer ses deux brodequins : — Et à la hauteur, hein, je vais voir ma belle 1 Firmin était resté planté sur le trolloir",brodequins
1942,"le Dans la section du cuir et de la chaussure. d pavillon de l'Intendance montra la fabrication du brodequin de marche modèle 1941, dans ses divers stades",brodequin
1896,"séance du 20 avril 1896, par Ch. de Villedeuil. — Bottine-brodequin, par F. Boschet",brodequin
1839,"Brodequin moscovite. —A la forme étrange de ce tricot on serait loin de soupçonner son usage(...)On coud ensuite le commencement du brodequin qui renferme le pied, en ayant soin de tendre autant que possible le tricot pendant que l’on fait",brodequin
1920,"laisser écraser sous la table votre brodequin par un soulier amoureux, de recevoir des déclarations et d'y répondre, et même d'essayer un peu, pour voir, d'unir vos lèvres à d'autres",brodequin
1897,"Elle quitte le cothurne pour chausser le brodequin, — castigat ridendo mores, — et s'appelle alors „La Comédie(...)",brodequin
1916,1 V Havresac 1 1 Brodequins de marche du modèle I1 i unifié,brodequins
1916,"Principe la même tenue que les officiers, mais ils font usage des tembières, des brodequins et des éperons à la chevalière, du ""dèle de la troupe",brodequins
1916,Petit équipement : Brodequins de marche du mo- dèle unifié (paire(...)1 Le fourgon de forge de chaque escadron contient 20 paires de brodequins de pointures diverses(...),brodequins
1854,"Les évêques qui d'abord avaient chaussé les sandales des apôtres , puis le brodequin sénatorial(...)",brodequin
1904,"tissée en mailles serrées, elle forme un véritable feulrè amortissant le mouvement du brodequin",brodequin
1935,"L'Italie est à l'étroit dans sa botte, où elle subit le supplice du brodequin",brodequin
1922,"celui qui (( chausse le brodequin », comme on disait jadis, habitué aux périodes comiques — eussent-elles des prétentions lyriques — le « comédien » ne peut, de par ses moyens physiques, s’élever jusqu’aux grandes manifestations héroïques de Melpomène",brodequin
2003,"Certains ont aussi subi le ""brodequin"", pièce de bois qu'on applique aux jambes puis qu'on serre au moyen d'un pieu et de cordes(...)",brodequin
1948,Le supplice du brodequin — Ça ne vous fera:: rien de me mettre un peu de pendre Mudac y La poudre MUDAC donne une Impression de confort extraordinaire,brodequin
1891,"En arrivant au corps, échanger des chaussures allant au pied contre des brodequins neufs au cuir rude, et qui sont presque toujours ou trop petits, ou trop grands, devient parfois un véritable supplice pour les jeunes soldats",brodequins
1896,"Brodequin. — Les brodequins sont des chaussures lacées, ils ont, suivant la hauteur de la tige adapt e à l’empeigne, des avantages et des inconvénients",brodequin
1825,"Sur le grand théâtre du monde, Vous qui chaussez le brodequin , Souffrez que je lève à la ronde Un coin du manteau d'Arlequin",brodequin
1845,"car nos actrices ne sont plus obligées de se couvrir d'un masque, nos comédiens ne mettent pas de brodequins, et dans nos tragédies modernes on ne chausse plus le cothurne",brodequins
1929,"de bois rouge, balances à la romaine, bas chinois au pied minuscule, roses, violets, verts, souliers usagés, depuis la pantoufle brodée jusqu'au solide brodequin « made 'in England(...)",brodequin
1898,"Ces chiffres doivent nous paraître excessifs, maintenant surtout que nos soldats sont pourvus du brodequin(...)",brodequin
1898,"étale une petite quantité de graisse avec la main, gros comme-une noisette par brodequin",brodequin
1918,"chaussures par an, on juge de l'importance que doit avoir cette industrie, et l'on peut se dire que le million mensuel de paires de bottines ou de brodequins sur lequel l'Intendance se croit en droit de compter sera loin de pouvoir satisfaire aux besoins de la population(...)seulement, au lieu dçs doigts de l'artiste, ce sont des LA SEMELLE DU BRODEQUIN, DITE « PREMIÈRE » On distingue sur tout le pourtour la « gravure » dont la partie supérieure a été relevée",brodequins
1918,"En présence de la hausse constante que subissaient les bottes, brodequins et souliers de toutes sortes et de toutes qualités, l'Etat s'émut et étudia le moyen de venir en aide tout au moins à ceux dont les ressources limitées ne permettent pas d'aborder la cordonnerie de luxe(...)également qu'un bénéfice de 15 Finalement, le public devait trouver à se chausser dans la plupart des magasins aux prix suivants : brodequins d'homme, 28 francs(...)",brodequins
1833,"il passait chaque nuit Dans tes chemins obscurs, tout noirs de graminées, Des brodequins furtifs, des jambes avinées(...)",brodequins
1930,"Brodequins imperméables, cuir de tannage spécial, triple semelle cousue, genre cuir phoque, brun foncé, valeur 185 fr",brodequins
1838,"ensuite qu'il avait perdu ses brodequins, puis qu'on les lui avait volés, e",brodequins
1832,"comme cette jambe fine est plus fine encore , ce petit pied plus petit, sous ce léger réseau , dans cet élégant brodequin",brodequin
1837,"les bracelets de velours à médaillons et les brodequins de gros de Naples vert, garnis de maroquin noir",brodequins
1837,"des brodequins : seulement le satin-turc commence à remplacer le coutil et les gros de naples(...)Il n'y a plus guère que les couleurs aventurine ou verte, garnies de maroquin verni, qui résistent encore et soient bien portées pour la saison: demandez plutôt au Brodequin vert, boulevart des Italiens, n° 2",brodequins
1837,"Vous mai cherez. quoi que vous en ayez, vous marcherez toujours les pieds à la geneane. comme autrefois les pauvres torturés condamnés au brodequin de fer(...)",brodequin
1837,"249 de la botte vernie on du brodequin à talons de dix-huit lignes, mesure ordinaire(...)Avec cette élégante et légère innovation on porte de toute nécessité la guêtre, ou mieux encore le brodequin bronze-hanneton, verl-pill ou gris foncé, presque lilas",brodequin
1837,Les brodequins écrus ou nankin très clair sont la chaussure adoptée de préférence(...),brodequins
1837,"de véritables et gracieux souliers en maroquin vert-pré , bronze ou saphir, bordés d'un ruban de couleur différente , froncé quelquefois sur le coude pied, comme vous en rencontrerez de charmantes fantaisies au Brodequin vert, à côté du passage de l'Opéra",brodequin
1837,"Ces souliers vernis si admirablement coupés, ces bottes de maroquin si légères, ces brodequins noirs si à la mode aujourd'hui, tout cela. si vous y reconnaissez un cachet d'élégance et de bon goût indéfinissable, tout cela vient de cette petite rue qui a nom Verderet, je pense",brodequins
1905,"elle obéit sans réserve et sans peur à toutes ces violences de la « tète et des sens, elle touche aux deux extrêmes, le pied dans « ïe brodequin de(...)",brodequin
1833,"Desdames avaient avec des robes de poult de soie blanc ou de moire également blanche, des brodequins en satin blanc. .""_■. ■ :'-'.""'""'t:-Ji —-On voyait des gants longs, garn>is par le haut, d'un, noeud de rubans> à bouts flottans, d'autres(...)",brodequins
1833,"une longue moustache cirée, le cou nu, la tête rasée, excepté une touffe épaisse de cheveux sur le sommet du crâne, une veste turque sans manches, un large pantalon plissé sur les hanches, enfin des brodequins lacés jusqu'à la naissance du mollet : tels étaient les Manteaux-Rouges",brodequins
1913,"Murger, Scènes de la vie de Bohême, chap. XV11, depuis «Le lendemain matin était le premier jour du mois de mai» jusqu'à « ton brodequin coquet», avec une coupure",brodequin
1892,"Pierrot est plus heureux le voilà intact, presque sous le talon d'un brodequin",brodequin
1907,évêché va sans doute abriter bientôt les jeux du socque ou du brodequin,brodequin
1936,"Navarre avait attaché à son avion, par un câble, un vieux brodequin de troupe",brodequin
1885,"siège, il donne des croûtons de pain aux bonnes bêtes La chanoinesse avoue soixante-dix ans(zuzezl) Robe à traîne, brodequins lacés, mitaines en tricot",brodequins
1822,monstrant le brodequin,brodequin
1881,"Le brodequin napolitain est substitué au soulier actuel et à la guêtre pour la chaussure des troupes à pied. — Il sera distribué à chaque homme, concur- remment avec le brodequin, une chaussure dite de repos, qui se composera du soulier actuellement en usage et d'une paire de guêtres blanches",brodequin
1881,4 juillet. — Loi relative à la substitution du brodequin napolitain au soulier et aux guêtres pour la chaussure des(...),brodequin
1881,218. — Substitution du brodequin napolitain aux(...),brodequin
1891,"Leurs jambes disparaissaient en des gaines étroites, les pieds seuls, sans cothurne ou brodequin, posaient(...)",brodequin
1871,"De cette façon on avait une véritable chaussure, un brodequin, un soulier, comme le disent tés expressions grecque et latine",brodequin
1871,"Les Grecs, en effet, l'appelaient du nom d'upodêma, le nom même qu'ils donnaient à une variété de leurs chaussures, h'upodêma était un soulier ou brodequin, qui montait à droite ou à gauche, de manière à couvrir complètement le pied",brodequin
1871,"Histoire naturelle, liv. XXXIII, ch. 49.) C'était si bien une chaussure, qu'ils se servaient même du verbe calceare ou calciare, chausser, comme pour eux-mêmes, quand ils mettaient leur chaussure appelée calceus, c'est-à-dire un soulier, un brodequin, qui montait à droite et à gauche, de manière à couvrir tout le pied, par opposition aux crepidoe ou aux soleoe qui ne le couvraient qu'en partie",brodequin
1871,brodequins ou plutôt de souliers pour rendre plus exactement le mot solea,brodequins
1881,"rude brodequin dessinant un jarret athlétique, on eût dit une race élémentaire de demi-dieux ou de géants",brodequin
1881,On entendit son brodequin orthopédique résonner sur le chemin(...),brodequin
1881,"mais c'est le brodequin surtout qui est un capo d'opera(...)Tiens voici douze cachets de bains pour l'établissement de Saint-Samuel, et quand ton brodequin magique sera(...)",brodequin
1890,"Dans les quatre régiments, les prix moyens des chaussures d'ordonnance sont : Brodequins 10 fr(...)50 à 0 fr.GO Chaque homme use en moyenne, par an, une paire de brodequins et une paire de souliers, plus en réparations diverses aux chaussures pour environ 5 fr",brodequins
1906,"LE SABOT DE VÉNUS V énus, un soir d'été, par l'orage surprise, Egara dans les bois son riche brodequin Chamarré d'ambre et d'or, et dont la forme exquise Semblait l'œuvre de choix du plus adroit lutin",brodequin
1886,singulier marqua l'exhibition du brodequin,brodequin
1935,11 a préconisé l'adoption d'un brodequin mixte à semelle de cuir cloutée(...),brodequin
1931,"6 mois Pantalon en toile bleue 6 mois Couverture de laine 3 ans Brodequins (paire) 1 an Bandes molletières (paire(...)1 chapeau de paille, une vareuse de toile, uu patalon de toile, une paire de brodequins et une coùverture",brodequins
1931,"et conditions déterminées Par le cahier des charges, les brodequins, bandes molletières, serviettes de toilette, brosses à laver et le savon faisant l'objet (e l'adiadication du 21 janvier 1932, aux prix ci-après iudiqués : brodequins la paire(...)",brodequins
1936,"Il a le pied chaussé d'un brodequin à grande tige élargie du haut, semblable à ceux des soldats sur la fresque de Couddes (Loir-et-Cher) (1(...)",brodequin
1894,"DE L'ACADÉMIE DE VAUCLUSE 151 ferrea ou hipposandale, espèce de brodequin en fer que les anciens mettaient aux pieds des chevaux, et une casserole de bronze",brodequin
1894,"90 MÉMOIRES Pour l'honneur de la brosse à lustrer, pour l'honneur De la poêle, que vous risquez de compromettre, Qu'il sache bien que, s'il avait daigné commettre Au soin du tourne-broche, au soin du brodequin Quelqu'un de coeur plus haut et d'esprit moins mesquin, Il eût pu mieux juger notre corps",brodequin
1926,"3.853 paires de brodequins à la. maison Molon et les 1.300 premières paires, présentées le 29 septembre, avaient- été refusées par la Commission de réception du Havre(...)",brodequins
1916,"dans le brodequin relâche,de faire jouer leurs chevilles, etc(...)hiérarchique descendante, les médecins de bataillon furent invités, l'Académie de Médecine consultée, à veiller à èe que les hommes desserrassent leurs brodequins ainsi que leurs bandes molletières aussi souvent qu'il serait possible, à ce qu'ils mobilisassent leurs doigts, de pieds dans le brodequin relâché, à ce qu'ils fissent jouer leurs chevilles,etc",brodequin
1928,"tirailleurs partant en permission : C’était un beau gaillard, noir comme les baguettes d’un tambour et porteur d’une paire de brodequins dignes d’être suspendus en ex voto à la Chapelle de Notre-D",brodequins
1928,"Brodequins troupe ferrés ou non, cuir 1"" choix, valeur 75 fr., laissés 69 fr(...)Brodequins travail derby av. sont., semel. cous., b'* dura, val",brodequins
1910,"a broquin (brodequin), tantôt par dissimiiation : réquir, requérir",brodequin
1910,"peut-être du fr. bravement, par antiphrase. brènlté, brodequin",brodequin
1938,"Maintenant que le mot vient d’être vieilli de 261 ans, ne convient-il pas de penser que l’italien arlecchino a pu être au contraire calqué sur le français arlequin, et que ce dernier peut avoir une origine néerlandaise (cf. brodequin, mannequin et les patronymes Pierrequin, Hennequin(...)",brodequin
