year,sentence,key_word
1896,On y arrive par la porte Bordelle qui débouche dans la grande rue Marceau (aujourd'hui rue Mouffctard(...),bordelle
1950,ort Nous avons voulu vérifier pour d'autres cépages les valeurs du rapP 0rt s S/P. Voici réunies dans le tableau II calculées d'après les donl'écs Peynaud les valeurs du rapport S /P de certains cépages du Bordels ge poids maximum du grain pour les années 1937 et 1938 (1(...),bordels
1915,"11 Wir haben zuverlâssige Nachrichten, dass in solchen Siadten, in denen die StadtTerwnlInng fiir die Unzuchtder Mënnenwelt Bordelle 2ulassen zu rnusseu glauht, in den Mobilmachungstagen und ebenso in den folgenden Wochen der Truppenansamnilung und Truppenausbildung, die Scharen(...)",bordelle
1836,"Par là corbleu, messieurs, j'aime ces vieilles tours de la porte Bordelle: notre sire nous les montre assez, Dieu merci(...)",bordelle
1869,"qui nous force de souffrir impunément plusieurs bordels publics dans la \ ille, mais je n'ay(...)",bordels
1919,"à Hambourg, où la Révolution a promené la torche du conflit religieux, elle a maintenu les bordels et éliminé l'enseignement religieux(...)",bordels
1927,Il n'y a donc plus de bordels en Suisse depuis plus d'un an,bordels
1864,"Il porte au dos le titre de ~fMes de ~oMfde<M~ et contient quatre grands poëmes Le roman de Vespasien (folio 1), le roman des Lohérains (folio 103), le roman du roi Auberon et de Huon de Bordelle (folio 283), le roman de Buevon de Hantonne (folio 461), et de",bordelle
1905,Les hommes sont invités au commerce sexuel par la prostitution qui s'étale dans les rues ou parl'existence des bordels,bordels
1925,"se nonit, Jedes wott's Nàttst sin un dàt's ess zewett, D'Kramerméi, d'Kiàferliss, un 's Bordels Lehn, Dite-n-alTI Màssdi gli vorne dron stehn",bordels
1932,"Peut-être s'étonne-t-il des guerres, des tribunaux, des bordels, mais tout cela est encore la vie et il veut la vie",bordels
1937,"BÔRDELLE, s. f",bôrdelle
2003,"Pourquoi pas Marthe Richard qui ferma les bordels, et Henri Martin, dont les murs de France et de Navarre, dans mon jeune temps, r éclamaient 1 a 1 ibération(...)",bordels
1893,au deta de la porte Bordelle,bordelle
1870,"de mur devait être située à la hauteur de la quatrième tour après la porte Saint-Victor, mais cependant plus rapprochée de la porte Bordelle ou Bordet, située à l’endroit où cette enceinte coupait la rue de la Montagne-Sainte-Geneviève",bordelle
1900,"Constantin, Gaspard Bordel, Louis Iloibel, François Vibert, Claude Gravod, Jean-Franç",bordel
1900,"Bultel, le 7"", JeanClaude Deage, François Garin, Jean Sissc, les 10°, 11° et 12°, François Charcot, Aymé Chardon, Josuë Bordel, Pierre Chevrier, Claude Crose, Maurice de Lamberlde Choirié, Pierre Truffon, Cl",bordel
1900,"Erasme Ricardy, Jean-Pierre Masseriol, Gaspard Bordel, Estienne Videt, J",bordel
1900,"Favre, Jean-Estienne Bordel, Jean-Ant",bordel
1900,"26 tienne Cholel, Aymé Poi-cheron, .lanns Vulliel, Jacques Bernard, Thomas Bugnet, François de la Chinai, .losuë Bordel, Claude Sibaud, ,1(...)",bordel
1855,"Giel, M. Bordel",bordel
1963,"offensive des Normands, qui envahissent les terres de Thibaud, Ne leissent en Chartrain et Duneiz bordel Ne mézon en estant ki seit fors du chastel, et Au jor maisme arstrent Chartres sa cité ( 3(...)",bordel
1906,"9 » l’une bon choix, — 8’75 — — 3* choix, — 7 50 — I er choix, lie hlanclie 9 75 — — bon choix, — 9 25 — — 3» choix, — 8 50 — 1/2 bordel",bordel
1906,"7 50 — l” r choix, lie blanche 9 75 — — bon choix, — 9 25 — — 3* choix, — 8 50 — 1/2 bordel",bordel
1906,"1"" choix, lit blanc/ e 1) 75 — bon choix, 9 25 — 3“ choix, y ■■ 8 50 1/2 bordel",bordel
1934,"Frau in der Badewanne ertränkt bordel war Ihre Handtasche, der Pelz* und meurtre Kleidungsstücke gare verschwunden und von idem Begletter mitgenommen bordel",bordel
1934,"Jahrhundert stammender Kirchenaux, ist in der verflossenen Nacht lingeescher bordel(...)Unter den Personen, die aus dem Konzentrationslager enflasses bordel sino, befimdeni sic der frühere badische Minister Remmele, dires(...)",bordel
1934,"Prager Messe, welche 3847 tschechoslowakische und 272 ausländische Aussteller umfasst, ist beute morgien Eröffnet bordel(...)Nachdem er den grosse Fortschritt, der bérets erzielt bordel zist, intertricher und die gegenwärtige Lage dargestellt natte, relies er ebenfalls, dans das gegenwärtige System loch l nvollständigkeiten aufweist tmd durci die momentané dem Senat vorliegende Vorlage abgeändert merdent sol",bordel
1914,"Er ist in das nachstlie- gendo ( inrnisonlazarett überführt bordel. sprint Joachim, der jüaglste Sohn dea Kaisers, ist in Strassburg und im Elsass als Irü- herber Student an der Strassburgier l niversitiit bekannt(...)zurückgestellt, cordon gare, aufgefordert bordel, sic peiner nuent iirztlichea l tordu- chenu# zu 'untelrziehen",bordel
1914,Herr Pfarrer Pussere-Hüningen ist éden- fallu freigesprocben bordel. zest in Lürrach(...)Uebrigeus sino aile diése Gerüchte widerlegt bordel durci die Erklârung,bordel
1939,"dans ein U-Boot gesich- tet bordel semi, das confort von zizi Kanonenbooten verfolgt kurde, die im gansez 12 Schüss° abgabcn. schwachen Widerstand von suites der feindlichen FUegerei gefunden(...)ermordet bordel Binnen 10 Minuten war das Haus von ionien gesàubert und der ord",bordel
1939,"Die B<>eatsung der Stadt ist durcit dires Kavalleriebrigaden verstàrkt bordel. die sic bis in die Hauptstadt durchschiugen und vor wenigen Stunden eintrafen(...)zwischen Deutschland und Sowjetrussland hein Abkommen abgeschlossen bordel far, um die Aufteihmg Polen# zu regela",bordel
1939,"Ar- beute unterstellter mineralogischer Bezirk gegrüpdet bordel, der seine Sitz tp Mulhausen bat(...)Heintz., Bischof von Metz, hat an Mgr. Mesgucn, Bischof von Poitiers, in dessin Diozese zahlreiche evakuierte Ixithringer untergebracht bordel sino, peine Brief gerichtet, dem wir die folgenden Stellen enta- nehmen : azur Stunde",bordel
1939,"s ^ je berwachungskomitee me- ' nieras bezahlt bordel, canif ihn mut(...)Ihr miche i nieras mit absolutiser Sicherheit festgestellt bordel",bordel
1914,"Au Sud d’Ypres nous avons perdu quelbues points d’appui (Hollebecke stand- bordel, mais nous avons progressé à l’Est d’Ypres vers Paschendaelle",bordel
1859,"Bordel ne s’est pas défendu, et vous l’avez horriblement mutilé(...)Bordel vous a demandé grâce , il vous criait qu’il avait de bonnes intentions",bordel
1941,"56 b. bordel alfa SG uni I». tiens alfa, ' AC 2<*i b. bordel alfa, MDetD 61 dito, GDctC 40 dito",bordel
1923,Réaction de Bordel-Wassermann... në-alive. — de Guillain — d’Emmanuel — de Lange Observation XI Hémiplégie gauche 1921° r' cd ’ ** d ° 01 anS ’ ° St enW te 22 mars ruche H T P ° Ur d “ membre supérieur Nie tout antécédent morbide A l’poumon malade Piennni,bordel
1923,Réaction de Bordel-Wassermann. négative. — de Guillain — — de Lange — — d’Emmanuel — Observation XV Paraplégie spasmodique A(...),bordel
1923,"Réaction de Bordel-Wassermann. . . positive. — de Guillain. de Lange d’Emmanuel Observation XVI Epileptique mImoT/X 1 S charron ' entre au Mrïice du Profe(...)3. réaction, de Bordel-Wassermann. . . négative <le Guillain —■ de Lange — d’Emmanuel",bordel
1923,"Réaction ,1e Bordel-Wassermann... négative — de Lange de Guillain d’Emmanuel Observation XXIII Paralysie générale progressive , Le8mar sl921,MUeBertheO...,âgéede4Onn« > .. dans le service du Professeur Mairef 7 ° St admire caractérisés par des idées de richesses' endo ‘M'"""" 18 deux mois, la malade accusait i 4 Braudcurs - y a la faisaient se réveiller en sursaut",bordel
1923,Réaction de Bordel-Wassermann. . positive. — de Guillain — — d'Emmanuel — — de Lange Observation XXIV Tabes avec double arthropathie me R,bordel
1923,"Réaction de Bordel-Wassermann... négative. de (iuillain , - e positive. — d’Emmanuel — de Lange",bordel
1839,Elisabeth-Pélagie-Joseph Bordel(...)Christine Bordel,bordel
1966,"P'he devon yaouankiz Breizh lavant en he fend dessin ar yeux bordel, ive he feus désuet serin, kanak, ha dansai ive he zazou bouh, neuve Breizh a vo adkeltiekaet da va, ha savetier war un drop",bordel
1966,"AR VRO, kelaouen bordel pe nanti, Etude-crit pique N° 2(...)2 F. - AR VRO, kelaouen nan bordel, Etude critique N à 3 3 F. - PREDER, Etude critique, par Goulven PENNAOD I F",bordel
1913,"LE PHOSPHATE 775 CHRONIQUE GENERALE PHOSPHATE Phosphates du Dyr Assemblée générale du 21 Juin <913 LA DISCUSSION M. Bordel. — Je me permets d'ajouter quelques mots au rapport du Conseil pour dire que la circonstance qui a le plus influé dans un sens défavorable sur l'exercice 1912 est la hausse îles frets(...)M. Bordel. — Nous avons un marché avec la Société tunisienne, mais je crois que l'usine ne fonctionne pas encore",bordel
1913,Bordel. — \ vis-à-vis de Saint-Gobain nous sommes tenus a une certaine complaisance : nous ne sommes(...)M. Bordel. — Cela varie II s’agit de contrats passés sur plusieurs années,bordel
1909,La bonne de M. Bordel lui déclara : « Le bois que j’ai charrié dans la propriété de mon patron lui appartient(...)demande le président à M. Bordel. — C’est exact,bordel
1909,"Et aux gendarmes Roux et Bordel, qui eurent mille attentions délicates à son égard, et le déposèrent sur une couche de foin dans la remise(...)",bordel
1977,"La plupart des autres bordels de la capitale, des plus huppés, comme le Sphinx du boulevard Edgar-Quinet ou le One-two-two de la rue de Provence, aux maisons d’abattage, comme le Fourcy ou le Panier Fleuri, furent tout de suite vidés de leurs occupants, pour, dans un premier temps, être affectés au logement des étudiants ou abriter des œuvres sociales, avant de devenir, par la(...)",bordels
1977,"M.C., autrement dit du « bordel militaire de campagne(...)",bordel
1977,"LE CRAPOUILLOT 5 Chapitre I LE VERTUEUX SOLON CREE LES BORDELS w 5 f h A Pompéi, cette « flèche » phallique indiquait la direction du lupanar(...)SAINT AUGUSTIN L ES bordels de papa, ces joyeux « claques » des années folles, dont quelques messieurs grisonnants et décorés ont conservé la nostalgie, figurent aujourd’hui en bonne place dans l'histoire de la civilisation",bordels
1977,"les cordons blancs auxquels les astreignaient les ordonnances des clapitouts, adressèrent en 1389 une pétition à Charles VI, lequel leur octroya la lettre suivante : « Faisons savoir à tous présents et à venir que, oye la supplication qui faite nous a été de la part des filles de joie du bordel de notre grande ville de Toulouse, dit la Grande Abbaye, contenant que, pour cause de plusieurs ordonnances et défenses à elles faites par nos capitaux et autres officiers de notre dicte ville sur leurs(...)",bordel
1977,Chacun à sa place : les putains au bordel et les autres dans les foyers(...),bordel
1977,"extraordinaire que, quatre ans plus tard, le magistrat Louis Wolff réunit vingt et une motions afin d’obtenir la réouverture des bordels(...)A la cour des rois de France, le roi des ribauds avait disparu, mais le bordel royal existait toujours, surveillé par une sorte de sous-maîtresse appelée « la dame des filles de joue(...)",bordels
1977,"LE CRAPOUILLOT 73 Chapitre VI LA RECONVERSION DES BORDELS DE PAPA Paris, rue de la Charbonnière, mars 1977 : des deux côtés de l’artère, on fait la queue devant une « maison » DISQUES l(...)Mais voyons plutôt comment se sont recyclés les bordels de papa(...)Véritables « bobineras » également, ces B.M.C. (bordels militaires de campagne) qui, de temps à autre, défraient la chronique",bordels
1977,Ces maisons meublées étaient en fait d’authentiques bordels fonctionnant sous contrôle policier et médical,bordels
1977,C'est dans nos bordels que les étrangers venaient explorer la face cachée de la France,bordels
1977,"Le choix. (Gravure de 1884.) tes du bordel n'induisent pas en erreur les historiens de la luxure de papa : les maisons closes n’étaient pas un dérivatif coûteux réservé aux classes privilégiées de la jet-société d'alors(...)navale, le bordel était la fleur de nos villes de garnison",bordel
1977,"iiÀkàtiJtUxUj Le choix. (Eau-forte de Louis Legrand - 1901.) Les archétypes du bordel qui hantent entore l'inconscient collectif des Français ne se réalisent plus aujourd'hui que dans l’ambiguïté des travestis(...)S’il existe un folklore du bordel, nous en avons également hérité un florilège de plaisanteries classiques : — Monsieur, vous êtes une vraie tête à claques(...)",bordel
1977,"On aurait difficilement trouvé plus sordide, sauf f sur les « théâtres d’opérations extérieures », où régnait le B.M.C., appellation officielle du bordel militaire de campagne(...)C 'est ainsi que j'ai été appelé à monter la garde au bordel de Soueïda pour protéger les fornications des Malgaches et en interdire(...)",bordel
1977,"LE CR. — A votre avis, c'est plus immoral que d'aller dans un bordel de luxe(...)",bordel
1977,L'atmosphère du bordel était tranquille et provinciale,bordel
1977,"Les puristes déplorent que le mot « bordel », comme d'ailleurs le mot « cirque », soit synonyme de « fouloir » dans la langue populaire(...)Ces dames respectaient mon isolement studieux dans une sorte de vénération maison — c'est le cas de le dire — pour l'instruction et les valeurs bourgeoises : le bordel est conservateur et le maquereau modéré",bordel
1977,"LE CRAPOU1LLOT 17 Chapitre II DU PARC-AUX-CERFS AU CHABANAIS Un client fait son choix sur portraits. (Gravure d’après Crispijn Van de Passe.) P ENDANT la régence de Philippe d’Orléans le Corrompu et durant le règne de Louis XV le Bien-Aimé, les bordels connurent un éclat particulier",bordels
1977,"On y trouve la description de quelques perfectionnements analogues à ceux qui, un siècle et demi plus tard, feront la gloire des grands bordels de la capitale",bordels
1977,"serveuses montantes ») fait un si grand tort aux bordels traditionnels que le total de ceux-ci à Paris descendra à 73 en 1888 et à 59 en 1892 (on comptait alors 203 brasseries desservies par 1 100 « filles(...)Dans ce recueil de souvenirs personnels intitulé Un joli monde, le policier décrit minutieusement l’intérieur d’un petit bordel misérable(...)",bordels
1977,"Auprès de ces sordides maisons d’abattage, on commençait à voir à Paris quelques grands bordels bien tenus, destinés à une clientèle plus aisée(...)A cette époque de rénovation d’un Paris où triomphait la bourgeoisie, il n’est pas surprenant d’assister à la naissance des premiers bordels de grand luxe",bordels
1977,"Le prince de Galles avait sa chambre au Chabanais Le plus fastueux, le plus célèbre de ces bordels « trois étoiles » fut installé au 12 de la rue Chabanais",bordels
1977,"Pendant plus d'un demi-siècle, toutes les filles de bordels durent se soumettre à des(...)",bordels
1977,"Quand les « taupiers » deviennent P.-D. G. Après une longue période purement artisanale, le bordel s’industrialisa(...)Deux « hommes du voyage », anciens « placiers en filles » pour les bordels des ports du Japon, de l’Afrique du Sud et de l’Argentine, firent une magnifique carrière : après s’être acheté des maisons à Lyon et à Reims, ces deux « durs », que l’on appelait Nez-Pointu et Georges le Cuirassier, furent(...)",bordel
1977,"Le Guide rose, annuaire-indicateur des maisons et salons de société (exclusivement réservé aux tenanciers de bordels), signalait(...)",bordels
1977,"Lî/Ü L ’M Le luxe étonnant d’un grand bordel de la Belle Epoque, le 6, rue des Moulins : le salon oriental (en haut à gauche(...)",bordel
1977,"Il rêvait d’un grand bordel, mais, selon les lois en vigueur, il lui fallait pour l’acheter une femme légitime",bordel
1977,"En habit et haut-de-forme, il épousa Fabienne en 1942, avec pour témoins un de ses associés et le patron d’un bordel de la rue de l’Arcade",bordel
1977,"André Malraux rapporte dansât Voie royale ce souvenir de jeunesse : « Un jour, on me mena, à Paris, dans un petit bordel minable",bordel
1977,"Dans les bordels du quartier de l’Opéra, on connaissait, vers 1937, un riche industriel qui apportait à chacune de ses visites un oiseau vivant, dans une petite cage, et une paire de chaussures neuves",bordels
1977,"Pierre Mac Orlan, lui, a écrit à propos de la fermeture de 1946 : « En faisant fermer les bordels, Marthe Richard a aboli deux mille ans de civilisation(...)Et à la splendeur des bordels de luxe ils opposent la misère des courtisanes(...)Dans les bordels usines la passe est minutée Il existait encore(...)",bordels
1977,"Bien sûr, il en existait encore, mais il y avait également des bordels usines, où la passe minutée, comptée au plus juste prix, permettait à de véritables entrepreneurs de maisons publiques de faire fortune",bordels
1977,"Contrairement à ce Un bordel usine : le Panier Fleuri, boulevard de la Chapelle, quelque temps après la fermeture",bordel
1977,"LE CRAPOUILLOT 49 TEMOIGNAGES et DOCUMENTS UN GRAND BORDEL PARISIEN EN 1750 « Il y a eu de tout temps, dans la ville de Paris, des putains et des mauvais lieux, les uns un peu plus fameux que les autres, et cela est absolument nécessaire dans une aussi grande ville(...)De temps en temps, les commissaires font des visites dans leurs quartiers et enlèvent les filles de petits bordels du commun, pour faire conduire ces filles(...)",bordel
1977,L K: 'Jj La maison à soldats. (Gravure du XIX e siècle.) LE MICHÉ SÉRIEUX VIENT SEUL AU BORDEL « La sous-maîtresse l’accueille avec son plus gracieux sourire,bordel
1977,On se croirait au bordel,bordel
1977,"Desgranges - 1821.) BORDEL : « Aw XVIII e siècle, l’académie d’amour est un lieu où l’on va pour jouer au jeu de Vénus, et c’est cela qu'on appelle en bon français bordel",bordel
1977,"BOTTIN Voici quelques pseudonymes authentiques de patrons de bordels en 1925 : Henri les Yeux Bleus, Georges l’incendié, Fernand le Moche, Louis le Rouquin, Chariot le Zouave (tenancier du Petit Soleil, de Tours), Michel i’Italien, Jean le Tatoué, Marius le Noir, Arthur l’Edredon, Champagne, Edouard la Carpe, Marius la Voix d’Or, Coco Lacet, Chariot l’Italien, François le Corsico",bordels
1977,"EN DIRECT DU BORDEL En 1927, Maryse Choisy, romancière, chiromancienne et journaliste, eut l’idée de réaliser un grand reportage sur les maisons de tolérance(...)On n’ignore rien dans un bordel de province",bordel
1977,LE CRAPOUILLOT M LES BUVEURS DE BOCKS « Ils entrent au bordel comme ils iraient au café(...)LE BORDEL PARISIEN « Le « claque » est un Institut de psychologie expérimentale,bordel
1977,"Ensuite, le taupier argumente en faveur du bordel bienfaisant",bordel
1977,Ne vaut-il pas mieux aller au bordel que tromper l’épouse avec sa meilleure amie(...)et peint sur le bordel est archifoux(...),bordel
1977,Ces médaillons avaient longtemps orné le salon d'un bordel de la rue d'Amboise — où Lautrec habita avant de s’installer rue des Moulins — et ils figuraient diverses pensionnaires(...)Mais où sont les bordels d'antan(...),bordel
1977,"Mais où sont les bordels d’autant(...)Pour l'honneur de la République Daignez, monsieur le Président, Rapporter ce décret inique Rendez-nous les bordels d'autre",bordels
1977,"Ici, au cours d’une soirée costumée, elle mime une patronne de bordel examinant une pensionnaire",bordel
1890,"Lou bordel routier et four, un Soler Iwritaple, Tetabo lo Coillob' en tourbillon lo qui(...)Lou bordel es fi note gras, mais quoi pitchiou : Pari qu’tribo pas o(...)",bordel
1844,"lean Lacour, Philippe Bordel, Antoine Bordel et Hugues Bourgeon, tous quatre vigneron, demeurant à Chenoves, à l’exception d’une partie desdits bâtiments occupée par M",bordel
1876,elle envoya la femme Bordel porter le tiroir h arranger chez un serrurier(...)La femme Bordel avoua tout et accusa la fille Merle de l’avoir entraînée à commettre ce vol. On arrêta ces doux femmes qui furent traduites aux assises dernières,bordel
1876,"rand Ventre, le jury a rendu un verdict de culpabilité, et la femme Bordel a été condamnée à trois ans de prison",bordel
1864,"162 REVUES. bordel: MM. Pécholier et Saintpierre. — Générations spontanées : MM. Béchamp, Pasteur, Donné. — Encore les mariages consanguins : MM",bordel
1864,bien comparable avec celui de l’ouvrier en bordel soude l’horloger,bordel
1864,"3° A l’absorption directe du bordel par la peau dans les opérations de V sauvage humide , dans le raclage des plaques, dans le pétrissage et la mise en pains du produit(...)La durée des diverses réactions qui donnent naissance au bordel, obligeant le fabricant(...)",bordel
1864,Qu’est-ce que le bordel,bordel
1864,"H 7 toxiques du bordel, nous serions portés tout d’abord à considérer corne très-dangereuse une profession qui expose, d une manière persistante, les ouvriers à l’action de ce produit(...)Neuvième expérience, dans laquelle on a retrouvé le cuivre dans l’urine des ouvrières en bordel",bordel
1864,2° Celle note ajoute que les jeunes filles qui manient le bordel «souriraient de pitié si on leur recommandait de se laver les mains avant de prendre leur repas,bordel
1864,"L action des poussières de bordel sur les organes respiratoires mérite plus d’attention, non pas que leur absorption par la muqueuse pulmonaire soit considérable(...)Celte action irritante des poudres de bordel sur les organes respiratoires est parfaitement en rapport avec les observations de nos devanciers",bordel
1864,"Le bordel, mis en pains ou en boules, est séché d’abord au soleil, puis sur des claies disposées à cet effet aux étages supérieurs de rétablissement(...)et imprégné de bordel, ainsi que la simple vue permet de le constater, il est porté dans des cours , où il sert à l’engraissement de la volaille ou des moulons",bordel
1864,"Il y a cependant encore ici une distinction à faire: c’est surtout chez les personnes irritables, au visage grêle et nerveux , à la fibre sèche, plutôt prédisposées aux tubercules qu’aux scrofules, que les poussières de bordel sont à craindre(...)N est-il pas permis d’admettre à priori, par exemple, que des angines chroniques survenues chez des sujets de celte deuxième catégorie seraient heureusement modifiées par I action mélasyncritique des poussières de bordel",bordel
1864,"Les effets du bordel ne nous ont point paru sensibles sur celle fonction(...)L'action irritante utopique de la poudre de bordel détermine assez souvent, chez les personnes non accoutumées , de légers accidents sur les(...)",bordel
1864,"Il nous est, par conséquent, impossible de connaître même approximativement, par cette expérience, quelle est vraiment la dose de bordel dont le séjour dans le tube intestinal et l’absorption ont suffi pour amener la mort",bordel
1827,"54) Il a été procédé, à la requête de sieur Jean-Louis-Joseph Ma* bordel, propriétaire, habitant de la ville de Brive, qui a constitué pour son avoué maître Jean-Baptiste Blanchard, avoué près ledit tribunal de première instance séant en ladite ville de Brive, y demeurant",bordel
1842,"En ce moment Bordel tira de sa poche un long couteau, et en menaça les deux antagonistes(...)Alors Bordel s’élança sur lui, et, au moment où il se relevait, il lui enfonça son couteau dans le cœur",bordel
1835,"La veuve Bordel engageait sa voisine à coucher avec elle, mais elle ne put l'y déterminer(...)dame Bordel était placé en travers, la tête tombant vt rs la ruelle(...)",bordel
1933,"Bordel négative, on n’obtient pas avec le résidu sanguin extrait du tube capillaire la fluorescence rouge de I hématoporphyrine, il est possible, que pour la différenciation du sang (réaction de Bordel) la concentration sanguine était trop faible",bordel
1933,"Car une trace de sang traitée au leiico-malachite ne convient plus à aucun examen spectroscopique, fluoroscopique ni cristallographique, ni a la réaction de Bordel",bordel
1944,"épouse de Monsieur Emile BORDEL, d me- naître au Serv’ce du Génie-Rural(...)Imprimerie M. BARTHELEMY 46, tâte Gerretetee » AarrowHw Et Monsieur Emile BORDEL, cultivateur, demeurant e* domicilié à CAVAILLON, quartier d s Piantiers, d’autre part(...)",bordel
1886,"GRILLAGES o se- RONCES en ACIER, 9 fr. les 100 mètres CHAISES* BANCS * TABLES jardins Serrurerie et Outillage Horticoles bordel, 16, quai du Louvre, PARIS",bordel
1882,Virtuosin in hôclister Vollkonnnenheit gewahr bordel,bordel
1886,"Bordel. (“est M. Javil'ier, conseiller municipal, etmoi, qui avions été envoyés à M. Boraet, par M. Baudin(...)Bordel ayant immédiatement consenti à donner la satisfaction demandée, dans les termes mè nes do la note précitée, nous n’avions qu’à nous retirer(...)",bordel
1867,"LE Président. — Cependant, Bordel à qui vous avez vendu tant d’objets provenant de ce vol, ne pouvait pas ignorer leur origine 7 L’accusé(...)Je n’ai vendu à Bordel que deux chemises",bordel
1901,"Bordel Wous avons le profond regret d’apprendre lia mort presque foudroyante de M. François(...)François Bordel, après s’être fait dans le commerce dijonnais une place importante, entra pour la première fois au con- -seil municipal en 1870, avec la liste Enfert, Dubois, Lévêque, Robelin, etc(...)François Bordel et prie sa famille d’agréer l'expression émue de ses condoléances les plus sincère» et les plus vives",bordel
1893,"330 — an, und Kriemhild fait, wie Hagen, der giclai soie Frevels bewusst, sic in diéses Land wagon tonne, da or nichât gelaient bordel soi",bordel
