year,sentence,key_word
1863,"Henri de Bourbon put même, pour soutenir cette guerre, emprunter quatre canons à la ville d'Orthez et mander à lui le régiment du sieur de Castelnau de Chalosse, cantonné dans la vallée de la Soule, et auquel il permit de se recruter de quelques(...)",soule
1921,"Procès-verbal de la séance du 2 janvier 1921 La séance 'èst ouverte sous la présidence du camarade Puchéou et comme secrétaire de séance le camarade Soûlés (chef de train), à la Bourse du Travail, à 14 heures",soûlés
1892,"dès qu'elle est abandonnée, elle tourne sur elle-même el gravit soûle une pente de 4 centimètre» sur une longueur de 40 centimètres et vient frapper en tournant sur un trapèze en fer mobile qui sert àmarquer le numéro ou la couleur qui gagne",soûle
1909,La séance est ouverte sous la présidence de M. Soulé,soulé
1909,"Quelques observations sont présentées par MM. Béguin, LEFÉBURE, GAVBLLE, DUBOIS, CORNET DE Romagne, Soulé, Héron(...)Je vous propose également de continuer votre confiance au trésorier, M. Soulé, pour le prier de conserver ses fonctions",soulé
1909,"Vice-présidents M. Soulé, de Ribes-Christofle, Lefébure et Eudes(...)Présents MM. Fabre, Soulé, Eudes, Vergoz, Cruchon, Perrin, Kula, Vaillant, Lacau, Pradillon, Tétard, Gaston de Monicault, Barbier, Pinchard-Dény, Ferlay, Galineau, Cousseyre, Goubie, Viet, Ausseur, Bréant et Faure(...)Carel, Pinchard- Dény, Michel, Ausseur, Rouart, Rodrigue, Bonnier, Riehardière, Bergeotte et Ed. Duval MM. Fabre, Soulé, et Vergoz sont chargés de la rédaction des",soulé
1909,"présents MM. Lucien Fabre, Soulé, de Ribes-Christofle, Vergoz, Cruchon, Perrin, Lacau, Richardière, Barbier, Kula, Viet, Leyrit, Pradillon, Galineau, Faure, Bergeotte(...)Puis M. Fabre, et après lui M. Soulé, ont exposé au ministre les origines du Congrès, son importance et sa portée",soulé
1909,"DES armes, munitions jj, Soulé, président de la Comaktici.es DE CHASSE mission du Congrès mixte de 49, me Bkmche, Pam. l'Industrie du bâtiment",soulé
1909,M. Soulé donne lecture d'un certain nombre de vœux,soulé
1909,"N.-B. Nous rappelons que les adhésions et souscriptions doivent être adressées à M. Soulé, président honoraire de la> Fédération nationale du Bâtiment, membre de la Chambre de commerce de Paris, trésorier du Congrès, 13, rue de Thorigny, à Paris(...)ouverte, sous la présidence de M. Soulé",soulé
1909,"Excusés MM. Soulé, Georges Picot, Goubie, Perrin, Rarbier, Carel, Richardière et Faure",soulé
1909,"La Chambre de commerce de Paris était déjà représentée au sein du Comité par MM. Soulé, de Ribes-Christofte, Jouanny et Niclausse",soulé
1909,"rêt de l'enfant que s'élèvent des voix puissantes comme celles des Soulé, des Villemin, des Isaac, des de Ribes-Christofle, des Templier, etc",soulé
1867,"La friture grince, la matelotte bouillonne, le vin coule, le patron chante, la patronne ronfle et le sommeiller se soûle",soûle
1909,"En Bretagne, écrit M. Girod, le. jeu de la soûle se jouaient entre jeunes gens de(...)La victoire restait au parti qui avait pu s'emparer de la soûle et l'a porter sur une autre commune que celle où le jeu avait commencé(...)Le nom même de soûle, ajoute Souvestre dans ses Derniers Bretons, vient du celti que heaul (soleil), dans lequel l'aspiration initiale a été Changée ,eu",soûle
1909,"Bretagne, écrit M. G-irod, le jeu de la soûle se jouaient outre jeunes gens de deux communes voisines(...)La victoire restait ,au parti qui avait pu s'emparer de la soûle et, la porter sur une autre commune que celle où le jeu avait commencé(...)Le nom même de soûle, ajoute Souvestre dans ses Derniers Bretons, vient du celtique heanl (soleil), dans lequel- l'aspiration initiale a, été changée en s",soûle
1880,"Le 5 juillet, l'auteur de cette invention, M. Soûle, du comté de Wayne, a traversé la rivière d'Harlem en partant du High Bridge(...)Soule pèse 125 livres et enfonce ses souliers dans l'eau jusqu'à une profondeur de trois pouces et demi",soûle
1897,"Dans l'Emulsion Scott, l'huile, présfeiçvéç contre toute altération, combinée avec les hypophosphites de chaux et de soûle,devient agréable au goût et de digestion facile",soûle
1931,"Le grand chistera est l’instrument des troupes payées qui s’exhibent d’Hendaye à Capbreton, et il permet les plus belles attitudes, c’est un sujet tout désigné pour les sculpteurs, mais il est incomparablement moins vif et gai que le petit chistera, dit jeu limpio, où le truquage est moins facile, et que les meilleurs amateurs du Labourd et de la Soûle essaient à présent de remettre en honneur(...)Les gamins basques de toutes les régions, du Labourd jusqu’à la Soûle de Tardets-Sorholus, jouent bien(...)",soûle
1928,"Les intermèdes divers ayant soule- mamc prochaine(...)Pierre Soûle, 62 ans, chaudron en retraite, G7 ans",soule
1910,"rbie«, «le façon è év 1er prnp g ition soûle» rmiie pur le invce li m dn champignon(...)",soûle
1888,"Membres : MM. Hunàult (Nantes), Soulès (Dijon), Caza- gne (Lyon), Payer (Reims), Thirouin (Bourges), Thubé (Bayonne(...)",soulès
1888,"Chrétien contre Soulé.) M. Chrétien, commissaire-priseur à Sedan, a(...)fait assigner M. Soulé, entrepreneur de concours régionaux, devant le tribunal de commerce de Sedan en paiement de 83 fr(...)A la barre du tribunal, M. Soulé a offert de payer à M. Chrétien le montant de la somme à lui due d’après taxe",soulé
1888,"Le tribunal a statué en ces termes : Attendu que le sieur Chrétien réclame au sieur Soulé la somme de 83 fr(...)Attendu que, de son côté, le sieur Soulé, par l’organe de son avocat, offre de payer le montant de la taxe, mais se refuse à supporter les autres frais, qu’il qualifie de frustratoires, prétendant qu’aucune justification ne lui aurait été faite relativement à la taxe de ces frais, et que, d’autre part, l’état de ses affaires ne pouvait en aucune façon autoriser la procédure de saisie(...)",soulé
1888,"que n'ayant pas d’argent disponible pour Soulé il lui est impossible de lui envoyer le montant de son compte, mais qu’il peut fournir sur lui Royé, un mandat de cette somme payable fin février(...)Attendu que ces frais de négociation ne devaient pas être supportés par Chrétien, qu’en effet, M° François, pour sou client, a soutenu à l’audience que Soulé avait formellement promis à Chrétien de lui payer ses frais en son étude, avant son départ de Sedan(...)précaire de son débiteur, se soit fait autoriser(...)",soulé
1888,"mm H8 JOURNAL DES COMMISSAIRES PRISEURS offres de Soulé sont insuffisantes et que sa demande reconventionnelle n’est pas fondée(...)Par ce3 motifs , — Condamne Soulé à payer à Chrétien la somme de 83 fr",soulé
1888,"Gazagne (Lyon), Hunault (Nantes), Payer (Reims), Stevenin (Rethel), Soûles (Dijon), et Thirouin (Bourges), membres",soûles
1888,"Dijon. — Coutet, Lemoult et Soulès",soulès
1888,220 JOURNAL DES COMMISSAIRES PRISEURS MM. Lougarre Lorieux Lucotte Mille Mottié Moussard Museux Noël Ozange Ozanne Pagnier Paris Payei Pépin Petipasla Vasselais Polguère Potier Prier Proux Rapin Reîmffat Robardet Rognon ltoujon Ronseaux Roullet Sauvé Soûlés Teissonnière Thévenet Thirouin ïhomassin Thorant Thubé Vachot Vallet Vagbeaux Verdenal Yvonnet Wiart Alger Nantes Saint-Pierre Vernon Soissons Rouen Reauvais Tonnerre Pont-Lévêque Darnetal Besançon La Rochelle Reims Chinon Fougère Toul(...),soûlés
1911,"Haussmann, Paris ET TOUTES LES BONNES PHARMACIES GRAND HOTEL SEUL ETABLISSEMENT DE é ORDRE DOMINANT LA MER Entre les Casinos et en plein centre ■ CUISINE RENOM IVI EE ch au Soûles « luxe — Sur TTcrurc -■ T T v BOTTES ECUY ERES ET CHANTILLY Chaussures de Chasse MÉDAILLE D'ARGENT: Exposition Universelle GRAND PRIX : Exposition de Milan T- Achille R Ô B AT -$» PARIS — 2S1",soûles
1981,"Aussi bien, je ne puis m’empêcher de conter cet enterrement de Sylvestre / Le transport continuait sa route à travers l’océan / Un jour de la première quinzaine de juin, / La vieille Yvonne qui est soûle(...)",soûle
1885,"En tous cas, de nouvelles explications, de nouveaux documents auraient été demandés au maire intransigeant, qui bien certainement s'ét.ut imaginé que toutes ses propositions allaient être acceptées à la soûle vue de son nom et sans contrôle",soûle
1858,"Nous entendrons Littolf, Sivori, IMalti, Bottesini, Herrmann, Seligniann, François Mendès, Jaell, Mmes de Soulé, Caussmille, Cambardi, et d'autres qui ne sont pas désignés encore",soulé
1932,"Irn grossen Soûle treffen wir uns, der Hasse",soûle
1914,"68 — Andrée-Cécile FAUROUX, rue dés 36 Ponts, 12 — Jeanne-Andrée MARQUÉS, rue du Port Garaud, 23 — Andrée-Julie BOYER, rue, Montaudran, 34 — Pierre-Luc SOULÉ, rue Saint- Joseph, 11",soulé
1853,"des pluies abondantes et soule, leI a été le caractère saillant et pour ainsi ~e unique, de la constitution atmosphérique il l'hiver: Celle saison s'est prolongée au i a terme ordinaire , puisqu'on n'a constaté tes beaux jours persistants que vers la fin c de semblables conditions, l'élément canal et l'élément l'humatismal, avec leurs Cet article est un résumé succinct du rapport fait à la de Médecine, Chirurgie et Pharmacie de Toulouse",soule
1892,"Sélika (dans son lit, la tête à demi soûle- ' Aie. regardant ia pendule.) — « Déjà deux(...)",soûle
1883,"Le royaume est compris entre le Béarn, la Soûle, les Pyrénées et le Labourd",soûle
1888,"académies mais par la conscience,—A l'orgueil de la beauté corporelle, la Raison oppose 11 beauté de l'àno, soûle durable, seule inaccessible à la vieillesse et à la mort",soûle
1908,"Soulé, conseiller d’arrondissement, membres du bureau",soulé
1911,"Le d i à 1 > ’ Parait pas fait épré. .Peur dessus le I al ut i soûle dan le pré, Gagn’ le guaret, te prend lié citrouye et la glisse Dusqu’au fin fond de la palisse : I cougne tout son souc avec in groù bigot,, Cave in grand got, Au bià milan la saque, (Coume i ferian d’in cheun qu’arait moral de raque) Peur dessus i s’étend à pial vente et se met Tout coume(...)",soûle
1882,"Hier, le pauvre malade avait reçu, vers quatre heures, la visite de son camarade Lhéritier et avait encore pu échanger avec lui quelques paroles Une heure après, Montbars se soûles brusquement sur son lit, puis reto^ Tout était fini(...)",soûles
1921,"i U ^Etudes Supérieures de Chimie A^ kolo La plus grande ^ H6g£oxi LA PLUS MODERNE INSTALLATION Soûle Pliarumcie vomliisil à de« IM**x vraiment eoMiioeveÂpùîf mmw ssiciTp’owiiisAîtpsj Içs ~ "" i iYi,ir»fi Le (iérant, ; J. l'oYAim. T KfpniMHiua Haint-Oenis U, Aycusib — NiaR",soûle
1876,"A la GRAINE DE LIN, guimauve et graine de lin, au FUCUS CRISPUS et à la GUIMAUVE soule, pour II la toilette des Dames",soule
1906,"On remarquera d'abord que les syllabes terminées par une consonne, ainsi que la diphtongue au (aou) admettent soûles, à quelques exceptions près, les notes liquescentes : excei-sis, iw-ter-ra, hosan-na, glorittm t",soûles
1881,LE GRAND TURC Il continue à y avoir à Londres cent mille femmes soûles tous les samedis soir,soûles
1932,"peintures de Georges CASTEX, Alphonse GAURET, Paule SOULÉ, Jeanne BOYÉ, Emile SATGÉ, Alphonse FAURÉ, Hélène RIVIÈRE, Adrienne YARZ, Henri de TOULOUSE-LAUTREC",soulé
1932,"un peu plus sur les envois de Castex, Gauret, Périer d'Hauterive, Paule Soulé et Renaud de Vezins(...)Paule Soulé qui promène son chevalet d'un bout à l'autre le la France, a, cette année, poussé hors de nos frontières, jusqu'à Bruges qui paraît l'avoir(...)",soulé
1932,Paule SOULÉ. — La Croix-Blanche,soulé
1932,"peintures de Georges CASTEX, Alphonse GAURET, Paule SOULÉ, Jeanne BOYÉ, Emile SATGÉ, Alphonse FAURÉ, Hélène RIVIÈRE, Adrienne YARZ, Henri de TOULOUSE-LAUTREC",soulé
1932,Parmi les phénomènes d'ordre physique citons le soulè,soulè
1918,"qui sont d’une importance se condaire à côté des problèmes que soûle voient un certain nombre de faits énoi mes comme l’abaissement de notre na taiité, l’alcoolisme, l’insuffisance de notre production industrielle et agricole, la dé c dence de notre marine marchande",soûle
1999,"18 M.J. FONDECAVE-WALLEZ, P. EICHÈNE ET B. PEYBERNÈS (10) Sélandien) dans le Béarn oriental (Guillempau, Nay.) et dans P4c, voire P5, donc déjà dans le Thanétien bien affirmé dans le Béarn occidental (Loubieng) et la Haute-Soule (Orhy(...)Béarn jusque dans le Thanétien au moins (PEYBERNÈS et al., 1996) et au Pays-Basque jusque dans l'Yprésien (FONDECAVE-WALLEZ et al., 1995]. CONCLUSIONS Assez comparable à la série du Béarn occidental et de la Haute-Soule (FONDECAVE-WALLEZ et al., 2000), la série(...)",soule
1999,"2000. — Limite Crétacé-Tertiaire et biozonation micropaléontologique du Danien-Sélandien dans le Béarn et la Haute-Soule (Pyrénées-Atlantiques, France(...)",soule
1999,"à l'Ouest, la série plus profonde du Béarn occidental (Oraas, Loubieng, Pont-Labau) et du Pays Basque sudoriental/Haute-Soule (Pic d'Orhy) où le niveau à Iridium n'a",soule
1999,"la base du Paléocène et semble génétiquement liée à la présence du film d'Iridium) et du Béarn occidental/Haute-Soule (FONDECAVE-WALLEZ et al., 2000(...)Dans les autres coupes du Béarn occidental et de la Haute-Soule, la SD-T3 apparait soit complète, comme à Loubieng (où un intervalle transgressif [IT] carbonaté, à biophase benthique dominante, s'intercale entre brèche de PBN et calcaire de PHN), soit incomplète comme au Pic d'Orhy (où elle se limite à un PBN spectaculairement resédimenté) ou à(...)",soule
1919,"Et puis, c'est le Bruit : Le Bruit si dominant, si fort, Si plein de mort Qu'il soûle ou bien qu'il endort(...)",soûle
1918,Le sergent-fourrier Paul Soulès a obtenu une deuxième citation à 1 orsre de la division non moins flatteuse : « Gradé très dévoué et très courageux,soulès
1898,es auteurs présumés de ces motions paraissent devoir profiter de la discussion du budget des affaires étrangères pour soule- fverles débats devant la Chambre(...),soule
1904,"mais on ne lui fait pas grâce de sa pitance, si bien qu'on le soûle à tire-larigo, et qu'après cela je ne sais ni ce qu'on en fait, ni ce qu'il devient ainsi que sa compagnie",soûle
1896,"conditions : Boutures, racines et pis-soulés i Sud-Ouest. - RUPECTB1S-LASCASTKLLES",soulés
1898,"et enfin M. SOÛLES, qui fait de la sculpture picturale avec un brio, une dextérité qui le détourne malgré lui du sentiment qu'il voulait exprimer(...)F. SOULES. TOMBEAU",soûles
1873,"Soulé (Emile), docteur en méd., à Bordeaux",soulé
1873,"Soûlé , médecin en chef du chemin de fer du Midi(...)",soûlé
1873,"Soûle, doct. en méd., à Castillon (Gironde(...)",soûle
1919,"estimons, nous avons même la certitude. que l’union fraternelle des Mutilés et des Poilus nous donnera la victoire qui soûle peut assurer le",soûle
1891,"UNE AGRESSION Hier, vers 6 heures du soir, un individu dont le nom est resté inconnu venait chercher, place du Capitole, le dé- crotteur Antoine Soulé, en lui disant qu’on l’attendait rue Gambetta pour aider à un travail Arrivé à cet endroit(...)Plainte a été portée à la police par Antoine Soulé, qui a déclaré que ces individus lui en voulaient depuis longtemps",soulé
1891,"Les soûles où le puisement et Femboutelllage sont surveillés par un Représentant de l'Etat A VENDREZ™""""” du Pont-Neuf, magasin avec sous-sol, l 6r et 2 9 étages",soûles
1858,"Déjà, nous tenant tous < quatre par la main (car deux d’entre nous avaient pu se « traîner jusqu’auprès des autres), nous comptions passer t ensemble l’arme à gauche, quand l’uu de nous se soûle- « vant à grand peine, aperçu deux sœurs de charité, qui, « malgré un feu d’enfer, à travers les cadavres et les cris « des mourant», parcouraient le champ de bataille cher- < chant des blessés à secourir",soûle
1909,sol. — Enfant Fersol. — François Robert. — Foria. — Evain. — Lagatdu. — J. Soulé. — M. et Mme Hyver. — Graeve. — Cou- turier,soulé
1913,"GRAND ARRIVAGE D’ ALUMINIUM PUR Soûle batterie «le cuisine et ustensile de ménage vraiment hygiénique, propre, pratique el facile à entretenir",soûle
1938,"Mariages Le 15 octobre dernier, en l’église du Sacré-Cœur de Constan- tine, a eu lieu le mariage de Mlle Simone Soulé, fille de Madame et M(...)Robert Soulé, contrôleur adjoint des P.T.T. à Constantine, et petite-fille de Madame et M. Jean Soulé, et de Madame Veuve Blanc, avec M",soulé
1926,Soûle une mesure exceptionnelle peut mettre Un à cette affaire exceptionnelle,soûle
1920,"Le musée de la Malmaison, asile des souvenirs impériaux vient d'être autorisé par un décret très officiel à accepter un legs de Mme Mandeviile où se trouvent parmi d'autres objets, ceux-ci qui soulè* vent encore des(...)",soulè
1910,Eflet stimulant Immédiat. r Guérison gar.p. une soûle boite (f&e.ldlalm.)InT.disci. r frix 10 fr,soûle
1866,"Ont été nommés : MM. Lamaignère père, Garet, Soulé, Barthe, Cassou, Forest et Fric",soulé
1933,"3 e Prix : M. Soulé, 200 fr. en espèces, diplôme de médaille d’argent(...)1 er Prix : M. Soulé, diplôme 200 fr. en espèces",soulé
1933,2 e Prix : Médaille vermeil à M. Soulé(...),soulé
1892,"Soulé, archiviste(...)",soulé
1863,"44 Fil à Voile, m. b. par Sting et Rivale. — M. Courtade- Soulé(...)98 Mouzaïa, m. b., an. ar., par Miraluï et Sac au Dos. — M. Courtade-Soulé(...)101 Nigra, f. n. par Prétendant et Prima. — M. Courtade- Soulé",soulé
1927,leur localisation géographique (par exemple Faire du jeu appelé soûle est bien délimitée(...),soûle
1891,"BOUDERON DE SOÛLE, lettré, grave quoique jeune, déjà financier, assure que le Parlement a pour mission particulière d’assurer nos moyens de communication avec nos voisins de la péninsule ibérique(...)Le greffier PEYRL DE SOÛLE",soûle
1925,"SILHOUETTE Elancée, l'air jeune et svelte, la taille soule et fine, un chic personnel et du maintien, la tête légèrement inclinée comme un lis sous la brise parfumée, deux grands yeux bleus pleins de mélancolie, les joues roses et veloutées, une démarche languissante et fière à la fois",soule
1865,"S’adresser, à M"" Cia este BRUN, aubergiste rue Marie-Amélie, numéro <L 3. jardin avec maison d’habitation, Sis route de la Pépinière, connu soûle nom de : CHATEAU DES FLEl RS S’adresser à M",soûle
1945,SOÛLÉ,soûlé
1887,Jeanne-Marie-Catherine Soulé,soulé
1889,Soûle a été aussi fortement éprouvée(...),soûle
1946,"en novembre : la Soûle et la Choule en France, et les mois suivants les autres jeux : Paume, pelote, luttes, joutes, inail, etc",soûle
1946,"Mais, ainsi que l’a fort bien fait observer Siméon Luce (6), la soûle ou choule, le plus populaire des jeux de force ou d’exercice au Moyen Age, comme les dés étaient le plus usuel des jeux de hasard, avait, de vieille date, de trop profondes racines dans presque toutes les parties du royaume, particulièrement(...)",soûle
1946,"D’ailleurs si, à la même époque, notre grand Rabelais (en 1535), dans les 217 jeux de son Gargantua, énumère la Soûle i et la crosse et ne fait aucune place au(...)",soûle
1924,"démontages rapides, la bouteille d'air comprimé gonflant le pneu sans pénible recours au pompage, uit contrôleur de pression facile à lire, des crics à villebrequin soûle",soûle
1932,M. Soûle(...)J..C. : M. Soûle,soûle
1937,vent soûle,soûle
1857,"sont pris en merne sens , et leurs terres sujettes » à ce service sont a pelées Caveries et caballariae en » Latin, et caballarius dans l’accord du vicomte de » Soûle avec le comte Ccntulle de l’an 1080",soûle
1917,"Ainsi parce qu'une surveillante, exécutant en ordres qlti, Iiri avaient été donnés a fie r dans la GiMm.bil-e d'un^ infirpiière une dizciiiie d'oéiifs, soûle nourrituire qu'eHè puisse prendre, fît qu/êlte a payés de ses devers",soûle
1867,"La veille du 5 janvier, il s'était soûlé",soûlé
1918,"Unter furcht- baren Verlusten ist die Offensive gescheitert, die Reims zijm Fall bringen und einen Brückenkopf von « unabsehbarer strategi- scher Wichtigkeit » — so hiess es noch am vorigen Freitag in deutschen Blættern — südlich der Marne sichern soûle",soûle
2007,"enseignement maritime en poste à Paris, le professeur général de 2 eme classe de l’enseignement mari- - au grade de contre-amiral, le capitaine de vaisseau du corps des time Paul Bedel (1 er février 2007) PROMOTIONS, NOMINATIONS ET AFFECTATIONS D'OFFICIERS GENERAUX DANS LA DEUXIEME SECTION Ont été nommés ou admis : -le commissaire général de l ere classe Jean-Claude Soulé (1 er mai 2007(...)",soulé
2014,"EV1 (R) David ALFORT Président de la section Haut-Rhin - Territoire de Belfort » SECTION ACORAM GASCOGNE Sortie Béarn et Soûle du 28 juin 2014 André Mabrut, ancien trésorier de la section(...)renommée de la Soûle(...)",soûle
1832,Rivières. — Travaux sur une rivière non navigable ( Sr- Soulé). — Contestation. — Compétence administrative — Compétence judiciaire,soulé
1832,"Voir ( mu3 ) Rivières. — Travaux sur une rivière non navigable ( Sr. Soulé). — Contestation. — Compétence administrative. — Compétence judiciaire. — Discussion, Voir (i'i3) Ponts",soulé
1832,"Le sieur Soulé possède des propriétés sur l'une des rives de l'Adour dans le département des Hautes-Pyrénées(...)Le sieur Soulé, pour se garantir des ravages de cette rivière, a fait des travaux défensifs : le maire s'en est plaint(...)L'arrêté et la décision ont été déférés au conseil d'état par le sienr Soulé",soulé
1832,"arrèt de la cour de cassation , du 19 décem-hrc 1826, IÎ\rj. — Travaux en rivière : règlement ( Sr. Soulé(...)Soulé, 228",soulé
1832,"Yu les requètes introductive et ampliative enregistrées au secrétariat général de notre conseil d'état, les 5 et 24 août 182g, par lesquels le sieur Soulé, docteur en raédecine et propriétaire à Tarbes, se pourvoit contre une décision du ministre de l'intérieur, en date du g novembre 1827, confirmative d'un arrêté du préfet des Hautes-Pyrénées, en date du i3 avril précédent, lequel a disposé que ledit sieur Soulé serait tenu de détruire et enlever comme offensifs(...)",soulé
1832,"йЗо LOIS, onDONNNANCES, E T C. lequel il est conclu au rejet des requêtes du sieur Soulé et à(...)Lanvin, avocat du sieur Soulé(...)Considérant que par son arrêté du i3 avril 1827, le préfet a statué soit sur les contestations d'intérét privé entre le sieur Soulé et la commune d'AureilIian, nées au sujet de l'application du règlement, soit sur des conlra-ventions aux dispositions de ce même règlement, contestations et conlraventions dont le jugement appartient aux tribunaux(...)",soulé
1904,"baiser de paix, Lilette, soule- \eepar Madeleine, rouvre lesyeux comme une toute petite Belle au Bois Dormant",soule
1885,"Tournier, Bayaut, Mourot, Aucouturier, Soulé, Lalanne Michel, Lalanne Guillaume, Darrigade, Rivarès Pierre, Autigeon Alcibiade, Filhon, Lalheugue fils, Montérou, Tonnet, Loustau, Larrande, Boudat, Dabadie Louis, Fréchou père, Claverie, mercier, Boudousse, Mongabure, Malère Henri, Min-vielle Victor, Larqué Joseph, Lafargue, Cazaux peintre, Etcheberry",soulé
1936,"La soûle, il y a six siècles(...)On sait que nos ancêtres jouaient à la soûle, un sport que l’on considère, en quelque sorte, comme l’ancêtre du rugby",soûle
1935,Manléon-Soule. — Le club de Mau- léon-Soule s’est réuni chez les parents de l’un des membres(...)Il a pris comme devise la devise de Mauléon-Soule : Orok-Bat. qui signifie : Tous un,soule
1926,"7. — Jeanine Adrienne Soule- ry, l’Etang",soule
1926,Soule-té. — Veux-tu être heureux trois jours(...),soule
1913,"La lettre que j’ai reçue, — si elle n’était J l’oeuvre isolée d’un jeune énergumène en quête de réclame et qui n’est même pas I Bulgare, — constituerait à elle soûle une J pièce à charge dan* le dossier balkanique(...)",soûle
1863,Soulé a éprouvé un échec au théâtre de Nantes,soulé
1913,"audience diihier, cteux famiitee rivales die gitanos étaient citées pour coups et vioien- . y^.y-y. otyiiio-inc, uu -m i ces réclpioquies, les familles Soulès et Pou- iuin *Max Linder, Prince, Dranem bill_ triompheront dans d© nouvelles scènes comi(...)Quelques jours après, la tribu des Soulès se présentait, au nombre de cinq person¬ nes, à la Cour des -Miracles, et frappaient le père Poubil, mort depuis des suites de ses blessures, sa femme et son fils, qui -ne durent leur salut qu'à la fuite(...)femme(...)",soulès
1909,"en tous les cas, l'erreur serait minime, car la terre est grande et il ne se passe guère de jour sans que les journaux n'enregistrent quelque petit soulè¬ vement",soulè
1831,"Le clergé n'était plus qu'un corps sans âme , sans oeuvres, sans foi, gorgé d'or , soûlé de richesses",soûlé
1887,"Le bruit court en ville que M. Roux, conseiller, est nommé président de chambre à la cour, en remplacement de M. Soulé, atteint par la limite d’âge",soulé
1839,259 Sans l'sou j'suis heureux Pauvre comme un gueux Partout je roulc Et je me soûle,soûle
1839,Sans l'sou j'suis heureux Pauvre comme un gueux Partout je roule Et je me soûle,soûle
1914,"Mais eux, soûlés de sang et d’alcool, et de nard",soûlés
1995,13213 Sophrologie 13332 Soule(...)13898 Soule,soule
1995,"IKHERZALEAK-TRAIT D'UNION (Chéraute, Pyrénées-Atlantiques) Pays de Soûle / Ikherzaleak-Trait d'union(...)Soule(...)Pays de (France)--Descriptions et voyages Soûle",soûle
