year,sentence,key_word
1916,"ENFANTS ASSISTÉS 277 3° Chaussures grandes fillettes, pointures 34 à 40, la paire \ ., 13 » -l"" Chaussures cadet brodequins, pointures 33 à ■11, la paire r 15 » 5' Galoches enfants, pointures 16 à 18 3 75 0° Galoche fillettes, pointures 19 à 23 4 75 7° Galoches, grandes fillettes et garçons, pointures 24 à",brodequins
1839,"Gette, mag. de chaussures p. dames, à garantie, brodequins, guêtres, chaussons, etc., r. de Bussy, 27",brodequins
1839,"Thuillard , fab. de brodequins, socques et tout ce qui concerne la chaussure des dames, r",brodequins
1839,"Pradel-Huet, fab. de souliers et brodequins pour dames et enfans, chaussons, pantoufles, socques, etc., bottes(...)",brodequins
1839,"Tavernier , fab. et mag. en cuir et liége. brodequins, etc. envoie eu province, r(...)Thuillard, fab. et claques en liége et cuir, fait brodequins eL tout ce qui concerne la chaussure des dames, fait la commission, r",brodequins
1934,"D’autre part, le marché avait pour objet la confection par le sieur P. des brodequins",brodequins
1934,"21 du dit marché..., les cuirs nécessaires à la fabrication des brodequins devaient être fournis par l’administration, dans les conditions de l’instruction du 19 janvier 1916 sur le ravitaillement en cuir de chaussures, au prix maximum de l’annexe de la dite instruction",brodequins
1911,"MESDAMES, MESSIEURS, Il y a quelques nuits, pour la plus grande joie des petits s et des grands, le Petit Noë), gracieuse fiction due à la piété de nos pères, distribuait dans des chaussons de bébés, dans d'élégantes bottines du bon faiseur, et même dans d'inesthétiques brodequins américains, les cadeaux de toutes sortes, portés du Paradis jusqu'à nous par l'âne de Bethléem",brodequins
1875,"Artémis eut des brodequins en marbre rouge, et les Hermès des têtes de marbre jaune",brodequins
1879,Des brodequins,brodequins
1982,"Il attire d'abord sur eux l'Inquisition, avec Jean de Roma et ses brodequins de graisse bouillante(...)",brodequins
1903,"Celui-ci va pataugeant dans la boue qui pénètre par dessous les basanes, s'insinuant dans les brodequins et l'on",brodequins
1886,"D'autres encore offrent des manteaux de diverses couleurs, fabriqués par l'Arabe à l'oeil farouche, des coupes d'argent dorées au dedans et noircies au dehors parle soufre, niellées, des étoffes, des épées, des cuirasses, des boucliers, des mulets, des chevaux, des peaux de Cordoue, blanches et rouges, des brodequins, des gants, de légers tissus avec",brodequins
1886,"Il est chaussé de hauts brodequins ouverts et lacés sur le devant, comme en portaient à Rome les personnes de distinction",brodequins
1892,"chaque côté, brodée en or, avec son etole, manipule, voile, bourse, chape, tunicelles, brodequins et souliers de chaque couleur",brodequins
1853,"Cette espèce de brodequins qui laissent les chevilles découvertes et se lient sur le cou-de-pied, est, malgré son extrême petitesse, rendue avec(...)",brodequins
1912,"Dès que ces serments furent solennellement faits, le Roi fut dépouillé de sa grande simarre de chambre, et, quand il fut avec sa seule tunique de drap rouge, le grand chambellan lui chaussa les brodequins, le duc d'Anjou, pour le duc de Rourgogne, lui attacha les éperons d'or",brodequins
1888,les pieds sont chaussés de hauts brodequins ornés d'ailes,brodequins
1888,enroule autour de son bras gauche et retombe jusqu'à la hauteur des ailes des brodequins,brodequins
1896,"Jeune, élégamment vêtu, chaussé de brodequins, il regarde avec assurance et ses bras levés rappellent la prière des orants aux premiers siècles",brodequins
1896,"Baiser de Judas (S. Matth., xxvi). –Judas baise le Christ au visage ('), pendant qu'il l'enlace de son bras gauche il est suivi de soldats, l'épée et la lance à la main, en jaquette courte et brodequins rayés horizontalement",brodequins
1896,"Leurs pieds sont chaussés de brodequins, à raies horizontales et rebords rabattus, et sur la tunique, venant à mi-jambes et laticlavée, ils portent un manteau qui n'est autre que le pluvial ecclésiastique, c'est-à-dire qu'il est bordé d'un orfroi dans toute sa hauteur ('), et fixé sur la poitrine par(...)",brodequins
1896,"A la gauche du Christ se tient Simon le Cyrénéen, qui porte la croix de la main gauche, en l'appuyant sur le sol c'est un jeune homme élancé, sans barbe, les jambes nues, vêtu d'une tunique rouge, ceinte à la taille et chaussé des mêmes brodequins que les soldats et les prêtres (a(...)",brodequins
1907,"Je remarque encore des brodequins à élastique, à bouts vernis, qui m'indiquent le provincial soucieux de e faire du genre Ï» et les socques de la bonne grosse(...)",brodequins
1883,"De cette sorte, il porta pendant quelques jours une magnifique paire de brodequins sans semelles, et dont il était tout fier",brodequins
1883,"Je venais de me fabriquer une paire de brodequins avec de vieilles bottes trop étroites, que j'avais élargies avec mon couteau",brodequins
1989,"Vieillards chenus, fluets ou bedonnants, toujours en haillons avec aux pieds des brodequins qui « rient » comme les chaussures de Meka dans Le vieux nègre et la médaille, les personnages de la farce séduisent du fait qu'ils ne disent pas leurs (mes) aventures, ils les chantent(...)",brodequins
1922,"brodequins rouges un petit, caducée ou baguet.t.e(...)",brodequins
1922,"Tout )e reste a disparu .de ce qu'on montrait autrefois comme authentique l'épée de Roland, l'olifant, l'étrier, les brodequins, d'autres disent des(...)",brodequins
1871,"13,941 90 Total égal 522,105 14 L'Etat a abandonné au déparlement 459 vareuses provenant de mobiles, et 232 paires de brodequins acquis pour les mobilisés",brodequins
1871,Considérant'que 200 paires de brodequins ont été délivrées à l'asile départemental(...),brodequins
1899,"Aux lueurs des torches que portaient des serviteurs, les agrafes de sa chlamyde et de ses brodequins jetèrent mille feux qu'admirait la foule",brodequins
1921,"Atelier de cordonnerie. — En 1921, cet atelier a produit 4.135 paires de diverses chaussures, dont 700 paires de brodequins pour l'armée beylicale",brodequins
1946,brodequins délacés,brodequins
1924,"Savon et Cramier, négociants à Limoges (brodequins(...)",brodequins
1904,"En veste de cuir et salopette pour le mauvais temps, costume de chasse, leggings et brodequins",brodequins
1892,"Chaussure : brodequins, sandales et sabots(...)9° Chaussure : brodequins, sandales, sabots(...)",brodequins
1897,"face, assis sur un siège à dossier, les pieds chaussés de brodequins et reposant sur un degré",brodequins
1897,"traits d'un homme imberbe, aux cheveux courts, vu de face, vêtu d'une toge blanche, les pieds chaussés de brodequins il est assis sur un siège à degré et tient un manuscrit sur ses genoux",brodequins
1939,brodequins fauves,brodequins
1940,"En ce qui concernait les chaussures — à part des brodequins à ski — j'utilisais au cours de toutes mes expéditions, les merveilleuses bottes de phoque, appelées en langue eskimo Kamik",brodequins
1835,"ses petits pieds sont garantis du froid par des brodequins en satin violet, bordés de zibeline",brodequins
1916,"de gants, et les pieds chaussés de brodequins pointus à forts talons, en cuir rouge, montant au-dessus de la rheville et lacés sur le cou-de-pied avec des lacets en soie rouge, ornés de pièces de cuir découpées en forme de rosette",brodequins
1947,"de brodequins de fer rouge, coiffé d'un casque de métal chauffé à blanc",brodequins
1947,"Mais, comme le remarque Krumbacher, par ce vers le poète ne fait qu'énumérer les divers genres de tourments que le martyr eut à subir, et la confession du Christ par les flammes ne signifie pas nécessairement la mort par le feu, ce terme pouvant très bien se rapporter à la torture par les brodequins de fer rouge et par le casque chauffé à blanc, laquelle(...)",brodequins
1913,"Un bas-relief votif, apporté de Grèce, représentant une divinité féminine, peut-être Bendis, en tunique courte, hauts brodequins et capuchon, tenant une lance et une patère, accompagnée d'un petit personnage encapuchonné",brodequins
1908,"recouverte de broderies très finement travaillées et une blouse également flottante tombant à mi- jambe, taillée dans de la jolie soie de couleur: leurs pieds minuscules et déformés font peine à voir, ils sont enfermés dans des brodequins tout juste assez grands pour contenir le poing d’un enfant",brodequins
1928,"Il avait un pourpoint et un haut- de-chausses cramoisis, des brodequins blancs, une chemise blanche dont les manches étaient retroussées sur le poignet et une toque de velours noir à compartiments d’or",brodequins
1929,"36 — son mari Ferdinand de Portugal, attardée devant un grand feu, il prit la liberté de leur mettre en mains ses brodequins tout trempés de pluie et de boue, et de les inviter à les faire sécher",brodequins
1827,"4 00 Banderole de giberne, en buffle uni. , 2 90 Baudrier de sabre, id 3 90 Bretelle de mousqueton, id 1 00 Fourreau de baïonnette 1 10 Fonte de pistolet avec sa courroie 2 90 Rouchon de mousqueton 0 30 Brodequins, la paire 7 00",brodequins
1827,"Il » 15 5(1 » » 15 50 » » 15 50 » » 15 50 » » Epc.fns. - » » 2 » » 2 » » » 1 35 » » 1 35 » »» Brodequins r D * * * '* 7 » Soulies 25 » » 5 25 Il » 5 25 » » 5 25 » » » » Selle complète, courroies et bottes de mousqueton",brodequins
1827,Brodequins(...),brodequins
1827,"brodequins en cuir de vache, fermés-sur le coude-pied au moyen de deux lacets et d'une languette en cuir, cousue après l'empeigne",brodequins
1892,Il est vêtu d'une cuirasse à l'antique et chaussé de brodequins décorés de mufles de lions,brodequins
1913,"Ici, le poète vénitien fait allusion à une autre mode ancienne, celle des brodequins surélevés, sortes de cothurnes, qui augmentaient singulièrement",brodequins
1928,"A la passion qu'elle montrait de ces puissants brodequins, la Pia reconnut combien cette petite était voluptueuse",brodequins
1821,"Le chef de la tribu écossaise, t avec son poignard et ses pistolets de flibustier, son r bonnet de cacique, son manteau drapé à la grecque, < ses brodequins quadrillés qui rappellent, comme toutes 2 les étoffes du pays, le tatouage des anciens habitans(...)",brodequins
1911,"Il y a donc là un progrès marqué dans -le traitement des fractures obliques, vu la facilité de se procurer ces brodequins, dits confortables, la facilité(...)",brodequins
1829,"Petrus Salius Diversus raconte qu'une nuit un jeune homme se leva tout endormi, s'habilla, mit ses brodequins et des éperons, monta sur sa croisée et piqua des deux, se croyant à cheval (2(...)",brodequins
1897,"Le Cordonnier-Poète (1) OPÉRA-COMIQUE EN UN ACTE jPo ÈM E D'jËMILE p E R N A Y Musique de M. LECHE V AL LIER de BOIS VAL (1) Au xvm' siècle, un cordonnier, Henry Sellier, né à Saint-Quentin, établi rue du Coq-Héron, dans une échoppe de planches vermoulues, fut poète à ses heures, et publia les Lundis du réparateur des brodequins d'Apollon, essais de poésie, etc",brodequins
1982,"5° deux paires de chaussures (souliers, bottines ou brodequins(...)",brodequins
1929,"Les derniers procédés qui subsistèrent le plus longtemps furent la simple suspension et les brodequins, et, encore, les réservait-on pour les cas particulièrement graves (à Paris, procès de Damiens(...)",brodequins
1929,"Mais le supplice le plus usité, le plus connu et qui persista le plus longtemps, fut la question des brodequins",brodequins
1883,"MMxnrmB mmnwtKB Bottes Chevreau & Satin Chevreau doré et glacé à Talons Louis XV Bottes veau blanc Souliers Satin et Fantaisies blanc et noir pour Bébé Bottines Bottines en Drap de couleur en Drap de couleur Bottines Elégantes Brodequins ferrés genre anglais pour Touristes Bottes à l'Ecuyère TOUS LES GENRES SE CONFECTIONNENT SUR MESURE Socques, Caoutchouc, Galoches et Chaussons, Guêtres en drap, Guêtres",brodequins
1862,"d'ailleurs, à l'époque où les Romains pénétrèrent en Espagne, ils n'avaient pas de sandales, mais des bottines de peau, ocreae, ou des brodequins plus bas, garnis de clous, caligae, d'où est venu pour Caïus César le surnom de Caligula, en souvenir de celte chaussure qu'il avait portée dans son enfance au milieu des camps",brodequins
1885,"Comme un patricien de l'ancienne Rome, il marche au milieu de sa gens, les jeunes clients de l'Art, auxquels le peintre a fait adopter écoutez l'Américain Moore (2) une veste et des brodequins bleus, un petit manteau flottant sur l'épaule, un chapeau à plumes, deux pistolets à la ceinture et un grand(...)",brodequins
1876,"Ainsi : les noeuds de rubans, les plumes d'autruche, les agrafes de diamants, les brodequins richement . brodés, les màur teaux de satin, etc",brodequins
1876,"je dis patte et non cuisse, car l'objet tout entier se composait de ce que dans mon ignorance j'appellerai un tibia, et de la patte avec ses quatre doigts, le tout recouvert de cette peau noire, luisante et rugueuse, qui fait que le dindon a l'air de marcher sur des brodequins de chagrin",brodequins
1908,"hauts brodequins, formés par de gros anneaux pareils à des bracelets",brodequins
1839,"qui serait préférable, on s'était arrêté à la question dite des brodequins, comme à celle qui menaçait le moins la vie du patient",brodequins
1839,"les bandes qui descendent de son genou à la cheville, et les grandes boucles qui serrent ses sandales ou ses brodequins sont aussi, en général, faits ou au moins ornés(...)",brodequins
1839,"jambes chaussées de brodequins d'étoffe d'argent brodée d'or, avec des semelles de satin cramoisi, et deux grands oreillers de drap d'or, l'un sous la tête et l'autre sous les pieds",brodequins
1844,"les bras étaient ramenés vers l'abdomen, et les pieds, chaussés de brodequins frangés, laissaient encore voir autour des os de la jambe un cordonnet de soie qui en faisait le tour",brodequins
1908,"ils portant la robe longue, le bonnet et les brodequins, insignes de leur qualité et dont, seuls, ils ont le droit, de se vêtir",brodequins
1853,Brodequins et sabots-souliers d'un prix très(...),brodequins
1856,"A dit que non. k « Ce fait, avons fait délier le dit Van den Enden et oster les brodequins (1(...)",brodequins
1896,"La semelle de ses brodequins en peau, frottée de colophane, marquait ce piétinement en taches blanches sur le fond sombre du tapis",brodequins
1854,Contre le fond de Pédicule et sous le dais est a3sis un personnage vêtu d'une tunique et chaussé de brodequins liés autour de la cheville,brodequins
1911,"L'homme est chaussé de hauts brodequins, le pilastre de gauche a complètement disparu, enlevé par une coupure très visible. (Il a été en(...)",brodequins
1901,petits brodequins,brodequins
1901,"tête est ceinte d'une couronne de corde, les pieds chaussée de brodequins à lacets",brodequins
1913,"nom propre ou peu s'en faut il donne des détails de costume : huit religieux portent capuce non cousu (cnm capucio non consuio), quatre ont un bonnet noir fcum birro nigro), sept une chemise de toile (cnm camisia tele), deux des bas (cnm caligis), plusieurs des pantoufles, des souliers, des brodequins (cutn panloflis, solularibus, brogiquinis(...)",brodequins
1820,"Il avoit la tête nue, le pantalon retroussé sur ses brodequins",brodequins
1849,"Des* jeunes filles chaussées de brodequins dorés , dansaient en frappant, du pied, la.terre en cadence(...)",brodequins
1846,"les brodequins, soit en lasting, soit en drap noir, soit en gris, sont très bien portés pour le matin, en déshabillé : 11 en est de même quant aux escarpins vernis pour soirées",brodequins
1985,"Il est chaussé de gros brodequins, porte un bleu de travail, se coiffe d'une casquette en simili cuir qui évoque un capitaine au long cours et tient d'une main un éternel sac à provisions et de l'autre, qu'il vente, qu'il pleuve ou qu'il fasse beau, un invariable parapluie",brodequins
1928,à la fin de l'année la majorité des tirailleurs aura reçu une paire de brodequins,brodequins
1903,"Je n'ai par contre et cela seul me désespère Qu'une paire et que la moitié d'une autre paire De brodequins, soit trois",brodequins
1894,"et dans ce but rien n’a été épargné, pas même les instruments de torture connus sous le nom de brodequins",brodequins
1860,"cette influence orientale, telles que certaines parties du costume, les brodequins et la genouillère",brodequins
1892,"Colomb, de son côté, lui fit présent d'un collier de perles, d'un manteau écarlate, d'une paire de brodequins rouges et d'un anneau d'argent(...)",brodequins
1902,"DU Xe AU XIIe SIÈCLE 111 l'abbé l'albergue, un saumon, du vin, des brodequins marquetés ou encore harnacher son cheval, etc",brodequins
1900,Parfois de solides brodequins montant un peu haut ont suffi à dissimuler la paralysie,brodequins
1863,"Les membres de la victime étaient soumis à une extension douloureuse, les jambes étaient froissées à l'aide de brodequins, et, lorsque l'accusé était brisé par la souffrance et inondé d'eau froide, il était étendu sur un matelas près du feu, et le médecin s'approchait de lui pour s'assurer s'il allait passer de vie à trépas (1(...)",brodequins
1856,Des brodequins en maroquin orange et à bordure de pourpre défendent sa jambe dont le genou est nu,brodequins
1879,"Quelques femmes portent des bas, d'autres ont les pieds nus dans leurs babouches ou dans de larges brodequins d'une forme particulière très-évasée par le haut",brodequins
1906,"Bourré s'adresse, d'abord, au peintre Colin d'Amiens, à qui il envoie les instructions les plus précises : Colin figurera le prince à genoux, en costume de chasse, et chaussé de brodequins, l'épée au côté, le chapeau entre les mains jointes et le collier de l'ordre de Saint-Michel suspendu au cou(...)",brodequins
1852,"les uns avec des bouts recourbés, les au» très en forme de brodequins 3",brodequins
1835,"parements noirs, rouges, verts ou roses, d'un pantalon bleu clair collant, qui va se perdre dans des brodequins en cuir noir lacés jusqu'audessus de la cheville",brodequins
1835,"Leur costume se compose d'une veste blanche très-légère, d'un pantalon de même couleur, serré aux chevilles sur des brodequins verts, et d'une petite casquette verte aussi, surmontée d'une touffe de plumes de différentes couleurs, et ornée d'une plaque(...)",brodequins
1835,"cette contrée, ô vous qui aimez la vie ornée, les brodequins de soie et le son des guitares sous les peupliers au clair de la lune",brodequins
1940,"Nous la reproduirions ici avec plaisir, si elle ne nous semblait avoir été enjolivée, ou même fabriquée après coup, dans une intention de littérature. ' Chacun s'est étendu ensuite à qui mieux mieux dans la description du supplice horrible des brodequins qui fut infligé à ce malheureux",brodequins
1842,"une robe empourprée empruntant des nuances violettes, traînait magnifiquement ses grands plis après ses pieds chaussés de brodequins d'étoffe rouge brochée d'or : son front était presque dur, tant sa majesté était celle du front d'un homme",brodequins
1903,"bravade, nièce~ tenace, tanière, tombe, brodequins, moustache, poitrail, spadassin, langoureux, etc",brodequins
1904,"Les gâteaux cuits, il les déposa dans l’âtre en riant dans sa collerette, car il supposait qu’à première vue le vieux les prendrait pour de vrais brodequins, et non pour mignardises de bouche",brodequins
1893,Nous vous offrons en sacrifice nos brodequins(...),brodequins
1846,"brodequins à larges bords, se repliant en dehors",brodequins
1846,"L'Adjudant, est un jeune homme à pied, vu de profil droit, vêtu d'une tunique, chaussé de brodequins à larges bords et se repliant en dehors, auxquels on distingue les éperons(...)",brodequins
1859,"Leur chaussure consiste en cothurnes ou brodequins comme ceux des Etrusques, avec des ornements des mêmes couleurs et des mêmes dessins, et notamment la bordure grecque ou méandre",brodequins
1849,"Frontal, brodequins, tortillons, échelles(...)",brodequins
1860,"Mais aussi c'est que chacune de ces Parisiennes en lissant ses cheveux, en laçant ses brodequins, en gUssant ses doigts sous la peau délicate d'un gant, s'est rendu compte(...)",brodequins
1860,"Aussi, j'en suis persuadé, les malheureuses qui ont négligé le soin de leur pcrsonne en ce monde, seront dans l'éternité de l'autre vie condamnées à porter des brodequins garnis de pointes d'acier, des corsets armés de lames(...)",brodequins
1886,"Guêtres, bottes, brodequins où les souliers tiennent. (Roquefort, ibid., t. I, p. 763(...)",brodequins
1837,"Pour toute arme , il glissa un poignard dans ses brodequins et ayant attaché un bout des draps à une brique antique scellée(...)",brodequins
1923,"En outre, 700 francs d'indemnité de logement, nourriture pour sa personne et effets de travail se composant de deux pantalons, deux vestes, une paire de brodequins, une casquette",brodequins
1862,"96 — petitesse extrême, étaient chaussés de brodequins de cuir rouge de forme antique",brodequins
1805,"Au reste, l'épée qui s'échappe de sa main, « le casque, les riches brodequins, le manteau brodé, « tout en un mot, fait allusion au sang illustre d'où tirait « son origine ce petit-fils de héros, ainsi qu'à la noble « carrière(...)",brodequins
1851,"eçons, Écuarpes, gilets, jupons, crantes, bas, chaussettes, chaussons, brodequins, cache-nez, guêtres pour enfant, bretelles, tapisseries au crochet et auttesouvr~g~ La parfaite(...)",brodequins
1902,les brodequins pour fool-ball avec protège- chevilles,brodequins
1917,"supposé aussi que « ce dieu était vêtu d'une draperie légère posée sur l'épaule gauche, qu'il était chaussé de brodequins",brodequins
1846,"prends ton voile couleur de feu, accours plein de joie avec tes brodequins d'or sur tes pieds si blancs",brodequins
1830,"une longue moustache cirée, le cou nu, la tête rasée, excepté une touffe épaisse de cheveux sur le sommet du crâne, une veste turque sans manches, un large pantalon plissé sur les hanches, enfin des brodequins lacés jusqu'à la naissance du mollet, tels étaient(...)",brodequins
1929,Les petits souliers de la Parisienne se tordaient en voulant égaler les gros brodequins de troupe,brodequins
1929,"Elle l'accompagnait comme de juste (hap! troisième cuiller) et la maman lui avait mite ses plus Ibeaux atours, chaussettes blanches, brodequins blancs",brodequins
1844,Brodequins,brodequins
1844,"620) OUVRAGES EN PEAU Olt EN CUIR non dénommés. — On range dans cette classe : 1 ° les bottes, souliers, brodequins et autres ouvrages de cordonnerie, sans distinguer entre ceux à l'usage des hommes ou des femmes",brodequins
1900,Caisse n° 1273: 150 paires de brodequins de Strasbourg,brodequins
1891,"Quand je serai roi de la mode, j’édicterai des brodequins à la chinoise, des collerettes dont le tuyautage dentelé déchirera les nuques, et des corsets de fer étroits comme la bouche d’un homme triste, en attendant les tatouages lancinants et Je Iranspcrcemenl des narines par de lourds anneaux",brodequins
1886,"remplaça ensuite par de forts brodequins, mais aussi bien avec les appareils qu’avec les brodequins la marche était lente et défectueuse",brodequins
1904,"Celles-ci seront des brodequins très larges, la mesure ayant été prise sur deux paires de gros bas(...)Ce sont d’épais brodequins de cuir doublés de cuir, et dont le talon n’est pas rapporté, mais pris dans l’épaisseur du morceau de cuir qui sert, diminué, à confectionner la semelle",brodequins
1904,"en peau de mouton, la fourrure à l’intérieur : ils se mettront sur les brodequins avant d’assujettir les raquettes",brodequins
1889,"11e se debvoyent porter et honorer par les chrestiens, et que en la capse n’y avoit aultre chose que les pantoufles ou brodequins des chanoines de Thérouanne, ou semblables et injurieuses parolles, en quoy cognoist avoir grandement offensé Dieu, sa benoiste Vierge et Mère, Révérend Père en Dieu monsieur de Thérouanne, parce que n’avois obéy à ses commandemens, ains injurieusement contrevenu, et pareillement mes honorez seigneurs, doyen, chanoines et chapitre de Thérouanne, ausquels et à chacun d(...)",brodequins
1914,Ce pied est protégé par de solides brodequins et repose sur un sol uni,brodequins
1921,"et que, d’autre part, les manufactures de chaussures employèrent à la confection des brodequins de l’armée des quantités de cuirs inférieures à celles qui étaient annoncées",brodequins
1921,"et qne* d’autre part, les manufactures de chaussures employèrent à la confection des brodequins de l’armée des quantités de cuir inférieures à celles qui étaient annoncées",brodequins
1855,"L'exécution se fit à Barbalisse, petite ville de Syrie, sur l'Euphrate. d'où, le jour suivant, le gouverneur partit, emmenant avec lui Sergius qu'il fit chausser de brodequins tout hérissés de pointes de clous",brodequins
1855,"robe, collier de perles, brodequins, tout y était",brodequins
1863,"et quoi. qu'on ne danse pas dans les champs comme dans nos salons avec de légers brodequins, on n'en saute pas moins(...)",brodequins
1863,les comiques n'avaient que des brodequins légers qui leur laissaient leur taille naturelle,brodequins
1935,"Les genres de tortures les plus courants étaient les poucettes et les brodequins, la suspension et l'extension du corps, c'est-à-dire l'estrapade et l'échelle, ainsi que la torture de l'eau",brodequins
1933,"La femme de 30 ans qui n'est pas le meilleur roman de Balzac, en est certainement le plus romantiquement romanesque : l'ingénue, chaussée de «brodequins en prunelle puce», le beau capitaine dont les broderies «pétillent(...)",brodequins
