year,sentence,key_word
1894,"Ecriture d'une langue magique, où les caractères sont tracés, dans le vague imprécis de la scène, par les brodequins pâlis des ballerines",brodequins
1846,"AÇTRICES. m .le.coeur maternel s'est, révélé à chaque instant par une foule d'attentions délicates : le soulier fourré a remplace le mince brodequin(...)",brodequin
1846,"Ses pieds étaient emprisonnés dans des brodequins, et un chapeau assez semblable aussi à celui des cavaliers féminins que nous nommons amazones, était(...)",brodequins
1916,"Mais le clou, la scène vraiment admirable, Ta plus magnifiquement jouée est. celle de la Salle des Gardes, où, les jambes broyées par l'affreux supplice des « brodequins », La Môle ne peut fuir",brodequins
1890,"foin odorant, ces deux jeunes gens formaient un couple vraiment fait pour réjouir les yeux. — La jeune fille avait le buste ser<é dans un de ces casaquin* d toile claire à irois larges plis dans le dos, qu’on nomme une taille dans le pays : la jupe de même étoffe collait aux hanches et tombait jusqu’aux pieds chaussés de gros brodequins: les manches retroussées au-dessus du coude montraient de beaux bras hâlés",brodequins
1906,est celle qui au premier plan se baisse pour nouer son brodequin(...),brodequin
1846,"aurore vient en souriant poser son brodequin de pourpre sur le balcon du jour, nos idées se succèdent toutes également brillantes et dorées",brodequin
1902,"Quant àCornély, nul publiciste n’était digne de lui décrotter les brodequins(...)",brodequins
1869,Brodequins de chasse cuir anglais à des prix modérés,brodequins
1914,"De magnifiques souliers vernis à boucles d'argent, rehaussaient mieux qu'aucuns brodequins grecs le prestige de l'acteur et fascinaient(...)",brodequins
1914,"Tout à coup, elle aperçut à uil étalage en plein air des souliers de toutes sortes — brodequins, souliers Molière, bottines à boutons, etc",brodequins
1923,"le solide gars, son. casque dans une main, l'autre en écharpe appuie sur le cou de l'aigle abattue le lourd brodequin des tranchées",brodequin
1891,"Les brodequins vernis de ses pieds très petits Luisent comptaisamment, mon coeur coquet s'y mire",brodequins
1883,"ainsi décrite dans la saisie : brodequin fermé au moyen d'un système de pitons fermés, dans lesquels joue un lacet en double triangle",brodequin
1935,"arrivant à Ampari. hy ce soir, ignoblement sales, ruisse- 7 L lanls nos kakis éraillés, nos brodequins l rattachés avec des ficelles",brodequins
1910,"intéressée, qu'à la forme des chapeaux ou des brodequins, ou en- - ebre à la préférence de chacun de ^c nous ""pour lès petits pois au lard ou \ les canards aux navets",brodequins
1911,Il lui arriva même parfois d'en profiter pour lui faire présenter la note de brodequins de fantaisie qu'il s'était fait faire par le meilleur cordonnier de la garnison ou pour se faire rendre cent sous qu,brodequins
1881,Le troisième ayant pour objet la substitution du brodequin napolitain au soulier avec guêtres pour la chaussure des troupes à pied,brodequin
1829,Les brodequins à talons hauts sont toujours à la mode,brodequins
1924,et ces cavaliers étaient chaussés d'une espèce de brodequin de marroquin rouge(...),brodequin
1907,"expel'lises médico-légales par une excursion dans l'Engadine, oÙ il respire cet air de cristal, cet air divin des hautes cimes : de l'air pur qui s'est promené sur les neiges immaculées, Muni de guêtres solides et chaussé de robustes brodequins, il abat les kilomètres, escalade les montagnes, découvre les glaciers sans autre accessoire qu'un gros alpenstock rigide qu'il pique solidement dans un rythme régulier, lent et sûr",brodequins
1929,"IL Comme il aime le feu, la fumée, il achète Un cigare, et, l’éclair à la bouche, en flânant, Il voit deux brodequins qui s’en vont cheminant : Une jeune ouvrière, ange en simple toilette, Effleurant nos",brodequins
1927,SCENE IX Le Scout Je crois que ce n’est pas le moment de faire mes offres de service Mon ami « Pot-au-feu » n’a pas précisément l’âme scoute Les pantouffîes le chaussent mieux que nos lourds brodequins,brodequins
1909,"CHAUSSURES — Brodequins à lacets THE SPORT TAILLEURS CIVILS ET SPORTIFS 17, Boulevard Montmartre, 19 Paris PAHIS — IMPRIHKHIK C1IAIX — 20189-7-09",brodequins
1919,Une paire brodequins de marche(...)Une paire de brodequins de repo,brodequins
1829,"soigner relâche ses sangles, et lui ôte son camail, sa bride, ses brodequins, etc",brodequins
1834,Pour ung collet faisoit ung » brodequin,brodequin
1900,"Un pantalon trop court et fripé flottait autour de ses jambes, chaussés de brodequins tous neufs",brodequins
1910,"Cinq ou six portes-monnaies ont été volés chez M. Pierre Clanac, propriétaire à Berjoulet près, de Mélagues ou chez M. Lamie, de la ferme de l’Homme- Mort, plus divers objets et, une paire de brodequins appartenant à ce dernier",brodequins
1901,"Le vieillard y est représenté de grandeur naturelle, en culotte courte de velours noir, chaussé de bas blancs et de brodequins à rubans, revêtu d'une veste violette avec parements à boutons et manchettes de dentelle",brodequins
1843,"sieurs Prospert et Mathieu, anciens condamnés politiques, el Véret, marchand de brodequins",brodequins
1949,Ils étaient tout simplement vêtus d’une chemise et d’un pantalon genre « travail » et chaussés en grande partie de brodequins,brodequins
1907,"Cordonnerie. ■— Bottines, bottes, brodequins élastiques, formes, oeillets, pantoufles, souliers",brodequins
1924,"En période électorale, tout candidat qui, à un moment quelconque, a porté un bonnet de police, un brassard ou une paire de brodequins napolitains du modèle réglementaire, se croit fondé à s'attribuer le titre d'ancien combattant",brodequins
1952,vous permettra d'identifier vos toiles préférées DBGAS: Danseuse nouant son brodequin(...),brodequin
1903,"L, bottine de cuir, déformation du mot brodequin: Enne paire de brosquins",brodequin
1835,"En vain tu changes chaque jour de parure, en vain"" tu resserrés « autant que possible le brodequin qui contient ton joli pied tu ne plais pas moins quand (i) Le rete dl Vulcano, 'o",brodequin
1867,"Moi je n'ai ni laquais, ni chevaux, ni voiture. 'Ce sera, je l'atteste, une peine bien dure De voir vos petits pieds dans de forts brodequins Ou de vous les meurtrir aux pavés des chemins(...)",brodequins
1876,une autre avait logé des grands pieds plats dans des brodequins élégants,brodequins
1918,"il était chaussé de brodequins .surmontés, au-dessus des chevilles, . d'une couronne de poil de lapin el ses poignets étaient encerclés de bracelets de cuir lacés",brodequins
1934,"plus, loin, d'énormes brodequins, opprobre de la cordonnerie, font penser à des pitres criant leur boniment devant la baraque d'un colosse(...)",brodequins
1873,"Ils étaient noirs, en forme de brodequin et ornés près de la cheville du pied de la figure d'une demi-lune qui n'était que la représentation d'un C, lettre initiale du mot centum, nombre primitif des sénateurs",brodequin
1909,"porteune absence de naturel et de simplicité, se croit toujours chaussé du cothurne ou du brodequin, est volontiers solennel et gourmé, en un mot, se figure que les hommes « se relaient pour le contempler(...)",brodequin
1892,27. — La chaussure est le brodequin réglementaire de l’infanterie avec jambières en cuir pour toutes les armes,brodequin
1892,"SÜO et d’une chaussure d'homme à pied. (Souliers, brodequins ou bottes sans éperons.) chapitre iv — Du matériel à employer",brodequins
1831,"Cet appareil est un brodequin ordinaire, garni de deux grosses pièces de bois, dont le jeu a pour but d'élever la pointe du pied(...)",brodequin
1907,"la lionne, dernière expression— sélection serait plus juste— du vaste monde des grisettes (peu à peu tranformées en lorettes) d’où émergèrent — suprême chic — les lionnes, compagnes empanachées des lions, chaussées du brodequin et coiffées du bibi à la fois coquet(...)",brodequin
1911,"Les essais n’intéressent pas que le costume, mais les souliers aussi, qui sont des brodequins en cuir(...)",brodequins
1936,"une enseigne de diamant sur son casque, et d'ailleurs des diamants sur tout son costume, ses brodequins notamment",brodequins
1912,"A ce compte, au Vigan et dans ses environs, on n'aurait qu'à chausser de bons brodequins et à courir un peu partout",brodequins
1919,"de de l’entrepôl d’effets de Mézidon, jqui travaillait au déchargement d’un wagon en provenance de Rennes, vola une paire de brodequins et les cacha dans la manche d’une capote ou on les a retrouvés",brodequins
1888,"Au musée de Clermont et dans les collections particulières de l'Auvergne, on rencontre presque toujours le même type le dieu est représenté nu, coiffé du pétase, parfois couvert de la chlamyde et chaussé du brodequin à talonnières",brodequin
1888,"Le premier est le plus voisin du Mercure classique ou gréco- romain les figurines de bronze, où l'on remarquera toujours une tendance à simplifier le modèle convenu, représentent souvent le dieu debout, coiffé du pétase, ordinairement nu, d'autres fois vêtu de la chlamyde et chaussé des brodequins à",brodequins
1941,"Pidé va se coucher et invite les autres à suivre son exemple car il est neuf heures: bruits de brodequins sur le plancher, craquements des grillages de châlits",brodequins
1964,"quatre petits clous à pointe recourbée et tête globuleuse, du genre clous à brodequins (fig. 15, pl. 1). — en pierre : un fragment de support de vase en pierre qui devait avoir, entier, 18 cm de côté et était décoré de dents de scie (fig. 7, pl. 3(...)",brodequins
1910,"Le fait est qu’avec cette chaleur torride il ne pouvait aller loin. ' Ceux qui n’ont jamais chaussé les brodequins ferrés du chasseur et n’ont pas porté le fusil — pour leur plaisir — un jour d’ouverture, — par un temps caniculaire ne peuvent se faire une idée des sueurs",brodequins
1854,"cette glace, on vit alors que le Pelil Chaperon rouge existait dans les entrailles du Loup, mais que ses brodequins de maroquin rouge élaienl, pour lè traitrc, d'une digestion difficile",brodequins
1921,"les pieds, chaussés de brodequins, sont croisés",brodequins
1906,"Il ne suffit plus au forestier, comme au temps jadis, de chausser ses lourds brodequins et ""de s’en aller tranquillement le matin, dès la première heure, faire une tournée de surveillance(...)",brodequins
1932,"un foulard rouge criard, une veste cien- à carreau jaunes et verts, un impéctesse eablè pantalon ""çharlestqn 1' et ladessous, rove- une paire de brodequins 44 — C'était 3- lé sieur G jeule d'Empeigne, qui pour pasi au ser inaperçu, essayait dé se faufiler derl'ins- ""ère la haie de citronniers qui formait la avait clôture de la parcelle du gîte",brodequins
1859,"On jouait hier les Aides de camp, Madame Grégoire, les Brodequins de Lise, l'Ours et le Pacha, toutes pièces qui appartiennent au répertoire de nos théâtres en vogue, et nous avons remarqué dans le jeu des acteurs typographes nn certain cachet d'oliginalité qui n'était pas dépourvu de charme",brodequins
1879,"C'est alors qu'on doit employer un brodequin montant, fixé sur le côté par une vis à écrou et depuis longtemps en usage dans un grand nombre d'asiles",brodequin
1889,"Le pied est logé dans une sorte de brodequin en cuir doux(...)Pour marcher, le Cosaque, sans quitter son brodequin, chausse des souliers découverts",brodequin
1898,"trouvait là les épées à deux tranchants, autrefois employées pour la décollation, les fouets plombés, les verges de fer, les tenailles meurtrières, les réchauds et les marques, les brocs pour la question de l'eau, les brodequins de bois avec leurs coins, et les poulies pour l'estrapade",brodequins
1898,"un brodequin de torture, dut écouter les explications de M. et de M"" 10 Chantavoine sur la future installation de leur fille, sur la position dans le pays qu'occupait déjà Muterel, qui était un jeune homme de moyens et d'une éducation conséquente",brodequin
1933,"complets et les brodequins des rradéa, les calots et les primes de libération, on aligne encore 3.187 419 fr",brodequins
1855,"On remarque dans cette exposition des brodequins de chasse et des bottes vernies à l'écuyère, dont la semelle et le talon sont en gutta-percha, et des bottes de marais d'une fort belle apparence",brodequins
1855,"Clerxc, de Paris (boulevart des Italiens, 11) expose des bottes à l'écuyère et à revers. et des brodequins boutonnés et élastiques faits avec la perfec ion qui est toujours obtenue dans les ouvrages de sa maison",brodequins
1905,dame 4 50 Botte noire pour homme 7 95 Brodequins noir ou jaune p homme,brodequins
1874,formes plus rationnelles voici le soulier ~<~ sorte de brodequin relevé de la pointe et encore bien plus long que le pied,brodequin
1933,"En France, les tortures les plus ordinaires furent l'extension, l'eau et les brodequins(...)Et nous passons à la question des brodequins",brodequins
1903,"L’autre, 55 ans, court, rond, vêtu d’une façon de complet taillé par une couturière malhabile , brodequins à(...)",brodequins
1904,"La Nuit de Noël C’est la nuit désirée où la troupe folâtre De nos roses babys, anxieuse, a placé L,un ses brodequins d’or, l’aulrte un sabot cassé, Près des débris fumants de la bûche dans Vôtre",brodequins
1896,"L'abbé, la soutane relevée sur le côté, chaussé de brodequins et de leggins, prenait aussi sa part de gaité, et s'efforçait de rasséréner son ami, qu'une appréhension vague, inexplicable, obsédait sourdement et attristait",brodequins
1907,"constrictives en brodequin, en jarretière, en bracelet, en ceinture",brodequin
1897,"A la passion qu'elle montrait de ces puissants brodequins, la Pia reconnut combien cette petite était voluptueuse",brodequins
1878,"A coup sûr, Mesdames, si haut que soient vos talons, vous n'oseriez hasarder vos brodequins à travers ce marécage(...)",brodequins
1856,"défendre sa liberté , toutes les dames de la ville de Sienne se départirent en trois bandes : la première était conduite par la signora Forteguerra, qui était vêtue de violet, et toutes celles qui la suivaient aussi, ayant son accoutrement en façon d'une nymphe, court et montrant le brodequin",brodequin
1938,"Le commandant Arvers (12e), « Le Père des Alpins », dota ceux-ci de leur tenue spéciale : vareuse, ceinture de' laine bleue, jersey, pantalon maintenu par des bandes molletières croisées, brodequins spéciaux, grand manteau à capuchon, alpenstock et grand béret",brodequins
1928,"Au bout d'un quart d'heure, du casque aux brodequins, je n'ai pas un fil de sec",brodequins
1900,"La veille, sur les boulevards, les soldats circulaient en tenue de campagne, se hâtant pour la plupart de regagner la caserne, et les pans de leurs capotes relevés, leurs brodequins enserrant le mollet leur donnaient un aspect alerte et dégagé vraiment agréable à voir",brodequins
1902,"Bpttes, bottines, brodequins, souliers, pan-, touflés de t'ôutes-sbrtes poui^ïéminesj.fillettes, enfants, à partir dé 6 frânes la paire. : : y(...)",brodequins
1884,"De cette sorte, il porta pendant quelques. jours une magnifique paire de brodequins sans semelles, et dont il était tout fier",brodequins
1899,"telle a été la vraie cause de toutes ces ̃parades et farces politiques, où l'on chaussait tantôt le cothurne, tantôt, le brodequin",brodequin
1859,"Les uns, écrivait M. LéonGozlan (1), subissent pendant » quatre ou cinq heures, dans une atmosphère de feu, la ques» tion des brodequins, comme on disait autrefois dans le lan* gage de la torture(...)",brodequins
1886,"3 ans, vêtu d’un paletot Doir et d'une petite jupe, même couleur, coiffé d’un béret noir, chaussé de brodequins, avait disparu de chez lui",brodequins
1927,Paire 8.50 BRODEQUINS veau (35 au 44(...),brodequins
1927,Le Scoot Je crois que ce n’est pas le moment de faire mes offres de service Mon ami « Pot-au-feu » n’a pas précisément Pâme scoute Les pantouffles le chaussent mieux que nos lourds brodequins,brodequins
1860,"id. bottines, brodequins, souliers et galoches pour petile fille n’ayant pas plus de o""178(...)",brodequins
1895,"On eût dit un vieillard à la façon dont-il traînait, au ras du sol, ses brodequins éculés",brodequins
1860,Ses pieds étaient chaussés de brodequins en cuir(...),brodequins
1933,"4 Le Metteur en scène, en chemise de tennis, calotte de golf et brodequins d’alpinisme. — La star est arrivée(...)",brodequins
1913,"un papa à autos, une maman à petite correspondance, et que l’on habille en gentlemen, car les autres, les vieux de la vieille, dont on ferre les talons de brodequins par économie, ceux-là, non vraiment, ne marquent pas un progrès très sensible",brodequins
1983,"les « brodequins » sont payés 15 F en 1869, 19 F en 1877 et 18 F en 1882",brodequins
1922,Contre la boue qu’on fasse arranger les brodequins à l’atelier et qu’on les graisse,brodequins
1900,"e Adjudication a Paris ' le 26 octobre 1900 e .i e POUR FOuiiNnuRtï niï il e brodequins, souliers et lacets de t jî brodequins(...)",brodequins
1838,brodequins,brodequins
1909,"deux caisses de chaussures (brodequins, sandales, etc(...)",brodequins
1920,"du mollet. d) Les brodequins de grandeurs normale, seuls, seront exclusivement autorisés. ej \Jo casque en cuir obligatoire à porter en course et à l'enlralliement",brodequins
1910,"Ils combattirenLdonc et furent victorieux. .«< Devant tant de glorieux exploits, Dandolo dut chausser les brodequins couleur de pourpre et, acclamé par une foule en délire, fut proclamé seigneur de l’empire d’O(...)",brodequins
1848,Un long voiie en étoffe couvre la partie postérieure de ses cheveux et retombe derrière elle. 'Ceci et des brodequins lacés sont(...),brodequins
1962,"Des trois façons de questionner, par brodequins, à l'eau ou à l'estrapade, Poitiers ne semble pratiquer que la première(...)Puis on le déshabille, on lui attache les mains, on le chausse des brodequins et le président fait tirer la première et la deuxième cordes",brodequins
1962,"Louis Lambert, 29 ans, de La Chapelle-Bertrand, subit, pendant l'instruction, la question aux brodequins jusqu'au huitième coin, victorieusement, ce qui lui vaut de se tirer d'une accusation d'assassinat avec une fustigation, la marque au fer et les galères à perpétuité",brodequins
1926,"de tout petits brodequins, de la pointure de Cendrillon",brodequins
1869,"aux mains sales, les paysannes fardées de son et chaussées de brodequins de terre",brodequins
1889,"11° Trois paires de brodequins, une paire de souliers vieux (ressemelage) et deux paires de petits souliers(...)",brodequins
1895,jambes frénétiques terminées par l'éternel cou-de-pied cambré chaussé du brodequin d'or,brodequin
1895,"Il fut grand jusque dans sa tombe, où il se fit coucher avec les insignes pontificaux, les brodequins et le manteau de pourpre dont Étienne, à la demande de Pépin, lui accorda le privilège",brodequins
1907,"et ce dernier prit même la défense des sorciers, dévoilés par tous les procédés de l'inquisition, l'estrapade, le chevalet, le brodequin, le fouet, le collier, etc",brodequin
1916,"Lucien vint à moi, tout pimpant, dans ses brodequins luisants et sa capote brossée, tout aimable de sourire, de bonté d'âme et de pureté de cœur",brodequins
1908,Ajoutez à cela un pied comme le doigt dans un brodequin de satin noir d’une forme ravissante,brodequin
1908,"L’arrêt lui ayant été prononcé le 27 mai, on lui donna les brodequins qui le firent crier beaucoup plus haut que la première gêne, mais ne tirèrent point d’autres paroles de sa bouche sinon qu’au premier coin il demanda à Dieu",brodequins
1892,"Les nègres étaient d'un noir indécis.les plumes mal collées, certaine peau de léopard d'une brièveté inquiétante, et le peuple de Sélika avait chaussé pour adorer Wishnou bottines à boutons ou à lacets, souliers découverts, brodequins de toute sorte",brodequins
1932,Vous trouverez chqz LÉON LAVASTRE le réputé CHAUSSEUR Le plus GRAND CHOIX - La MEILLEURE QUALITÉ AUX PRIX LES PLUS AVANTAGEUX Tous les modèles de Chaussures fantaisie et classiques Spécialité de Brodequins de travail et de chasse et(...),brodequins
1913,"Son bottier lui apporte une paire de bottines dans lesquelles il se trouve réellement souffrir la question des brodequins, une des horreurs du Moyen-Age",brodequins
1895,"En 1783, Oreste dépouilla le cothurne et chaussa le brodequin, prenant un engagement de première basse à la Comédie Italienne",brodequin
1876,"Cela rappelle les tortures de l'inquisition : — des scies, des brodequins, des outils qui coupent, qui percent, qui écrasent et même qui brûlent",brodequins
1923,"L'huile est extraite par les «Thô», des fruits du faux bancoulier, au moyen d'un pressoir spécial basé sur un principe qui rappelle celui de la torture au brodequin : deux forts madriers sont mobiles autour de leurs extrémités inférieures qui reposent accolées au(...)",brodequin
1867,"Le brodequin demi-lacé, (Le temps presse il faut qu'on babille!) Sur la lèvre un chant commencé",brodequin
1933,"Les concurrents se présentent en brodequins, culotte chemise et(...)",brodequins
1882,"Il était vêtu d’une blouse bleue, d’un pantalon en velours marron et chaussé de brodequins. — Les abords de l’Elysée ont encore été troublés hier par un fou venu pour",brodequins
1882,"Après le tourment des brodequins, je fus longtemps à me rétablir(...)qu'il était malheureux, très malheureux... — Après tout, dit le pope en sourian on ne l’a jamais chaussé de certains brodequins à vis",brodequins
1936,"Pour parcourir toutes. chaussées, aussons-les de forts brodequins Comme pour la maréchaussée En cuir de bœuf, non de chagrin. * * Sur les sentiers de, durs, pavés, Ils iraient tous le cœur content, Les pieds à l'aisé 'bien chauffés",brodequins
1914,"S. I. M. les danseurs sont vêtus de tuniques découpées dans le bas qui laissent à découvert la jambe nue, chaussée d'un brodequin montant jusqu'au mollet 1",brodequin
1918,brodequins de marche et de chaussures de repos les troupes du X e et du XI e corps d’armée,brodequins
1895,"si ton linge était moins douteux, si tes brodequins éculés pouvaient se transformer en bottines fines au son neuf et musical, si ta houppelande était du dernier cri, si(...)",brodequins
1856,"Nous rassemblerons, sous un seul coup-d'œil, les poètes qui chaussent gaiement le brodequin comique, font de la vie et du théâtre une sorte de Fronde joyeuse, où ils se précipitent à l'étourdie, cherchant peu à nous instruire, mais beaucoup à nous égayer",brodequin
1965,les jambes sont nues et les pieds étaient chaussés de brodequins,brodequins
1936,Ses brodequins régimeiitaires le soulageraient mieux,brodequins
1895,"16 £50 BRODEQUINS qualité, 9,50, 10,25 5 50 RICHELIEU(...)",brodequins
1960,"difficultés dans les pointures des brodequins, mais nous étions résolus à nous couvrir de, gloire",brodequins
1926,"POUR HOMMES ( i ( J Brodequins avec clous, en noir et * ^ cuir naturel à 31, 30, \-2 et 19 fr",brodequins
1855,"C'est ainsi que, malgré la puanteur de cette espèce de demi-brodequins, les modernes Atala parcourent les vastes solitudes",brodequins
1855,"les brodequins destinés, dit-on, a maintenir le pied, nemeparaissent convenables que lorsqu'ils sont lacés derrière les guêtres de toile rempliraient mieux l'objet qu'on se propose, celui de contenir le bas de la jambe et d'assurer",brodequins
1895,"Quant à la chaussure, le brodequin adopté dans l'armée et le soulier de repos suffisent",brodequin
1822,sur des brodequins comme lès autres acteurs comiques(...),brodequins
1894,"Une dés dernières venues est l'oeuvre d'un ouvrier cordonnier qui présente aux visiteurs unepairedebrodequins, dits brodequins-guêtres, celte chaussure est spécialement destinée à l'armée, aux touristes, et en général à toutes personnes ayant à faire de longues marches",brodequins
1904,"LA JEUNE FRANÇAISE. voyez venir ces deux personnages qui semblent sortir d'un roman de.Fenimore Cooper : un géant à la moustache couverte de glaçons, le buste moulé dans une tunique blanche, la tête encapuchonnée d'un casque laineux, les mains gantées de gants énormes, les pieds chaussés de brodequins qui rappellent les mocassins hurons — suivi de quelque squaw au visage tanné, à la jupe courte enveloppant à demi des jambes maigres — tous deux recou(...)",brodequins
1938,"Tandis que l'appel grave et doux Des cloches vibre dans l'espace, Je mets mon costume de chasse Et mes lourds brodequins à clous",brodequins
1903,"Le soulier ou le brodequin en cuir chausse bien le pied, le maintient et donne de la stabilité et",brodequin
1818,"Ce privilège. détruit toute espèce d'émulation, Le talent s'endort dans l'inaction, tandis que la vigilante médiocrité chausse à son grêle brodequin ou le cothurné",brodequin
1939,"265. que vous trouverez le plus grand choix de chaussures écoliers, richelieu et brodequins pour garçonnets, sports et bottes fantaisies pour hllettes",brodequins
1918,faire à Hanoï des brodequins par dizaines de mille,brodequins
1934,"la tyrannie de la mode, depuis la coiffure qu’il est de bon ton de discipliner rituellement suivant le barème du coiffeur, jusqu’aux petits pieds qu’il est normal d’enserrer en d’étroits brodequins, dût-on souffrir mille calvaires, en passant par la taille de guêpe,’qui fit de nos femme,s autant d’infirmes(...)",brodequins
