year,sentence,key_word
1887,"Anciennement la femme qui renonçait à la communauté et qui, par suite, refusait de payer les dettes de son mari, devait mettre les clefs sur la fosse du trépassé la raison en était qu'autrefois on donnait les clefs de la maison à la nouvelle mariée comme un signe de l'autorité que son mari lui abandonnait sur tout ce qui était du ménage et de la conduite du logis",trépassé
1887,"Trantel ou trentin, parce que durant trente jours on priait Dieu pourrie trépassé.) Notre Coutume ne s'explique pas sur la forme nécessaire à la validité(...)",trépassé
1868,"AIta), guné de ita, trépassé, c’est uniquement pour en rapprocher êtana, la mort, le départ de cette vie",trépassé
1899,"Moi j’ai connu un homme qui serait mort comme un peureux et qui a trépassé en brave, rien que pour avoir eu ce petit livre-là dans sa poche",trépassé
1936,La- menlo (pour les Trépassés) -Bai(...),trépassés
1936,"Les Contes d’Hoffmann, opéra d’Offenbach. — 18.05 Veillée de» trépassés La Mort, poésie de J. Wolker(...)",trépassés
1954,pour les trépassés,trépassés
1985,"Soufflez sur cette larme, qui vient du temps qui passe où trèpasse cette » race de seigneur et reste en mon cœur gravée",trèpasse
1926,"La lande est pour le Breton la terre des aïeux, dont la souvenance s’affirme le soir dans la plainte des trépassés que porte le vent de la Cornouaille au pays de Léon, penant qu’autour des menhirs la dame des Roni- gans se déroule au clair de lune parmi les feux follets",trépassés
1858,LiToussiiar Les Trépassés i,trépassés
1846,lundi Trépassés,trépassés
1933,trépassés,trépassés
1933,"mais quand on se rappelle la charité pratiquée par les générations du moyen -âge envers les âmes des trépassés, cela ne paraît pas étonnant",trépassés
1940,"apporté l'apaisement il est revenu vers eux, à chaque saison, sans se lasser du cycle éternel qui entrelace les frissons d'avril, les joies de l'été, la chanson du vent, jusqu'aux chemins de l'automne, à l'heure où : Des écorces couleur du printemps trépassé Tombaient en emportant par morceaux le passé",trépassé
1966,"108 Quand GUILLAUMET a décollé pour ...25 ans après il verse au dossier son témoignage Chaque année, le 2 novembre, jour des Trépassés, se déroule en rade de MARSEILLE, à proximité du Monument aux Morts d’Orient et des Terres Lointaines de la Corniche, une émouvante cérémonie",trépassés
1927,"A moins d'être futuriste impénitent — et le futurisme est du passé très passé et trépassé — nous avons le devoir de rassembler pieusement tout ce qui nous rattache aux temps défunts, mais desquels notre époque procède tout ce qui peut expliquer l'évolution de l'humanité",trépassé
1905,"valets de justice, pendant que la cloche des trépassés lançait dans les airs son glas lugubre depuis l'instant où il se mit en marche jusqu'au moment où le glaive justicier fit son oeuvre(...)",trépassés
1919,"pour nous soustraire au regard pêne trant des éléments, nous nous enveloppons d'une espèce de suaire qui, nous retranchant de l'ambiance, nous fait pareils à des trépassés",trépassés
1919,"ancestral, ce qui, sans cesse, doit reformer notre organisme qui, sans cesse, s’use et trépasse",trépasse
1920,"la Barque abandonnée, la Lavandière de Nuit, la Baie des Trépassés",trépassés
1920,"dit-il, de simples documents, que je LA BAIE DES TRÉPASSÉS (AQUARELLE) « LES SILHOUETTES DU CRÉPUSCULE » a 84",trépassés
1914,"pays des morts », où se rejoignaient les âmes des trépassés",trépassés
1914,"La croyance à la survie des âmes des trépassés aussi bien que la croyance aux esprits puissants, fondateurs de tout. ce qu'il y a de bon au monde, dérivent du totémisme",trépassés
1904,Fig. 9. - Le Clucheteur des Trépassés,trépassés
1935,On dirait d’une lamentation de trépassés,trépassés
1881,Item une croix d'argent pour les trépassés,trépassés
1881,"D'autres, au contraire, sont nouveaux, comme « la croix d'argent pour les trépassés » (n° 23), la « croix de bois couverte d'argent doré (n° 31), qui s'ajoute aux processions à la « grand'croix d'or » (1"" inv., n"" 2), un « calice d'estain » (3) (n° 35) et six chandeliers de même métal (n° 42), ce qui indique le peu d'aisance de la communauté",trépassés
1881,"enfin la croix des trépassés a aussi sa couleur funèbre, qui est l'argent, par opposition à l'or réservé pour la croix des processions il en était ainsi à Monza, où les deux croix, de métal différent, sont indiquées par les inventaires",trépassés
1919,"Nous y passerons deux nuits, ce qui nous permettra d'aller admirer la Pointe du Raz et la Baie des Trépassés, par(...)",trépassés
1930,Et les chers trépassés n'étaient pas aussi délaissés,trépassés
1942,"Mais, à peu près quinze jours plus tard, il poussa sur la fosse du trépassé une branche verte, portant une rose blanche, alors que ce n'en était point la saison",trépassé
1939,"66 ŒUVRES changea brusquement : sur les doubles croches de la fugue qui termine le Kyrie, se pressait, haletante, la foule des trépassés, mouillée d’une sueur grise(...)",trépassés
1994,"L’année scolaire commence le lundi qui suit le 9 octobre et se termine le samedi qui précède le 25 août, les élèves ont congé le mercredi après -midi de la veille de la Toussaint, de Noël, de la Circoncision, des Rois et de l’Assomption, le jour des Trépassés, le samedi(...)",trépassés
1846,par l’auteur'des lettres d'un trépassé(...),trépassé
1846,"Nous trouvons dans de très-piquantes lettres d’un trépassé, très-spirituel de son vivant, et qui en perdant la vie n’a pas perdu l’esprit, un fait fort plaisant de nature à prendre place dans nos nouvelles du sport",trépassé
1846,"Sporling Magazine. ) QUELQUES MOTS SUR LES CHEVAUX DU DONGOLA, DE l’ÉGYPTE, DU NEDJD, ETC. , PAR L’AUTEUR DES LETTRES d’üN TREPASSE, Publiées à Berlin, en 1746(...)",trepasse
1846,"Egypte, du Nedjd, etc., par l’auteur des Lettres d’un trépassé",trépassé
1905,successions en déshérence n'attendit pas qu'un voyageur moribond fût trépassé pour le dépouiller(...),trépassé
1868,"i ) Kl h h , j * ir :k Hélas 1 le jour des trépassés, les morts étaient partout, — dans les tombes, — et autour, — avec cette différence que ceux qui reposent sous la terre ont vécu, et que ceux qui grouillent dessus attendent de vivre",trépassés
1990,"La croyance tenace à l'errance des trépassés pose un problème plus grave(...)ici qu'on voit, dans un passé assez proche, l'influence maléfique d'un trépassé conjurée par le geste insolite et barbare de la décapitation du cadavre, selon une coutume venue du fond des âges",trépassés
1990,"comme les trépassés quittent leur tertre à volonté, les guerriers de la Valhôll(...)",trépassés
1906,"L'ancien « chausson » des Français et le « self defence » des Anglais ne se ressemblaient guère et le « chausson » est trépassé, hormis comme exercice d'entraînement",trépassé
1906,"Par contre, un contemporain de l'illustre moine eût trépassé rapidement s'il avait dû participer à la fameuse course cycliste, dite de six jours, qui a eu lieu pour la treizième fois dans Madison square, à New-York",trépassé
1984,"et messe des Trépassés à Sassenay 1457-1802 — ibid., p",trépassés
1908,"En face d'une pareille intransigeance n'est-on pas fondé à dire aux catholiques avec M. Philippe Berger : « Ce n'est pas à nous, c'est à vous qu'iront les plaintes des trépassés que vous aurez privés d'un repos qu'ils espéraient et de cet atome de survivance et de gloire posthume auxquels ils avaient droit (3(...)",trépassés
1957,"Wright « Whirlwind » de 220 ch, quittait la baie des Trépassés (Terre-Neuve), pour se poser à Llanelly (Grande-Bretagne), le lendemain à 11 h",trépassés
1960,"Faisant alors cap nord- est, par Québec, Montréal et Rimouski (Canada), De Pinedo arrivait le 20 mai à Terre-Neuve, amerrissant dans la baie des Trépassés",trépassés
1924,Nous verrons cependant que le caractère sacré d’une partie au moins d’entre eux pouvait suffire à assurer la subsistance des trépassés par les signes magiques dont ils étaient couverts,trépassés
1924,N’aurait-on offert aux trépassés que des fragments(...),trépassés
1949,16 janvier 1941 : c'esl ia mère de M. Besnard qui trépassé,trépassé
1891,"Traduction Sancta et salubris est cogitatio pro defunc- tis exorare (Machabées, liv. 2, chapitre 12.) Pater Noster et Ave Maria pour les trépassés",trépassés
1891,"Au siècle dernier, ce modest e sanctuaire, érigé en bénéfice, avait un chapelain et une hoite des trépassés, administrée par deux procureurs ou marguiHiers laïcs (5(...)Un inventaire des titres de rentes dues à cette hoite des trépassés (confrérie instituée pour les âmes des fidèles défunts(...)",trépassés
1891,"Divers actes des 16 e , 17 e et 18 e siècles attestent notamment la pleine activité de celles des cinq plaies de Notre Seigneur, de Ste-Anne, du St-Eosaire, de St-Vincent, des Trépassés (3(...)n° 15. (2) Liasses des Archives de la Préfecture, déjà visées. (3) La boîte des Trépassés était une association paroissiale de soins pieux et de bonnes prières pour les défunts (Dictionnaire des confrérie-' dans l’Encyclopédie de l’abbé Migne(...)",trépassés
1936,"Le cimetière Monceaux connu sous le nom de « Clos du Christ » Sous la Révolution française, le cimetière de la Madeleine, doublement peuplé par la faux naturelle de la mort et par le couperet de la guillotine, n’avait plus assez de terre pour recouvrir les os des trépassés",trépassés
1924,servait aux messes des Trépassés(...),trépassés
1924,"LES ENSEIGNES DES MAISONS DE LA RUE SAINT-DENIS 105 Les Trois Sorcières 186 Les Trois Visages 469 La TrurfJte 201 La Truie qui file 43 La Toilette royale 429 La Toison d’or 109 457 La Toison royale 457 La Tour 16 La Tour d’argent 428 La Tournelle 69 Le Tournois 344 Les Trépassés o V Le Vase d’or 421 Le Vase d’or et le Grand Monarque 69 Le Veau d’or 101 Le Vert-Galant 356, 347 84 La Victoire 443 331 Les Vieilles Etuves ou les Etuves à hommes *88 La Ville d'Anvers 5 La Ville d’Arras 321 La Ville(...)",trépassés
1924,"Les Signaux, L'Hôtel de Tours. — La Reine de France, L'Ecu de Pologne, T.es Trépassés, Le Hérault d'Armes (paroisse Saint-Leu ' Saint-Gilles(...)",trépassés
1924,Confrérie de S 4 Eloi tenait des réunions privées et faisait célébrer des Messes en l’honneur de son saint Patron ou pour le repos des âmes des confrères trépassés,trépassés
1945,ne refusez pas à nos âmes de trépassés votre lessive mystique(...),trépassés
1898,"Dès son origine, l’Eglise a eu des prières et des messes pour les trépassés(...)Après avoir, le 1 er novembre, fêté tous ses membres, morts ou vivants, saints, confesseurs ou martyrs, connus ou inconnus, qu’ils aient ou non une fête assignée dans le cours de l’année, l’Eglise consacre le jour suivant à la commémoration des fidèles trépassés dont les âmes sont au Purgatoire",trépassés
1898,"Mais 1a, mort est plus qu’une absence éternelle : notre voix peut frapper l’oreille du trépassé, nous ne l’entendons plus",trépassé
1898,L'action bienfaisante qu’exerce sur nous la pensée de nos morts immédiats s’étend à la commémoration de l’ensemble des trépassés,trépassés
1898,"Au théologiste qui a l'espérance d’ouvrir aux trépassés les portes du Ciel par ses prières ou par les sacrifices qu’il s’impose, et qui nous demanderait : Quel profit vos Morts peuvent-ils retirer de votre culte(...)Quant aux bonnes œuvres accomplies au nom des trépassés — nous ne parlons pas d’bypothéquer les biens",trépassés
1905,"bieufaiteurs vivants et trépassés de la Confrérie, et qu'on prie pour eux",trépassés
1905,"la Confrérie fera dire une messe pour les lunes des Confr¡'~res et bienfaiteurs trépassés ÜO Les Confrères seront aussi soigiieux de se disposer par une vraie confession et comrnunion à gagner l'indulgen~e plénière qui leur est octroyée en forme de jubilé trois fois en leur vie, et il l'llellre rie leur trepas, en invoquant le saint nom de Jl",trépassés
1842,"20 janv., le lendemain des Cendres, 2 mai, 22 juillet, t.. octobre, jour des Trépassés",trépassés
1842,30G 2 mercredi Les Trépassés,trépassés
1876,G 5G 4 31 2 j V Trépassés,trépassés
1899,6 48 4 39 4 42 3 21 27 2 Jeu 305 Trépassés,trépassés
1910,Cent livres parisis furent prélevées sur l’amende pour faire dire un service solennel à Notre-Dame et autres œuvres pies pour le repos des âmes de ceux qui avaient trépassé dans ce naufrage,trépassé
2002,"Pastiches - ANONYME, 1950 -331 - Sur le chemin, Clio délaissée Garde en sa main Les Trépassés",trépassés
1910,"C’est que Meyer estime que les idées très diversifiées au sujet de l’au-delà, du sort des trépassés, des soins à donner aux morts, de leur action bienfaisante ou malfaisante, n’ont en réalité rien de commun avec la religion, pas plus que les ancêtres n’ont rien de commun avec les dieux(...)s’il est des peuples, tels les Egyptiens, chez qui le culte des morts joue un rôle important à côté de l’évolution purement religieuse, il en est d’autres, tels les Grecs d’Homère, pour qui les morts continuent une(...)",trépassés
2014,"Deux autres dames HITTLER ont trépassé à Strasbourg en cette année 1871, mais toujours pas de Catherine",trépassé
1916,Lorsqu’il étudia la chapelle des Trépassés,trépassés
1916,"ou bien glissant silencieusement sur le sable d’une grève tranquille, rendez-vous favori des poètes et des rêveurs trépassés",trépassés
1881,"Puis vient cette clause curieuse relative à la fête du patron : les bacheliers de Saint-Cyr seront tenus, sur les legs qui leur sont faits, de faire distribuer perpétuellement, au soir de la veille de Saint-Victor et le jour de la fête « quand l’esglise (le chapitre) yra en procession, » en disant les recommandations des trépassés sur lui, ses père et mère, parents(...)",trépassés
1881,"faire dire : Vigiles des morts « cou- pelées par trois fois des deux petites clochettes de l’église, » le 6 juin, veille de Saint-Claude, et, en ce jour une grand’messe des Trépassés, avec offertes de pain(...)",trépassés
1924,raz de Sein bouillonne en s’avançant vers la baie des Trépassés,trépassés
1888,"bons bourgeois, de prendre garde aux fole1l1'11 et aux incendies et d'exhorter le peuple, lorsque minuit sonnait, à prier pour les trépassés(...)priez Dieu pour les trépassés (2(...)",trépassés
1928,"service des trépassés, 3 fr., plus le luminaire et l’offrande. (3) B 355, passim.. (4) Vaubourg des Marets, 50",trépassés
1928,"La Boîte du Purgatoire était une association pour les trépassés, qui consacrait ses offrandes à des offices funèbres et à l’entretien de la chapelle des Morts",trépassés
1928,"confrérie du Rosaire aurait fait cesser brusquement ( 9 l A Velaines, près de Ligny, à la maladrerie de Saint- Jean de Froide Entrée, des loges furent construites et une épitaphe rappela qu’en 1630 deux capucins étaient « trépassés au combat cy devant de la charité en soulagent ment des pestiférés de Ligny »( 10(...)",trépassés
1928,"La môme année, défonse est laite aux maîtres d’école do laisser les enfants courir dans les églises aux fêtes de la Toussaint et des Trépassés, pour la récitation des sept Psaumes (Invent., 52(...)",trépassés
1972,"59 seulement « trépassé », c'est-à-dire endormi",trépassé
1968,"Un transfert le chef de division a l'heureuse idée de nous faire faire le tour de Tevennec, en mettant successivement le cap sur le phare de Sein, sur celui de la Vieille qui marque les cailloux situés au large de la pointe du Raz, puis sur la pointe du Van, au nord de la baie des Trépassés, avant de revenir à 5 nautiques au sud de Saint-Mathieu, où nous avons rendez- vous avec deux hélicoptères pour un exercice de « treuillage du personnel(...)",trépassés
1890,L'oeuvre de piété nouvelle est déclarée plus louable et plus fructueuse que les fondations de messes pour les trépassés,trépassés
1859,On écoute expirer lentement les sons graves. g On ne se moque plus des galants trépassés(...),trépassés
1845,"Outre l'instabilité qui lui est propre, des milliers d'incidents intérieurs la troublent et la » des trépassés, et là, ayant fait quelques sacrifices de propitiations, et luy ayant offert les » effusions funèbres que l'on répand sur les sépultures des(...)",trépassés
1922,"certitude de l'existence réelle des êtres que nous avons perdus. )n y rencontre des trépassés revenus pour affaires personnelles, révélations posthumes, avertissements et même vengeances",trépassés
1921,"De là nous descendîmes à Argos, où les codga Bachis nous hébergèrent dans une maison, dont tous les propriétaires étaient trépassés depuis peu de jours",trépassés
1821,"Certes, Messieurs, nous ne nous tenons ni pour battus, ni pour trépassés(...)",trépassés
1861,"En effet, brûler les corps après décès sur un bûcher plus ou moins pompeux, avec du bois, des liqueurs, des essences plus ou moins rares, n'était pas tout ce qu'ils réservaient aux trépassés",trépassés
1916,"où se trouve la tète du cadavre, il saigne un poulet et une pintade avec lesquels on prépare ensuite un repas pour les petits-enfants du mort, et il adresse une prière à l'àme du trépassé, lui demandant sa protection pour lui et pour sa famille",trépassé
1901,2 sam. les Trépassés 6 50 4 37 le 2 à 3 Dim. s,trépassés
1900,Cela serait vrai surtout quant aux individus trépassés en pleine vigueur et subitement,trépassés
1900,"Contes de la mer, dans La Fiancée des Trépassés, et dans Le mauvais frère",trépassés
1885,"déterrer tous les débris de tous les morts et de toutes les choses mortes des vieux temps, morts et trépassés, que sois-je encore",trépassés
1914,L. M. M. J. V. S. D. L. M. M. J. V. S. D. L. M. M. J. V. S. D. L. M. M. J. V. S. D. L. TOUSSAINT Les Trépassés S. Hubert S. Charles B Ste Sylvie S,trépassés
1887,Les Trépassés(...),trépassés
1909,la Pointe du Raz et la Baie des Trépassés,trépassés
1909,la Pointe du Raz et la Baie des Trépassés,trépassés
1892,"Le t9 décembre 1609, les syndics de J'hôpital d'Agen, en la personne de Me, Jacques Roques et de Jean Vacquié, bourgeois, demandent aux consuls, patrons de l'hôpital, de vouloir bien autoriser audit hôpital la création d'une Co~a frérie rlile de la lVlis~riconde, pour le soulagement des pauvres, l'entretien des prisonniers, la visite des pauvres honteux, la sépulture des pauvres trépassés, Archives de",trépassés
1982,"avec une tête de mort : « Passants qui que vous soyez Priez Dieu pour les trépassés » et la date de 1764, qui nous indique peut-être le début des travaux",trépassés
1932,"Mais la mère du trépassé, Domenge Doyarasse, regimbe contre la flétrissure et porte le différend à Rome (1(...)",trépassé
1825,166 ANNALES DE LA LITTÉRATURE Que quand nous avons trépassé,trépassé
1860,TOUSSAINT. al 11 x ( 2 -*11 x. 28 1:20 307 2 Vendr. Trépassés. ■5 12 A 3 = 12 — 1 Ï21 308 3 Samedi,trépassés
1860,après les Trépassée,trépassée
1869,2 M Les Trépassés,trépassés
1892,"Les vieux pins demi-morts courbaient leurs fronts lassés Et les brouillards semblaient, dans la grise pénombre, Des choeurs de trépassés",trépassés
1891,trépassés dans un cercle d’une monotonie désespérante,trépassés
1910,205 ces termes : « Nous touchons aux temps prédits pour l'accomplissement de l'œuvre du Trépassé,trépassé
1910,"Il lui tient ce discours : « Je suis Pierre, fils de Pierre le Trépassé, l'un des huit exécuteurs testamentaires qu'il a chargés de faire prévaloir sa volonté sur les ruines(...)",trépassé
1892,"Nous avons longtemps erré dans cette nécropole, enfouie elle-même, comme un des trépassés qu’elle a reçus, dans la ville populeuse",trépassés
1819,L'échelle est toute littéraire et relative aux trépassés(...),trépassés
1918,La patrie originelle en disparaissant aux abîmes est devenue le refuge sous-marin des trépassés,trépassés
1836,"proche de l'Al- cazar, et l'évêque et les autres ecclésiastiques chantèrent prières, vigiles et messe comme c'est la coutume pour les trépassés",trépassés
1846,"justice divine, de l'autre le cœur du trépassé, et il observe attentivement le degré d'inclinaison du fléau",trépassé
1862,On célèbre tous les samedis dans ces chapelles un service pour les trépassés,trépassés
1863,"A la quatrième passe, Le plus jeune compagnon Tombe, et voilà qu'il trépasse En balbutiant un nom(...)",trépasse
1910,Quand les morts entendront en éclats retentir Et troubler le sommeil de leurs sombres retraites L’appel aux trépassés des divines trompettes,trépassés
1921,"Ce fut dans le grand, amphithéâtre de l'Ecole un assaut d'éloquence pour glorifier le trépassé, exalter ses qualités d'homme et de savant, les services rendus au pays par ses découvertes, et pour déplorer qu'une mort stupide ait mis un terme à une carrière(...)",trépassé
1931,"Chaque jour, on nous présente, dans les journaux, la victime la plus marquante et nous avons loisir, en regardant les traits du trépassé, d""y voir la marque de la mort prochaine dans les bajoues tombantes de la future victime, dans son regard morne, dans tous ses traits usés par cette comptabilité criminelle qui consiste à sans cesse emmagasiner des toxines et à ne jamais les sortir",trépassé
1935,il ajoute que s'il trépasse le premier(...),trépasse
1915,C’est-y pas le meilleur moyen d’employer la- veillée que de parler des trépassés,trépassés
1925,Trépassés 2 — Fête de la Victoire et de la Paix,trépassés
1891,Il est plus immobile qu'un trépassé,trépassé
1891,"que nous traduisons, bien entendu par: on persécutera les trépassés",trépassés
1896,"Avec Du Boulou à la Jonquère de M. G. Arrès, Au Canigou, de M. É. Delcros, Excursion en Cerdagne, de M. L. Bertrand, Gorges de Carença, Gorges de Bassibès, Pic de la Serra Gallinem et Roc des Trépassés, de M",trépassés
1931,En remontant vers le Nord on rencontre la légendaire Baie des Trépassés où la mer est grandiose et terrible dans les tempêtes(...)De Douarnenez à la baie des Trépassés une muraille de falaises hautes de Go à 70 mètres qu’indentent d’étroites et sauvages ravines domine la mer,trépassés
1931,La baie des Trépassés,trépassés
1931,Baie des Trépassés,trépassés
1908,qui sont encore que l'homme peut parler avec les trépassés alois que jamais l'identité des esprits avec les puissances évoquées ne sera prouvée,trépassés
1894,"Tabe si, d'chés bieux jours passés, Tu viens m' rafraîtchir el mêmoère, Tu m' parl's aussi d' chés trépassés, Ed cheux dont j' n'ai point d'eutr' histoère",trépassés
1867,"les anciens, les Egyptiens surt, étaient célèbres par le culte qu'ils idaient aux trépassés, e 3 novembre est la grande fête ., s chasseurs, c'est la Saint-Hubert",trépassés
1929,30 1 V TOUSSAINT 2 S Trépassés NL 3 D s Hubert 4 L s Charles 5 M s 9 Bertille 6 M s Léonard 1 J s Ernest 8 V s es Reliques 9 S s Mathur,trépassés
1929,5 B s Constant 1 s TOUSSAINT 2 B Trépasses 3 L s Hubert 1 L s Eloi 2 M s 8 Aurélie 3 M s Franç,trépasses
1918,"Il lègue aux recteurs de la Charité, tuteurs des pauvres, tous les livres composant sa bibliothèque, à l'exception de ceux en langue française réservés à sa fille, à la charge par lesdits recteurs de faire célébrer, après l'ouverture de son testament, trente messes pour le repos de son âme et chaque année deux autres le jour des trépassés",trépassés
1889,2 Samedi Les Trépassés,trépassés
1910,Nous ne parlerons pas des tarifs des sonneries variables selon les classes ni de ceux des services des trépassés cotés à moitié prix quand il s'agissait de sonner les cloches,trépassés
1910,"aussi fautil voir avec quelle rapidité et avec quelle insistance il demande le médecin qui, sans doute, n'arrivera jamais que pour la trouver trépassée",trépassée
1850,"des tombeaux, et ils prennent pour des personnages réels et vivans les statues de pierre, les statues des morts, droites et immobiles sur les sépulcres des trépassés",trépassés
1897,"La femme, saisie, accouche d'un enfant mort et trépasse",trépasse
1874,"1814 Ouvert, du Congrès de Vienne. (Fr., Autr., Russ., Angl., Prus., Suède, Esp. et Port.) 2 L. Les Trépassés",trépassés
1914,"Le gouz~erneur de la boite du purgatoire » était ainsi nommé de ce qu'il avait l'administration de la « boîte du purgatoire Il ou des trépassés, caisse destinée à recevoir les offrandes qui servaient à entretenir la(...)",trépassés
1914,en 1790 la Fabrique recevait pour les Trépassés quatre paires et demie de sept jours simples,trépassés
1897,"Leur gloutonnerie est telle, que nonseulement ils dévorent ceux de leurs semblables qui ont trépassé, mais qu'ils s'attaquent aussi, — du moins en captivité(...)",trépassé
1888,4 V. I V TOUSSAINT ✓ 2 S TRÉPASSÉ» v 3 I) S. Hubert / 4 I. S. Charles \ 5 M SV berillte /GM S,trépassé
1923,manqiicnl qu’à Bal) el-Mrisa 11e sont jamais (pic très faiblement ou trépassés. Sauf à Chella. leur brisure n’est jamais forte,trépassés
1893,Les Trépassés,trépassés
1853,"Vous croyez peut-être que la marquise va se jeter aux pieds de ce père qu'elle a privé de son fils, lai avouer ce repentir, cet amour vengeurs qui se sont emparés de son âme et pleurer avec lui sur le cher trépassé",trépassé
