year,sentence,key_word
1932,"érivèrent à r’tirer 1’ soûler dul grand Louis (qui chausso dul 47 et d’mé coume pointure, pie nus; inco, lo dimaches, avo do chaussottes, Lato in pô gêné(...)Coume lé Nanette n’atômc ine bête, elle v’iet roieter da L soûler drô dul Louis : elle retrousset sé minchotte, y l’ourret sé grande main sochc, r’tirei d’abord dul soûler do bouts d’boù(...)",soûler
1904,"Usine a Gaz : «avenue de la Gare, 29 Comptoir National d'Escompte : succursale, «allée d'Etignv, 28 correspondant M e Ro.- bcrl, huissier, me Soulér(...)M’ Robert, rue Soulér.at — M - R. Mengardon, rue Azémar, 6 Recette des Douanes : avenue du Portillon Recette Buraliste: avenue Carnot, 23 Recette Municipale : M",soulér
1940,0) N 23 ( 2 FEVRIER 1940 6 NE JETEZ PAS CE HOURNAL - FAITES IE CI SOULER 2 D E LA(...),souler
1941,"i t""~ çants, Employés, Artisans -,Èri^3.tvos mains quT est l'arme de Ll -., z.: vrance , c'est soûler ent par Votre",soûler
1904,"nouveau client, de chaque nouvelle cliente, car, bien entendu, le sexe faible sera admis à l'égal du fort et l'on compte même lui réservor, dans la vaste salle, un compartiment spécial dit: compartiment des dames soûles(...)Pour vous soûler, vous faut des noces, Des orgi's, tandis qu'moi, tas d'rosses, J(...)",soûles
1898,"D'abord, il faudra les soûler(...)",soûler
1925,Imenl à craindre que ies eaux soûler- di raines qui alimentent-la ville eu soient & tarie(...),soûler
1898,"s'amuser, que la joie de boire et de se soûler",soûler
1900,"sè.rai grand, pour pouvoir'jine soûler comm' papa(...)",soûler
1889,"SOUSCRIPTION ., pour soutenir la candidature - legislative du citoyen Charles SOULER Y, pn^nilih par les groupes cacrierx et fax soein(...)SIXIÈME LISTJÎ 1 1 1 , Report. *0 7U 10 Un ancien patron de Souler)"". , , , 4 50 Liste(...)",souler
1889,"Vous répondrez à notre appel et, le 22 septembre, vous déposerez dans l'urne le nom d'un des nôtres, vous voterez pour le citoyen Charles SOULER Y, et vous contribuerez ainsi au(...)",souler
1870,"Ma parole d’honneur, c’est à dégoûter de se soûler à la tête do son bataillon",soûler
1902,IN VINO VERITAS Dessin de DAUMIER. — Jamais on ne peut se soûler avec du vin à quinze francs la bouteille... — T’en sais rien,soûler
1929,"27 )) IIervy (Pierre) Canal, soûler(...)Canal, soûler",soûler
1831,"Vous « meublez et remplissez vos maisons pour fournir à ses « voleries : vous nourrissez vos filles , afin qu'il ait de qu o « souler sa luxure : vous nourrissez vos enfans , afin qu'il « les mène pour le mieux en ses guerres , à la boucherie, « qu'il les fasse les ministres de ses convoitises , les exé« cuteurs de ses vengeances",souler
1908,"savonner les cordes pour qu'elles enserrent bien les cous, et ensuite à bien se soûler du poison que leur vendent ces mêmes gens instruits de la classe dirigeante, afin d'oublier aussi vite et aussi complètement que possible leur âme et leur quaîité d'hommes",soûler
1884,"Elle se tourna, elle aperçut l'alambic, la machine à soûler, fonctionnant sous le vitrage de l'étroite cour, avec la trépidation profonde de sa cuisine d'enfer",soûler
1884,"Et elle jetait des regards obliques sur la machine à soûler, derrière elle",soûler
1906,"Dem i-Pension naires Les demi-pensionnaires sont reçus à l'école tous les jours, jeudis compris, depuis 8 heures le matin jusqu'à 7 heures le soir, ils y reçoivont le repas de midi et le Soûler de quatro heures",soûler
1822,"l'article finit par un couplet dégoûtant, dont voici la pointe : Il écrit pour se souler, il se soule pour écrire",souler
1918,pression : nous aV° l américain et du punch kirsch — de quoi soûler tout(...),soûler
1872,On la loue (rien de l'éloge) pour la faire'soùler et la voir soûle,soùler
1907,"LE COMPÈRE MATHIEU PAR L'Abbé DULAURENS ( Siiiti: ) « Comme mon père n'est point de ces gens à contredire, qu'il est vif, emporté, hargneux, bourru, ivrogne, orgueilleux, tracassier, absolu, tel en un mot, que la plupart de ces gentilshommes sans éducation, qui n'ont d'autres qualités que celles de jurer, chasser, se soûler, plaider, estropier leurs valets, battre(...)",soûler
1992,"Tout ce que je voulais, c’était aller à ces soirées pour me soûler ou me droguer",soûler
1929,"ange, Sultane du trottoir, ramassant dans la fange L'argent qui doit soûler ton rude compagnon",soûler
1884,"Moi, pour me soûler, ça-me coûte au moins vingt francs. * * — Prévenu JeanGigoux, vous êtes en état de vagabondage. — Moi, je suis de l'état de fumiste",soûler
1892,"Si j'aime à me soûler, je sais courber l'échiné(...)",soûler
1895,"On n’empêche pas, malgré tous les sermons, les ivrognes de boire et de se soûler au besoin avec le plus pernicieux des alcools : l’eau-de-vie de pomme de terre, l’alcool an nytique(...)Qu’ils con tinuent donc à leur aise à se soûler avec la quinine et grand bien leur tasse(...)",soûler
1917,i 1 il i Soûler(...),soûler
1933,"Soûler, SI Orner(...)",soûler
1898,"Double. suicide. — Gaston Mullier, sous-officier au 13« d'artillerie, àVincennes. s'est suicidé avec sa maîtresse, Marguerite Soûler(...)",soûler
1898,"mpnd et par le pointeur, un sale type, ca- ( * bâretier à la Croix-Rouge, qui est véritablement terrible à l'égard de ceux qui n e vont chez lui se soûler",soûler
1898,"Croix-Rouge, qui est véritablement terrible a l'égard de ceux qui ne vont chez lui se soûler",soûler
1909,"et je vous ai déjà dit qu’on devenait alcoolique, sans jamais se soûler, mais seulement en absorbant chaque jour deux ou trois petits verres de calvados ou de cognac(...)",soûler
1931,"rancG de 1 r Est■ f (d(-nt,-&ulhouse) du 7/8 : ”Los Allemands voudraient faire crpiro que soûler la crise «économique ot la charge dos réparations sont la causa d© leur malheur* Tel n’ost pas la oasjla responsabilité do l’Allemagne est trop manifesta, A aucun moment collo-ci ne s’ost donné la peine d'adapter son économie aux obligations résultant pour elle du Traité do Paix",soûler
1887,"quoique j'eii meure, Soûler ma lèvre du baiser(...)veux encor, quoique j'en meure, Soûler ma lèvre du baiser",soûler
1896,"l'une revue, réunissant la lâs oiTi'ciôrs pour leur conseiller de se "" soûler en cachette et de cuver leur vin ti sous la laide(...)",soûler
1896,"Voyez-vous, chez nous, ,1e ministre de la Guerre ou le Président de la Ré- I publique, à la suite d'une revue, réunissant les officiers pour leur conseiller de se soûler en cachette et de cuver leur vin sous la lable",soûler
1908,"c'est bon pour vous autres, oui 1... que tout ça que vous gagnez c’est rien que pour vous soûler la gueule",soûler
1893,"Vins, traiteur, G bis, Fourcroy Souler Frutcl Brossct, 21 -, b",souler
1907,avant de vous souler comme voL'père(...),souler
1837,Roger-Dubos Melun ( 0 Bournet-Ver- Meaux Bachellery Monret Melun ron Provins Henry _ SEINE~ET- Soûler^ Constats Mes Chevallier Cavaro^ OISE Etàmpês Flamand Michel (Frenoy) Campes Hernoux Bruslé Versailles(...),soûler
1910,"Un grand NIMES-CINEMA Place d’Assas \ sous le litre, mes moyens me per mettaient de me soûler tous les jours, maintenant qu’il vaut cinquante centimes je ne puis me cui-ter qu’un jour et l'autre non",soûler
1847,"on ne trouve pas toujours des assassins sur sa route, et j'aurai le plaisir de me soûler cent fois sans rencontrer un malheureux que mon état d'ivresse m'empêchera de sauver(...)Au troisième acte, il. se soûle encore",soûler
1892,"on s’embête quand qu’c’est qu’on vit tout seul, et un’femme. malgré qu’bien souvent c’est assommant comme tout, c’est encore plus agréable qu’la société des copains qui pensent qu’à s’soùler ou bien qu’à aller dans les maisons",soùler
1892,"VieÜt d'oumbro lou souler E de nivous l'esclayre, Vieüt d'oumbro lou souler E d'ounour lou ploser. e Jonument de Jarbot Comme nous l'avons annoncé, un Comité vient de se fonder à Paris, pour ériger, à Beaulieu, un monument à la mémoire du général baron de Marbot",souler
1868,prendre à tâche de lui inspirer la plus grande répulsion et ne songea qu’à se soûler,soûler
1868,"Chaque voyou cherche sa femme, l’embrasse et va se soûler chez le mastroquet voisin",soûler
1892,Signe caractéristique : Nine Mousson aime se soûler avec du champagne,soûler
1898,"Il a soûlé un navet, des serins, des pommes de terre, des sangsues, du blé, des chevaux, etc. etc., parce que toutes ces formes ont un élément commun : l'eau(...)J'ai parlé tout-à-l'heure que l'on pouvait soûler les oignons, les navets et les carottes",soûlé
1929,"par mille petits canaux souler»_ rains, une partie notable de celte som■e me, certainement supérieure au vingt(...)",souler
1926,"mon lieutenant, y a Chaussagne qu'a sa soûlé comme trois cochons(...)annoncer une fantaisie sur Faust, où il y a l'air de Méphisto, et la resottise plus grande encore de n'avoir pas fait mettre à la boite depuis ce matin, mon soliste Chaussagne, qui en a profité, le chameau pour se soûler comme dix mille cochons Il est au poste, maintenant, occupé à cuver sa cuite",soûlé
1892,"au marié, lé faire soûler tous deux(...)Mais v’ia t’y pas qui s’apercevircnt qu’on v’iait lé faire soûler, et alors tout ce que n’on leu vidait, y zou fouliant souque(...)",soûler
1909,"ce, prêts à soûler dans une voilure toujoursattelée(...)",soûler
1896,"Sans alcool nous allons nous trouver en face d'électeurs sérieux, qui liront les journaux au lieu de se soûler au cabaret, qui exigeron t, pour leur donner leurs voix, des hommes capables, honnêtes, vraiment soucieux du bien public, qui leur demanderont compte de leur mandat, qui voudront des r-aisons et non plus des bouteilles 1 Franchement ce sera insupportable",soûler
1897,"Ce n’est pas assez, il faut se soûler de ses phrases, les mâcher comme du bétel, les assimiler a notre pauvre corps et en faire tout notre nous-mème(...)Jules Claretie, tout en manifestant le respect qu’on doit à un grand écrivain étranger, ne va pas, bien entendu, jusqu’à « se soûler des phrases » du prophète, et son impression(...)",soûler
1929,"Exotiques j COMMERCIALE des VINS 137, Bd loeîgchamp, MARSEILLE forfait - commission TUBES pour arrosage —ia PIQUETS pour Vignes et Clôtures TOLES ondulées occasion, la feuille 6 francs REB0UL GAUCH0N & C"" loi, soûler",soûler
1935,"Où qu'y sont t'y ceux temps anciens, Quand j'nous bijions darrié les meules Pendant qu' ton pé fasait des liens Au soulé qu' flambait les éteules(...)soulé, soleil",soulé
1935,t'oblige à te soûler(...)Tu te soûles avec Verlaine(...),soûler
1880,"Voici un passage de la nouvelle Marseillaise blandhe que les Charette et les La ROehêjacquelèin font chanlef à ces brutes, qui appartiennent corps et âme à qui les fait soûler : Unis au feu comme à la table, Nous combattrons et nous boirons",soûler
1883,"Il avait un rire de poulie mal graissée, hochant la tète, les yeux attendris, fixés sur la machine à soûler",soûler
1892,"Pour M. Sciimuriikr, Soûler",soûler
1820,"40 Une- promesse sous seing-privé par laquelle ils »Wa«entà soûler la pension de leur fils , par trimestre «t tfavance, dans'la caisse du receveur d’arrondissement ou dans la caisse de L’école , et de fournir le trousseau ou d’en payer la valeur en argent",soûler
1938,"1936 et 27 oct. 1:'936, relatifs à 'appUcation de la toi du 21 juin 1936 sur ta semaine de quarante Heures respectivement dans les mines soûler- raines de charbon et darls les services du jour des mines de charbon",soûler
1915,"Il me semble que tant qu'on peut tuer. on peut aussi boire, et ce serait plus moral, à mon avis, de soûler les hommes avant une bataille pour qu'ils tuent sans savoir ce qu'ils font, plutôt que de les obliger à faire cette affreuse besogne de sang-froid",soûler
1886,"gouvernement de se soûler, de marauder dans les jardins conservateurs, de prendre au collet les lièvres réactionnaires(...)",soûler
1934,Je vais me soûler(...)Les gard » passaient leur temps à se soûler,soûler
1851,"Un des plus goûtes est de soûler une fille jusqu'à » ce qu'elle tombe moitié ivre: alors on lui fait » ava er du vinaigre, dans lequel de la moutarde et » du poivre ont été délayés(...)",soûler
1894,"Souler, Jean, Ecolo d'Héliopolis",souler
1892,Voulez-vous soûler vos yeux,soûler
1914,"Souler, tu que dal cial veses ma meijolmeta Dija me se fuma toujours(...)0 souler fas luzir lous urols dinz l'essieta(...)",souler
1901,"Mes amis, soulez-vous — telle a toujours cté la morale de l’animal en général et du singe, gorille, macaque, -chimpazé, orang- outang ou autre en particulier(...)Et les petits se sont soûlés comme des grives(...)Et les pères de famille, pour ne pas s’exposer aux tracasseries administratives du maire Laurent continueront à envoyer leurs enfants dans cotte école de malheur où l’instituteur enseigne aux entants que leurs parents sont de vieux singes et où, en guise de récréation, ces petits malheureux s(...)",soulez
1888,"On les a persuadés que c'était œuvre pie, agréable à Dieu et aux hommes, de débarrasser la terre des turbulents qui réclament le prix de leur peine, et c'est avec une férocité digne des temps barbares qu'ils se précipitent contre les misérables hè- res qui suent douze et quinze heures par jour pour nourrir engraisser et soûler de toutes les jouissances les maîtres, les seigneurs(...)",soûler
1910,"François Riéger, fis de Charles Rieger et de Louise Schwunke. — Marie Soulier, fille de Barthélemy Soûler et de Marie Gevmet. — Jean-Edouard Duroux, fils de Jacques Duroux et de Emma Schneider",soûler
1916,"Lorsque ce navire de guerre avait voulu soûler, à coups d’obus, le sous-marin anglais qui venait d’apparaître à la surface, ^explosion immédiate du projectile avait anéanti l’équipage allemand et fait sombrer & contre-torpilleur pour(...)",soûler
1937,"La route reliant les cols d'Aubisque et du Soûler, au cirque du Litar, vient d'être Midi-Camping et le Bulletin Officiel coupée par un éboulement",soûler
1898,"Je vais me soûler. sacré destin, va",soûler
1918,"De plus, deux soldats américains s’exhiberont dans le même sports : Chick Soûler et Bob Evans(...)",soûler
1918,"de jaile Edouard SOULE ëçp-£é£ ( 4 ,Rue Deville.TOULOUSE - PRIX FIXE Maison cfEdition LABOUCHE Frères Graveurs-Imprimeurs — / 0 et / / , Arcades du Ç apitoie — TOULOUSE Libr airie Militaire et Touristique",soule
1899,"suivantes : « Digne enfant de nos œuvres soûler- » raines, tu as éprouvé des malheurs » chez toi, — parce que tu étais trop » connu, — mais conserve bon espoir",soûler
1882,"Je trouve qu’un prêtre a le droit de priser comme un simple mortel, de se soûler en cabinet particulier comme vous et moi, dès l’instant qu’il ne se montre pas sur la voie publique en état manifeste d’ivresse",soûler
1882,"quoique très-coulant à l'endroit de la , virginité de ses filles, elles avisèrent de le soûler pour lui faire oublier ses scru-pules",soûler
1889,"soûler comme une grive, on de lâcher les chi ns a ses i rousses s’il lai-ail du bruit, i Le sous-pi< fel, M e de Folhmpré et : deux ou trois des membres les plusémi(...)",soûler
1901,"Gompto rondu, par M- G. Soûler, de la r(Wn. exposition de « L'Art dans tout » (17 rcI)ro(lllctiolls(...)",soûler
1876,"C'est un agent de police. — Allons donc 1 Vous ne vous êtes donc pas aperçu qu'il n'a bu que du punch, et que mon punch-ne peut pas soûler un homme en cinq minutes",soûler
1907,"Moyennant cinq dollars, les citoyens de cet heureux département de l'Union ont le droit imprescriptible de se soûler, à gogo, pendant un an",soûler
1946,"nos a mises d’Ouiins ont offert un fceaiu soûler à 250 enfants BEAUREPAIRE. — Nous avons dernièrement secouru un malade en sama, ainsi que sa famille- Nous payons partiellement une pension à un malade du Comité de Vieux pour un séjour à là campagne",soûler
1911,de ce pauvre peuple qui se croit libre parce qu’il a la liberté de se soûler et de s’abrutir et que le vice et le préjugé enchainent aussi solidement que le feraient des liens de fer,soûler
1865,"Des flots qu'il en fait couler Alimentant son délire, Il écrit pour se soûler, Et se soûle pour écrire. — Un personnage éminent de l'Empire, collègue et ami du premier consul, à qui le Code civil doit ses sages et judicieux travaux de jurisconsulte, ne trouva pas grâce auprès de la Restauration, et perdit son emploi d'archichancelier",soûler
1890,"Soûler Francisco, rent., Reüss, H. de France",soûler
1908,"Et pis, y pourrait s’soûler avec, ça y abîmerait I’tempérament. i. —Crapouilloï. — Attention, j’crôis qui c’particulier qu’est derrière moi veut s’envoyer mon litron",soûler
1880,"mais le dictionnaire de l'Académie écrit soûl, soûler, et on ne saurait mieux faire que de l'imiter",soûler
1895,Soûler.croit que le chloroforme et l'essence de térébenthine agissent surtouten déterminant un afflux sanguin plus considérable dans les parties recouvertes par la pommade et que l'acide salicylique agit surtout sur les cellules cornées en fondant(...),soûler
1901,"c’est de l’espagnol, je sais bien, mais l’Italie peut en user et la France le comprend.) Quoiqu’il en soit le mari de la balia peut se soûler à son aise",soûler
1875,"Lentripé est absolument persuadé qu’il doit tou à son mérite, que tous les travailleurs sobres, consciencieux et honnêtes pourraient devenir millionnaires s’ils n’allaie^ pas se soûler le samedi au cabaret, et que tout est pour - mieux dans le meillenr des états où la journée de l’ouvrie^ est de cinq francs par jour, quel que soit le nombre des eu fants qu’il a à nourrir",soûler
1871,"GoVon, caporal Soûler, garde",soûler
1901,"Comme lus deux eaux sont de i qualité identique, car il est indiscu- tri I table qu'elles appartiennent toutes eu deux à la même nappe d'eau soûler- cii - raine, il esl dans l'intérêt des finan- cl e ces communales, de choisir l'eau de ré la pile 13, mais en soumettant son à examen bactériologique à l'apprécia- dt - lion de M",soûler
1903,Si c’est permis de ® soûler comme ça,soûler
1871,"il» ne cessèrent pendant ce» dix jour# de me tourmenter et enfin d’arriver a soûler le» hommes de ma compagnie pour qu'il» nomment un autre capitaine, ce qui sc fit, et je passai» sergent-major dan» 1A même compagnie, mon sergent-major étant passé capitaine à ma place(...)soûler tonte la jouraec ciiez les marchands de vins, d'abord parce que je n'avais que ma petite solde de 1 fr",soûler
1893,entrer au cabaret voisin et s'y soûler jusqu'à la nuit venue,soûler
1930,"I Demander le nouueau Catalogue Illustre g Pour réparer, coller, soûler la faïence, la porcelaine, la terre cuite, la verrerie le marbre, l'ivoire, les objets d'art, etc",soûler
1815,"cherchent à soûler encore les nations de d’Allemagne et du Nord , dans l’espoir de rentrer une seconde fois par la force des armes sur un sol qui les désavoue et ne veut plus les recevoir",soûler
1876,"la seconde complètement soûle, une fille maigre, longue, disloquée, dont la figure terreuse semble suer du plomb",soûle
1876,"ça finira de me soûler, et je ne sentirai plus rien",soûler
1943,"plongèrent leur fin museau, lampant à se soûler",soûler
1943,Mauléon-Soule. — Hôtel Saubidet,soule
1881,"quand même nos hommes s’amuseriont aux courses de crabes, ça les empêcherait pas de ce soûler, pisque Malhurine a vu les beaux messieurs qu’étions autour du prince, et le prince itou, boire tretous des tas de chopines qu’on leu zapporlail sur des belles petites planches d’argent",soûler
1848,Le roi continue de se soûler et de faire des bravades,soûler
1898,"Donne à boire, toi, Louis, donne à boire tout plein, je veux me soûler chiquement, oui, je veux me soûler",soûler
1837,"Je ne ferai pas ici la -description de cette caverne merveilleuse, du gouffre effroyable qui sous la forme d’un puits s’ouvre sous vos pieds à trois ou quatre cents pas de l’eutrée , et laisse entendre le'bruit des eaux soûler- raines qui traversent ses profondeurs",soûler
1887,"Gymnase Soûler, fondé en 1866, Nice",soûler
1895,"Je te dis que je veux . cinq mille francs, et je les aurai, tu me les donneras quand même. ■ Cet entêtement tranquille irrita Thérèse et acheva de la soûler",soûler
1840,de sc soûler,soûler
1887,"prend contre moi des airs bien résolus, Je m'écrie aussitôt, d'une voix bien piètre : Pardonnez moi, monsieur, je ne le ferai plus 1 Si j'aime à me soûler, je sais courber l'échiné",soûler
1923,"recours aux eaux provenant des sources cor qui représentent le produit d'épanché- p0< ment des couches aquifères soûler- j qu raines,'alimentées par les pluies dans j SOi les conditions suivantes : des eaux nié- I d'à téoriques qui tombent à la' surface du de sol dont une partie s'écoule en ruissel(...)",soûler
1920,eU de lin prussien à Cologne il n' y a Pas lieu de lem cas. énaJl coli' I/immense majorité du peple drbce que d *e ce tinuera son chemin sans se sOuler êes apôtreJ émissaires prussiens ont à dire,souler
1851,"c’est d'habiller à neuf quelques gredins eu guenilles, el de soûler la canaille",soûler
1906,"dite civilisée, continue de soûler dans ce cercle de sang et de feu",soûler
1871,Fen électrique sur la pointe Soûler (côte Est d’Angleterre(...),soûler
1892,soûler » le gamin... oh(...),soûler
1930,"voici la comtesse de Valois, que chacun regardait sans pouvoir se « souler » de 1 admirer et de contempler ce corps « gens, jone et mollez » si bien recouvert d'un drap de soie(...)",souler
1871,Soûler,soûler
1922,"APPEL AUX PA YSANS Per louïs éfon8 dé Russie Lou soûler d’obrièou roubeillo dé aplondour, Din l’aïguo dé loï fouonds bagno soun disqué(...)",soûler
1911,"Il faut en outre que le commun dant du territoire ait la haute uiaiu sur sa routa de ravitaillement, c'est-A dire sur les débouchés de la Renoué Je compte beaucoup utiliser celte voie et pas soule- inent pour les besoins des troupes ou de l'administration",soule
1911,"Admettons un accident : la commune, étant civilement responsable, se verrait obligée de verser au père de l'enfant blessé uno Indemnité bien supérieure à ce que peut soûler la modeste amélioration que nous indiquons(...)",soûler
1895,"Ils vont, pour se soûler des batailles lointaines, Où les guerriers vaincus tomberont par centaines, Où l’odeur du carnage enivrera les cœurs(...)",soûler
1892,"Délicatesse et idéalisme qui, d'ailleurs, n'empêchaient pas Olibrius de se soûler tous les iours et de consacrer toutes ses nuits à réhabiliter les chevalières du trottoir",soûler
1887,"Pon- dam que ma fille souffre, qu’elle pleure, l’oublier, me soûler comme autrefois",soûler
1899,"Il peul, à son gré, l'aire «jaillir la flamme élincelanle, il peul lancer à la l'ois, « el lit neige à l'aile blanche, el les foudres souler« raines, il peut confondre cl bouleverser l'univers, « rien ne me déchira(...)",souler
1886,bien vous en a pris de soûler le coquin,soûler
1919,"Mais, patience, il aura sa revanche : si l'on veut l'ordre dans la rue et ia baisse de la criminalité il faut laisser les hommes se soûler",soûler
1885,"Le rapport dont les conclusions furent adoptées établissait que le champ Brouea, approprié pour-un marché au bétail, ne soûler ait que 11,800 de plus que le Orand Tour te fut sur(...)",soûler
1902,"L'1MMEUBLE: ET LA CONSTRUCTION DANS L'EST - 133 sommes parvenus à creuser un soûler- ' rain long de 12 mètres, haut de Om",soûler
1932,"1 De sévères secousses sismiques, accompagnées de grondements souler°jTr~ rai ns, furent ressenties pendant trente secondes dans la région industrielente(...)",souler
1980,"Celui-là est décidé à voir du surnaturel, et à s'en soûler",soûler
1915,Vous n’ pensez qu’à vous soûler,soûler
1901,"ils n’auraient rien balayé du tout, ils seraient venus se soûler avec leurs petits-fils et ils auraient trouvé que l'armée française depuis leur temps n’avait pas dégénéré",soûler
1934,"ayant mis en demeure de rembourser, tout en avisant le bureau des aiiaires indigènes, le cheikh tenta de soûler une partie de la tribu contre son caïd",soûler
1925,"Interrogé, il reconnut avoir reçu la somme et l'avoir perdu aux car- Les sauf dix sous qu'il réservait pour se. souler",souler
1927,"urij On saura la vérité, On passe l'interrogatoire de Soûler(...)Mais- Soûler, insistait(...)Si Soûler en a vu",soûler
1907,"Au mois de juillet 1902. encore en panama et en soûler s — Difes, mossieu Partisse(...)",soûler
1841,sc soûler comme un portefaix(...),soûler
1886,"De plus, vous avez fai L votre possible pour le faire soûler, vous l’avez suivi toute la soirée du 15 et aussitôt que vous le perdiez de vue, vous demandiez où il était",soûler
1916,"Il vient de partir pour Laybach, d'où il se rendra au front. rière jusqu'en ses fonds les plus souler rains",souler
1851,"Louis Bonaparte voulut avoir et qu’il eut, en effet, en arrivant, le 2fi septembre 1848, à Paris, ce fut avec M. ProutThnn Avec M. Prmullion, qu’on laisse aujourd'hui pourrir au fond d'un cachot soûler-rain, dans ta prison de la Conciergerie, pour avoir osé soutenir celle audacieuse proposition : Le président de la république est responsable, dont il est diseubilile",soûler
