year,sentence,key_word
1961,"En 1140 ou 1141, Guillaume Bordel de Conas, dont le testament ne devait être publié qu'en 1147, prévoit la réversion de l'héritage sur(...)bienfaiteurs (nommément Bernard de Roujan et Marie Bordel), de sorte que ses dernières volontés revêtent encore une double forme : donation pro anima d'une part, disposition testamentaire et universelle d'autre part",bordel
1961,"Nous avons relevé l'activité du scribe Adam, rédacteur de plusieurs chartes testamentaires parce qu'à deux reprises, en 1147, lors de la publication des testaments de Guillaume Bordel et de Bernard de Roujan, il fait déjà fonction de notaire",bordel
1961,"Ainsi le testament de Guillaume Bordel de Conas (1140 ou 1141) ne fut publié qu'en 1147, ce qui pourrait indiquer une assez longue survie à l'acte dispositif",bordel
1961,Exercice du droit et fonctions sociales du testament de l'acte du testateur des biens 1140 ou Guillaume Bordel T. Charte Disposition univ,bordel
1887,"10 — de Bosc-Bordel, tenue par M. Bourgois",bordel
1887,30 » — Bosc-Bordel 30 » — Bosc-Roger-sur-Buchy,bordel
2004,"La décision sera confirmée un an plus tard par une délibération du Consulat signée de l'un de ses Consuls, BONAPARTE : ""La métairie provenant de l'émigré BORDEL située à St Laurent de la Salanque et celle de l'émigré COLL, sise à Perpignan, sont mises à la disposition du Ministre de l'Intérieur à l'effet d'y établir une Bergerie(...)",bordel
1924,"Welch, directeur de l'Ecole d'Hygiène et de santé publiques à Baltimore: Iules J.-B. Bordel, professeur à l'Université de Bruxelles",bordel
1938,"Lueillt dans les « histoires bordel '""h vient de publier Gustave Counouilhou'^ Depuis un an, M. Biraudaud a assort à ses affaires",bordel
1962,"Si cette remarque était valable pour le Bordel nous pouvons dire que les religieuses de Prouillan et celles de r tevrault avaient, au contraire, des dispositions pour l'agrieultt, si l'on en juge par l'importance de leurs propriétés",bordel
1850,"si le capitaine offre soit de transborder à ses frais les marchandises de l'affréteur sur un navire en partance pour le lieu où celui-ci a entendu les expédier, soit de lés conserver à son bordel les transporter au port de destination de son navire, pour delà, les faire rendrez ses frais au lieu où elles doivent arriver, et en se chargeant, dans tous les cas , de l'augmentation de prime de l'assurance de ces mêmes marchandises, s'il y a lieu, une telle offre est satisfactoire",bordel
1922,"Bottard, à Versailles (22 février). — Roux (L.-E.-.ï.), au Sud-Algérien (6 mars). ■ Radiations : MM. Morel, — Bordel, retraités",bordel
1922,"6 avril). :■ Nomination : M: Bordel, retraité, à la 14e région (21 février(...)",bordel
1852,"Nel bordel farei garrir Sol tra pazzi, e disperati Lasciereigli ancor piatir",bordel
1936,"Causerie par M. l'abbè Bordel, aumônier général adjoint de la J.O.C. : Que votre volonté soit faite(...)",bordel
1896,"Stupre, fornication, incongruités ou malséances plus émétiques à voir que ces Panathénées du bordel 1 Quoi de plus sinistre qu’un tel(...)",bordel
1908,"8 Bordel Jean, concierge(...)Bordel,e.Cie Electrique",bordel
1908,"Epieiers-merc. : Berlholon, Bounier(V), Bordel, Ecuyer, Joannon, Fabre, Maillard, Roche, Bourrin, Baronnier, (Charroi, Thivilior. EUiblisscmenls du Casino. Docks Foreziens, Alimentation stéphanoise. Fers el quincaillerie : (Vve) Vaehon, Murigneux",bordel
1908,"Bordel, Dégoulange",bordel
1908,"Bordel, vciyag.com., av(...)Bordel, e",bordel
1908,5 Bordel (Vve(...),bordel
1908,"7 Bordel, voyageur coin",bordel
1908,"56 Bordel, tailleur habits",bordel
1930,"33, quai de Queriès, S""c'été BOrdel ise de Maté- nel et Produiis Coloniaux(...)",bordel
1989,Par contre un bordel des États-Unis a des actions en bourse,bordel
1877,"Cet éminent et regrettable archéologue, à qui la France et surtout la Normandie doivent de précieuses découvertes et d'excellents travaux a publié en 1871, à propos du porche de Bosc-Bordel, dont il a obtenu le classement comme monument historique une notice très-intéressante sur les porches des églises de la Seine-Inférieure (2(...)",bordel
1940,"Bordel (Jean), 19-8-11, Monlalieu-Vercieu, 2° cl., 29° R. I. . .'""""■.' Bordereau (Fernand), 5-12-09",bordel
1864,"VII LES ENFANTINES A la Naissance d'un Enfanl Jules Pautel 219 La Prière d'un Enfant à Alarie Sabin Aressy 221 Hymne du Réveil M""""= Antoinette Bordel 223 Un Berceau Louis de Cgurmont 224 Enfantine Eugène Boisset 228 La Requête du Troubadour Louise Michel",bordel
1921,250 137 387 XII. _ Prises de sang pour réaction de Bordel- Wassermann,bordel
1858,"que Bordel, locataire d'une partie 1 de l'auberge de la femme Marais, ayant payé r ses loyers à Leroy qui les avait saisis dans ses r mains, a formé opposition aux poursuites de la Sl veuve Ricot, qui lui demandait le paiement de Sl _ ces mêmes loyers comme étant aux droits des a époux Marais, par suite du bail général de l'àue berge que ceux-ci leur avaient consenti le 2 t déc(...)Bordel aux poursuites de la dame veuve Ricot \ sera déclarée à bon droit",bordel
1858,"Mais le sieur Bordel ayant: été laissé dans les lieux loués par les époux Marais, il s'opéra entre lui et la dame veuve Ricot, à laquelle l'auberge fut louée dans son entier par les époux Marais par bail sous seing privé du 2 décembre 1854, une tacite réconduction(...)que Bordel a résisté, et que sur les poursuites exercées contre lui par la veuve Ricot, il a mis en cause Leroy afin de le faire condamner à restituer les sommes qu'il lui avait payées, ou au moins à le garantir des condamnations(...)",bordel
1858,1131 Bordel,bordel
1894,"3,5.7,9.11 à BORDEAUX Engrais chimiques A organiques composés p r t"" cultures rBODCITS CHDDQCIS AGRICOLE SIR TITRES GARiYTlS ANTICRYPTOGAMiQUES ET INSECTICIDES Poudre Brun p* II préparation iostanlanée de la Bouillie bordel(...)",bordel
1888,"Castilli, Mallarmé, Huré (Ach.), Jouyne (H.), Charpentier, deSamboeuf, Amar, Blasselle, Lalour, Ncugass , Dessoliers, Broussais, Vandier, Probst, Tilloy, Jcnoudet, Dam, Parizot, Taconis, Parissot, Bordel, Poivre, Darmon",bordel
1888,Bordel (Alfred(...)Bordel,bordel
1888,Bordel,bordel
1888,"4S86, Fermé fils. i ■GAUTIER fils, à Nanterre.—1818, Bordel. —4828, Gau- j tier. — 4838, Gautier fils. i DEHERPE, à Colombes.—4823, Tirlet. — 4834, Mené- i lolte",bordel
1857,"1 825 Bonté-Barbe, 1 56 Bordel",bordel
1857,"Cod. Nap., art. 1167.) (Ricot — C. Leroy et Bordel.) 16 fév. 1856, jugement du trib. d'Evreux qui le décide ainsi(...)que pour justifier son opposition, Bordel a appelé dans la cause Leroy, afin qu'il discutât la validité du paiement fait en ses mains(...)",bordel
1857,"Mais le sieur Bordel ayant été laissé dans les lieux loués par les époux Marais, il s'opéra entre lui et la dame veuve Ricot, à laquelle l'auberge fut louée dans son entier par les époux Marais par bail sous seing(...)que Bordel a résisté, et que sur les poursuites exercées contre lui par la veuve Ricot, il a mis en cause Leroy afin de le faire comdamner à restituer les sommes qu'il lui avait payées, ou au moins à le garantir des condamnations qui pourraient être prononcées contre lui",bordel
1979,"Donc le droit des femmes sur leur corps, le droit à ne pas être considérées perpétuellement comme objet de violence sexuelle, objet à consommer, objet au coin d'une rue, ou au bordel municipal comme le voudrait Joël Le Tac, est loin d'être reconnu",bordel
1879,"Bordel, archipresbitero, et Aimonio de Barmont 5 et Amlardo de Chasluzh",bordel
1935,"Auzouville-VEsneval (blé), Auzouville-sur-Ry, Beauvoir-en- Lyons, Bellozanne, Bénesville, Bennetot, Bierville, Blainville, Blosseville-sur-Mer, Bois - Gautier, Bois - Guilbert, Bois - Hé- roult, Boissay près Buchy, Boissay-sur- Eaulne (blé), Bosc-Asselin, Bosc-Bordel, Bosc-Mesnil, Bosc - Roger - sur - Buchy, Bourville, Brémontier, Briquedalle, Buchy (blé), Bures et Burettes, Butot près Pavilly, Campneuseville, Canville- les - deux - Eglises, Catenay, Catillon, Caule-les-Ventes (La), Chapelle-sur(...)",bordel
1935,"116 680 ou 4 boisseaux de 18 pots 1/16 (A) 131 720 Bosc-Bordel, 4 boisseaux de 16 pots (A(...)",bordel
1935,"32 930 ou 16 pots 29 170 Bosc-Bordel, 16 pots 29 170 Bosc-Geffroy",bordel
1935,"19 250 Bosc-Asselin, 12 septiers de 4 boisseaux ou 48 boisseaux de 18 pots 1/16 (A) 15 806 ou 12 septiers de 4 boisseaux ou 48 boisseaux de 16 pots (A) 14 001 Bosc-Bordel, 12 septiers de 4 boisseaux ou 48 boisseaux(...)",bordel
1913,"SUR LE COMMENCEMENT DU PRoTESTANTISME EN AGENAIS 305 Puyols luy disoit que, ~L l'avanture, quelque jour, il y mettroit dans lad. religion une fille, led. de Godailh, parlant à lad- de Puyols, luy respondit qu'il la mectroit plus toust au bordel, disantque quandil voyoit ung religieux,que lui sernbloit qu'il veoioit quelques foulx, et pour ce que l'on parla de Sainet François, icelluy",bordel
1913,"faisoyent ses biguotes, vúlant dire des religieuses de l'rloe Vlaria, de biens desquelles lad. qui deppouse est procureuse administraresse, auquel respondist ycelle qui deppouse, que tout jours se mocquoyt d'elles et d'icelle qui deppouse et après plusieurs paroulles ledict de Guodailh dict illecques qu'il aymeroit mieulx mectre une safilheau bordel quede la mectre religieuse",bordel
1985,"De l'Oustillement au villain 337 GLOSSAIRE (tiré du Glossaire d'U. Nystrom) Les mots sont traduits dans l'ordre où ils apparaissent dans le texte, où ils sont marqués d'un par vraiment boillon petite bière estorez garni hars osiers assotez traité de sot esracier arracher ensement aussi gaaingnage profit plege caution fesche cordon d'osier a envis à contrecœur sarcel sarcloir regrouce gronde enhanter emmancher bordel et buiron grange, cabane jarce lancette feste poutre ostil outil buire cruche(...)",bordel
1985,"La ferme elle-même, et l'auteur commence très justement par là son énumération, comprend plusieurs édifices qui ont chacun leur fonction6 « Qu'il li covient meson Et bordel et buiron (grange et cabane) En l'un mete son grain(...)",bordel
1850,"Celui qui a incontestablement obtenu les résultats les plus remarquables est Ferdinand Bordel, ex-jardinierde l'hôpital général(...)Ferdinand Bordel appartient à une famille de jardiniers il est fils et frère de ceux qui ont cultivé le vieux poirier dont je parlais en commençant",bordel
1897,"Conversazioni romane, par L. Bordel et L. Ponnelle, bibl, XIII, 319",bordel
1896,Bazoge Bayle brigad. de gend. en retraite id. (Rhône Couzon Bordel -Perroncel receveur bural. de l r ” classe id. id,bordel
1896,Bordel aspirant Mondoloni prép. mob,bordel
1896,"Bordel, Vaucluse. — 123",bordel
1986,"représentait un vaste bordel de luxe : «A la cour on ne parle que de duels, puteries et maquerélages» (41(...)",bordel
1975,Elle a quitté son mari et a fait le ' bordel ' avec un autre type,bordel
1847,"Bordel, rue de Champeaux, 13",bordel
1907,Porche de Bosc-Bordel,bordel
1861,"Chevalier François, notaire à Besson. ' Bordel Jean-Baptiste., propriétaire à Bresnay",bordel
1902,"Nommé (3 octobre) : M. Bordel, dir. de Cherbourg",bordel
1997,"26155 Réunit : ""Bordel 1900"", ""Café 1930(...)",bordel
1936,"une petite excavation intrigua le propriétaire, M. BORDEL",bordel
1925,"Eurostus Bordel Dev. — Découvert en mai, à 1400 m. d'altitude, sur un col encore parsemé de neige(...)",bordel
1913,1 BORDEL M'.hef d'escouade(...)2 BORDEL (Jean) (îendarme. (iendarme. » » >1 » » » » 1 G. R. BORDENAVE (Biben-Phîlippe(...),bordel
1894,"Forgerons : Bordet-Drillien, Bordel-Josserand, Létourneau, Mu- gnier",bordel
1894,"Couvreurs : Bordel fils, Du- noyer, Greby, Jeannot",bordel
1894,Perruquier : Bordel,bordel
1898,"I Bordel aîné (François), anc. dép.. r. .Milli",bordel
1880,Bordel (Simon-Frédéric-Ernest) né le 8 février 1824,bordel
1880,Bordel & 8 février 1824,bordel
1933,Girars Gubins III deniers obole de son vivier et de son bordel,bordel
1933,"Péronne, chef-lieu cant. (3) Bordel ou bordeau signifie petite ferme. (4) Sic. (5) II est probable que ce mot a le sens(...)",bordel
1906,Un graveur anonyme dans une planche conservée à l'Albertine figure une scène de bordel. (*) Bon nombre d'autres gravures erotiques sont décrites par Bartsch et Passavant,bordel
1908,"claire et l'extérieure tout près du bordel anguleuse M- Persela, Mab",bordel
1933,"2° Badigeonner les arbustes à l"" bouillie bordel a i se",bordel
1966,"aide-cuisinier à bord d'un cargo, garçon dans un bordel de l'Arkansas, pensionnaire d'une maison de redressement, débardeur, steward sur un paquebot, gardien de prison et « deputy-sheriff », son apprentissage de la vie est celui d'un jeune aventurier des années vingt",bordel
1902,"lieu dit en Vigne Bordel, appelée la Varcinoz, et ce, moyennant quatre messes par semaine 2° il réserve pour lui, et, après lui, pour Messire Michel Voutier, son neveu, prêtre aussi, le droit de patronage de la dite chapelle et il substitue à ce dernier, après son décès, pour jouir du même droit, les enfants mâles de son autre neveu Voutier Jean-François, fils du dit Jean Voutier peintre, et ensuite les autres enfants des dits enfants par ligne et non par tête",bordel
1923,"Bonv, L. Bouillon, Bordel, Bordères, Borderon, M. de Bordes",bordel
1925,"à l'ex-pupille Bordel Gilberle, qui vient de contracter mariage(...)Décide l'attribution d'une dot de 200 francs à l'ex-pupille Bordel Gilberte, mariée récemment",bordel
1989,"classiques (Les amours de Charlot et Toinette) ou inédits (Le Bordel royal, Le Procès-Verbal de l'Assemblée de fouteurs ou La vie privée etscandaleuse de Marie-Antoinette) (P.P. AA 81, nOs 6064(...)",bordel
1989,"une table en train de lire, semble-t-il sur un pied d'égalité, qui Le despotisme, qui On peut tout dire et tout faire, qui Le Bordel national, La lVlessaline française (« avec gravures ») ou La vie privée de Necker (ib., n° 187(...)",bordel
1989,"actualité sur le mode licencieux (Le Bordel national, Les Travaux d'Hercule), la satire contre-révolutionnaire, visant avant tout les leaders jacobins (La Prise des Annonciades, Le chef des Jacobins aux Français.), satire appelant en réponse le rire patriote anti-nobiliaire (La Chasse aux bêtes puantes) ou anticlérical (La Calotte renversée) et, surtout, les foisonnantes dénonciations individuelles",bordel
1923,"Jolïros, Bordel",bordel
1923,Dess. : M0 Le Bordel,bordel
1915,"Dans le Bessin, c'est Bretteville sur-Bordel(...)",bordel
1887,"fait à Choisy, on a trouvé tout le tour du château garny de placards qui portoient ces mots Bordel Royalle",bordel
2000,"Hennique (L'Affaire du grand 7) décrit ainsi comment une garnison lancée sur de vagues indices dans une expédition punitive en vient, prise de folie meurtrière, à massacrer les filles du bordel de la ville",bordel
1903,"inventaire après décès, compte d'exécution testamentaire, etc. (1754-1767). — Legs de la Marquisière commun entre l'H.-D. et l'hôpital général. — Constitution de rentes, obligations, procédures concernant Jean Bordel, écuyer, sieur de la Marquisière (XVIIe siècle(...)",bordel
1872,Testes: Stephanus Bordel,bordel
1872,"295 — Testes qui videront vel audierunt, quando Goslenus dédit, et Athelinus annuit, fuerunt ii : Stephanus Bordel",bordel
1905,De là le ruisseau de Bordel et les marais avoisinants (formés par les affluents et sous-affluents de la Seulle) constituaient la limite jusqu'aux environs de Monts et de VillyBocage,bordel
1965,qu'il- était entré dans un couvent de religieuses pour y faire comme dans un bordel(...),bordel
1886,Emile Bordel. — 1(...),bordel
1949,"Robert Bordel, voir Les sources inédites",bordel
1935,"Banneton, rapporteur de la Commission des affaires fg ersss expliilue que cede inscrite sous le n° H du bordel'une des pIns imposantes envoyées à la Commission, ^,e encore cn(...)",bordel
1910,"Capitaines : BOREL (E. C. F.) BORDEL-CARTAN (E. F.) g, COUTOU (A. A.) PROMPSAL (E. M. 14 ROY (M. F. P. A.) Lieutenants : ALLÈGRE (J. H. A.), BARRÊME (J. M. J. L.), BUSSERY (J. M.), CANARD (C. J.), CAZILLAC (J-L. E.), CHAIX (J. D.), FAIDIDE (A. M. C ), FOURNEREAU (D. M.), IMBERT (A. M.), LUIGI (C. MANTELIER (A. P.), MERCIER- (L. J. M.), MERLIN (J. E. L. C(...)",bordel
1910,"1 BORDEL (Constant-Cyrille), service géographique, groupe de brigades de sous-officiers,Commercy",bordel
1910,"BORDEL-CARTAN (g), expéditionnaire de 2e classe",bordel
1910,"Bordel-Cartan, 5(...)Bordel-Cartan (E. F.), 138",bordel
1910,"Bordel (P. B. M.), 123(...)Bordel (J. B.), 143(...)Bordel (G. J.), 1244",bordel
1910,"BORDEL, officier d’administr. de 2e cl. du génie",bordel
1864,"et il repoussait, comme n'étant ni pertinentes ni admissibles, les articulations du sieur Bordel, lesquelles ne tendaient qu'à démontrer qu'il n'y avait pas, eu faute de sa part",bordel
1864,"Bordel, 478",bordel
1864,"Le 6 août 1861, le Tribunal civil de Troyes rendit le jugement suivant : « Attendu que Bordel articule(...)pose en fait et offre de prouver les faits suivants : — Premièrement, que le sieur Célestin Bordel, qui habitait les bâtiments incendiés, avait quitté la ferme à cinq heures du matin et n'est revenu à Bercenay qu'à onze heures du soir(...)",bordel
1931,"NATALITÉ ET ACCROISSEMENT DE LA POPULATION 279* l'îlot bordel lis (Gironde, 163(...)",bordel
1883,"nuicts et les jours parmy les femmes qu'on apprend les ordonnances et le droiet romain, mais bien les règles et le droit du bordel",bordel
1883,"parce que tu ne vas plus à l'Église que pour y voir les plus belles, et y faire mille souhaits impudiques, tu diras encore qu'elles sont en un lieu de desbauche, à cause que ton impiété en fait un bordel",bordel
1849,"Bordel-Aniypt, rue Neuve",bordel
1862,"Angleterre, interdisant un bordel situé près de l'église Saint-Merry, et autorisant de le transporter dans la Cour-Robert, aD",bordel
1909,"Les substituts, dans sa manière de Gueulette, Qui, le soir, au bordel, hantent les gigolettes, S'esclaffent, de la Meuse à la(...)",bordel
1909,"Toutes les pièces belliqueuses et tendancieuses comme celles dont je viens de parler et auxquelles il convient d’ajouter « Toten- tanz » (la Danse des Morts) avec son enthousiasme, soudain écroulé, pour le bordel, toutes ces pièces empoignent, non parce quelles persuadent, mais parce qu’en elles s’agite un tempérament si bouillant que notre société ordonnée ne saurait le supporter hors de(...)",bordel
1909,"Le malheur et le bonheur pour nous, c’est que l'hôtel est devenu un bordel — bordel de rois en tournées, du roi d’Illyrie ou de Cerdagne, ce soir-là",bordel — bordel
2001,Un bordel(...),bordel
1990,C'est le bordel,bordel
1937,Bordel-Wassermaim ont été faites : : Négatives 238 ■ Positives,bordel
1903,"Bordel, enelTel, adémor.lré que le sérum des animaux auxquels on a injecté du sang dune autre espèce, acquiert la propriété de détruire les globules rouges du sang desanimaux de cette dernière espèce",bordel
1875,"Vers la fin du XIIIe siècle, Hubertant passa dans la maison de Bretteville-le-Bordel, près Caen, et en 4374 on le trouve encore entre les mains de Pierre de Breteville, écuyer",bordel
1907,"3, rue de Sèze, BORDEL lli Téléphone 27.68 I Téléphone 27.68 aj J Vfo * AGENTS MEMAMPÉS 3JI A. L'ART NOUVEAU Maison LHVHUD, LESfURE, a BEÇbHRD 45, rue Bouffard et rue Montbazon, 9",bordel
1875,103 .25 Bordel frères(...),bordel
1978,S'il y en a trop c'est le bordel,bordel
1956,Dupuy ten à inviter le Gouvernement à attribuer des sec d'urgence aux maraîchers de la région bordel dont les cultures ont été détruites par les g< (renvoyée à la commission des Finances(...),bordel
1935,abeilles charriant le miel portraicturé sur l'affiche et collé sur le mur du bordel avec son nom primoroso dessiné par des œillets et le nom de son élevage andalou orné de l'odeur des oignons et des jasmins joint aux mille raisons de se taire et d'être sourd à la puce qui pisse la pluie rassasiée déjà de prendre tant de café au lait qui secoue blonde la chevelure qui espère et désespère cachée derrière la porte en fer qu'en faisant la nigaude qui cache sa honte sous la nappe gonfle la voile et(...),bordel
1895,B. — Borde de Bordel(...)1718. — Regnier de Bordel,bordel
1895,Bordel,bordel
1895,D. autorisant les sieurs Bordel à substituer à leur nom patronymique celui de Borde,bordel
1880,"Glydenboss, bordel",bordel
1880,"Schrefenboss, bordel",bordel
1933,"la rue Bordel ou Bourdel, qui était située derrière le Marché au Blé et communiquait avec la rue Saint-Martin (34(...)",bordel
1911,"J'irai, si vous voulez, les demander au bordel(...)",bordel
1907,"Elirai. — t Nusse, Bordel et C(...)",bordel
1895,"La Porte Bordet ^ Bordel, Bordelle ou Bordelles, nommée depuis Porte Saint-Marcel, se trouvait près de l’extrémité de la rue Bordet, depuis rue Descartes (1(...)","bordel, bordelle"
1895,9 i — Une famille Bordelle avait donné son nom à la rue qu’elle habitait,bordelle
1895,La porte Bordelle en particulier fut mise en complet état,bordelle
1895,"En mai 1525, « ceux des faulxbourgs Sainct Marceau ont baillé requeste à la ville pour avoir la porte Bordelle ouverte, à la charge de leur bailler en garde à leurs dépens et d’y soumettre tels gens(...)",bordelle
1932,"isolé sur milieu de Bordel (gélose à l’extrait de pomme de terre, additionné de sang(...)",bordel
1931,"Mlles BORDEL (Albertine), finisseuse, 31 ans de services",bordel
1931,"Mlle BORDEL (Albertine), piqueuse en chaussures, 30 ans de services ETABLISSEMENTS LEMARCHAND FRERES LEBERTOIS (Marie), bambrocheuse, 30 ans de(...)",bordel
1938,"L’appelante dit qu’elle demeure en la rue Coquatrix, qui est foraine, où il y a eu bordel, de si longtemps, qu’il n’est mémoire du contraire, etc(...)Ce passage prouve, en outre, que les rues où il y avait « bordel » étaient regardées comme « foraines », c’est-à-dire étrangères au régime et au droit commun de la voirie ordinaire",bordel
1938,"L’école de l’In- térest, L’heure du Berger, le Bordel des Muses (Paris ridicule », etc), avec notice biographique, in-8, de LXV1I-242 pp",bordel
1938,"du Berger » et de l’« Escole de l’Intérest », pour avoir fait un livre intitulé : « Le Bordel des Muses », escrit J’< Apologie de Chausson », le « Moyne renié », et autres compositions de vers et de prose pleines d’impiétés et de blasphèmes contre l’honneur de Dieu, de la Vierge et de l’Estat",bordel
1915,17 Bordel (Maurice(...),bordel
1896,"Ainsi s'explique que l'anglo-s. bord signifie aussi bouclier et les dérivés"" v: fr. borde, bordel, maison (enceinte(...)",bordel
1871,50 (Allaire 100 Eure...... Louviers..... des Ouvriers...jForlier 100 (fll1!e Turlure ... 80 (Domergne ... 30 Gard...... Sumène ..... de la commune. jGuibal ..... 30 (Motge 30 I Robert 120 I Bordel 120 i . ~t Lamary,bordel
1842,Et ce fut alors entre ces deux vieux amis à qui répudierait 'honneur d'avoir patroné G. dans la haute société bordel aise,bordel
1904,"Bordel, Hipp., faïences et poteries, place Notre-Dame-du-Mont 11(...)Bordel (Vve), rentière, r(...)Bordel, Louis, cordonnier, r",bordel
1904,"présid. : Toche, V. Jt Charbonnier : Bordel, J(...)",bordel
1904,"Bordel (Vve) rentière. ..................................... .................................... tiers (rue), de la rue Barbaroux 2, i la rue de la Bibliothèque 29",bordel
1904,"Bonnet, A., rue de Lodi 2-2. ■Bordel, Louis, r",bordel
1904,"Bordel, Cyrille, adjoint du génie de 3mo classe",bordel
1904,"TÉLÉPH 901.17, usinai à BorDel (Oise). (Voir: Lamineurs). ■ HOTELS 1 GRAND HOTEL RESTAURANT UNIVERSEL 30, Cours Belsunce, 30. — MARSEILLE RÉGIS CHAMPT, propriétaire, ex-Maître d'Hôte",bordel
1904,"Louis Bordel, cordonniei 8 Coll",bordel
1864,"CAMMARTIN, subst. (conc. conf.). —Me* Blasselle, Muré, Castelli et Bordel, av",bordel
1843,L'ABBAYE B'ACLfS. cum vallicula adjacenti a summitate collis que dieitur Testus usque ad locum qui vocalur Bordel ad dexteram vero partem et in sinistram utrobique quantum tenet spatium unius leuce in agris pratis pascuis sylvis montibus aquis aquarum decursibus et omnium rerum usibus ita ut inperpetuum libere habeant utantur sine omnium hominum inquietatione vel cujuslibet debiti exactione servitii,bordel
1877,17 août. - Circulaire à MM. l'Ordonnateur et le Procureur général relative à l'envoi d'un bordel'eau analytique des dépêches destinées au Ministre de la marine et des colonies 78-367 BOUCHERIE,bordel
1927,"La réaction de Bordel-Wassermann est négative dans le sang et le liquide céphalo-rachidien, a\ec lympnocylose minime = 3, mais abondante albuminosc = 0,50",bordel
1927,Plusieurs fois le suis allé au bordel,bordel
1949,"Astruc écrivit à un ami d’Avignon pour le prier de lui envoyer, s’il pouvait se les procurer, les statuts de la Reine Jeanne pour l’établissement d’un bordel",bordel
1949,de Garein et ses amis aient placé dans cette rue le fameux bordel institué par la reine,bordel
1949,"LA PROPHYLAXIE ANTIVENERIENNE 33 cette reine ait réglementé ces bordels par les statuts dont parle Astruc, et, après lui, Papon,.Linguet, Merlin, etc(...)",bordels
1949,"De nombreux lupanars organisés ont été établis à travers les âges et dans de nombreux pays depuis la création des premiers bordels militaires dans l’Empire romain(...)Avec le temps ces bordels devinrent des institutions civiles, souvent acceptées par la société, facilitant ainsi l’extension des maladies vénériennes dans les populations",bordels
