year,sentence,key_word
1923,"Cet immortel se proposait de faire route de Toulouse à Montpellier par Albi, quand le jeu du hasard l'aiguilla sur Carcassonne : « deux voitures étaient attelées dans la cour du Grand Soleil, - raconte-t-il dans le tome III de son Ermite, - j'avais fait déjà plus d'une lieue, lorsque songeant à me mettre à mon aise, je cherchai dans une poche de la calèche mon bonnet de velours que j'avais eu soin d'y faire placer(...)",calèche
1873,"N'oublions pas de signaler la belle calèche et le. dorsay à huit ressorts, provenant de la maison Henri Binder, qui sont pour ainsi dire neufs",calèche
1858,"Et celui qu'emporte une volante calèche, le gracieux euphèbe qni s'étale demi renversé sur les coussins, les yeux vers les nuages, aspirant les vapeurs légères du Havane, tandis que sur le siège de strapontin, la blonde fée de l'improvisation, dressée sur les genoux, excite les chevaux blanchis d'écume, joue avec des diamants, attrape en passant les rameaux Heuiis de la route, rit et livre aux brises du soir ses cheveux emmêlés, c'est encore le Courrier et son équipage",calèche
1913,"Ils débarquèrent un malin et Ton sortit à. celle occasion certaine calèche que je n'avais jamais vue(...)Vimposante berline du Directeur, mais je ne soupçonnais pas qu'il pût y avoir la calèche des Administrateurs, qui doit être aujourd'hui quelque-luxueuse limousine(...)",calèche
1947,"Au milieu de l'ignorance complète des Tourangeaux, l'Empereur déchu traversa Tours le 30 juin 1815 dans une calèche jaune sans armoiries ni bagages, attelée de quatre chevaux menés",calèche
1947,Et la calèche jaune repartit d'une seule traite jusqu'à Poitiers,calèche
1889,"Après son déjeuner, le roi fait en calèche le tour du mont Coron : aux saints qui dénoncent son incognito, il répond par d’affables inclinaisons «le tète: s'il rencontre un pauvre, il fait arrêter son équipage(...)Lors du tremblement de terre qui a désolé Nice en 1887, parmi les rues remplies d'une population atfolée, — on vit soudain apparaître la calèche du roi, souriant et calme",calèche
1895,"Un charmant postillon Louis XV conduisait supérieurement une calèche toute pleine de divers personnages en superbes costumes Barbe Bleue, l'Œil Crevé, le Petit Faust(...)",calèche
1950,"pas les dames en calèche HORTENSE pue de et le prince, dans leur calèche, se promenaient au parc de Saint-Cloud, endroit très à la mode, où le Tout-Paris 8e rencontrait",calèche
1868,"Tom entra, et la première chose qu’il rencontra sur son passage fut la calèche de Marguerite, telle encore que l’avaient laissée les petits visiteurs du jour précédent(...)Sur les coussins capitonnés de cette calèche, reposaient pêle-mêle, Mlles Zerline, Bleuette, Popotte, Suzanne et Amélie qui, pour des enfants perdues, avaient vraiment là un lit assez douillet",calèche
1868,"ANNEXES Planche à découper. — Calèche découverte, pour poupée, avec attelage de chèvres",calèche
1868,"Cartonnage à découper. — Calèche découverte, pour poupée, conduite par un petit garçon et traînée par quatre chèvres",calèche
1868,"Et l’enfant se leva en chantant, car elle venait de se rappeler que toute sa petite famille, Bébé compris, avait dû rester dans la calèche de la remise où elle était aussi en sûreté que dans la chambre de Marguerite",calèche
1868,"Quand elle fut près de la porte, elle entra rapidement et se dirigea sans regarder à droite ni à gauche, vers sa petite calèche, où elle venait d’apercevoir celles de ses tilles que vous savez",calèche
1868,"Elle retourna une seconde fois la calèche en tous sens, regarda dessus, dessous, devant, derrière..., mais pas plus de Bébé que précédemment(...)",calèche
1868,"Découpez, à présent, les deux façades de la voiture ( N os 2 et 3 de la planche coloriée), puis les N os 1 et 4 de cette même planche qui composent l’intérieur delà calèche, ainsi que le petit morceau N° 5 qui est le dossier du siège de cette calèche",calèche
1903,Le roi et la reine ont pris place étang unr calèche attelée à la daumont(...)La reine et Mme Loubet montent dan une deuxième calèche,calèche
1879,"on partira demain, à 5 heures du malin, dans une bonne calèche(...)",calèche
1942,Angoissée la famille décide de partir à sa recherche et frète une vieille calèche,calèche
1889,"le haut de ces voitures, dit impériale, n'a pas les mêmes inconvénients que la promenade en véhicule suspendu ordinaire, calèche, coupé, cab, phaéton ou autre, en raison des mouvements de côté qui se produisent, au lieu d'être des mouvements d'arrière en avant",calèche
1868,Entrent dans une calèche coduite en Daumont . . qui,calèche
1998,"Louis XVIII venait en calèche remercier sa garde de lui(...)Là-dessus, au lieu de croix d'honneur, le roi ne tira de sa calèche que des rouleaux d'or qu 'il donna à distribuer pour les(...)",calèche
1890,"Berta s'était mise à la fenêtre, et écoutait, avec une inquiétude pleine d'angoisse, le roulement précipité de la calèche, qui devenait de plus en plus distinct(...)",calèche
1892,"à 1 heure du soir Rue du Mans, à Sablé I)’un MOBILIER ET DE DIFFERENTES VOITURES Entre autres breack et calèche PRÉSERVATIF CONTRE LE CHOLERA Pendant la période d’épidémie cholérique, j’ai constamment prescrit à mes malades et à ma famille l’usage de la Liqueur Bénédictine de l’abbaye de Fécamp, soit comme préservatif, soit comme remède contre ce terrible lléau, et je dois déclarer que, par l’usage de cotte bienfaisante liqueur, j'ai obtenu les plus heureux résultats, en préservant la vie de(...)",calèche
1847,"Maurice voulut descendre de la calèche. — Un instant, s'il vous plaît. — Il ne me plaît pas d'attendre, répliqua Maurice(...)En achevant ces mots il partit comme trait. — Béatrix descendit de la calèche et pa doucement sa main sur le bras de Mauricr — Eh bien",calèche
1847,"il demande t des chevaux à la poste, il ira dans la fOl J chercher la calèche, il nous l'amènera il C'est donc pour deux heures à peine qu'il no i faut l'hospitalité",calèche
1847,"aux premières feuilles, quand le cœur se réveille avec les bois et les prairies, Mme dE Parfondval ordonna à son cocher d'atteler les chevaux à la calèche pour la mener au château de Béthisy",calèche
1847,"Au même instant une calèche, remarquable par la fraîcheur et le bon goût des ornements, par la beauté de l'attelage et la richesse de la livrée, débouchait en face de lui par la rue de Mariahilf",calèche
1847,"Il paraît qu'elle a tout renvoyé à ses amants, ses chevaux, sa calèche, ses tableaux, ses diamants",calèche
1847,"Ils descendirent de la calèche,et,après avoir marché(...)",calèche
1847,e doute lorsqu'elle eut avisé l'élégante calèche où la comtesse de Laverney était auprès de Gardeville dans un mol abandon,calèche
1847,CALÈCHE. ^ I La calèche était au bas du perron,calèche
1847,"LES TROIS SOEURS. a23 Une lois, une seule fois... ne vous ai-je -as dit que j'avais violemment rencontré une omtesse en sautant dans sa calèche aux hamps-Elysées(...)",calèche
1847,"on le voit souvent traverser Vienne, sans escorte, dans une calèche à deux chevaux",calèche
1847,"Elle sonna, un domestique parut. — Qu'on attèle la calèche, dit-elle(...)La calèche s'arrêta à la porte, le duc descendit de chevalet il se présenta.à la portière: — Descendez-vous, Madame",calèche
1847,"Béatrix, repliée mélancoliquement au fond de sa calèche, demeurait plongée dans une rêverie pénible",calèche
1847,"Quelques heures après, elle arrivait de- vant l'hôtel de France où déjà stationnait une calèche(...)A peine eut-elle jeté les yeux sur cette calèche qu'elle y reconnut Mme de Laverney",calèche
1847,"J'entends bien, madame, mais je ne com.( prends pas. — Il ne s'agit pas de comprendre, suis mes .( ordres mot à mot. Quand tu auras conduit la : calèche rue Saint-Dominique, et les chevaux - rue de Grammont, tu iras te conduire toilf même chez celui qui te paie tes gages",calèche
1847,"Évoquait-il cette fois l'ombre du maréchal Masséna, qui, sous le feu le plus violent de la mitraille, dirigea , comme on sait, son corps d'armée en se faisant conduire dans une calèche attelée de magnifiques chevaux blancs",calèche
1847,Il reconnut la calèche de Mmede Fargiel(...)La calèche était couverte ce jour-là,calèche
1847,"Maintenant il faut choisir, une jolie calèche, une jolie femme et une jolie main. — Pour moi, dit un des gais compagnons, j'avoue que je me méfie un peu des femmes qui sont seules dans une voiture, car, si elles étaient(...)La calèche était si basse, que cette femme semblait avoir des airs desul-i tane(...)",calèche
1847,"A cet instant un très joli landau qui avait l'air d'une corbeille de fleurs, tant les femmes qui s'y trouvaient étaient fraîches, jolies, parées avec éclat, passa a côté de la calèche(...)",calèche
1847,"La calèche avait dépassé l'arc-de-triomphe, les chevaux hennissaient déjà à l'odeur printanière du bois(...)Il n'avait pas eu le temps, depuis qu'il se trouvait dans la calèche,"" de se demander s'il aimerait la comtesse",calèche
1847,"La calèche disparut sous les branches de l'avenue. — Qu'importe(...)Tout préoccupé qu'il fût des dangers de sa position, en se plaçant dans la calèche, il avait remarqué, que l'un de ses amis s'était fort rapproché de la voiture et avait eu le temps d'en reconnaître les(...)",calèche
1847,"Madame, que votre calèche était prête, dit le colonel en entrant dans le salon",calèche
1847,"L'une, dans une élégante calèche armoriée, c'était Mme de Laverney, qui, s'efforçait de regretter le duc de Reichstadt comme un caprice évano *ui",calèche
1847,"Cette calèche était d'un luxe jusque-là inconnu(...)Cette calèche, conduite à la Daumont par deux jeunes postillons harnachés avec presque autant de richesse que les chevaux, était verte et or(...)",calèche
1847,"299 Maurice, s'était approché de la calèche. —C'est bien étonnant(...)Il allait droit à la calèche de Béatrix",calèche
1847,"Un jour que je passais en calèche avec mon mari dans une h des allées du Prater, un groupe d'officiers* qui - se trouvait devant nous s'arrêta",calèche
1847,"Le vieillard la prit, sortit précipitamment de sa calèche et courut dans un coin de la cour la parcourir rapidement",calèche
1847,"En effet, le prince était revenu droit à là calèche. — Madame, dit-il en jouant le calme le plus(...)Mauric debout dans la calèche, avait beau ordonn au chasseur de faire arrêter, celui-ci n'av: même pas l'air de l'entendre",calèche
1847,"je me suis élancé dans une calèche découverte, en face d'une belle femme qui rêvait sans doute aux printemps évanouis, car elle avait près de trente ans",calèche
1914,"Parmi les trophées pris à Czenslochowo, se trouve la calèche de Guillaume il avec son manteau bleu",calèche
1897,"je serai dans ma « calèche tirée par mes deux beaux chevaux, 1 « l’autre aura quatre chevaux, avec un pos- « tillon(...)",calèche
1897,Une calèche à brancard pour 3 personnes coûtait 6 fr. par poste et 3 fr. par lieue,calèche
1868,"Tout ce qu'on sait, c'est qu'elle est venue ici avec un grand luxe, dans une calèche à quatre chevaux, une calèche qui a des roues cerclées en argent",calèche
1896,1-5 A Vendre UN 33 13 3EG A O K S’attelant à 1 ou 2 chevaux ■ UNE CALÈCHE LE TOUT EN BON ÉTAT S’adresser à M,calèche
1858,"espèce de petite calèche attelée de deux chevaux, conduite par un cocher généralement sale et d'une tenue assez bizarre",calèche
1887,"En la salle des ventes, sise rue St-Louis, quartier du nord, le Commissaite-Priseur vendra à l'encan et au comptant, à la requête du se or Appouodéaret en vertu d'un jugement du Tribunal de la justice de paix de Pondichéry, en date du 3 juillet 1886, une calèche à 4 roues(...)",calèche
1879,"FAILLITE )c Jean LASS,ULt-GMLE, fils, de Gabas Le vendredi douze décembre prochain, t deux heures de relevée, sur la place fiarcadet, à Oloron-Ste-Marie, Il sera procédé à la vente aux enchères publiques de deux juments, deux jeunes mules, une calèche et un omnibus, provenant de la faillite du sieur",calèche
1864,"r., Un gamin monte sur les ressorts d'une calèche yiçtoria qui conduisait deux jeunes époux",calèche
1829,"Quelques élégantes, en landaw , en calèche découverte , avaient risqué des manches longues, justes, à deux coutures, et à petit bouffant,vers l'épaule, le tout pareil à la robe",calèche
1901,"madame, pour qui mon oncle n'avait pu avoir de mérite que celui de la nouveauté et qui depuis longtemps ne s'occupait plus de lui, madame écouta Ù peine Dugnès, et lui parla de sa nouvelle calèche et de sa logea 1 Opéra, Dugnès, qui connaissait la fibre sensible des(...)",calèche
1943,"258 — Ceei' 'à la poste, tout de suite, commanda Laza-rîne en lui tendant la let-tre destinée à Marcel Laugiel, -Quelques heuns après, à Orléans, une calèche at-tt",calèche
1894,"Heureusement, ce n'était rien: deux chevaux d'une calèche, effrayés par le large pantalon rouge de notre chef de musique de zouaves, se sont emballés et sont allés se jeter dans quelques tables, qui, heureusement, étaient inoccupées et qu'ils ont renversé ainsi que trois caisses de plantes avec force bruit",calèche
1916,"Immobile sur les coussins de la calèche, abritée par 1 ombre légère d’une ombrelle, Marie-Adélaïde attendit l’ennemi",calèche
1936,"Dans la rue, devant la porte de l'hôtel, une calèche découverte attelée de deux belles mules attendait les touristes. — Nous ne prendrons pas de guide, déclara Axel",calèche
1936,La calèche aux mules nerveuses et fines était à peine arrivée qn'elle sauta dedans,calèche
1899,"résolut plus facilement que je n’aurais supposé et un bel après-midi de septembre, la vieille calèche du manoir, longtemps délaissée et revernie à neuf pour la circonstance, prit le chemin de la Villa-des-Roses, emportant tous mes espoirs de bonheur",calèche
1899,"Et quand, dans notre calèche, nous nous retrouvâmes seuls, le marquis et moi, je n’eus pas le courage de demander au veillard la causp de son erreur, tant cette erreur me paraissait avoir arrangé les choses au mieux",calèche
1902,"autant. — Tiens, dit la mère Franquin, qu’e«t-ce donc qu’il est arrivé à a calèche fie Frédéric",calèche
1886,"il est si bon de rouler calèche, quand on a couru nu pieds dans son enfance",calèche
1916,"Immobile sur les coùssins de la calèche, abritée pari ombre légère d’une ombrelle, Marie-Adélaide attendit l’ennemi",calèche
1981,Collection Calèche(...)Collection Calèche(...),calèche
1981,1528 Collection — Alerte 1534 — Calèche 1535,calèche
1916,"Immobile sur les coussins de la calèche, abritée par l'ombre légère d’une ombrelle, Marie-Adélaïde attendit l’ennemi",calèche
1876,"de Jalabert i Lebaiser de Judas', plusieurs de Chardin, de Rosa Bonheur et de Landelle, I Du palais du Luxembourg, une rapide calèche nous a conduits à l'hôtel des Invalides, Ici, j'en suis sûre, vous serez bien aise que je réveille vos souvenirs, et que j'y Soute mes propres impressions",calèche
1921,"2 chevaux garnis (non attelés), prix porté de 0 a 12 fr. . ' 2* Au cimetière du boulevard Bru : La calèche, prix porté de 12(...)3° Au cimetière Israélite : La calèche, prix porté à 16 fr",calèche
1900,"Ace moment une superbe calèche revenait du bois do .Boulogne. — Voyez donc, dirent les anciennes élèves de Mme Brévins, les mêmcsquiavaionldansé aubald'Alicc(...)La calèche fuyait comme une hirondelle qui rase la terre",calèche
1892,"Le Caïd des Messaoud el Horchan nous a envoyé sa calèche, ses deux mules(...)",calèche
1928,"4 L'OBJECTIF Legray s'épuisait à tasser gratuitement ses épreuves sur la saignée de ses visiteurs tel plus tard le munificent Le Pic chargeait de ses toiles les biceps de tout sortant), les deux Bisson, tout à fait grisés de la subite ivresse d une situation nouvelle, avaient immédiatement imaginé de se faire construire à Saint-Germain, sur les bords de là Seine, deux charmants cottages jumeaux, d’où ils arrivaient le matin pour y retourner le soir, en calèche à deux chevaux",calèche
1916,"Enfin, le grand jour arrive : dans"" une magnifique calèche à deux chevaux que lui pifcle un de ses collègues, notre ma- i gistrat se rend à la petite gare pour y f recevoir le poète(...)La calèche à deux chevaux l'emmène à travers la ville et produit une sensation(...)",calèche
1909,"Au moment où Rodolphe entra dans la cour, Murph remettait dans la poche d'une petite calèche de voyaga une paire de pistolets qu'il venait de soigneusement essuyer",calèche
1867,"Elles finissent tout simplement par se transformer, se démocratiser, qu'on y aille en calèche ou à pied, avec des cocottes(...)",calèche
1853,"Au milieu de cette confidence, on vient annoncer au général qu'une dame arrêtée aux avant-postes, dans une calèche de voyage, demande à lui parler(...)",calèche
1943,"Une calèche « 40 en long » les transporte en moins d’une heure au centre de la ville, où un déjeuner reconstituant commence à leur ouvrir une perspective moins sombre sur l’avenir",calèche
1930,"Depuis les carrosses à mantelets du xvme siècle, que dépeint Van der Meulen, jusqu'aux calèches, aux tilburys, aux coupés de gala d'Eugène Lami, de De Dreux, de Constantin(...)",calèches
1930,Carie et Horace Vernet figurent très honorablement et la grande calèche à quatre de la collection de M. le Comte de Camondo réjouit,calèche
1830,et une vaste calèche dans laquelle se trouvaient madame la duchesse d'Orléans et ses filles(...)derrière la calèche venait M. le duc d'Orléans à cheval : il était entouré <Cun petit nombre de cavaliers,calèche
1945,"rnmenait, aux accents de > Auprès de ma blonde » l’antique calèche des doyens du pays",calèche
1930,"Puis M. Morinaud prend j Vacquier, président de l’Association place dans une calèche en compa-jde gymnastique des Deux- Charen(...)Dans une deuxième calèche, pren- Pelletier, chef de cabinet du Préfet(...)",calèche
1935,"En calèche Il la mit dans une calèche et, au trot, l'enleva",calèche
1872,"Sous les cuirs dorés et vernis, Aussi rapide qu'une flèche, Vos chevaux roulent la calèche Plus douce que les plus doux nids",calèche
1887,"votre bulletin, et vos bagages sont déjà hissés sur le derrière de la calèche",calèche
1887,"Calèches, Paniers Milor, Vis-à-vis, etc",calèches
1900,"Calèche japonaise. landau, bicyclette, automobile, c'est toujours à la roue que l'homme fait appel",calèche
1916,"Immobile sur les coussins de la calèche, abritée par l'ombre légère d’une ombrelle, Marie-Adélaide attendit l’ennemi",calèche
1839,Mmcs Cuzcnt et Camille étaient en calèche découverte,calèche
1814,"Est-il donc arrivé quelque accident nouveau A ta grande calèche, à ta petite bête(...)",calèche
1855,monte dans sa calèche et se fait conduire dans la boutique où il avait rencontré(...),calèche
1968,C'est comme si on se contentait d'installer un moteur perfectionné à l'avant d'une vieille calèche(...)calèche elle-même qu'il faut modifier en fonction du mode de traction employé et des rythmes nouveaux de déplacement,calèche
1906,"demandé un. vote de blâme au maive et au premier adjoint, parc1- qu'il les a vus sêprome- : ner en calèche et faire la"" noce avec rarchitectè dés écoles, le baslycot Hoëlle, conseiller municipal de Lens",calèche
1902,"LA F ANPAU. - Qu'est qui a payé les promenades en calèche, sur le pont de la Concorde(...)",calèche
1925,"Une caleche avancée, Mile de La Marseillere y prit place en compagnie de Gourville plus content encore du bou tour qu'il jouait à M. de Waldeck que de l'agréable société qui lui était réservée",caleche
1894,"Justement une calèche est en partance pour Oran, Gracioso(...)En voyant partir les deux calèches, il appelle à plusieurs reprises ses camarades sans obtenir de réponse, car le cocher, croyant entendre une menace d'anarchiste, fouette de plus belle ses rosses",calèche
1893,"Dernièrement, M. Baillv, inspecteur des douanes, l’a parcourue en calèche",calèche
1918,"dans la calèche qui suivait, Mme Wilson, Mme Poincaré, Mlle Wilson et le général Léorat",calèche
1899,"mepowvais faire différemment que de confier mes Intérêts et les soins de me représenter i mon ami, ' , Ce fut donc lui que je suppliai d’être mon intermédiaire pour la démarche officielle auprès de M we de Reaeehéne, U §’j résolut plus facilement que je n’aurais supposé et un bel après-midi de septembre, la vieille calèche du manoir, longtemps délaissée et revernie à neuf pour la circonstance, prit le chemin de la Villa-des-Roses, emportant tous mm espoirs de bonheur",calèche
1899,"Et quand, dans notre calèche, nous nous retrouvâmes seuls, le marquis et moi, je n’eus j)as le courage de demander au veillard la cause de son erreur, tant cette erreur me paraissait avoir arrangé les choses au mieux",calèche
1899,"Il s’y résolut plus facilement que je n’aura** supposé et un bel après-midi de septembre, ** vieille calèche du manoir, longtemps délaissée(...)",calèche
1899,"Et quand, dans notre calèche, nous nous retrouvâmes seuls, le marquis et moi, je n’eus pas le courage de demander au veillard la cause de son erreur, tant cette erreur me paraissait avoir arrangé les choses au mieux",calèche
1857,"A trois heures, Pandolfe et Colombine sont en calèche découverte(...)Pandolfe trouve que, s’il ne fait pas courir, madame fait bien assez courir après elle... et il jette un regard soupçonneux sur tous ces lions, crinières déployées, qui suivent, haletants, la calèche de Pandolfe et sa fortune",calèche
1834,On mit à la calèche quatre chevaux gris magnifiques. — Que pensez-vous de ces deux paires(...),calèche
1920,"CHOSES ET AUTRES LA CALECHE DU PRESIDENT Mon grand père était, carrossier... (Que l'on veuille bien excuser cette confidence dénuée d'intérêt. : mais la mort de l'impératrice Eugénie invite aux souvenirs, et, ceux-ci s'enchaînent les uns les autres",caleche
1920,"L'arrivée de M. Grévy, président de la République, en calèche à la daumont, autant qu'il m'en souvienne(...)",calèche
1863,"Desmées et Mme Pioussinger font arrêter la diligence, et bientôt toute la famille réunie est installée dans la calèche que conduit Pancrace, en se retournant de temps en temps pour regarder son jeune maître, et aussi(...)",calèche
1915,"Ainsi équipé, sous le costume de Potioreck ou de l'archiduc Charles, il poursuit sa route dans la calèche du général autrichien",calèche
1916,"Immobile sur les coussins de la calèche, abritée par l'ombre légère d’une ombrelle, Marie-Adélaïde attendit l’ennemi",calèche
1875,"autrement qu'en constatant que vous les avez dépensés pour vous soutenir au ministère et pour saper le trône en créant des postes et des sinécures pour vos parents, vos am s et vos partisans, dont beaucoup n'avaient pas d > quoi se faire des pantalons qui aujourd'hui se pavanent en calèche et jouissent",calèche
1939,"11 se situe dans le temps, en pleine « grande génération de 1830 », six ans après la Préface retentissante de Cromwell, cinq ans après ces Orientales que Louis et ses amis lisent et relisent en s’exaltant, tandis que leur calèche parcourt lentement de « beaux vallons », des « bois charmans », trois ans après la tumultueuse victoire d'Hernani, à laquelle avait contribué la jeunesse enthousiaste des « ateliers », enfin l’année(...)Pendant qu’ils lisaient ces vers pleins de sentimens, moi, la tête hors(...)",calèche
1927,la calèche du colorie,calèche
1869,"J i M -: --- I à IVllàF ®°°pé» calèche, victoria, phaëton, LilMIilt vifrà-vis, cheval à vendre, rue Laffiue, 48",calèche
1988,131 — à cheval et en calèche,calèche
1988,"L'entretien de la calèche est assuré par Roussely, carrossier et sellier, 1, rue SainteCatherine, et lorsque Cocotte la jument ne semble pas « dans son assiette », c'est monsieur Giraud, vétérinaire, qui habite tout près dans",calèche
1988,"perron de La Côte, Aglaé fait un grand signe d'adieu en direction de la route blanche, où roule la calèche qui conduit Eugène à la gare d'Ingrandes, puis, rentre dans la maison, s'assied à son bureau et inscrit dans son livre de comptes : « 3 octobre 1866",calèche
1988,"Aglaé reste trois semaines à Poitiers, visitant les environs dans la calèche d'Auguste et rentre à Caen en passant par Paris",calèche
1865,La calèche découverte suivait tranquillement un chemin ombreux et écarté,calèche
1900,"Vous seigneur, vous cordon bleu, vous prince et duc et pair de Charlemagne, vous roi d'un petit pays, faisant vos lois tout seul, les violant sans craindre la presse bégueule et déhontée , vous qui avez chevaux, et voitures, et splendides repas, vous avez arrêté votre calèche à la porte d'un éditeur(...)",calèche
1900,"Selon l'usage du temps, on était hors de table avant quatre heures, et quelqu'un proposa une promenade au bois de Boulogne en calèche",calèche
1900,"Là ne point se connaître en harnais, en ressorts, en tilbury, en calèche, en tandam, en diébitsch, en cheval de pur sang, en vrai fox-hound, en steeple-chase, etc",calèche
1900,Les calèches étaient au bas du perron,calèches
1900,"A peine arrivé, et déja encombré de bagages, de calèches, de tout l'attirail en(...)",calèches
1900,"les deux princesses, malgré les rayons du soleil et les tourbillons de poussière, ont fait découvrir leur calèche",calèche
