year,sentence,key_word
1980,"SÉGUÉLA (Jacques). - Ne dites pas à ma mère que je suis dans la publicité, elle me croit pianiste dans un bordel / Jacques Séguéla",bordel
1980,"elle me croit pianiste dans un bordel 11122 Nos élèves qui nous élèvent 11078 Nourritures vivantes pour poissons et alevins 10933 Nouveau manuel complet du charpenti 10918 Le Nouvel ordre économique mondial, l'économie de la Chine 10855 Le Nouvel ordre intérieur 10848 Nouvelles hypothèses sur l'action socio-culturelle(...)",bordel
1910,"Avec l'hémolyse, que les travaux de Hamburger, de Bordel et de beaucoup d'autres physiologistes, ont rendue si précise, on voit clairement que des proportions minuscules de certaines madères chimiques déterminées ont une activité puissante",bordel
1945,"Perpignan 4- 0 St. Bordel, b",bordel
1882,"1 L'assemblée a confirmé dans leurs fonc- e lions pour 1882 MM.Bordel, Daguin,Truchy d et Rôuilaux-Dugage, commissaires des comptes. d Compagnie générale des eaux",bordel
1912,"Depuis les travaux.de Bordel, on est convenu de caractériser l'Immunité par la présence, dans les humeurs, de substances spéciales appelées anticorps",bordel
1934,"vivait dans un bordel de Budapest(...)Van der Lubbe raconte qu'il voulait sauver cette fille du bordel, mais elle lui aurait réclamé -de l'amour",bordel
1881,"Hugues Bordel 63, 04",bordel
1881,"Guillaume Fournier, Hugues Bordel, Clarembaud de Somme-Vesle(...)",bordel
1881,"Hugue Bordel, Clarembaud de Somme-Vesle(...)",bordel
1919,"Une partie des bIjoux ont été retrouvés. -- Le soiis-officier «mérica'ln Louis Bordel, étant sorti d'un débit, rue de Bercy(...)Bordel a été remis aux autorités américaines. — M. Faugeron, secrétaire suppléant au cabinet de M(...)",bordel
1928,"Davligucs e-xposeva les résultats de sein expérience personnelle dans .. l.""s applications de la (ivcll'e génitale de ranimai à l'homme ». M', le Professeur Bordel, directeur de l'Institut Pasteur de Bruxelles, nous a l'ail le grand",bordel
1906,"103 - France, Bordel, Mme Sauvct, Malmaison, Martella, M. lUcoire. etc., et pour des Reines-Marguerites variées",bordel
1882,245 à 250 255 a 260 275 à 280 Fins Bois (Bordel ies(...),bordel
1891,"S’agit-il de mettre le bordel en scène avec la fille Elisa, ou d’exulter »S ( .) aux dépens de 93",bordel
1904,"Toujours à la demande de la défense, le propriétaire du café de la Paix, M. Ger¬ main Bordel, déclare que Mme Plagniol, son mari et leur(...)Yous avez entendu, dit-il, d'honnêtes gens, MM. Badou et Germain Bordel qui avec une certainne crânerie, sont venus déclarer qu'ils avaient toujours vu ma cliente avec son mari ou sa fillette",bordel
1920,Georges Bordel,bordel
1912,"k 860 Parts 55 6 0- : - 2 o' Act. de -500 fr CIIEI%IliNS DE FER FRANÇAIS Cie Bordel~,iis(,~ des Comptoirs(...)",bordel
1966,"Paix sans victoire, c'est pain sans levain, civet sans vin, bar sans câpres, cèpes sans ail, amour sans querelles, chameau sans bosses, nuit sans lune, toit sans fumée, ville sans bordel, porc sans sel, perle sans trou, rose sans parfum, république sans(...)",bordel
1813,"Noyer , rue bordel, n",bordel
1942,Par note spéciale jointe au.- bordel'eaux 1-J bis les inléretsés(...),bordel
1891,"Bordel, Bon.— 84",bordel
1919,Démobilisé 1 rentré. - 14.43-458.' ) LA ROSEE remplace le VIN BORDEL A tSE Essai pour 120 lit,bordel
1889,"Tenez, figurez-sés les premiers sur la liste d'admissibilité, dont les noms suivent : Gauchon, Duclos, Gilles, Delisle, Miette, Schreiner, Bessières, Beghehli, Flaunet, Port, Sayellou, Bordel, Perchier",bordel
1893,"diplômes de solistes, M. Bordel, alto, et M. Adam, piston",bordel
1905,"Henri Bordel f 1889, à 09 uns",bordel
1943,"COMBS-LA-VILLE. — La daine Bordel, née Arinaridine Huin, 54 ans, couturière, est inculpée de vol de linge au préjudice «ie la «lame liertho Québert",bordel
1870,"Dépôt à Pau chez M. La bordel te, pharmacien, rue des Cordeliers , 12. (34) if9.Pt. les iéonnét dont t’abon- uement a expiré Met 30(...)",bordel
1912,"Gare aux vipères. — Des chasseurs qui, depuis l’ouverture de la chasse, ont parcouruleshroussail- les de Pech-Long commune de Bouyssou, et le Buis-Bordel commune de Lacapelle-Maiival, nous raconte tt que ces deux endroits sonten ce moment infestés d’une infinité de vipères",bordel
1910,"vous retracer, tel qu'il a été établi par Bordel et Gengou, à la suite des recherches antérieures, si remarquables, que déjà nous deviors à Bordet",bordel
1934,"Ce Napoléon, par exemple, aigle cancéreux qui n’a point choisi d’être fléau comme on choisit une putain au bordel, mais qui est devenu ce qu’il fut parce qu’il avait faim, et qui déclare : Je n’ai aimé qu’une femme : elle m a fait cocu",bordel
1913,"Bordel Armand, 24 rue de Paris et Langlois Albertine",bordel
1933,"C’est de l’art pour escales d’équipages révoltés, un cauchemar de cinéastes, une apothéose pour bordel communiste",bordel
1945,octobre feront l'objet d'un secoti bordel-eau,bordel
1850,"François, g. p. à Pont-en-Royer ,(Isère), b. à Turriers (B.-A.) Bordel, g. p. à Le Puy (Haute-Loire), b",bordel
1936,"De nombreux vins, tous meilleurs et plus fins les uns que les autres avaient été offerts par de généreux négociants et propriétaires bordel-ais",bordel
1924,"Entre la caserne, l'eucharistie et le bistro, entre le bordel et la jésuitière, l'âme du peuple trouva l'espace nécessaire à son épanouissement",bordel
1868,"Dussaud, Couvreux, et surtout MM. Bordel Lavalley, qui, à eux seuls, auront creusé les trois quarts du canal",bordel
1904,"Pierre LeHegarat, inculpé d’ivresse à bordel de privation de nourriture, a été condamné à un mois de prison et à la privation du(...)",bordel
1907,"satyriquement, pour dire maquerelle, dame d’honneur de bordel, gouvernante qui élève des jeunes filles à la débauche",bordel
1907,"Putain, Puline. —- Garce qui court les rues et les bordels, et se pro t tue au premier venu. laisez-vous, petite puline, (Depuis on a dit putain(...)",bordels
1907,"ibaud. — Putacier, paillard, coureur de bordel",bordel
1907,"Aller dans un mauvais lieu, au bordel, y faire brûler un fagot, en caressant une Silvie",bordel
1907,"Courir leguilledoux. — Pour courir la prétentaine, courir le bordel, fréquenter les femmes débauchées",bordel
1907,"Vaire la petite joie : se divertir en compagnie de femmes de moyenne vertu, c’est-à-dire, au bordel, faireledéduit(...)Janneton. — Synonyme de putain, gibier de bordel, suivante de Vénus",bordel
1907,"femme qui fait le petit métier, une putain, une coureuse, un gibier de bordel",bordel
1907,"Gibier.— Fille de joie, putain, garce ou maquerelle, qui sont du gibier de bordel",bordel
1907,"Pour boucan, bordel où l’on entretient des femmes publiques",bordel
1907,"Et voilà comment, pour avoir voulu posséder son bordel à elle — mettons-y des formes, son sérail (on écrivait jadis(...)",bordel
1907,"oule, avec ses cuisiniers, ses vins exquis, son suisse à la porte, étaient à la fois bordels et maisons de rendez-vous, puisque les rapports de police nous font connaître les noms de plusieurs grandes dames qui y venaient sur commande, puis- qu ’ e n 1766, M m ' d’Oppy y était trouvée par la police, remplissant temporairement les fonctions de fille de",bordels
1907,Bordel ambulant. — C’est ce qu’on appelle à Paris un carrosse de fiacre(...)Bordel (brusquer un). — Manière de parler fort en usage parmi les jeunes débauchés à Paris,bordel
1906,"Muet Mélomane, scène comique, M. Bordel(...)",bordel
1934,"Un bordel s’éparpille de temps à autre, tandis que(...)",bordel
1993,"le proxénète, le tenancier de bordel ou d'Eros-Center peut désormais être considéré comme un entrepreneur",bordel
1993,"Les bordels sont normalement interdits, mais il en existe quelques-uns",bordels
1993,"Les bordels et les maisons de prostitution sont autorisés(...)autorisation des bordels et des Eros-centers, encouragent le trafic des femmes et procurent au « milieu » des gros bénéfices(...)Des bordels ont été fermés, par exemple, le grand Eros-center de Hambourg",bordels
1993,"En outre, il existe de nombreux bordels clandestins dont les propriétaires ne sont pas poursuivis",bordels
1993,Les bordels étaient d'ailleurs déjà interdits mais il en existe de clandestins,bordels
1993,"femmes, émigrées ou non, sont libres de choisir la prostitution comme « profession » et très bientôt, être tenancier de bordel, sera aussi une profession",bordel
1932,"Le rapporteur principal était le professeur Jules Bordel, de Bruxelles, et dix co-rapporteurs, choisis",bordel
1940,"Bordel Deiphine-Léontine-Fran- çoise veuve Vallée, 72 ans, rue Talbot n w 1",bordel
1929,"971 Bordel Marc, 236, rue Duguesclin, Lyon (Rhône(...)",bordel
1893,"Bt une Créance de S.CtoOfr. due par M. Julipn Barrois, propriétaire à Bordel, productive d'intérêts à 4 0(0.1'An'et .exigible le 24 avril 1395. - Mise à prix : aoo fr(...)",bordel
1896,"Bordel (François), instituteur au Pailly",bordel
1886,"BORDEL A ISERIES Un conseiller municipal de Bordeaux bien connu à la Bourse, reçoit une lettre d’un man- diant qui lui demandait use aumône",bordel
1845,"Montereau, 517 50, 520 - Bordel 08 'Mi",bordel
1922,"A Pari* : 12.rue du Quatre-Scptembre et dans toutes set Succursales A la Société Bordel lise, 4",bordel
1919,Marcelle Bordel,bordel
1885,"4e lot. — Chemin d’intérêt commun n* 4, de la station de Vergèze aux Marais inférieurs.— Exhaussement de la partie comprise entre le puits d’Anglas et les marais du Bordel, sur une longueur de 1,455 mètres 80 cent",bordel
1845,"i« i porte S. Marcel (et non Bordel et Bordelle, ; comme on la nommait encore postérieure- -j ment à 1434(...)",bordel
1907,"Le Derby annuel sur route de nos amateurs i est incontestablement Paris-Caen. i Organisé par le Cyclo-Club Alcyon, cette I1WMIIW L'équipe de l'Union cycliste bordel",bordel
1862,"Pierre Bordel , secrétaire à la mairie de Modènes (Vaucluse), suivhnt procès-verbal de Berlier, huissier à Roquemaure , en date du onze décembre dernier , laquelle(...)",bordel
1905,"L’action du borax n'est pus une propriété physiologique. — Il ré.-ulle des expériences de Bordel et d'autres que la propriété que possèdent les microbes de s’agglutiner sous I influence des agglutines, ooagulines ou précipilines, ou d'agents chimiques, n'est tas une propriété physiologique, car ils la possèdent encore après leur mort",bordel
1935,"un Bordel^ 3 et des coteaux de la Loire, — et une Alêj",bordel
1981,"La prouesse est que ce bordel où s’enferme le narrateur est le lieu de l’adieu, il précède le voyage définitif(...)Le faste de l’existence (le mystère du bordel) c’est son mirage",bordel
1981,"Un entretien avec Jeanne Moreau, merveilleuse interprète de Lysiane, patronne de bordel et maîtresse du frère jumeau de Querelle",bordel
1981,"eux il y avait des prostitués (étrangers pour la plupart, ou citoyens déclassés racollant chez eux dans des bordels, acquittant l’impôt) et des esclaves, que l’on utilisait comme objets de plaisir sans qu’ils eussent mot à dire",bordels
1981,"Madame Lysiane, la Maîtresse de bordel sub specie aeternitatis(...)",bordel
1981,"p.ll) Dans ses « récits incertains » il nous lâche un bordel de mots qui nous arrivent vides, «puants comme des rots(...)",bordel
1932,"Quelques Européens, colons, marchands d’alcool, tenancier do bordel, qu’une infâme envie de s’enrichir et de s’or. aller au plus vite rend féroces",bordel
1934,"W. positif, on pourra souvent juger opportun d'employer une méthode de floculation et la réaction Bordel-W assermann, de préférence à,deux méthodes de floculation(...)Un grand nombre de sérologistes connus estiment que l'une de ces méthodes devrait toujours être une méthode de floculation et l'autre une réaction du type Bordel- Wassermann",bordel
1934,"134 discordantes = 47(i réactions Pourcentages : concordantes : 71,84 % discordantes : 28,1(5 % 100,00 % Comparaison des résultats de Bordel-Wassermann cl Kahn (476 réactions) : Réactions concordantes : 364 (76,47(...)",bordel
1865,du sieur Bordel. ■ _(...),bordel
1911,"Suisse, Italie, conn. lefranç., 14^16 ans. —Lauré Bordel, lycée de jeunes filles, Clermont",bordel
1905,"noble Gile de Ravoré des fiefs desquels ils étaient mouvants, rière le diocèse de Genève et la vallée d'Aulps, soit de l'endroit où est bâtie l'abbaj^e, avec la petite vallée y contiguë, depuis le sommet de la colline de Thex jusqu'au lieu appelé Bordel (2), d'environ une lieue d'étendue à droite et à gauche avec les champs, prés, pâturages, marais, montagnes, ëau, cours d'eau et autres, avec l'approbation faite par illustrissime Thomas, comte de Maurienne et marquis d'Italie, de tous les(...)",bordel
1905,"jusqu'aux confins de Neyon et de là à Bordel, et dès Bordel jusques à l'Aulps de Lenz, avec tout ce qui est entre Lenz et Evoré, de sorte qu'ils en puissent jouir paisiblement",bordel
1905,"lequel la cella avait été bâtie, mais encore toute la vallée adjacente*du sommet de la colline de Thex jusqu'au lieu dit Bordel (i) sur la largeur d'une lieue, avec les champs, prés, forêts, montagnes et cours d'eau renfermés dans cet espace(...)Dans le résumé que l'Inventaire nous donne de l'acte (nos 46 et 404), ce lieu est nommé tantôt Bornel, tantôt Bordel. (2) Besson, Mémoires, preuves n° 10",bordel
1905,"46 COPIE DE L'INVENTAIRE d'abbé d'Aulps depuis qu'il commençait à exiger les bans et autres droits de Justice des hommes de son abbajre depuis bordel jusques à col (i), dont il l'investit et la dite abba3re, chargeant ses hoirs d'être tenu à la même investiture en faveur d'icelle",bordel
2004,"EV1 Denis Dujardin Le bordel des muses IT1 : Au Moulin Rouget de Gradimir Smudja, aux éditions Delcourt",bordel
1930,"fol. 41), régnant pour Ihors Charles par la grâce de Dieu roy de France, dans la ville du Puy et en la présence de nobles hommes messire Guilhaume de Villaret, soldat, baille, et Guilhaume Compleur, juge de cour comune du Pui, se sont présentés sages hommes Durand de Portai dict Brojit, domicilliant, Jehan de Nivers et Jacques Bordel, citoyens et consulz de la ville du Pui et de mesmes ont represanté ausdictz sieurs baille et juge avoir esté créés nouvellement les sieurs consulz de ladicle ville(...)",bordel
1930,"Son parrin a esté noble Pons Bordel Irailh, bourgeois du Puy, et sa marrine Dame Catherine du Blanc, famé à M"" Jehan Trioulère, advocat",bordel
1929,"1111 IIAlli'-. à reiiielllv le- lleelice- ai' - cmiipaali"",'- de bordel e.uix",bordel
1943,"BORDEL (Sportiv»Ir DÙmes), 154,05(...)",bordel
1888,"ouvre largement à l’initiative et à l’activité de ses Afin d obtenir les résultats les meilleurs dans tous les différents services que nous venons d’énumérer, le comité directeur de la REVUE DIPLOMATIQUE MONITEUR DLS CONSULA TS et du BUREAU AUXILIAIRE s'est assuré dans toutes 1 m branches du commerce et de l'industrie le concours de personnalités éminentes et des maisons de premier ordre , H ■r Bière de Hambourg «mÉÎwTmark DÉPÔT UNIQUE ifadÉ^Tmahk Société centrale bordel^e 4, rue de Sè ft",bordel
1937,"me dit-il, vous pensez bien que, revenu sans un « pélos » de ce sacré bordel, je n'ai pas vécu jusqu'ici de l'air du temps",bordel
1903,"Bordel, qui présidait, c",bordel
1903,"v< Lucien Bordel, vice-président, du conseil m d'administration. se Voici le texte des résolutions qui ont «té adoptées : t( Première résolution. — L'assemblée r( générale, après avoir entendu le rapport ]<, du commissaire,approuve le compte ren- u",bordel
1874,"16e Prix, Essence, à M. M. Bordel, d'Angouville (Manche(...)",bordel
1911,"Hyménée Samedi dernier a été célébré le mariage de xMlle Marthe BordeL hile de notre ami Benoit Bordet, avec M. F. Meningaud, Officier d’administration d’Alger",bordel
1878,"Bordel, jardinier chez M. Milsand, à Villers-lcs-Pol.s, par Auxonne",bordel
1929,A BORDEL.S.iG « i 3 s I IS' 90 a 104 Iiue d'Ormvy Saigon(...),bordel
1902,"Facteurs, MM. Bordel, Brachet et Clerc",bordel
1902,"Institutrices, Mm"" Monry et Bordel",bordel
1902,"Institutrices, Mlle Martin, Mmes Bertrand et Bordel",bordel
1902,ChAteaullr_(Ir.-Bordel. Perins-Chabat. Plan-de-Baix. Peris. Châteaudoub. Oddolaies. Lus-Ia-Crolx,bordel
1902,"MÉVOUILLON. — Maire, M. Favier — Adjoint, M. Aumage. — Conseillers municipaux, MM. Arnaud, Pascal, Armand (E.), Bernard, Quenin, Bordel (C.), Armand (G.), Bordel (dit Bourna), Plaindoux et Dumond",bordel
1902,"Bàtie-des-Fonts : instituteur, N. Page 200. — Bégude-de-Mazenc : institutrice, Mme Bordel, en remplacement de Mme Niel",bordel
1902,"281 — 25 ROCHETTE (LA). — Maire, M. Veyne. — Adjoint, M. Vœuf (M.). — Conseillers municipaux, MM. Tirand, Clément, Vœuf (F.), Rippert, Reynard, Bordel et Pinet(...)M. le Maire, présid., MM. Chanu, Vœuf, Bordel, Paris et Jouve, membres",bordel
1939,"Et il répondait : « Paix sans victoire, c’est pain sans levain, civet sans vin, bar sans câpres, cèpes sans ail, amour sans querelles, chameau sans bosse, nuit sans lune, toit sans fumée, ville sans bordel, porc sans sel, perle sans trou, rose sans parfum, républiques sans dilapidations, gigot sans manche, chat sans poil, andouille sans moutarde",bordel
1849,"2° A M* Bordel, notaire kLsgny(...)environ de trrre, sise Commune de/Vaurj lieu dit la rive ou le pré Bordel(...)",bordel
1917,"La seconde Foire commerciale de Bordel Nous avons rendu compte en son temps de la première t., commerciale de Bordeaux qui fut inaugurée, le 5 se te 1916, par M",bordel
1848,"Bordel-Deshautschamps. mis en réforme, M. Baillaud, (Charles-Emile",bordel
1927,"M. Pierre Schwèisgulh, ancien directeur du Crédit National, administrateur de In Société Générale Alsacienne de Banque, sont élus comme administrateurs,...en remplacement rie MM. ■: Lucien-.Bordel",bordel
1950,"En arrtvant dans cette ville le jeune Bordel est victime d'un accident d'auto et doit être hospitalisé(...)Le jeune Bordel ne cesse de louer les infirmières soignantes et celles de la CroixRouge qui le visitèrent souvent, lui apportant force gâteries",bordel
1921,"2) La Révocation de l’Edit de Nantes. — (« Courrier du Dimanche » 1919-1920). (3) A. Bordel, Histoire de l’Eglise réformée de Nîmes",bordel
1891,468 Massart el Bordel,bordel
1996,"Langoureusement allongés sur le sable de notre atoll nous lançons notre message à la mer, modeste contribution au ""bordel ambiant"" qui agite le microcosme",bordel
1996,"Et la serpillière bordel, qui c'est qui va la passer(...)",bordel
1905,"Odon de Touquin, chevalier, Euphémie 57, 59 TOURNA Y, (Denis) 40 TOURNAI, (Gui de) 42 TRI BORDEL, Jean 80, 84 TRINEL, (Triangulum), (Aube), arrondissement de Nogent",bordel
1925,Bordel R(...),bordel
2014,"demeure qu'il s'organise autour de deux grandes catégories : la prostitution légale, qui s'inscrit dans le cadre des bordels publics (mancebias), et la prostitution « libre » (clandestine ou non), prohibée et réprimée par les autorités",bordels
2014,L'établissement de ces bordels publics participait d'une volonté des autorités royale et municipales de limiter la violence urbaine et de renforcer les mécanismes de contrôle social des pouvoirs publics(...)Il convient cependant de relever que cette valorisation des bordels municipaux n'a pas rencontré partout le même écho,bordels
2014,Cette perduration des bordels municipaux se pose comme une particularité espagnole(...)Il est difficile de savoir combien de femmes travaillaient dans les bordels publics dont la taille devait notablement varier d'une ville à l'autre(...)régir la vie intérieure des bordels(...),bordels
2014,"recluses dans le bordel, les prostituées étaient alors entretenues aux frais de la ville(...)Les bordels ouvraient généralement à 8 heures du matin, mais la réglementation ne fixait pas l'heure de la fermeture",bordel
2014,Le port de ces vêtements leur était imposé sous peine d'amende dès lors qu'elles sortaient du bordel,bordel
2014,"Vicente Graullera Sanz a observé que le bordel public de Valence(...)C'est moins — semble-t-il — dans les bordels clandestins (dont les mentions sont encore rares ; le cas de Madrid, où l'on dénombre 80 lupanars au milieu du XVIIème siècle apparaît comme une",bordel
2014,"données quantitatives) aux prostituées de toute nature : bordels publics, prostituées « épisodiques », femmes mariées conciliantes qui trouvaient là un moyen d'arrondir leur fins de mois",bordels
2014,En 1581 ils fondent la Casa Pia pour accueillir les prostituées repenties et militent pour la stricte application des ordonnances relatives au bordel,bordel
2014,"rapport à la France) est qu'on y trouve une prostitution officielle florissante dans le cadre des bordels publics municipaux (mancebias) quasiment jusqu'au milieu du XVIIème siècle, soit bien plus tard que partout ailleurs",bordels
2014,"On comprend dès lors pourquoi la prostituée, et notamment l'entremetteuse et tenancière de bordel, s'est imposée comme une figure(...)",bordel
2014,"le volet obscur de la prostitution qui demeure difficile à cerner, notamment en ce qui concerne les proxénètes et autres tenanciers de bordels",bordels
1920,"A EklWI/1111.,. s0'J A'ég-ofol 4 .58 G, Garner cIIS.(. Bordel.. F^RD 4 5q VO'. part. H. Davison... Saijlj Sa Ilisel",bordel
1883,Bordel,bordel
1883,"Je continue : c En effet, il ne se passe pas un jour sans que M. Bordel ne soit au palais national avec M. Salomon(...)",bordel
1963,"Kessel qui, dans sa Rage au ventre, écrivait en 1927 que « rigoler et économiser est le seul but du peuple français, le bordel et le bas de laine sont les pôles de son existence(...)",bordel
1919,"un lot IHRNA1S p. cliev. force moy.: à lx>ui. vides bordel, whfcky cliauip.. iHres. parisiennes nn lot caseo-ts et papiers viles à fruits et prim",bordel
1882,"de la mère patrie, et fit étrangler Jean de Bordel, Pierre Bourdon et Mathieu Vermeil",bordel
1938,"Rolande Bordel (20 ans), sana de Pignelin, par Nevers (Nièvre), aînée de cinq enfants et maman malade(...)",bordel
1929,"terre est un bordel et Paris, la capitale du bordel national",bordel
1929,C'est un bordel,bordel
1928,"Ce disant, il rougissait affreusement. — Le bordel(...)",bordel
1861,"ci-après, déc. 1672.. — En ce temps-Jà, un savant jésuite, Louis, Bordel, professait la Philosophie et les Humanités dans le collège de Ja Trinité",bordel
1896,"Outre les excellents coureurs toulousains que nous connaissons déjà nous avons été heureux de voir les Bordel lais, qui ont fait vivement impression",bordel
1909,"Frédéric, patron de la drague Pholade, pour avoir employé un canot, du bordel certains hommes de l'équipage à un service absolument étranger à celui de l'Administration",bordel
1891,"Etienne Bordel, la vente que celui-ci lui avait(...)",bordel
2001,"SI les .Seigneurs tit EtUpcr. c.vaicn: ehc: eux Ja Chw.bred:t Bordel, â-pîtss-fortc-raison Rcu-.ioa t or» y -rti avait-il d(...)ns le palais du Roi : fousHmri-7 on voyait.^"" 1 ' ci-cote un écriteau ferla porte du Bordel royal, ou on lisait",bordel
2001,66 Abréviation de boucans (bordels de bas étage(...),bordels
2001,"Centrée sur le monde de la prostitution (comme son nom pourrait l’indiquer, mais on doit constater que la liste alphabétique des notes s’était arrêtée à la lettre P dans l’édition précédente), elle est à la fois une sorte de carnet d’adresses des bordels de la capitale et un recueil d’anecdotes relatives à ce milieu",bordels
2001,"Si les seigneurs avaient chez eux la chambre du bordel, à plus forte raison y en avait-il dans le palais du Roi(...)écriteau sur la porte du bordel royal, où on lisait : Chambre des filles de joie du Roi",bordel
1947,Coucke Micheline Bordel M.-A,bordel
1918,"50 kilos, du Oqrole affi'.é- 1 kmie bordel la i«s Majrmy RoosO(...)",bordel
1893,"I Reinert, sorg.-inaj. au l°r rég. — 2 Vinel, serg.-maj. au 4"" rég. — 3 Biirrus, ssrg. au 1er rég. — 4 Gomicn, serg. au 2"" rég. — 3 Kernévès, serg. au l 01' rég. — 6 Marest, serg. au pr ,.ej,-. — 7 Bordel, adjud. au 3e rég. — 8 Dubois, serg. au 3"" rég. — 9 Bernard (A.-M.), serg",bordel
1904,"Ton/.é, Bordel, de Védrincs, Bala/.ug, Goudot, Ebslcln, Barbier",bordel
1934,Il roulait les « r )) comme un torrent les cailloux : « Bordel de Dieu I Quelle est l'andouille qui m'a envoyé cette pièce(...)Enfin Bordel de Dieu(...),bordel
1934,"Enfin, un bordel retiré, peint en violet vif, semblable à un blockaus et tenu par un ancien sergent de la(...)",bordel
1934,"les bordels du boulevard de la Chapelle(...)Parfois cependant ils commettaient des erreurs. — « Allô I C'est bien le bordel du 104, boulevard de la Chapelle(...)",bordels
1934,"Il nous racontait de. somptueuses histoires de bordées et de bordels avec un inséparable à lui qui était maintenant à la prison du Cherche-Midi : « Un jour, au clac (à Fontainebleau, rue du Chemin de fer. Cinq pensionnaires. Un tout petit bordel des familles) — je monte avec ma gonzesse",bordels
1934,"Gouesnon était célèbre pour son incapacité à s'habiller correctement en troupier français (Krabbe l'accablait sans aucun succès d'observations incessantes) et aussi, parce qu'un soir, étant émêché, au bordel, il avait joué du piano à coups de tabouret",bordel
1934,"LES PRIMAIÈES Robert, a trente-sept bordels en Syrie(...)Toto Roi du Bled patron de bordel(...)Une chouette petite poule de bordel",bordels
