year,sentence,key_word
1878,"Chez nous, en Bretagne, dans les parages sinistres de la baie des Trépassés, on dit que les pauvres habitants de la côte,, venant en aide à la colère de(...)",trépassés
1878,"Le vieux lord trépassé, sir Williams s'était montré désireux d'établir des rapports plus fréquents et plus intimes",trépassé
1836,"Sur ces entrefaites, un écuyer parut, qui dit que le châtelain venait de trépasser dans d'horribles, convulsions",trépasser
1836,"Mais dès que la trépassée eût touché le fond du trou, elle commença à s'agiter et à pousser des cris aussi perçans que pitoyables",trépassée
1836,"Enfin, je consentis dans l'espoir de trépasser durant la traversée : j'aurais préféré un coup de pistolet entre les deux yeux(...)",trépasser
1836,"Lucain était de la même opinion que nos premiers missionnaires lorsqu'il dit aux prêtres de la Gaule : « Vous ne faites point descendre les ombres dans la » nuit de l'Erèbe, dans le triste séjour des trépassés",trépassés
1923,Un vieil avare vient de trépasser en léguant ses biens à l'église,trépasser
1923,"Des gens que tout condamne à s'aimer, à se manifester du moins les marques apparentes de l'affection, il les voit affrontés, près de trépasser sous le poids de l'attente horrible",trépasser
1849,"Mourir, subir le trépas , se dit en français trépasser",trépasser
1849,"Emicare, resplendir^ Emigrare, trespasser",trespasser
1849,"Excedere , trespasser",trespasser
1849,"Prevaricari, trespasser",trespasser
1900,"sonnic, « Du vent froid qui souffle à l'heure actuelle, tellement froid qu'on me dirait sur le point de trépasser(...)",trépasser
1900,"Les siens, à la même place, Retrouveront, à mer basse, Ses membres déjà glacés Elle pourra tout entière S'endormir au cimetière Parmi les chers trépassés",trépassés
1882,"vingt plantes qu’il aura vendues, il en verra trépasser deux cents chez lui, qui attendaient le client",trépasser
1861,"Il sera célébré un anniversaire pour tous les trépassés de la tribu, et(...)",trépassés
1861,"A l'entendre, il était toujours à la veile de trépasser",trépasser
1916,"3 — f NOS MORTS Parfois la supplication chrétienne en faveur des pauvres âmes des soldats trépassés donne lieu, même sur les champs de bataille, à des cérémonies d’une émouvante grandeur(...)Quant à nous, mes chers paroissiens, joignons-nous par la pensée à tous les aumôniers militaires et aux prêtres- soldats, pour les accompagner dans leurs promenadtes funèbres, et prier, sous leur conduite, pour les fidèles trépassés sur les champs de bataille",trépassés
1867,"Baudeau de Somaize était donc l'ennemi intime de Molière lorsque Scarron vint à trépasser, le 20 octobre 1660",trépasser
1867,"de tant de papier, et imploraient le pape d'une voix qui, disait-il, sera bientôt celle des trépassés (2(...)",trépassés
1858,"crainte que votre attention nous fasse défaut, nous ne vous expliquerons pas comment il se fait que Sabine, la soubrette improvisée, devient princesse russe, vu que son premier époux a eu le bon esprit de trépasser définitivement",trépasser
1859,"Il y a mieux, et cette considération a sa valeur qui n'échappera à personne : vient-il à trépasser avant le versement complet de ses primes temporaires, la somme assurée(...)",trépasser
1899,"Citons encore un Portrait de Beethoven, curieux surtout comme travail à la plume, de Victor Rousseau, et une toile, influencée peut-être par Turner, Dans la baie des Trépassés, signée Orner Coppens",trépassés
1899,"VITRAIL, IMPOSTE DE LA PORTE D'UN BAR (BOULEVARD MONTMARTRE) LA RUE PITTORESQUE DEVANTURES ET BOUTIQUES DE l'obscur Ancelot, qui consentit à trépasser en 1854, après avoir doté théâtre de France d'innombrables inepties, dont l'Homme du Monde (1827) et le Mari de ma fille (1840), sont les fleurons les plus incontestés, il ne me revient qu'un seul vers, le vers d'ironie et d'amertume d'un mauvais poète, vexé d'avoir manqué sa vie et d'avoir chevauché si longtemps un Pégase boiteux, alors que la(...)",trépasser
1833,"pouls petit, et se croyait prêt à trépasser",trépasser
1893,"A trois jours de là, le notaire à qui monsieur avait laissé tous ses ordres bien avant de trépasser me fit appeler chez lui",trépasser
1905,"ces blessures énormes dont les balafres faisaient peur,quand on pouvait les refermer, celle dont La Hire finit par trépasser fut, au dire de nos sirventes,et complaintes gasconnes, la plaie béante que la nouvelle de la mort de Jeanne ouvrit au cœur de son mélancolique capitaine",trépasser
1905,Elle porte ces mots : « Trépassés du siège,trépassés
1905,"Enfin, Mgr l’Evêque d’Orléans reprenait une plus que séculaire tradition, renouvelée en 1803 par Mgr Bernier, en autorisant son Chapitre, en 1903’ à célébrer un service de Requiem pour les « Trépassés du siège de 1429 » (1(...)Les Trépassés du siège d'Orléans (1428-1429), par lu chanoine Cocn.utn, in-S de 80 pages. — 1903, Orléans, librairie Hcrluison",trépassés
1905,"toute la nuit ce fut un carillon à réveiller les trépassés jusqu'au Mont-Saint-Michel, au péril de mer, et jusque dans les champs de Karnak, le long du Morbihan",trépassés
1916,absoute pour les fidèles trépassés(...)A 9 h Messe solennelle funèbre suivie de l’absoute pour les fidèles trépassés,trépassés
1885,"Le malade venait-il à trépasser, il était enseveli aux frais des membres de l'association qui tous escortaient le cercueil et étaient présents à l'absoute, un cierge à la main",trépasser
1885,"Mais ce qui était alors une faveur accordée aux empereurs devint commun aux fidèles, après le concile de Vaison, sous le pape Léon Ier au milieu du ve siècle « afin dit Yves de Chartres, » de faire plus particulièrement profiter les trépassés des » prières de l'Eglise(...)",trépassés
1912,"le père Chaboulet qui, à la veille de trépasser, recommande à sa bru d'acheter le pacage de Bordier s'il se vend après sa mort, de lui faire faire une bière solide en bois de cerisier et qu'il voudrait presque essayer",trépasser
1888,Je crus qu'il allait trépasser,trépasser
1888,"aux yeux des spectateurs étonnés, un grand fantôme blanc, qu'on eût dit un trépassé sorti de la tombe, encore enveloppé de son suaire",trépassé
1888,"Puisque vous ne voulez pas me laisser faire le miracle à présent je le ferai un autre jour, non en ressuscitant un trépassé, ce que vous ne voulez pas me permettre, mais en vous empêchant de mourir",trépassé
1925,Et l'on avait fait si bonne chère que deux des convives en faillirent trépasser,trépasser
1926,"Mais eux, les villageoiSj au pied de leur clocher, Ils revivent eà vous la chanson de leur race, Sachant que vous bercez, la nuit, leurs trépassés Et que v^us conduirez lés enfants sur leur trace",trépassés
1926,"Quand de ton rêve trépassé, La voix dolente du Passé T'apporte, un instant., la mémoire, Faire une pipe, mon ami, Enregistre ce vieux grimoire, Cueille(...)",trépassé
1926,"Empoisonné par le fiel de ses intrigues, Narcisse Rendu venait de trépasser de la jaunisse",trépasser
1859,"Je n'oserais pas dire que M. Saint-Marc Girardin nous fasse à cet égard une confession générale, aussi bien n'est-il pas de ceux qui se disposent à trépasser(...)",trépasser
1934,"Si elle ne veut pas de nouveau trépasser sans gloire, elle serait bien inspirée en concentrant ses efforts en vue de sa réalisation, car partout l'on commence à comprendre qu'en persévérant dans l'inorganisation et désorganisation actuelles du commerce international, le monde s'anémie doucement, en vivant encore quelque temps sur ses réserves, vers un stade bien inférieur à celui de la fin du(...)",trépasser
1852,"Lorsque Rt'es forces vitales manquent, totalement épuisées, et que le moribond ~ya trépasser, donnez-lui le poids de quelques grains de Jen-sen, il ~revient à la vie",trépasser
1868,"Il eut l'audace et l'extrême impudence, Etant à bref délai sommé de trépasser, En se laissant mourir de ne point se presser",trépasser
1904,"Pourtant il était admis que les serviteurs d'un grand- seigneur pouvaient, comme récompense de leurs loyaux services, s'ouvrir le ventre en l'honneur de leur maître quand celui-ci venait à trépasser",trépasser
1838,"226-227, cite les expressions du langage courant : périr, passer, trépasser, décéder, rendre son âme à Dieu, expirer, s'endormir, s'en aller, passer l'arme à gauche, casser sa Pipe, s'en aller les pieds devant, manger les pissenlits par la racine",trépasser
1868,"Mais ce que l'on sait bien, par exemple, c'est qu'à la mort de Jacques Ier, ce Baucher, très-peu délicat, s'empara sournoisement du trône au mépris des droits de Pierre son beau-frère, fils aîné du roi qui venait de trépasser, et par conséquent son légitime et droict héritier",trépasser
1916,"3 — Sk- NOS MORTS Parfois la supplication chrétienne en faveur cfes pauvres âmes de-’ soldats trépassés donne lieu, même sur les champs de bataille, à des cérémonies d’une émouvante grandeur(...)Quant à nous, mes chers paroissiens, joignons-nous par la pensée à tous les aumôniers militaires et aux prêtres- soldats, pour les accompagner dans leurs promenades funèbres, et prier, sous leur conduite, pour Les fidèles trépassés sur les champs de bataille",trépassés
1862,"Pour nul cas ne le doibt faulser, Soit vert son espouse ou sa damé, Car mieulx vault loyal trepasser Que desloyal vivre en blasme",trepasser
1912,"Mais de quoi servait-il d'être détendu de la mort subite si l'on venait à trépasser hors de la grâce dé Dieu, et de quel réconfort n'était-on point privé, si l'on mourait sans viatique ■$'■ Contre un tel malheur rien n'était plus efficace que la dévotion à sainte Barbe, et",trépasser
1922,"Jeudi 2 novembre, à 9 houres : Meose solennelle daHequiem pour los Fidèles trépassés",trépassés
1922,A 9 heures : Messe solennelle de Requiem pour les fidèles trépassés,trépassés
1897,Valait-il pas mieux trépasser que de voir de telles horreurs,trépasser
1897,"existence le pauvre trépasse voulait se reposer. de suite un Ange-Indicateur surgissait du milieu des nuages. un ange au regard inflexible qui de la dextre, faisant un geste impératif, semblait dire marche Lui, qui voyait avec les yeux de l'Ame, obéissait",trépasse
1897,"Cette âme s'est égarée en chemin, mais c'est bien ici qu'est sa place 1 Et Jésus s'approchant du pauvre trépassé, l'embrassa tendrement en lui disant tout bas Entre, mon frère de souffrance, toi qui connus la douleur d'être un homme",trépassé
1863,"Et, pourtant, M. Feuillet n'eût pas été de l'Académie, sans M. Scribe , malgré Monsieur Dupan- loup, à moins que Monsieur Dupanloup ne fût trépassé d'aise en lisant Sibylle(...)",trépassé
1863,"Ma patience n'est, pourtant, pas de l'indifférence, et la preuve est que je suis toujours en fièvre, quand un Immortel vient à trépasser",trépasser
1948,"Cela ne vous empêchera peut-être pas de trépasser, mais, au moins, v °s parents et amis auront bien chanté et bien bu(...)",trépasser
1868,"Le coup d’œil était triste: des chats maigres, à l’œil éteint ou hagard, aux membres enveloppés dans des langes, semblaient être sur le point de trépasser",trépasser
2018,"Plutôt que vivre sans honneur, mieux vaut trépasser dans la gloire(...)",trépasser
1934,"La vie est courte, en vrais lurons, Profitons-en, puis nous verrons À trépasser, pauvres bourdons Que l'amour tue aux pieds des reines",trépasser
1874,Le moyen-âge se préoccupait beaucoup des trépassés,trépassés
1874,Les pierres elles-mêmes proclament la ferme confiance des vivants dans les suffrages des trépassés,trépassés
1874,Comment et quel jour vint-il à trépasser(...),trépasser
1869,au moment de trépasser se prévalaient de leur grand âge et de l'autorité de la tradition,trépasser
1918,"6 NOVEMBRE 1918 11 La Gommémoraison des Morts (2 Novembre) Par Commémoraison de tous les Fidèles trépassés on entend le jour fixé par l’Eglise pour faire mémoire générale de tous ceux qui sont morts dans la grâce du Seigneur, mais que le Souverain Juge n’a pas trouvés assez purs, au sortir de cette vie, pour les laisser entrer de suite au Ciel(...)le lendemain on sonnera encore toutes les cloches, on dira les Matines, et les prêtres célébreront la Messe pour les fidèles trépassés",trépassés
1918,"Service solennel pour les Trépassés de la Paroisse, Procession au Cimetière. — 8 h. soir",trépassés
1918,"Octave des Morts, — Vêpres des Morts à 8 h. du soir, service pour les Trépassés à 8 h. du matin. — Les quêtes à tous les offices sont(...)",trépassés
1887,"Si le Passant a le même destin, il entend bien trépasser au bruit des fourchettes, et non sans boire",trépasser
1890,"333 l'honneur que nous aurions de trépasser entre les mains d'un docteur, au lieu de succomber entre celles, beaucoup moins savantes, d'un officier de santé",trépasser
1896,d'aider le pape à trépasser,trépasser
1907,"et, lorsqu'ils étaient malades et que le curé, en vertu des ordonnances royales, venait les sommer de se confesser et de recevoir l'extrêmeonction, les uns, pris de remords, protestaient ouvertement qu'ils voulaient être fidèles à leurs premières croyances, et ils mouraient relaps, les autres, moins courageux, cherchaient des atermoiements, renvoyaient l'affaire au lendemain, espéraient trépasser avant d'avoir accompli l'acte que réprouvait(...)",trépasser
1873,"lit l’un, voilà qu’un bien brave homme es trépassé",trépassé
1873,"Si elle allait trépasser, maître Bedfort se déclare rait volé comme dans un bois",trépasser
1873,Ça ne vous changera pas beaucoup de trépasser(...),trépasser
1873,"Est-ce que Bright n’est pas massacré, anéanti, perdu, trépassé",trépassé
1916,"soldats trépassés donne lieu, même sur les champs de bataille, à des cérémonies d’une émouvante grandeur(...)Quant à nous, mes chers paroissiens, joignons-nous par la pensée à tous les aumôniers militaires et aux prêtres- soldats, pour les accompagner dans leurs promenades funèbres, et prier, sous leur conduite, pour les fidèles trépassés sur les champs de bataille",trépassés
1916,"a-t-il dit : C'est ma fête, Cette fête des Trépassés(...)Requiem esternam et serment de vengeance Sur les tombes des Trépassés(...)",trépassés
1894,cependant deux qui venaient de trépasser étaient (i) Voltaire,trépasser
1839,"mon enfant (c’est ainsi qu’elle appelait Catherine) et M. Frédéric promettent à Dieu de regarder comme leur fille, et de traiter comme telle, la pauvre petite de maître Nicolas Covenn, qui, comme vous le savez sans doute , est prêt à trépasser du chagrin qu’il ressent d’avoir perdu sa femme le jour de la naissance d’Antonia, puisque c’est ainsi(...)",trépasser
1916,"D’ORAN REVUE PAROISSIALE =— La Gommémoraison des Fidèles trépassés Nos pères avaient une foi prolonde, ils en avaient aussi ioute la délicatesse de sentiments(...)Il renferme cependant l’idée du passage d’une vie à une autre, sur laquelle la mort elle-même n’a plus d’empire, Parlons donc avec l’Eglise des fidèles trépassés",trépassés
1916,"378 — Le ciel est impuissant à les secourir, aussi les regards de nos chers trépassés se tournent vers la terre, attendant, réclamant, espérant de notre charité, de notre tendresse fraternelle l’allégement de leurs souffrances, l’acquittement de leurs dettes qui brisera leurs chaînes et leur ouvrira le ciel(...)Saint Odilon abbé de Cluny, au dixième siècle, parait être le premier qui ait eu l’idée de consacrer un jour particulier à la commêmoraison générale des fidèles trépassés",trépassés
1916,"380 — riand VI et Jean V, permit à tous les prêtres de ces deux royaumes, de célébrer trois messes le jour de la Commémorai- son des fidèles trépassés, et même de pouvoir les dire jusqu’à deux heures de l’après midi",trépassés
1916,"Aimons ces chers trépassés, mais aimons-les de la bonne manière, fleurissons leurs tombes, visitons leurs dernières demeures, mais surtout prions pour leurs âmes, travaillons à leur(...)nos mains, si nous le voulons, ruisselleront de grâces rafraîchissantes qui les soulageront, apaiseront leurs souffrances et leur donneront joie et bonheur. * * * Douce fête de la Commémoraison des fidèles trépassés tu auras consolé nos douleurs et porté à ceux que nous avons perdus la paix",trépassés
1916,Absolution générale pour les membres du Tiers-Ordre. g — Commémoraison des fidèles trépassés.— Messes basses à 5 h,trépassés
1898,"certains pays ont aussi trois messes au 2 novembre, afin de multiplier les grandes supplications qui se font pour les trépassés, La fêle de la -Commémoration des défunts est d'origine toute française(...)Au mpment où la dévotion à la Commémoration des trépassés aoq-iaierl ainsi comme un renouveau, il est juste de rappeler qu'un postulutmn, sj,gné de nombreux évêques, a supplié Léon XIII de vouloir bien étendre à tous les diocèses le privilège accordé à quelques-uns, de célébrer trois messps pour les(...)",trépassés
1898,"cela avait eu lieu aussi,ily a centcinquante ans, lorsque , BenoîtXIV, afin de m ultiplief les suffrages pourrbss trépassés et soulager les âmes du Purgatoire, céda aux désirs des peuples et des rois, écartant ^'ailleurs par",trépassés
1905,"comme trépassé, /c/c, etc",trépassé
1905,"corsaire la peut avoir », <' très peu contraint, semble-t-il, sur le vœu de chasteté Au demeurant, «: un brave gentilhomme, qui ne manquait pas de sens », et que M"""" de Sévigné appelle indulgemment mon oncle le pirate Or, quand il eut 68 ans, son heure de trépasser, il éprouva d'abord une certaine peine à se résoudre à mourir, dit Bussy",trépasser
1850,"besoin d'extrait de naissance , et les mauvaises se passent d'acte - mortuaire pour trépasser en temps, utile",trépasser
1846,"diverses coutumes qui offrent le caractère le plus bizarre, et montrent l'ascétisme dont les idées étaient imbues, on remarque celle des Clocheteurs des trépassés, qui ne survécut que peu d'années à l'époque dite du moyen-âge(...)On appelait clocheteurs des trépassés des hommes vêtus d'une dalmatique blanche, chargée de têtes de morts, d'ossemens(...)",trépassés
1916,"2 i— NOS MORTS Parfois la supplication chrétienne en. faveur des pauvres âmes des soldats trépassés donne lieu, même sur les champs de bataille, à des cérémonies d’une émouvante grandeur(...)Quant à nous, mes chers paroissiens, joignons-nous par la pensée à tous les aumôniers militaires et aux prêtres- soldats, pour les accompagner dans leurs promenades funèbres, et prier, sous leur conduite, pour les fidèles trépassés sur les champs de bataille",trépassés
1877,"Elle était si pâle et si défaite, qu'on eût dit qu'elle allait trépasser",trépasser
1935,"Sur le Pont-Neuf tout encombré des civières qui portaient les malades ou les trépassés, quelqu'un mit dans les bras du roi Henry un drapeau noir",trépassés
1935,"en cas qu'il viendrait à trépasser, ou encore que sa mère en demandât des nouvelles",trépasser
1935,"il en vint tant, que, craignant de perdre tout, le maréchal renonça à ses beaux projets, et se décida de trépasser sans rien rendre à personne",trépasser
1935,"Et, de ses cent clochers, montaient, avec l'angélus, les glas qui annonçaient les prières pour les trépassés",trépassés
1935,"Donc Saint-Maixant, redoutable seigneur, bénéficia sa vie durant de terribles légendes quel'onn'ose prononcer que lorsque les gens ont trépassé",trépassé
1935,"autant de satisfaction qu'il en avait ressenti jadis à liquider Louvois, père du trépassé",trépassé
1935,Il est bien vrai que Bouille ne se décidait pas à trépasser,trépasser
1935,"la montra pas, répondit qu'elle la montra à là demoiselle de Séquevillê, qui lui défendit d'en parler à per-: sonne (la- demoiselle de Séquevillê étant trépassée alors, ce qui donna lieu à cette réponse(...)",trépassée
1979,"La chose est encore bien plus atroce, si c'est un chef qui vient à trépasser pour garder la tombe de ce tyran, outre la demi-douzaine de femmes que l'on brûle avec lui, on attache quatre hommes aux quatre coins de la fosse, et pour les empêcher de fuir, on a soin de leur",trépasser
1906,qui était Coûte proche de trépasser et qu'il fallait réconcilier aveeleciel,trépasser
1909,"et ne sont pas près de trépasser, le directeur est un journaliste qui, s’il ne se désintéresse pas du côté industriel et commercial de son entreprise — et il le faut bien, car les profits des abonnements et de la vente en ce temps de journaux à bon marché ne couvriraient pas les frais — porte toute son attention au côté politique et social de son œuvre, marche avec ses collaborateurs en confiance, la main dans la main, et ne songe point ù les exploiter",trépasser
1924,Une jeune malade couchée est si livide qu'elle semble près de trépasser,trépasser
1878,"Retire-toi, veuilles me renforcer avant que j'aiMe trépasser",trépasser
1888,"Bothwell serait empoisonnée et sur le point de trépasser, tandis qu'en vérité elle a vécu encore de longues années après son divorce, avec deux autres époux consécutifs",trépasser
1898,elle va nous trépasser entré les mains(...),trépasser
1898,"Puis un moment arrive où le trépassé commence à revivre : les tarses d'avant, puis ceux d'arrière oscillent(...)",trépassé
1925,"CHATEAUROUX Mod9S fournitnm pour Modes — Deuil Parfumerie Cadeaux et Souvenirs farces et attrapes comiques Articles pour Cotillons En haute mer, à l’extrême pomte du Finistère, séparé de la terre par la sinistre baie des Trépassés, le phare de Gorlébella dresse sa silhouette triste et désolée Le chef, gardien vigilant du feu(...)",trépassés
1925,"Rue Molière Maison de confiance ti des meilleures conditions que partout ailleurs location - Réparations - Accords forme de Gorlébella et, rebonidssant de rochers en rochers, s’enfonçait dans les flots de la baie des Trépassés",trépassés
1931,"ils redoutent les souffrances qu'ils ont encore à endurer avant de trépasser, ils ne se préoccupent pas du jugement de Dieu(...)",trépasser
1916,"3 — * NOS MORTS Parfois la supplication chrétienne en faveur de'S pauvres âmes des soldats trépassés donne lieu, môme sur les champs de bataille, à des cérémonies d’une émouvante grandeur(...)Quant à nous, mes chers paroissiens, joignons-nous par la pensée à tous les aumôniers militaires et aux prêtres- soldats, pour les accompagner dans leurs promenades funè,- bres, et prier, sous leur conduite, pour les fidèles trépassés sur les ciiamps do bataillo",trépassés
1873,"Que décider autrement, outre que ce serait méconnaître et ou trepasser le but du législateur, ce serait encore faciliter à l'esprit de chicane et de mauvaise foi le moyen de transporter arbitrairement et à sa guise des juridictions établies par des dispositions d'ordre public(...)",trepasser
1894,sais-tu qui vient de trépasser,trépasser
1916,"3— i NOS MORTS Parfois la supplication chrétienne en faveur des pauVtfefc âmes des soldats trépassés donne lieu, même sur les champs de bataille, à des cérémonies d'une émouvante grandeur(...)Quant à nous, mes chers paroissiens, joigtnons-nous par la pensée à tous les aumôniers militaires et aux pTêtre^soldats, pour les accompagner dans leurs promenades fitnèbres, et prier, sous leur conduite, pour les fidèles trépassés sur les champs de bataille",trépassés
1915,"Le Vendredij, Service pour les Fidèles Trépassés, spécialement pour les Soldats morts pendant la guerre",trépassés
1915,"Mardi 2 Novembre. — Fête de la Commémoration des Fidèles Trépassés. — Messes basses à 6 heures, 7 heures et 8 heures",trépassés
1915,"Des Services pour les Trépassés seront célébrés pendant le mois(...)en outre des jours de l’Octave des Trépassés, les Vendredis 12, 19 et 26",trépassés
1912,"Aujourd'hui la fabrique fournit an brancard ad hoc, mais le drap fourni par les parents du trépassé et la moitié du luminaire demeurent acquis au curé",trépassé
1912,On conserve l'un de ces rameaux dans le fond de l'armoire pour les temps d'orage et pour le cas où un membre de la famille viendrait à trépasser,trépasser
1917,"Commémoraison de tous les fidèles trépassés ESPÉRANCE A CEUX QUI PLEURENT «Nous ne nous souvenons pas assez de nos chers trépassés, disait saint François de Sales",trépassés
1891,"Avant de trépasser, ses voeux avaient-ils donc été réalisés",trépasser
1887,"Hermès et conduisant devant son juge celui qui venait de trépasser, n'a que la tête de chien d'Afrique 2 et le 4",trépasser
1914,"Sr G., étrennes, pour l'autel des trépassés, 10 fr(...)",trépassés
1914,"Pour la chapelle des trépassés, Mme Régnier, à Pont-à-Mousson, 5 fr.– « N.-D. de L., protégez-nous », Bey, 20 fr(...)Pour le salut des trépassés, famille Toussaint, 60 fr",trépassés
1914,"En mémoire de M. et Mme Alexandre Boucherez, à Thionville, pour la chapelle des trépassés, 12 fr",trépassés
1914,"Paul Husson, pour la chapelle des trépassés, en souvenir de ses défunts, Pont a-Mousson(...)de Chevigny, pour la chapelle des trépassés, 20 fr(...)",trépassés
