year,sentence,key_word
1893,"La première fois que j'y goûtai, le palais en feu, leB entrailles en révolution, je crus que j'allais trépasser",trépasser
1884,Il avait d'autres raisons pour trépasser,trépasser
1863,"une quinte traîtresse, certain joueur de viole, trop ami de la pinte, venait de trépasser",trépasser
1887,Il vient de trépasser .omine un idiot(...),trépasser
1865,"Comm' ce s'rait un' injustice De ne pas récompenser L'art de se fair' trépasser : Je veux, dit maître Maurice, Un' somm' de cinquant' miil' francs, A litre d'encourag'ments",trépasser
1913,"1 Quand j'entends une femme de Ion embonpoint § — de ton appétissant embonpoint — parler de la § sorte, je crains toujours de trépasser dans une crise de fou rire(...)",trépasser
1865,"bruit mat d'un corps qui tombe Dans l'eau qui roule au long du quai : Là-bas, près de la Tour de Nesle, Quelqu'un vient-il de trépasser",trépasser
1916,"PROVERBES Octobre glaçé Fait vermine trépasser. * * An En octobre qui ne fume bien Ne récolte rien Qui sème à la Saint Denis Contemplera ses amis * # * Bel automne, printemps pluvieux",trépasser
1838,"Tels, a- vant de trépasser, comme disait hier M. Royer-Collard, la fouine(...)",trépasser
1838,"coryphée de l’incapacité, de la corruption et de la servilités va trépasser",trépasser
1878,"Elle arriva trop tard, triste coïncidence, Il faisait sombre et lui venait de trépasser, On entendait au loin une fête, une danse, La Gaité ne voyait pas la Mort se dresser",trépasser
1892,"une lettre d'un notaire de province, le prévenant qu'un de ses parents fort éloigné venait de trépasser, le laissant seul héritier d'une petite fortune assez rondelette",trépasser
1923,le .tripotage malprope des denrées alimentaires.nous devrions tous trépasser à là fleur de l'âge,trépasser
1853,"Maïs à quoi hbn tant amasser, Me dis-je ensuite""en ma raison grossière, s ■ Puisqu'il faut toujours trépasser Et s'en(...)",trépasser
1853,dans quelques jours. ' ■ ■ ï ItoMiio-ColleuilIe. — Les acteurs croque- j morts continuent à exhumer de la tombe des vau- 1 t devilles trépassés depuis cinquante ans,trépassés
1875,"Ce beau «adet ne s'est point jeté dans la rivière pour y trépasser volontairement, j'imagine, puisqu'il se débattait tout à l'heure comme Un diable dans un bénitier(...)",trépasser
1875,"c'est bien dommage,foi de Joson, de trépasser vilainement quand on est si jeune et si gentille que ça",trépasser
1846,"Si, près de trépasser, pauvre auteur, H doit craindre D'avoir porté trois noms pour n'en laisser aucun",trépasser
1862,"et alors je cherchais parmi mes parents, celui qui pour me faire son héritier, aurait eu l'extrême obligeance de trépasser",trépasser
1875,"Ce délit étrange a consisté à apprendre brusquement à une vieille dame la mort de son fils, ce qui l'a fait trépasser sur le coup",trépasser
1809,"La peur de trépasser, rend Julio de la plus grande ponctualité à exécuter celte ordonnance(...)",trépasser
1886,"moi, mon cher, c'est précisément la seule chose au monde que je n'ai jamais pu comprendre.' Une concierge parle d'un de ses locataires qui vient de trépasser",trépasser
1834,"Plus d'un accroc avait signalé ce trajet continuel, et sans doute le misérable pourpoint allait sous quelques jours achever sa triste existence, quand le j-uge vint à trépasser, Vendu de rechef, il fut contraint(...)",trépasser
1894,"Quand tombent les feuilles d'automne, On en voit beaucoup trépasser",trépasser
1909,"fous deux complotent leur évasion... hélas : Fana est. usé par sa longue détention et n'a plus longtemps à vivre : ht mort ""le surprend, tuais avant de trépasser, il conlie il Dantès le secret (l'un trésor(...)",trépasser
1877,"Un homme qui a trop longtemps vécu vient-il à trépasser définitivement, cinquante échotiers écrivent le lendemain : « Nous venons de perdre notre pauvre Nicolas",trépasser
1915,ou celle du preux qui se réjouissait de trépasser pour son Dieu et pour son Roy(...),trépasser
1913,"Les magistrats considéraient eux aussi, d'après les certificats médicaux, que cette épave humaine dont l'intelligence seule n'avait pas été atteinte, ne devait pas tarder longtemps à trépasser(...)les trépassés",trépasser
1913,"Vingt fois pendant le voyage, il faillit trépasser et il arriva à Lourdes dans le plus pitoyable des états",trépasser
1913,"Une autre fois, l’amusant comédien, faillit trépasser des suites d'une terrible indigestion de macaroni",trépasser
1897,"Il mangea, but, vendit,-troqua,, donna 1 tout ce qui restait du bien de la famille, et finalement se résigna à trépasser, un peu avant qu'il ne '■ restât même plus de quoi l'enterrer en ce caveau dé la cathédrale que fermait une superbe dalle de :■■ marbre gris écussonnèe de(...)",trépasser
1897,"it-juste-au même instant l'pauv' vieux *m-' Soupira, puis ferma les yeux, XnAttendant c""baiser d*paix sans doute' Pour trépasser si",trépasser
1840,"Sur cette mer passent deux, trois, quatre vaisseaux quand ils ont assez passé vous croyez peut-être qu'ils vont trépasser",trépasser
1907,trépasser que depuis que je suis résolu d'en finir avec l'exis- tence(...)c'est le cher passé qui va passer et devant lequel je vais trépasser,trépasser
1910,"Dessin de Hérouard. cérémonie, m’invitait à me rendre à la maison mortuaire, tout bardé d’une éloquence appropriée. ...Donc, quand ce pauvre Oscar vint à trépasser, le petit bleu ne se fit pas attendre",trépasser
1909,"C’est peut-être trop compter sur le bon équilibre mental de toute la corporation morticole, et nous croyons plutôt qu’il se trouvera des originaux, qui prendront plaisir, ne serait-ce que par amour du paradoxe, à revendiquer, pour les gué* risseurs officiels, le droit de décider de l’opportunité de la conservation où de la suppression de la vie, des malades, auxquels on ne sautait souhaiter que de trépasser le plus vite pos",trépasser
1829,"Oussé-je trépasser après , il ne sera pis dit que j'aie faussé compagnie en pareille occasion, à tant de braves gens que voilà(...)",trépasser
1829,"la porfe. — Messieurs les capitaines, entrez ici dedans , le pauvre sire Bertrand veut dire un dernier adieu a tous ses vieux compagnons , avant île trépasser ( Las njjiciers entrent dans la maison.) Appartement de Duguesclin(...)paix aux mânes du trépasse'. 'fous. — Gloire, à jamais au grand Connétable",trépasser
1884,"o»— Une concierge parle d'un de ses_ locataires, iqui vient de trépasser. ■ — Pauvre hommo I si sensible(...)",trépasser
1890,"La lugubre cloche du donjon qui, dit la légende, donnait d’elle même le glas quand un Coucy devait trépasser, commença bientôt à tinter des l’apparition de la sombre bannière fouettant l’air de ses plis",trépasser
1920,Pour les bants personnages qui pourraient trépasser il avait été apporlé d’Amérique tout un stock de crrcue ls à fond de zinc et doublés de satin,trépasser
1882,"Qu« la duchesse de Chaulnes ait fait un crible de sou contrat de mariage, à coups de canifs redoublés et fantaisistes, c'était affaire au duo, son époux, qui a eu le bon goût de trépasser, avant la fin de ce(...)",trépasser
1911,"Pour un peu, j’allais trépasser(...)",trépasser
1825,"Dans un hameau de la Belgique, D'une société lyrique Un immortel venait de ""trépasser(...)",trépasser
1912,"Achetez, il va trépasser » : 22). - 56(...)il peut trépasser » : 305 francs",trépasser
1832,Elle serait fâchée de trépasser sans vous dire adieu,trépasser
1899,"quel malheur 1 Dire que tu pouvais comme ça trépasser sans qu'on en sache rien de rien, et qu'on t'aurait trouvée froide ce matin(...)",trépasser
1924,"venir, j’ai été bien malade, j’ai même failli trépasser, mais le bon Dieu qui savait mon utilité ici-bas, ne ta pas voulu et me revoilà, Pendant que je gardais, le lit, j’ai beaucoup réfléchi: la maladie, comme la nuit porte conseil, j’en suis sorti meilleur",trépasser
1929,la prison— lequel vpht d'ailleurs entretemps de trépasse(...),trépasse
1929,"La'strychnime étant en vogue, puis que le pauvre Fauzi el Ohszzi venait d'en trépasser avant quelques semaines le fils trouve un -autre « Mounir el Ghazzi4(...)",trépasser
1894,"Si quelques démissions de sociétaires se sont produites dans l'année, on nous les reproche cruellement, comme si nous pouvions empêcher ceux-ci de trépasser ou ceux- là de lâcher l'enregistrement pour se faire notaires, com- missaires-priseurs, épiciers, ou pour allertoutsimplement planter leurs choux(...)",trépasser
1868,j'ai bien cru cette nuit que j'allais trépasser. — Alors tu' ne pourras pas aller à Paris(...),trépasser
1909,"It toi, fit le roi sans sourciller, quand supozestu que tu mourras t Sire, ,il est écrit au livre du destin que je dois trépasser trois jours avant Votre Majesté",trépasser
1828,"ils abondent dans la société , surtout dans le siècle où nous sommes , et il n est personne qui ne soit tous les jours exposé à tomber dans leurs filets, à commencer par ce pauvre diable, qui, sur le point de trépasser et de livrer son héritage, trouve toujours la des meii— dians qui le cajolent et cherchent il le lui soutirer(...)",trépasser
1836,"Mais, au lieu de trépasser, ainsi que chacun l'avait prédit, le petit Fortuné ne tarda point à prendre des développemens physiques, extraordinaires pour son âge",trépasser
1891,"J'ajoute que ledit opéra est à l'étude depuis quelques jours, et qu'avant peu. il sera prêt à passer... ou à trépasser(...)",trépasser
1901,"Trépasser à la fleur de l'âge, Un homm' si comme il faut, si bien, Avouez que",trépasser
1904,"chance contre 42 mille de trépasser avant le soir : tandis que le total des obligations 1870 émises s'élevant à 1 million 800 mille, il n’a qu’une chance sur 1 million 800 mille de gagner le gros lot",trépasser
1898,L'aumônier du bord et le matelot Martial ont pu échapper au naufrage et constater par écrit la mort du chef qu'ils ont vu trépasser,trépasser
1857,"blêmissent d'effroi, les esprits faibles ont la colique, et les gens forts se frottent les mains en pensant qu'ils vont trépasser en joyeuse compagnie",trépasser
1890,Trépasser ou s'unir à ce monstre,trépasser
1932,Du moins aura-t-elle su trépasser en beauté,trépasser
1928,"c'est lui qui vous dit les fêtes à souhailcr, qui vous parle vite et peu, mais presque toujours agréablement. - Quand vient son heure de trépasser on prolonge avec piété sa vie en l'oubliant plusieurs jours dans la pochette ou dans un coin du portefeuille",trépasser
1894,Les parents et amis ne voulaient pas laisser trépasser M™* T... sans lais ser au moins l'illusion qu'elle aliait comparaître devant Dieu en état de grâce,trépasser
1921,"les qualités, en elle réunies, La firent trépasser bien avant son moment(...)",trépasser
1926,De nouveaux ministères succédant & celui qui vient de trépasser ne dissiperont pas les difficultés au milieu desquelles la France se débat,trépasser
1926,Ne nous leurrons donc pas I De nouveaux ministères succédant à celui qui vient de trépasser ne dissiperont pas les difficultés au milieu desquelles la France se débat,trépasser
1938,"Les sinistrés agricoles, avant de trépasser pour toucher les indemnités du gouvernement, pourraient de la sorte disposer de quelque argent pour vivre et occuper leurs ouvriers",trépasser
1922,"d'un accident, le conducteur d'aulo-camion qui tamponne mortellement un cycliste, et la faute est d'autant plus grave que le conducteur a cherché à con trépasser",trépasser
1841,"Mais un sien parent, seigneur levant bannière, qui l’avait tenu sur les fonts baptismaux, étant venu à trépasser sans laisser de progéniture, le sire Jehan se vit aussi possesseur d'un beau manoir à gothiques fortifications, qui se dressait comme un géant sur la colline en face du prieuré des Bénédictins, et comme il ne manquait jamais de glorifier Dieu le saint jour de dimanche, qu’il était miséricordieux(...)",trépasser
1889,"Et je fais serment de prendre le froc, Et de trépasser, un jour, sur un roc, Sans que mon doigt touche un seul cheveu d’elle",trépasser
1849,"Pour la troisième fois , la feuille sans couleur allait trépasser comme ses aînées, lorsque paillasse s'avise de faire une pirouette par-dessus la Manche(...)Catarïna pleurante, à demi trépassée(...)",trépasser
1890,"Non content de faire I cules périr lès arbres de mort violente, voici I mon qu'il s'est mis eh tête de faire trépasser pass lentement les habitants de Bel(...)",trépasser
1923,"Tout à coup, notre coquin sauta de joiel 11 venait de lire une lettre, signée d’un notaire, qui disait : « Seigneur Tchan-Ta-fii, il g a un moi*, u* vieillard oint en mon élude et me déri ara que leu médt ci ne lui avaient affirmé qu'avant trente jours il serait trépassé",trépassé
1923,"semblait prêt à trépasser(...)D’ici là, le blessé avait le Umps de trépasser faute de soins",trépasser
1895,"Trépasser, c'est passer outre, passer au-delà des limites de ce monde, pour entrer dans le monde des esprits",trépasser
1864,"Lavater est constamment averti par un bruit sourd , quand un de ses paroissiens doit trépasser: Il dit alors : « Quelqu'un prend congé de moi* » et c'est réel",trépasser
1896,"une vieille paysanne, datant d'avant la Révolution — la grande, -— venait de trépasser: elle s'appelait Françounil(...)",trépasser
1938,vous faire trépasser/ ■ Quant aux: : maréehaux,trépasser
1926,"un bien désagréable moment à passer, voire à trépasser, mais(...)L’auteur, votre frère qui, comme vous, va trépasser, consent à entreposer chez lui toutes ces vaines et méprisables frivolités",trépasser
1921,"Loin maintenant de tout bruit, grelottante, prête à trépasser, elle essaye de se réchauffer aux brindilles dentelées et éparses que quelques poètes lui ont apporté, en cachette",trépasser
1921,"Elle approche en , vain ses chausses rappiécées des maigres sarments, elle grelotte, pleure, et se plaint tout bas dans un parler méconnu. elle va peut-être trépasser",trépasser
1927,"L'Argent n’a pas d’adeur Le camarade Krassiue, ambassadeur des Soviets à Londres, qui vient de trépasser, laisse à sa veuve — nous apprennent les dépêches — la coquette somme de 450 millions de francs",trépasser
1867,"Donc, quand la toile se relève, pour le quatrième et dernier acte, ce chenapan de petit Roland est entrain de trépasser tout doucement dans les bras de la grande et belle Aide, car il faut vous dire qu'il a reçu pas mal de horions dans la bagarre",trépasser
1895,"les comptez pour rien. — Bagasse, laissez donc les Arabes trépasser à leur aise(...)",trépasser
1925,Aussi ils ne tardèrent pas à trépasser par centaines et de grandes lamentations(...),trépasser
1901,"du coup il faillit trépasser, car il faut dire ici que rien n'inspire tant de crainte et d'effroi à Abdul-Hamid, que l'oeuvre et la personnalité même d'Emile Zola, il ne peut entendre prononcer son nom, sans trembler(...)",trépasser
1928,CONCLUSION. — Si- le président Herriot respira avant de complètement trépasser(...),trépasser
1903,Encore quelques jours et 1903 va trépasser(...),trépasser
1917,"Eh bien, maraud, quel est ton goût et dé quoi donc veux-tu trépasser(...)Sire, puisque vous me laissez le choix, je désire trépasser de vieillesse. — Accordé », dit le roi",trépasser
1861,"prête... (1) La Bretagne, parmi ses croyances superstitieuses et sentimentales, garde celle que ce nom désigne, et qui représente à l'esprit des habitants de Morlaix le passage du Charriât delà mort, près de la demeure de ceux qui doivent bientôt trépasser",trépasser
1916,Dicton populaire Octobre glacé Fait vermine trépasser,trépasser
1888,"Salut, année nouvelle, salut 1 Seras-tu, comme ta sœur aînée qui vient de trépasser, grosse d’orages et de sinistres politiques(...)",trépasser
1920,"Quand sénateurs et députés à force de se disputer seront en panne éreintés, prêts à trépasser, aphones, bègues, ils auront pour les confesser leurs saints collègues",trépasser
1918,"pleurait-elle tout bas, un de vos frères vient, à l'instant, de trépasser et bientôt les hommes noirs l'emporteront(...)",trépasser
1882,Avant de trépasser elle a mis ses affaires en règle avec tous les artistes qui l’ont soutenue de leur bonne volonté et de leur talent,trépasser
1930,"Trépasser pour trépasser, avec ou sans remède, du moment que le résultat est le même"" Terrible énigme' Dilemme redoutable(...)",trépasser
1905,"Syveton est mort, çà c'est assez drôle On dit qu' c'est sa femme qui l' fit trépasser Mais pour le prouver çà manqu' de con",trépasser
1946,"L'ETAT ORGANISE LA VENTE DES AUTOS AUX ENCHERES Et c'est pourquoi le médecin de campagne arrive chez ses malades lorsqu'ils viennent de trépasser NOUS avons des taxis(...)Pendant ce temps, votre médecin j de campagne bat des records à bicyclette et arrive chez les malades lorsqu'ils viennent juste de trépasser, Les bénéfices de ces ventes aux enchères vont, dit-on, aux bonnes œuvres de",trépasser
1914,Il va sûrement trépasser,trépasser
1910,"Le Journal Encyclopédique faillit trépasser pour avoir analysé avec éloges le livre de l'Esprit, d'Helvétius",trépasser
1894,"Voilà ma réponse. — Je veux dire, m’a-t-il réparti, que si votre femme venait à trépasser, vous seriez volé... comme dans un bois. — Volé(...)Donc, d’après son avis, si tu venais à trépasser, ma pauvre femme, tous les biens de ton père, qu'il m’a promis, qui sont quasiment à moi, depuis que je suis ton mari, tous ces biens-là seraient perdus pour moi",trépasser
1889,"ils ont pu consentir à trépasser, mais ils ne peuvent se résigner à l’enfouissement",trépasser
1938,"la fièvre aphteuae y fait l'objet d'une active propagande et les médeciu., lorsqu'ils vous approchent, ne songent qu'à vous faire trépasser",trépasser
1916,Dicton populaire Octobre glacé Fait vermine trépasser,trépasser
1906,"11 revient de Pa'ris, où il élail ailé auprès de son cousin Le Palud, lu sais le vieux garçon, si riche, qui vienl de trépasser dans une maison cléricale",trépasser
1934,"coupé dans la chair humaine, à force d'avoir vu tant de beaux jeunes hommes trépasser, cet homme n'arrivait plus à trouver la moindre valeur à la vie humaine",trépasser
1895,"Le gouverneur et la législature ont été élus Ï , par une majorité républicaine de vingt f à trente mille voix. pour un cochon faire une vie pareille, c'est ce qui me surpasse et me dégoûte en môme temps, et je suis certain que si tu me voyais trépasser cela te ferait moins de peine",trépasser
1884,Le plus âgé vient de trépasser,trépasser
1876,"soldats trépasser, avec miels yeux secs(...)",trépasser
1876,"le temps de la guérir, a dit comme ça la comtesse à l'a mère Gervais. — Ou de la faire trépasser, repartit Pierre",trépasser
1865,Il le fait trépasser le 1er janvier 1860,trépasser
1895,"Mme Panache, Rigolboche, et parmi ète les plus belles et les plus fêtées, celle Rose Pompon qui vient de trépasser",trépasser
1921,"Trépasser, Forearm, Bateau et Souviens-Toi, sont partis à peu près sur la même ligne devant Mignon, mais Souviens(...)-Toi ne tardait pas à prendre le commandement devant Forearm, Mignon, Bateau et Trépasser",trépasser
1891,"Citons-en quelques-uns : décéder,trépasser, expirer, succomber, s’éteindre, cesser de souffrir, rendre le dernier soupir, descendre dans la tombe, rejoindre ses ancêtres, etc",trépasser
1866,Il lui sembla qu'il allait trépasser,trépasser
1907,Et la terreur le prit de trépasser avant le retour de sa messagère,trépasser
1863,"Dans les intervalles le glas sonnait au beffroi, et au loin, dans les champs, tous les paysans priaient pour celle qui allait trépasser",trépasser
1904,Nous nous résumerons donc : la carte de visite ne paraît point en passe de trépasser,trépasser
1915,Il dut trépasser en cette(...),trépasser
1837,"Pour le plus grand développement de la rédaction il leur est impossible de trépasser ignorés, interdit, de ne pas être des morts célèbres dont le journal apprend le nom le lendemain à l'univers étonné",trépasser
1886,La jeune épouse se porte très bien et n’a pas le moins du monde envie de trépasser,trépasser
1927,"Jersey il avait vu, à l'entrée d'un champ, cette inscription « Il est défendu de trépasser ce champ(...)Pauvres gens Trépasser n'a pas toujours eu le sens appauvri qu'on lui connaît aujourd'hui, mais il signifiait, dans un sens plus large passer à travers",trépasser
1851,"elles portent crànement la culotte. — Allons, la revue peut trépasser en paix : M. Emile Taigny verra longtemps encore sa salle et sa caisse s'emplir",trépasser
1900,"MORTUAIRE Mort,détédé> défunt, trépassé",trépassé
1900,"Trépasser, c'est passer, outre, passer au delà des limites, de ce.monde, pour entrer dans le monde des esprits et de l'éternité(...)Le trépassé yh encore, d'une vie nouvelle et éternelle, celle que ses mérites lui ont obtenue",trépasser
1884,Mettrait-il longtemps à trépasser ou ferait-il galamment les choses on abrégeant son existence,trépasser
1891,"épigramme sur le môme sujet : Malgré la pourpre et le chapeau de Ruine, D'un rhume affreux tout près de trépasser, Un vieux prélat, lumme eut fait uu saint homme, Honneurs, plaisirs s'en allait délaisser",trépasser
1929,Nous tenions à redire ces choses au moment où Clemenceau vient de trépasser dans une apothéose parfaitement méritée,trépasser
1921,"Un troisième voleur venait de trépasser, lia bovalenl. lia chantaient, lia étaient A la fête De l'espUtion",trépasser
1888,allait trépasser,trépasser
1921,"Oui, certes, nous attendrons que l’exemple nous arrive de lieux aux noms plus burle-ques encore, et ce sera, fasse le iel, pour ne point le suivre, de par la impie dignité, dut en trépasser d'espérance rentrée, l'honorable député Siegfried(...)",trépasser
1911,"I N'empêche que si quelque pauvre vieux .> î curé de campagne écrivait à Sarto qu'il est iî j à là veille de crever de faim, il est certain qu'il aurait tout le temps de passer et do trépasser avant que Sarto se décide à lui 'i envoyer la moindre rondelle d'argent(...)",trépasser
1891,j'opérai un moribond qui faillit trépasser entre mes mains(...),trépasser
1903,Au dernier moment nous apprenons qu’un deuxième chien vient de trépasser des suites de ses blessures,trépasser
1918,"BénédictionLe fer Lundi, à 9 heures : Messe pour les Membres défunts de l'Association des Prières pour les Trépasser A i h",trépasser
1907,"de cour, vient de trépasser de cestuy monde dedans l'autre",trépasser
1866,1 Maître Grinchu l'adjoint vient de trépasser de sa belle mort,trépasser
1906,"Supposons que 1 ma femme qui est une brave et digne femme, une sainte, vienne à trépasser",trépasser
1928,"On l’a laissé trépasser comme un chien, oui, croaz",trépasser
1900,dois trépasser trois jours avant Votre Majesté,trépasser
1891,"empêcher son nom de s'éteindre, il était entré dans une fureur épouvantable, lorsque sa femme, atteinte en pleine poitrine d'un coup de pied de cheval, était morte après huit mois de mariage, laissant après elle une chétive petite fille qui faillit trépasser à peine née",trépasser
1922,"au moins un moratorium partiel — puis peut-être un crédit. — Pour l'observateur, cette tactique anglaise visait à provoquer une crise, une épreuve de nerfs, car le patient, en fin de compte, peut tout aussi bien trépasser pendant la crise",trépasser
1929,"Mâle et femelle se poursuivent d’ailleurs continuellement et l’ardeur duyfenard est telle que l’on a parfois tué d’un coup de fusil cet amoureux enragé, tandis qu’il faisait une cour effrontée à une renarde venant de trépasser pour avoir avalé une amorce contenant de la strychnine",trépasser
1928,"C'est: superbe, on aie u-ràlnt plus de trépasser. ■ dès l.oi'S: qu'on se serf de ce remède",trépasser
1885,il faudra patienter et trépasser d'effroi vingt fois de suite avant de mourir d'un coup de dague,trépasser
1932,"était pa3 confessé avant de trépasser, n’avait en rien accepté le concours de votre religion",trépasser
1935,La marquise pensa trépasser de fureur,trépasser
1896,"donnés : fil, pas, clair, forme, terre, fou, classer les mois suivants par familles : Clairement — passer — filament — format — folie — enterrer — éclair — compas — terrine — formule — clairière — filandreux—difformité —terrain — affoler — réformer — terrier — clarifier — passerelle — follet — uniforme —■ trépasser — territoire — clarinette — filature — raffoler — tertre — folâtrer enfilade — clarification — filasse(...)compas, passerelle, trépasser, passoire, passager, repasser, impasse, dépasser",trépasser
1857,"On l'avait bien fait trépasser alors qu'il était, fort heureusement, des plus vivants. — Duprez est en ce moment à Berlin, où il se propose de faire représenter son opéra biblique intitulé Samson",trépasser
1903,La morale de ceci c’est que certainement le jeune Fifi s’est laissé trépasser comme un petit serin,trépasser
1933,"le tiré et l'intermédiaire choisi, de con- trepasser un chèque non pro¬ visionné COUR D'APPEL",trepasser
1892,récemment l'athée Floquet donnait du Monseigneur gros comme le bras à l'évêque Freppel qui venait de trépasser,trépasser
