year,sentence,key_word
1928,Est-ce à dire que Samat ait oublié « le souffle immense du Mistral fait des âmes innombrables des taureaux trépassés(...),trépassés
1820,"Le 5 septembre, service solennel pour les fidèles trépassés(...)",trépassés
1909,"L’enfant trépasse et les formalités remplies, l’enterrement fait, le malheureux père revient prendre le collier de misère",trépasse
1869,"d'aller querre les corps morts des trépassés en leur » maison, et faire(...) les solennités accoutumées en tel cas, auxquels trépassés » il fera luminaire au chef d'hostel de quatre cierges qui seront allumés et ardents à l'entour du corps",trépassés
1886,"Le culte des trépassés, loin de s'affaiblir, semble, au contraire(...)",trépassés
1901,"aura cet hiver qu’un nombre restreint d’amateurs, il faut le considérer comme trépassé, tandis que d’autres formes comme le pardessus croisé repren- clroiitMe la vogue",trépassé
1891,"J'ai souvenance un jour visitant le patronage Notre-Dame-des-Champs à Angers d'avoir vu dans la chapelle, sur le marbre, les noms glorieux des enfants de l'œuvre morts au poste d'honneur : ailleurs pareilles inscriptions frappèrent aussi ma vue, mais durant la sainte messe le prêtre revêtu de noirs vêtements lisait à haute voix la longue liste des trépassés(...)",trépassés
1917,"Nous invitons les familles à faire célébrer, durant ce mois, des messes à l'intention de leurs parents trépassés, ou du moins à verser une aumône plus abondante dans le plat des âmes du purgatoire",trépassés
1919,"Au milieu du champ de repos, se dressait la Crsli — grâce à Dieu, ellexe dresse encore maintenant dans la plupart des cimetières de notre France, comme aussi dans nos cimetières militaires — et les Trépassés dorment ainsi leur dernier sommeil, sons le regard dn Christ qui a racheté le monde et qui s’est déclaré * la Résurrection et la Vie(...)",trépassés
1919,"S«>r la tête du Défunt, la Croix éteni ses bras* protecteurs et, au bas du monument, une formule discrète invite les passants â faire au Trépassé i'aumône d’une prière",trépassé
1851,"Yoici que vous découvrez maintenant un fait historique, vraiment miraculeux : c’est que le cardinal de Richelieu, trépassé le 4 décembre 1642, a fait trancher la tête au chevalier de Rohan, décapité devant la Bastille, le 27 novembre 1674, c’est-à-dire trente-deux ans après qu’il eut été enterré",trépassé
1917,"pauvres trépassés, n’oublions pas de les recommander plus instamment à la miséricorde divine, à l’occasion des cérémonies funèbres qui marquent ces premières journées de novembre",trépassés
1917,La liturgie des trépassés est pleine de larmes(...),trépassés
1914,"Commémoration des fidèles trépassés Parmi les sacrifices qui soulagent les morts, il en est un dont le prix est indépendant de celui qui le demande et de celui qui l’offre,et dont l’efficacité ne saurait être(...)",trépassés
1941,"La fête des Fidèles Trépassés, 2 novembre, non chômée au XIIIe siècle, l'était au xve siècle (synode de 1493(...)obligation seulement d'entendre la messe le jour des Trépassés",trépassés
1915,2. — Commémoraison de tous les fidèles trépassés,trépassés
1915,"Le pape autorise les prêtres à célébrer trois messes le jour des marts Le Pape vient d'accorder à tous les prêtres la faculté de célébrer trois messes pour les défunts, le 2 novembre, fête de la Commémoraison de tous les fidèles trépassés",trépassés
1918,On a creusé la fosse qui hébergera les trois .trépassés jusqu’à l’appel de la résurrection,trépassés
1915,"Nous espérons que l’assistance sera encore plus nombreuse aux diverses cérémonies qui auront lieu, en novembre, en faveur de nos chers trépassés",trépassés
1915,"Le pape autorise les prêtres à célébrer trois messes le jour des maris * Le Pape vient d’accorder à tous les prêtres la faculté de célébrer trois messes pour les défunts, le 2 novembre, fête de la Commémorai- son de tous les fidèles trépassés",trépassés
1919,Baie des Trépassés (Terre-Neuve) — Açores : 1.950 kms. — Durée de vol : 15 h,trépassés
1919,"Pour se rendre à la baie des Trépassés, l'appareil avait accompli les étapes suivantes : Rockaway Beach-Halifax : 1.000 kms(...)Deux autres hydravions N C 1 et N C 3 avaient quitté la baie des Trépassés en même temps que le N C 4",trépassés
1914,Petite com- mémoraison de tous les fidèles trépassés,trépassés
1926,"Or, tout bas, sur le seuil, on lui tint ce langage: « Excuse notre erreur, nous étions trop pressés, « Mais l'oncle n'est point feu, n'étant pas trépassé",trépassé
1866,Voilà pour les trépassés,trépassés
1926,"simplement le lien qui permet aux esprits désincarnés (trépassés) de pouvoir correspondre avec lee incarnés de la terre, par plusieurs procédés ou mécanismes : la table, l’écriture(...)Les preuves que nous pouvons et qu’en vérité, nous communiquons, avec les trépassés, pullulent",trépassés
1926,"Enseignez-les à vos enfants, à vos familles, à vos morts (trépassés(...)",trépassés
1865,"CHAPITRE xiv. — Mon épitaphe. ici ON A POSÉ POUR SE REPOSER, AVEC UNE AME BLASÉE, UN COEUR ÉPUISÉ EN UN CORPS USÉ UN VIEUX DIABLE TRÉPASSÉ ' MESDAMES ET MESSIEURS, PASSEZ",trépassé
1911,"l'espace, Ne voyant plus tes yeux, chère ftme que j'aimais, El j'ai «lit : i II faudra que toul ceci trépasse, El qu'il n'existe plus de cieiîx(...)",trépasse
1919,Est-ce la voix des Trépassés Qui sanglotent dans la nuit noire(...),trépassés
1898,11 s'agit d'un vitrail qu'une famille donne à l'église en souvenir d'un trépassé,trépassé
1874,"pour nous satisfaire, Mandez-en cinquante en galères Qui, regrettant le Trépassé, Diront(...)",trépassé
1900,"Auprès de lui, un moine à genoux, les yeux levés au ciel, récitait l’absolution et les prières des trépassés avec un admirable",trépassés
1875,"Pendant le déjeuner, Verdier ne m’a entretenu que des mérites de Mlle Elodie, — la dame de comptoir du café du Rat trépassé",trépassé
1937,"de faire sur la tombe de Seban, à l'occasion de la fête des Trépassés",trépassés
1852,"Derrière eux un homme, vêtu d'une robe noire sale et constellée d'insignes funèbres, s'en va agitant une cloche et annonçant la mort d'une ou de plusieurs personnes du quartier, sans oublier chaque fois son lugubre refrain : Réveillez-vous, gens qui dormez, Priez Dieu pour les trépassés",trépassés
1862,la fin duquel on but au repos de lame du trépassé,trépassé
1917,"Tous ces chers trépassés que l’on croit insensibles, Ce ne sont pas les morts, ce sont les invisibles : Ils revivent là haut, dans un monde éternel, Sous ce grand rideau bleu que les astres parsèment",trépassés
1917,La liturgie des trépassés est pleine de larmes(...),trépassés
1914,"Que Dieu conserve et bénisse les vivants, et donne aux trépassés le repos éternel",trépassés
1915,"yw Le Pape autorise les prêtres à célébrer trois messes le jour des marts Le Pape vient d’accorder à tous les prêtres la faculté de célébrer trois messes pour les défunts, le 2 novembre, fête de la Commémorai- son de tous les fidèles trépassés",trépassés
1915,"sentiment de grande charité pour les trépassés qui subissent dans le purgatoire les peines dues à leurs péchés, a daigné concéder, en l'audience accordée au R",trépassés
1915,"Le pape autorise les prêtres à célébrer trois messes le jour des msrts Le Pape vient d’accorder à tous les prêtres la faculté de célébrer trois messes pour les défunts, le 2 novembre, fête de la Gommémorai- son,de tous les fidèles trépassés",trépassés
1914,"r Commémoration (l(*s fidèles trépassés Parmi les sacrifices qui soulagent les morts, il on est un dont le prix est indépendant do celui qui le demandé et de celui qui l’offre,et dont l’efficacité ne",trépassés
1937,"Là, les âmes des trépassés doivent se sentir à l'aise beaucoup plus que dans les nécropoles où, au long des allées, s'alignent de somptueux caveaux et auxquelles il ne manque que la dénomination(...)",trépassés
1916,"bienfaisante suggestion de l’Eglise qui nous remet sur le chemin du souvenir, non point pour renouveler en nos cœurs d’inutiles larmes, mais pour nous inviter au soulagement spirituel des trépassés(...)",trépassés
1909,"16 L'Aéronàute Souhaitons de tout notre coeur que ces quatre glorieux trépassés inscrits maintenant sur le livre d'or des victimes du devoir soient les dernières et que l'air soit définitivement, irrémédiablement conquis sans plus de sang versé, sans, plus de larmes, de ruines affreuses",trépassés
1931,"6 juin 1931 L'ETOILE m L'A. È, F. La Page littéraire Mémoires (Pun trépassé (Nouvelle inédite, de Çeorge Çuilmin(...)Et je me vis tel que j'étais à vingttrois ans. (^ternaires d'un trépassé) George Guilmin Le discours de Bernard Shaw sur Jeanne d'Arc Londres 1er juin",trépassé
1946,"Un long et doux amour a-t-il là’ trépassé, Apportant à mon cœur une angoisse réelle",trépassé
1916,"trépassés qui paient leurs dettes à la justice de Dieu, parmi les terribles flammes du Purgatoire",trépassés
1854,"mais n'évoquons plus les âmes saintes des poëtes trépassés, ne montons plus ce douloureux calvaire, ne parcourons plus toutes ces pieuses stations du chemin des crucifiés où mon âme devient triste jusqu'à la mort : tristis est anima mea usque ad mortem",trépassés
1915,"161 - N° 11 Novembre 1915 Echo Paroissial de Cruzy-le-Châtel PRIÈRES POUR LES MORTS Voici le mois consacré aux fidèles trépassés, mois où l'Eglise rappelle à ceux qui sont encore dans le chemin de la vie, qu'ils ont à prier pour ceux qui ont quitté, pour toujours, les voies de la terre",trépassés
1980,"GEOFFRAY (César), harm. — Chant des trépassés(...)",trépassés
1980,153 Chansons et comptines 154 Chant des trépassés 159 Chefs d'oeuvre (15) classiques transcrits pour orgue électronique 123 Choeurs (3) avec accompagnement 193 Collection n(...),trépassés
1915,Ces pauvres morts reçurent une bénédiction et furent appelés : les fideles trépassés,trépassés
1917,La liturgie des trépassés est pleine de larmes(...),trépassés
1919,"Au milieu du champ de repos, se dressait la Croix — grâce à Dieu, elle se dresse encore maintenant dans la plupart des cimetières de notre France, comme aussi dans nos cimetières militaires et les Trépassés dorment ainsi leur dernier sommeil, sous le regard du Christ qui a racheté le",trépassés
1919,"S*>r la tête du Défunt, la Croix étend ses bras protecteurs et, au bas du monument, une formule discrète invite les passants à faire au Trépassé l'aumône d'une prière",trépassé
1868,pour obtenir la faveur de porter d'aussi sain' tes dépouilles au champ des trépassés(...),trépassés
1916,Mademoiselle Schwein crut son futur trépassé,trépassé
1863,"i Lentement, majestueusement, à travers cet incendie des sons, avancent les ombres des-trépassés(...)et c'est elle qui conduit nos Les cohortes des trépassés vont se perdre dans",trépassés
1922,DQ 2 V TRÉPASSÉS 3 S s.Huberl 4 D s,trépassés
1858,"Que de héros, près de ma couche, Te fumaient, qui sont trépassés(...)",trépassés
1866,"le chapeau est trépassé, il reviendra peut-être et je suis(...)",trépassé
1885,"Liiez le, marbrier. lin individu commande une croix pour un camarade trépassé, et donne les renseignements nécessaires à l’épitaphe. — ""Mort 1(...)",trépassé
1860,"Un musicien trépassé, Campé sur la terre grasse, D'un cercueil fait une basse, l'n archet d'un os cassé",trépassé
1883,L'Algérie sait faire à ses défenseurs des a. funérailles qui doivent donner des tressail« lements aux mânes des trépassés,trépassés
1869,détails circonstanciés qui complètent les renseignements que nous avons déjà publiés sur les désastres maritimes dont la baie des Trépassés a été le théâtre(...)La baie des Trépassés est située par 53 degrés 30 minutes de longitude ouest de Greenwich et 46 degrés 50 minutes de latitude nord(...),trépassés
1866,"des Détrompés,: des Agités, des Enflammés, des Insipides, des Fantastiueslij des Fulminants, des Nocturnes, des Dissonants, des Trépassés, des Vagabonds et bien d'autres encore",trépassés
1906,"D'après la tradition, en effet, la Baie des Trépassés, située près de Brest, devrait son nom à cette circonstance que, dans la nuit du r* au 2 novembre, chaque année, les âmes des Gaulois décédés se réunissaient au pied du gigantesque promontoir de Plogoff pour être jugées par Samhan, juge des morts(...)Les coutumes relatives aux trépassés 8 I VILLE IliPPARISjIl 2, 4, 6, Rue des Elaax(...)",trépassés
1887,mon oncle paternel n’a trépassé qu’à cent quarante-cinq anse,trépassé
1875,"C'est ainsi qu'autrefois, dans plusieurs provinces, on n'entrait point en héritage sans être venu invoquer saint Michel en'faveur de l'âme des trépassés, dont on allait recueillir les biens(...)",trépassés
1928,"Ensemble, les humains fêtent les Trépassés",trépassés
1834,"Il s'agenouilla sur le carreau, et pria pour l'âme du mendiant trépassé. — Enfoncé dans les coussins d'une ber, gère, le maître du château s'entretenait avçc son médecin, -Je ne me sens pas bien, docteur",trépassé
1916,Au soir décevant Mon rêve mouvant trépasse,trépasse
1904,"de nos jours encore, cet endroit sinistre s'appelle la « Baie des Trépassés",trépassés
1919,ils ont trépassé,trépassé
1878,"Ce musée n'est pas, comme on serait tenté de le croire, une collection d'instruments divers aux formes étranges, de crânes trépassés, de mâchoires enlevées, de tibias, de foetus en bocaux(...)",trépassés
1861,du trépasse(...),trépasse
1861,"A peine un malade ferme-t-il les yeux qu'on le croit déjà trépassé et qu'un concert de cris et de lamentations, à rendre mourants les mieux portants, annonce à tout le quartier le deuil de la famille(...)",trépassé
1917,constitue une action bonne et pieuse envers un grand trépassé,trépassé
1837,"Plusieurs barriques ont été trouvées dans la baie des Trépassés, commune de Plogoff",trépassés
1865,"Un beau jour l'oncle trépasse, laissant(...)",trépasse
1906,"trépassé : ,S A’elle(...)",trépassé
1882,avec une seule escale ou cap de Trépassés(...),trépassés
1872,"L'Église célèbre le 1er novembre la fête de la Toussaint, et le 2 celle des Trépassés",trépassés
1924,le glas des cloches semble la plainte des trépassés,trépassés
1868,Cardillac est donc trépassé,trépassé
1848,"N’oublions pas d’ajouter celte autre clause : « Que quand un maitre ou maitresèe dudit état mourra, sera tenu chacun barbier-chirurgien, passé maistre en la ville où aura esté et demeuré ledit trépassé, d’aller ac- compagnei le corps, sous peine de trois sols d’amende",trépassé
1857,"Tout ce faux échafaudage de charlataneries obscures et vieilles comme la nuit des temps est usé, passé, trépassé , mort et enterré par le globule, qui est la lumière et la vérité : le globule éternel, universel, prodige de la chimie, qui s'applique à ceci, qui s'applique à cela, qui s'applique à tout, à l'homme, à la femme, aux animaux du ciel, de la terre et de la mer(...)",trépassé
1868,"Le médium est-il sous l'influence de l'âme d'un trépassé qui est venue se loger momentanément dans son corps pour, pendant celte incarnation momentanée, parler, agir comme si ce corps lui appartenait(...)les esprits ou âmes des trépassés ne sont",trépassé
1868,"toutes les âmes des trépassés, donnez-vous à Dieu, sollicitez l'intervention des milices célestes",trépassés
1868,"un tel est trépassé « Et vous octroie une somme assez forte » Pour qu'au tombeau lui fassiez tous escorte, » Vous, les enfants",trépassé
1916,"oubli que verdissent des lierres, Aux Cryptes où nos pas se glissent angoissés De peur d'éveiller l'ombre où dorment les passés, Aux mausolées en fleurs fusant des cimetières, Aux somptueux tombeaux, faits d'ouvrages de pierres, Dont la richesse pèse aux pâles trépasses , Aux sarcop hages lourds de parfums condensés Que quatre fois mille ans n'ont pu mettre en poussières, Aux marbres précieux chers au repos des rois, 'Je vous préfère à tous, ô vous, les humbles croix Qui révélez les morts sur le(...)",trépasses
1889,"mais, après tout, je songe Que mes yeux sont en pleurs, Et que tout, dans son œuvre, est horreur, et mensonge, Si, pour nourrir ses fleurs, Il ne lui suffit pas d'avoir la sève, et même Les corps des trépassés Qui sont morts vieux et las de vivre(...)",trépassés
1917,"Ce jour, béni soit-il, quand de l'humus violé S'élèveront, ensemble, les voix des trépassés",trépassés
1897,Ils visitèrent les troncs : celui de Saint-Antoine et celui des Fidèles trépassés,trépassés
1857,l'empereur est trépassé(...),trépassé
1905,"pauvre Julien Lanmeur I Mlle Alice, accoudée comme la veille'à la fenêtre de la grande salle à manger, récitait, ellfi aussi, la prière des trépassés, et des larmes silencieuses coulaient sur ses joues soudainement pâlies",trépassés
1838,"2 vol. in-8, 15 fr. = LA CLOCHE DU TRÉPASSE",trépasse
1838,"La Cloche dit trépassé fera frissonner de joie les amateurs de fantômes, de revenans, de légendes superstitieuses, pourvu toutefois qu'ils n'aient pas un goût trop difficile et qu'ils n'aillent pas s'attendre à trouver dans une production semblable quelque mérite littéraire",trépassé
1937,"REYN0LDS53I A«CNCe F RANCE DUPIEUX Trépassés, et, à notre gauche, la pointe du Raz",trépassés
1963,"BAIE DES TREPASSES A l’extrémité de la dépression qui coupe en deux le cap Sizun, la baie des Trépassés nous réserve une jolie plage mais la mer y est souvent agitée",trepasses
1932,10 l’intérieur étaient accrochées de petites boîtes en forme de châsse contenant les chefs des trépassés,trépassés
1914,"Commémoration des fidèles trépassés Parmi les sacrifices qui soulagent les morts, il en est un dont le prix est indépendant de celui qui le demande et de celui qui l’offre,et dont l’efficacité ne saurait",trépassés
1880,"Des cavités pratiquées dans l’épaisseur des murailles donnent aux trépassés un asile à terme, car à Madrid les cadavres paient leurs logements",trépassés
1895,"Car en cette nuit, ma mère a trépassé, et je voudrais fort, devant son cercueil, murmurer prières pieuses(...)Et de tous côtés bondissent des halliers, trépassés en foule aux membres sans chair, aux os qui se choquent",trépassé
1925,Tristes et dolentes elles chantent au-dessus des villes et des campagnes la longue complainte des trépassés,trépassés
1935,"1 r- Las mariés tèn- 1 dent visite an ci- A metière aux tombe. de leurs parents £ N , ON loin de la baie des Trépassés, mêlées aux voix de l'orage et au bruit des galets froissés contre les rocs, neuf vierges druidesses étaient, dit la légende(...)montre même, près de la baie des Trépassés, des restes de murailles qui auraient appartenu à la ville d'Is. >'t naturellement des « pêcheurs dignes de fci » ont aperçu les mines d'une cité à travers les eaux transparentes",trépassés
1934,"ville d'Ys dont parle Renan, au large de la baie des Trépassés, celle qu'on devine dans les eaux, et dont on entend les cloches, certaines nuits",trépassés
1852,"le drap funèbre est jeté sur ce cercueil, et les mêmes frères le portent, en chantant l hymne des trépassés, au cimeterio dei giustiziati (cimetière des jusliciés), où l’eau bénite est versée sur la tombe par le prêtre",trépassés
1925,Tristes et dolentes elles chantent au-dessus des villes et des campagnes la longue complainte des trépassés,trépassés
1835,Les hommes chargés de transporter les trépasses manquent aussi à leurs fonctions,trépasses
1915,"Vf* («fit Le Pape autorise les prêtres à célébrer trois messes le jour des maris Le Pape vient d’accorder à tous les prêtres la faculté de célébrer trois messes pour les défunts, le 2 novembre, fête de la Commémorai- son de tous les fidèles trépassés",trépassés
1915,"3JSF <3p <éfê T3f& «Sp Le Pape autorise les prêtres à célébrer trois messes le jour des marts Le Pape vient d’accorder à tous les prêtres la faculté de célébrer trois messes pour les défunts, le 2 novembre, fête de la Commémorai- son de tous les fidèles trépassés",trépassés
1886,"Il s’était éclipsé Pour consoler (nouveau Mazêt peut-être) La mère en pleurs du bambin trépassé. — Oui, disait-il, c’est à l’audace Que le succès est toujours dû, Et de mon cher pourceau j’apporterai la grâce",trépassé
1911,Il nous vient annoncer que l’hiver li islt* cl sombre E-d passe trepasse II nous prend sous son ombre Kt nous promet déjà île beau/ bouquets de Meurs Due nous puissions offrir aux dus île nos co urs,trepasse
1920,"j’ qour ne pas voir la terrible appai'itl0u5 — Bon I dit Dixmer, me croyi<'z \e déjà trépassé, ma chère(...)",trépassé
1923,"Cloches qui riez quand l’aube s’allume, Cloches qui pleurez quand le jour s’enfuit, Angélus du soir perdu dans la brume, Glas des trépassés qu’emporte la nuit",trépassés
1861,"toute espèce de dangers, comme il convient à un trépassé",trépassé
1857,et faire revivre la poussière des trépassés,trépassés
1890,"e désert et le vide, D’un amour trépassé le squelette livide, La glace de la tombe, un silence de mort(...)",trépassé
1958,"N’oublions pas que saint Odilon créa à Cluny la fête des Trépassés, et(...)",trépassés
1958,"Et ainsi se renforce, pensons-nous, l’idée de l’existence d’une « iconographie d’origine clunisienne », élaborée par les abbés, leurs moines savants et leurs artistes, répandue dans les provinces romanes, et généralisée par adhésion spontanée, de la même façon que le fut la fête des Trépassés, institution(...)",trépassés
1947,au &k TIMOR passe Ifinsecte trépasse Parce qu’il ne peut survivre au contact des composants mortels : la Thanite et le D D T,trépasse
1908,Des soupirs et des pas de trépassés(...),trépassés
1849,"Son père trépassé . dit-il, était républicain pur sang",trépassé
1886,"Le trépassé, qui n'avait pas voulu attendre",trépassé
1804,Les Trépassés,trépassés
1804,Les Trépassés. sam. s,trépassés
1937,"tel celui-ci de 1569 « 0 vous qui passez, priez pour les trépassés(...)",trépassés
1939,"Le dernier Décembre 1683, recueilli hors des plntelets (troncs) de Véglise d'Helfaut comme s'ensuit, employé pour, en partie, subvenir <tu luminaire (1), savoir : — du platelet de l'église, pourchassé 56 6 Platelet du Saint Sacrement 3 1 — de Notre-Dame 36 du Rosaire 50 — des Trépassés 3 3 — des offrandes faites par le peuple allant chercher le pain bénit 6 1 Portant ensemble : 26 fl",trépassés
1939,31 — de Notre-Dame 40 — des Trépassés 48 — du Rosaire 51 Bassin des offrandes par le peuple allant au pain bénit G 14 Une corne et branche despreau rompu par le vent 5 i CASUEL EXTRAORDINAIRE pour 1685 florins sols deniers Legs transmis par le curé(...),trépassés
1939,Il Janvier 1686) 31 — du Saint-Sacrement 13 — de Notre-Dame 32 — du Saint-Rosaire 31 — des Trépassés 40 Offrandes du pain bénit 4 4 CASUEL EXTRAORDINAIRE pour 1686 florins sols deniers Blé du Bon Vendredy 1 rosière(...)43 — du Saint-Sacrement 20 — de Notre-Dame 31 — des Trépassés 44 — du Rosaire 38 Ofi ronde du pain bénit 48 Le total de ces différentes sommes oscille entre 50 et 60 florins de Flandre par an,trépassés
1939,"15 p. à Choquel pour avoir renfermé le fond baptismal d’une balustrade, et faict un tour pour environner les cercueils des trépassés",trépassés
1939,"SAINT-SACREMENT Louis Palfart avait créé une Confrérie des Trépassés, une autre de Jésus Flagellé en 1082, sur lesquelles nous n’avons guère de renseignements, et la Confrérie des Adorateurs du Saint-Sacrement, qui venait d’être instituée en 1080(...)",trépassés
1939,"L’atillage ou offrandes et luminaires ès services des trépassés appartient au curé seul, èi Vexclusion de tous aultres, et peuvent vailloir annuellement ung patacon ou trois florins",trépassés
1829,"Sàbotticrs, MM. dam , rue des Arènes. naud, rue des Combes arretaud , rue des Trépassés. auliell, rue Pont-St-Etienne. lanchard, rue Jauvion",trépassés
1829,"Petit, rue des Trépassés(...)ViH<gourtix , rue du Verdurie^, .V riltard-, rue des Trépassés",trépassés
1865,"remplaçaient partout l'armure de guerre par le cilice, multipliaient les jours de jeûne ou d'abstinence, recommandaient l'usage des flagellations, établissaient dans toute la chrétienté la commémoration des trépassés, instituée d'abord à Cluny",trépassés
1812,S. Anges 117 j-j 2 lun Trépassés,trépassés
1812,2 lun Trépassés,trépassés
1898,"le navire d'où l'on jette à la mer les camarades trépassés, en psalmodiant le de profundis à travers les ombres et les rumeurs du grand large(...)",trépassés
1875,Où notre bonheur trépassé(...),trépassé
1886,Ouvrons cette enveloppe noire : Un pauvre enfant est trépassé(...),trépassé
1886,"Sur un drapeau qu'il lient, une enseigne est gravée : « Excelsior î » Dans le gris crépuscule, en son cercueil glacé, Il repose î il esl beau, le jeune trépassé",trépassé
1932,"et après avoir examiné une fois encore la figure ipàle et inanimée du trépassé, ils sortirent lentement et sans bruit(...)Ensuite, et sans quitter la couronne il . souleva lentement la tête du trépassé.’ etl s’empara du testament",trépassé
1947,"qni, brisée, rompue, se casse et trépasse",trépasse
