year,sentence,key_word
2014,"Ainsi  ,  cette  canne  devenue  rame  devient  flambeau  dans  la  main  d'  un  angelot  volant  dans  le  ciel  à  gauche  .",canne
2014,"Au-delŕ  de  nos  filičres  traditionnelles  (  élevage  et  production  laitičre  ,  maraîchage  ,  canne  ŕ  sucre  ,  horticulture  ,  ...  )  qu'  il  faut  soutenir  ,  je  fonde  de  grands  espoirs  sur  l'  industrie  agroalimentaire  ,  sur  la  filičre  porteuse  de  l'  agrobiologie  (  produits  alimentaires  ""  bio  ""  ,  plantes  aromatiques  ,  médicinales  et  ŕ  parfums  ,  cosmétiques  ,  ...  )  ,  mais  aussi  sur  l'  agrotourisme  comme  autant  de  débouchés  pour  les  nouvelles  générations  .",canne
2014,"Pour  la  sécheresse  2012  ,  son  traitement  administratif  s'  est  fait  en  deux  temps  ,  en  premier  lieu  pour  la  filière  canne  et  ensuite  pour  les  autres  cultures  (  fourrages  ,  fruits  et  légume  ,  horticulture  )  .",canne
2014,"""  J'  ai  été  contacté  au  Minac  pour  apporter  mon  avis  afin  de  trouver  des  solutions  aux  troubles  que  cannait  le  secteur  de  l'  art  musical  .",cannait
2014,"Depuis  plusieurs  années  ,  le  PCR  ne  cesse  d'  attirer  l'  attention  sur  les  menaces  qui  pèsent  sur  la  filière  canne  ,  avec  l'  évolution  du  marché  mondial  du  sucre  et  les  décisions  prises  par  Bruxelles  .",canne
2014,"Jean-Yves  Minatchy  souligne  que  dans  la  période  actuelle  ,  c'  est  la  cacophonie  au  gouvernement  :  quand  Thierry  Repentin  dit  que  le  gouvernement  s'  occupe  de  défendre  les  intérêts  de  la  filière  canne  ,  a-t-il  lu  les  déclarations  de  Victorin  Lurel  ?  À  qui  faire  confiance  ?",canne
2014,"Qui  fait  remarquer  que  lors  de  la  discussion  sur  la  convention  canne  ,  le  président  de  la  FDSEA  a  quitté  la  salle  de  réunion  .",canne
2014,"Un  arc  narratif  qui  correspond  complétement  aux  canons  du  blockbuster  ,  tel  qu'  il  a  été  conçu  à  la  fin  des  cannées  70  par  Splieberg  et  Lucas  .",cannées
2014,"Cela  passe  aussi  par  une  vaste  réforme  foncière  ,  la  revalorisation  de  la  filière  canne  aujourd  '  hui  menacée  ,  la  relance  d'  un  tourisme  mettant  en  valeur  les  atouts  locaux  ,  le  développement  de  la  pêche  actuellement  entravée  par  les  directives  européennes  ,  la  marche  vers  l'  autonomie  alimentaire  et  énergétique  ,  le  développement  des  transports  collectifs  et  de  l'  ensemble  des  services  publics  ...",canne
2014,"Yvan  Perrin  dit  vouloir  tenir  le  cap  ,  mais  pas  à  tout  prix  :  ""  Je  n'  ai  pas  envie  de  canner  ""  ,  dit-il  .",canner
2014,"L'  réduite  systčme  Equinox  représente  incroyable  stabilité  ,  spécialement  quand  J'  utilise  it  et  aussi  longue  portée  carpe  canne  ŕ  pęche  .",canne
2014,"La  filière  canne  ,  ce  sont  plus  de  3.000  livreurs  et  plus  de  10.000  emplois  .",canne
2014,"La  courbe  du  chômage  dans  l'  île  pourrait  s'  élever  avec  la  menace  sur  la  filière  canne  ,  et  la  mise  en  danger  de  20.000  emplois  .",canne
2014,"L'  élection  municipale  pose  des  défis  aux  Réunionnais  ,  car  avec  l'  évolution  démographique  ,  les  effets  extrêmes  des  changements  climatiques  ,  la  remise  en  cause  de  la  filière  canne  et  les  conséquences  de  la  mondialisation  sur  l'  économie  de  l'  île  devront  être  mis  sur  la  table  par  des  élus  soucieux  du  bien  être  de  leurs  concitoyens  .",canne
2014,PR  Newswire  /  Les  Echos  /  SOCIETE  FERMIERE  DU  CASINO  MUNICIPAL  DE  CANNES  Exercice  social  :  Du  1  er  novembre  au  31  octobre  CHIFFRE  D'  AFFAIRES  HORS  TAXES  CONSOLIDE  AU  PREMIER  TRIMESTRE  (  période  du  1  er  novembre  2013  au  31  janvier  2014  )  Chiffre  d'  affaires  Exercice  Exercice  En  milliers  d'  Euros  2013  /  2014  2012  /  2013  Ecart  en  %  Jeux  1  er  trimestre  9  819  9  776  0  %  Total  jeux  9  819  9  776  0  %  Restauration  1  er  trimestre  734  818  -10  %  Total  restauration  casinos  734  818  -10  %  Autres  1  er  trimestre  128  121  6  %  Total  Autres  casinos  128  121  6  %  Casino  1  er,cannes
2014,"La  faute  à  ""  des  +  cannes  +  qui  ne  répondaient  pas  ""  au  lendemain  d'  un  jour  de  repos  lui  donnant  l'  impression  ""  d'  être  un  pantin  désarticulé  ""  .",cannes
2014,"De  cette  expérience  est  née  en  1967  la  première  poussette  canne  en  aluminium  au  pliage  tridimensionnel  ,  appelée  B-  0  1  .",canne
2014,"C'  est  un  projet  qui  est  déjà  canné  ,  qui  a  fait  l'  objet  d'  une  concertation  régionale  unanime  ,  autant  politique  qu'  économique  que  sociale  .",canné
2014,"Ce  dernier  a  rappelé  la  menace  sur  la  filière  canne  à  La  Réunion  ,  avec  la  fin  des  quotas  sucriers  ,  dont  les  prix  garantis  .",canne
2014,"Nous  aurons  aussi  l'  occasion  ,  Madame  la  ministre  ,  d'  échanger  sur  l'  avenir  de  la  filière  canne  à  La  Réunion  et  des  quotas  sucriers  .",canne
2014,"Pourquoi  prôner  à  La  Réunion  la  fin  de  la  filière  canne  ,  mais  encourager  aux  Antilles  la  filière  banane  ?",canne
2014,"En  effet  ,  le  gouvernement  a  lancé  ""  depuis  plusieurs  mois  un  audit  sur  la  filière  canne  sucre  et  sur  les  conséquences  de  la  suppression  des  quotas  sucriers  ""  ,  notamment  après  la  venue  de  Dacian  Ciolos  ,  commissaire  européen  en  charge  de  l'  agriculture  et  des  annonces  de  l'  ancien  ministre  des  Outre-mer  ,  Victorin  Lurel  ,  sur  l'  avenir  de  la  canne  à  sucre  à  La  Réunion  .",canne
2014,"Sur  une  passe  incisive  de  Bayal-Sall  plein  axe  ,  Hamouma  se  retrouva  entre  les  lignes  d'  une  défense  adverse  visiblement  encore  dans  les  vestiaires  ,  l'  ancien  cannais  arma  à  25  mètres  et  envoya  la  balle  sous  la  barre  de  Jourdren  .",cannais
2014,"Pour  les  agriculteurs  ,  par  exemple  ,  nous  voulons  les  rassurer  quant  à  l'  avenir  de  la  filière  canne  à  sucre  et  les  aides  du  POSEI  (  Programme  d'  options  spécifiques  à  l'  éloignement  et  à  l'  insularité  ,  ndlr  )  .",canne
2014, Cannes  me  voilà  !,cannes
2014,"Si  on  déstabilise  la  filière  canne  ,  on  remet  en  cause  toute  les  autres  filières  :  élevage  ,  maraichage  ,  horticulture  ,  entre  autres  .",canne
2014,"La  FDSEA  attire  l'  attention  des  candidats  aux  élections  européennes  sur  l'  avenir  de  la  filière  canne  ,  selon  le  Jir  .",canne
2014," CANNES  |  Le  premier  film  canadien  de  la  compétition  cannoise  ,  le  suspense  The  Captive  ,  d'  Atom  Egoyan  ,  n'  a  pas  créé  une  forte  impression  sur  les  festivaliers  hier  .",cannes
2014,FESTIVAL  DU  CINEMA  DE  CANNES ,cannes
2014,"""  Le  contexte  est  difficile  pour  la  filière  canne  par  exemple  ,  termine-t-il  ,  mais  la  foire  ne  peut  exister  qu'  avec  cette  filière  qui  doit  avoir  deux  objectifs  .",canne
2014, Cannes  se  la  joue  féministe-mais-pas-trop  -  Rue  89,cannes
2014,"Après  avoir  évoqué  l'  avenir  de  la  filière  canne  et  la  suppression  des  quotas  sucriers  en  2017  ,  mais  aussi  ""  l'  affaire  grave  ""  du  Traité  Transatlantique  ,  le  candidat  de  la  liste  pour  l'  Union  pour  les  Outremer  ,  a  évoqué  l'  octroi  de  mer  .",canne
2014,A  young  maker  switzerland  in  cannes ,cannes
2014,The  sovereign  funds  from  Qatar  is  looking  the  Carlton  cannes ,cannes
2014,"Etrangement  absent  des  colonnes  de  nos  journaux  et  de  nos  écrans  télé  depuis  quelques  mois  alors  que  deux  campagnes  électorales  ,  les  élections  municipales  et  européennes  ,  ont  mobilisées  La  Réunion  et  les  Réunionnais  sur  des  enjeux  politiques  forts  (  soutien  à  la  filière  canne  ,  politique  des  déplacements  ,  développement  et  aménagement  durable  )  ,  voici  que  Paul  Vergès  réapparait  curieusement  dans  la  presse  .",canne
2014,Le  PCR  attend  François  Hollande  au  tournant  de  la  filière  canne  .,canne
2014,Premier  comité  général  du  PCR  :  La  filière  canne  au  centre  des  préoccupations,canne
2014,"Plusieurs  sujets  on  été  abordés  ,  comme  la  crise  et  la  visite  du  président  François  Hollande  ,  mais  surtout  l'  échéance  2017  pour  la  filière  canne  ,  que  le  PCR  a  évoqué  vendredi  .",canne
2014,"""  Cette  échéance  pose  le  problème  de  la  fin  de  la  filière  canne  à  cause  de  la  fin  des  quotas  garantis  ,  explique  Yvan  Dejean  .",canne
2014,"C'  est  un  rude  coup  porté  à  la  filière  canne  mais  cela  fait  13  ans  que  cette  ""  ouverture  du  marché  sucrier  européen  ""  était  programmée  ,  soit  depuis  les  décisions  de  l'  Organisation  Mondiale  du  Commerce  (  OMC  )  qui  s'  était  réunie  à  DOHA  en  2001  (  142  pays  représentés  )  .  Depuis  le  1  er  juillet  1968  ,  l'  Europe  a  mis  en  œuvre  un  outil  afin  de  protéger  son  marché  sucrier  :  l'  Organisation  Commune  du  Marché  ""  sucre  ""  (  OCM  ""  sucre  ""  )  .",canne
2014,"Visite  de  F.  Hollande  :  La  FDSEA  attend  un  discours  ""  rassurant  ""  pour  la  filière  canne ",canne
2014,"La  FDSEA  a  voulu  présenter  un  agriculteur  qui  a  investi  dans  une  coupeuse  canne  longue  ,  créant  ainsi  un  emploi  .",canne
2014,"""  François  Hollande  ne  vient  pas  à  La  Réunion  pour  enterrer  la  filière  canne  """,canne
2014,C'  est  donc  le  moment  de  reprendre  la  filière  canne  en  main  en  s'  appuyant  sur  la  volonté  des  planteurs  (  qui  sont  des  professionnels  )  à  vouloir  pérenniser  cette  filière  créatrice  d'  emploi  pour  notre  jeunesse  .,canne
2014,Celui  de  l'  avenir  de  la  filière  canne  à  la  Réunion  .,canne
2014,On  essaie  de  ne  pas  arriver  avec  des  affaires  trop  bien  cannées  .,cannées
2014,"Hier  ,  ils  ont  eu  l'  occasion  d'  échanger  avec  des  conseillers  du  Président  sur  les  quotas  sucriers  ,  mais  Béjisa  ,  les  retraites  agricoles  ou  encore  la  convention  canne  .",canne
2014,"Le  représentant  de  la  Préfecture  qui  participe  à  cette  réunion  de  conciliation  a  annoncé  que  ,  si  sur  les  dossiers  Béjisa  et  sécheresse  des  réponses  peuvent  être  apportées  immédiatement  ,  il  ne  peut  en  être  ainsi  pour  les  questions  que  se  posent  les  acteurs  de  la  filière  canne  .",canne
2014,"Tereos  propose  une  prolongation  de  la  convention  canne  en  2017  ,  convention  dont  l'  arrêt  est  prévu  en  2015  .",canne
2014,Tereos  et  la  CGPER  n'  ont  pas  réussi  à  se  mettre  d'accord  hier  sur  la  question  de  la  convention  canne  .,canne
2014,"La  CGPER  ne  compte  pas  dégager  le  passage  ,  tant  que  les  discussions  concernant  la  prolongation  de  la  convention  canne  jusqu'  en  2017  ne  soient  pas  plus  satisfaisantes  .",canne
2014,"A  La  Réunion  ,  une  filière  canne  à  sucre  performante  mais  dépendante",canne
2014,Aussi  j'  invite  les  acteurs  de  la  filière  canne-sucre  à  programmer  sans  attendre  les  discussions  sur  le  sujet  de  la  future  convention  canne  dans  la  perspective  de  la  suppression  des  quotas  sucriers  prévue  en  2017  dans  le  cadre  interprofessionnel  obligé  que  constitue  le  CPCS  (  Comité  Paritaire  interprofessionnel  de  la  Canne  et  du  Sucre  )  .,canne
2014,"Après  l'  annulation  de  la  visite  de  François  Hollande  à  la  Réunion  ,  les  planteurs  attendaient  des  annonces  fortes  sur  l'  avenir  de  la  filière  canne  à  l'  horizon  2017  .",canne
2014,Les  planteurs  ont  décidé  de  lever  les  blocages  tard  dans  la  nuit  de  dimanche  à  lundi  grâce  à  la  promesse  d'  une  réunion  tenue  en  préfecture  dans  la  journée  sur  la  convention  canne  et  l'  avenir  de  la  filière  .,canne
2014,"""  Il  y  a  une  volonté  de  ne  pas  discuter  de  la  filière  canne  ,  affirme-t-il  ,  car  une  première  réunion  avait  été  annulée  le  7  juillet  .",canne
2014,"Loin  de  se  contenter  de  ""  mesurettes  ""  ,  dixit  le  président  de  la  CGPER  ,  les  planteurs  veulent  des  réponses  sur  l'  avenir  de  la  filière  canne  .",canne
2014,"Il  en  va  de  l'  avenir  de  la  filière  canne  après  2017  ,  selon  eux  .",canne
2014,"Il  a  en  outre  affirmé  qu'  il  donnerait  ""  des  garanties  de  l'  Etat  et  de  l'  Europe  ""  pour  pérenniser  la  filière  canne  à  sucre  ,  dont  les  fortes  subventions  européennes  pourraient  baisser  à  partir  de  2017  .",canne
2014,"Accueilli  par  plusieurs  personnalités  politiques  ainsi  que  des  acteurs  de  la  filière  canne  ,  François  Hollande  a  pris  connaissance  ,  au  travers  d'  une  exposition  ,  des  chiffres  clés  de  la  filière  canne  à  la  Réunion  .",canne
2014,"A  l'  issue  de  la  visite  de  l'  usine  ,  François  Hollande  a  formulé  plusieurs  annonces  en  lien  avec  la  filière  canne  à  la  Réunion  .",canne
2014,"La  filière  canne  fait  vivre  entre  13  et  18.000  personnes  ,  en  emplois  directs  et  indirects  à  la  Réunion  .",canne
2014,"Nous  devons  préserver  ,  maintenir  ,  développer  la  filière  canne  à  la  Réunion  .",canne
2014,"Très  attendu  sur  le  dossier  de  la  filière  canne  ,  le  président  de  la  République  a  renvoyé  la  décision  sur  l'  Europe  sans  donner  de  calendrier  .",canne
2014,"Pour  Bois-Rouge  et  la  filière  canne  ,  l'  avenir  est  toujours  flou  .",canne
2014,"L'  un  d'  entre  eux  focalise  l'  attention  ,  c'  est  l'  avenir  de  la  filière  canne  .",canne
2014,"François  Hollande  doit  y  faire  d'  importantes  annonces  pour  la  filière  canne  en  présence  de  plusieurs  responsables  politiques  et  économiques  ,  dont  le  sénateur  Paul  Vergès  .",canne
2014,"Ensuite  chez  nous  à  La  Réunion  ,  au-delà  des  mesures  obligatoires  pour  assurer  la  paix  sociale-voire  la  paix  civile-  dans  l'  île  (  contrats  aidés  ,  soutien  financier  à  la  filière  canne  ...  )  il  a  poursuivi  et  même  amplifié  sa  politique  de  cadeaux  aux  grandes  entreprises  sans  aucune  contrepartie  pour  les  travailleurs  .",canne
2014,"""  Qu'  on  commence  par  consulter  les  enseignants  avant  de  nous  arriver  avec  des  affaires  cannées  d'  avance  qui  vont  faire  que  les  enseignants  se  sentent  comme  des  exécutants  plutôt  que  comme  des  professionnels  en  éducation  ""  ,  lance  sa  présidente  ,  Josée  Scalabrini  .",cannées
2014,"Pour  les  cadres  du  PCR  ,  les  engagements  non  respectés  depuis  24  mois  portent  sur  le  tram-train  ,  l'  octroi  de  mer  ,  la  filière  canne  ou  encore  la  réforme  territoriale  .",canne
2014,"Chacun  leur  tour  ,  béret  vissé  sur  la  tête  ,  ou  canne  à  la  main  ,  ils  brandissent  leur  carte  de  séjour  .",canne
2014,"Le  bat  '  leh  devenu  canne  pour  tenir  le  coup  ,  le  quidam  sous  le  costume  est  bien  trop  raplapla  pour  hurler  le  ""  k  '  plah  ""  de  la  victoire  (  je  parle  un  peu  klingon  )  .",canne
2014,Un  quinquagÃ  ©  naire  a  Ã  ©  tÃ  ©  condamnÃ  ©  ce  mardi  Ã  huit  mois  de  prison  ferme  par  le  tribunal  correctionnel  dâOrlÃ  ©  ans  pour  avoir  tentÃ  ©  de  faire  passer  Ã  son  fils  incarcÃ  ©  rÃ  ©  deux  tÃ  ©  lÃ  ©  phones  portables  par-dessus  le  mur  de  la  maison  dâarrÃªt  Ã  lâaide  dâune  canne  Ã  pÃªche  .,canne
2014,"Jean-Yves  Minatchy  ,  président  de  la  CGPER  a  exprimé  sa  confiance  grâce  à  cette  première  visite  dédiée  à  la  filière  canne  :  ""  Lorsqu'  il  consacre  plus  d'  une  demi-journée  pour  visiter  le  monde  agricole  ,  ça  montre  qu'  il  a  la  volonté  et  qu'  il  veut  nous  aider  et  nous  accompagner  .",canne
2014,La  filière  canne  marche  encore  vers  l'  inconnu  .,canne
2014,quel  avenir  pour  la  filière  canne  après  la  fin  du  prix  garanti  du  sucre  en  2017  ?,canne
2014,"Enfin  ,  le  chef  de  l'  Etat  n'  a  pas  pu  donner  l'  assurance  que  l'  Union  européenne  avait  autorisé  le  versement  des  subventions  demandées  par  les  acteurs  de  la  filière  canne  pour  faire  face  à  la  fin  des  quotas  .",canne
2014,"Paris  sait  bien  que  la  Convention  canne  actuelle  se  termine  à  la  fin  de  l'  année  ,  et  que  le  prix  de  la  canne  de  la  campagne  sucrière  2015  dépendra  d'  un  document  devant  être  signé  avant  qu'  elle  ne  débute  .",canne
2014,"""  En  fonction  de  ça  ,  que  devient  la  filière  canne  à  La  Réunion  ?  Pourquoi  les  élus  cachent  cette  vérité  aux  planteurs  ?  ""  ,  a  posé  le  sénateur  .",canne
2014,"Raison  pour  laquelle  ,  de  nombreuses  inquiétudes  persistent  sur  l'  avenir  de  la  filière  canne  ,  a  expliqué  Paul  Vergès  .",canne
2014,"Ce  dernier  a  indiqué  que  les  manifestations  de  jeune  sont  en  convergence  avec  les  difficultés  rencontrées  par  la  filière  canne  ,  l'  importation  à  venir  de  matériaux  pour  la  NRL  et  la  réforme  territoriale  .",canne
2014,81  '  Chantôme  à  l'  entrée  de  la  surface  est  idéalement  placé  pour  frapper  mais  préfère  glisser  le  ballon  à  Cavani  qui  voit  sa  frappe  à  bout  portant  contrée  au  dernier  moment  par  un  pied  cannais  .,cannais
2014,"Le  second  point  à  l'  ordre  du  jour  ,  c'  est  la  filière  canne  .",canne
2014,"Dans  le  cas  de  la  filière  canne  ,  il  n'  a  pas  décrété  la  mobilisation  maximale  pour  éviter  une  catastrophe  .",canne
2014,"Le  chef  de  l'  Etat  ,  François  Hollande  ,  a  envoyé  un  courrier  au  président  de  la  CGPER  ,  Jean-Yves  Minatchy  ,  en  réponse  à  plusieurs  lettres  envoyées  sur  le  sujet  de  l'  avenir  de  la  filière  canne  .",canne
2014,"Sur  le  dos  ,  le  message  sur  la  provenance  est  on  ne  peut  plus  clair  :  ""  une  cassonade  corsée  tout  droit  venue  de  l'  île  Maurice  ,  100  %  pure  canne  non  raffinée  ,  qui  révèle  des  arômes  puissants  de  réglisse  ,  de  caramel  et  de  cannelle  !  ""  .",canne
2014,"Sa  canne  bien  serrée  dans  la  main  droite  et  une  paire  de  tennis  aux  pieds  ,  Hélène  ,  83  ans  ,  monte  le  boulevard  du  Général-Martial-Valin  dans  le  15  e  arrondissement  de  Paris  .",canne
2014,"Mais  dans  le  jeu  du  ""  chicken  ""  ,  Mas  a  canné  :  mardi  ,  la  campagne  référendaire  a  été  suspendue  .",canné
2014,"Un  mois  après  ,  il  n'  a  toujours  pas  de  réponse  pour  sauver  la  filière  canne  après  l'  échéance  2017  .",canne
2014,"L'  ailier  cannais  ,  grâce  à  un  regard  ,  fait  mine  de  centrer  .",cannais
2014,Une  convention  canne  signée  plus  que  pour  deux  ans  ...,canne
2014,"Autre  point  d'  inquiétude  ,  la  convention  canne  signée  entre  les  planteurs  ,  les  usiniers  et  l'  Etat  .",canne
2014,"Plusieurs  témoins  rapportent  des  dizaines  de  coups  de  feu  à  l'  intérieur  de  l'  édifice  du  parlement  ,  où  un  homme  muni  d'  une  arme  d'  épaule  ,  un  fusil  de  chasse  à  double  cannons  ,  arborant  un  foulard  blanc  à  motif  arabe  a  été  signalé  .",cannons
2014,"""  Pour  l'  instant  ,  Julien  a  confié  cette  canne  à  son  oncle  .",canne
2014,J'  ignore  d'ailleurs  si  elle  avait  dit  canne  lors  de  notre  conversation  .,canne
2014,Les  derniers  mois  ont  montré  que  le  gouvernement  n'  ignore  rien  de  la  menace  qui  pèse  sur  l'  avenir  de  la  filière  canne  à  La  Réunion  .,canne
2014,"Le  chef  de  l'  État  a  fait  sienne  la  revendication  d'  augmenter  à  128  millions  au  lieu  de  90  la  subvention  annuelle  versée  par  Paris  à  la  filière  canne  réunionnaise  à  partir  de  2017  ,  sous  condition  d'  un  accord  de  l'  Union  européenne  .",canne
2014,Le  projet  de  loi  de  finances  renforce  les  craintes  au  sujet  de  l'  avenir  de  l'  usine  de  Bois-Rouge  et  de  la  filière  canne  .,canne
2014,Cette  visibilité  a  toujours  été  la  règle  pour  la  filière  canne  depuis  son  intégration  au  marché  européen  .,canne
2014,"Les  prises  de  position  des  usiniers  et  des  planteurs  renforcent  les  inquiétudes  ,  car  les  discussions  semblent  s'  orienter  soit  vers  un  avenant  à  la  Convention  canne  actuelle  ,  soit  vers  un  accord  courant  sur  deux  ans  .",canne
2014,Le  motif  est  la  baisse  de  la  subvention  de  l'  État  à  la  filière  canne  inscrite  dans  le  projet  de  loi  de  Finances  pour  2015  .,canne
2014,"La  baisse  des  crédits  dévolus  ŕ  la  diversification  agricole  (  -  3,6  millions  ?  )  et  ŕ  la  filičre  canne  sucre  (  -  2,4  millions  )  était  au  cœur  du  débat  qui  s'  est  déroulé  mardi  matin  ŕ  l'  Assemblée  nationale  lorsque  Stéphane  Le  Foll  ,  ministre  de  l'  Agriculture  ,  a  été  auditionné  en  commission  élargie  .",canne
2014,"Financement  du  logement  social  ,  menace  sur  la  filière  canne  ,  soutien  aux  entreprises  ,  emplois  d'  avenir  :  l'  intergroupe  des  parlementaires  de  l'  Outre-mer  demande  au  gouvernement  de  revoir  sa  copie  .",canne
2014,"Pour  l'  agriculture  ,  l'  Intergroupe  alerte  sur  la  baisse  de  la  subvention  à  la  filière  canne  ,  et  interroge  sur  ce  qu'  il  advient  de  l'  aide  annuelle  supplémentaire  de  38  millions  d'  euros  à  partir  de  2017  .",canne
2014,Cette  dernière  a  alerté  François  Hollande  sur  la  baisse  prévue  des  crédits  alloués  par  l'  État  à  la  filière  canne  .,canne
2014,"Après  de  nombreux  échanges  avec  le  Gouvernement  ,  ""  le  Premier  ministre  a  rendu  des  arbitrages  favorables  aux  Outre-Mer  sur  trois  sujets  majeurs  :  le  logement  intermédiaire  ,  les  crédits  consacrés  à  la  filière  canne  à  sucre  et  à  la  diversification  et  le  CICE  renforcé  pour  les  entreprises  des  secteurs  prioritaires  de  la  LODEOM  ""  ,  salue  Jean-Claude  Fruteau  .",canne
2014,"S'  agissant  des  crédits  consacrés  à  la  filière  canne  à  sucre  et  ceux  en  faveur  la  diversification  ,  Jean-Claude  Fruteau  se  félicite  du  rétablissement  des  crédits  ""  qui  permettront  le  soutien  actif  de  ces  filières  essentielles  pour  les  économies  des  DOM  ""  .",canne
2014,"Ce  que  prévoit  le  gouvernement  ,  c'  est  une  baisse  de  la  subvention  accordée  à  la  filière  canne  réunionnaise  ,  ainsi  qu'  à  la  diversification  .",canne
2014,"C'  est  la  dernière  coupe  avec  la  Convention  canne  actuelle  ,  qui  a  duré  7  ans  .",canne
2014,"Comment  dans  ces  conditions  négocier  une  Convention  canne  ?  Des  agriculteurs  vont-ils  planter  ou  replanter  de  la  canne  s'  ils  n'  ont  pas  la  certitude  de  pouvoir  la  vendre  à  l'  usinier  pendant  son  cycle  de  production  ,  soit  au  moins  7  ans  ?",canne
2014,Une  canne  à  pêche  ?  Un  gant  ?  Une  boule  ?  Une  tronçonneuse  ?  Il  existe  des  manettes  bizarres  qui  font  autant  rire  que  pleurer  .,canne
2014,"Puis  faire  pareil  sur  tous  les  termes  adjacents  (  réseaux  sociaux  et  société  ,  regard  de  l'  autre  et  apparence  physique  ,  cannons  de  la  beauté  ...  )",cannons
2014,"Sur  le  volet  agriculture  ,  les  députés  notent  que  :  ""  considérant  les  risques  pour  la  filière  canne  à  sucre  et  pour  la  diversification  d'  un  fléchage  d'  une  partie  des  crédits  sur  le  Programme  d'  Investissement  d'  Avenir  ,  le  Gouvernement  a  entièrement  rétablis  les  crédits  à  la  demande  conjointe  des  parlementaires  .",canne
2014,"""  Finalement  ,  nous  avons  racheté  une  poussette  canne  assez  légère  pour  que  nous  puissions  la  monter  avec  nous  dans  l'  appartement  .",canne
2014,La  nouvelle  convention  canne  inquiète  le  syndicat  des  Jeunes  Agriculteurs  de  la  Réunion,canne
2014,"La  nouvelle  convention  canne  du  CPCS  (  Comité  Paritaire  de  la  Canne  et  du  Sucre  )  fixera  demain  le  nouveau  prix  du  produit  ,  ""  resté  fixe  ces  9  dernières  années  ""  ,  indiquent-ils  .",canne
2014,"Deux  instances  dirigeantes  du  PCR  ,  secrétariat  et  bureau  politique  ,  ainsi  que  Paul  Vergès  et  Elie  Hoarau  ont  tenu  une  conférence  de  presse  commune  pour  alerter  sur  de  nouveaux  éléments  accélérant  la  crise  de  la  filière  canne  .",canne
2014,"Le  secrétariat  du  PCR  ,  le  bureau  politique  du  parti  ,  le  sénateur  Paul  Vergès  et  le  conseiller  régional  Elie  Hoarauont  tenu  hier  une  conférence  de  presse  pour  annoncer  le  lancement  d'  une  grande  campagne  pour  sauver  la  filière  canne  à  La  Réunion  .",canne
2014,"Pour  donner  un  avenir  au  résultat  de  tous  ces  sacrifices  ,  la  mobilisation  va  s'  amplifier  pour  sauver  la  filière  canne  .",canne
