year,sentence,key_word
2019,"Pour  cet  exercice  ,  qui  relève  parfois  du  marronnier  ,  les  analystes  scrutent  les  signaux  faibles  qui  pourraient  constituer  autant  d'  indices  pour  étayer  leurs  pronostics  .",marronnier
2019,"Et  ajoutons  qu'  ils  auraient  eu  raison  ,  tant  ces  deux  marronniers  ,  aussi  dérisoires  soient-ils  ,  semblent  avoir  davantage  d'  impacts  sur  la  réalité  que  cette  réunion  de  chefs  d'  État  ou  de  gouvernement  dans  l'  ancienne  résidence  de  l'  impératrice  Eugénie  ,  à  Biarritz  .",marronniers
2019,"Les  abeilles  du  rucher  butinent  sur  un  rayon  allant  jusqu'  à  2,5  kilomètres  ,  le  site  est  notamment  riche  en  marronniers  .",marronniers
2019,Les  marronniers  sont  de  sortie  .,marronniers
2019,"Erable  ,  marronnier  ,  bouleau  ,  hêtre  :  ils  souffrent  déjà  ,  et  leur  taux  de  survie  sera  réduit  dans  les  décennies  à  venir  ,  prédit-elle  .",marronnier
2019,"Au  seuil  de  la  retraite  ,  les  propriétaires  ,  cherchaient  depuis  plus  d'  un  an  un  repreneur  pour  le  commerce  qu'  ils  tenaient  depuis  plus  de  quinze  ans  ,  dans  ce  quartier  des  Marronniers  en  pleine  évolution  ,  où  des  logements  continuent  de  sortir  de  terre  .",marronniers
2019,"Quatre  arbres  sont  visés  ,  deux  magnolias  ,  un  marronnier  et  un  saule  pleureur  ,  tous  des  arbres  centenaires  .",marronnier
2019,"À  8  h  ,  un  des  opposants  ,  Christophe  Jouanneault  ,  était  installé  ,  depuis  le  lever  du  jour  ,  dans  le  marronnier  menacé  ,  et  les  défenseurs  du  jardin  se  réunissaient  pour  décider  des  actions  à  mener  d'  ici  la  fin  de  l'  arrêté  des  travaux  ,  jeudi  à  19  h.  ""  Nous  ne  voulons  pas  laisser  ces  arbres  être  abattus  avant  la  fin  du  délai  de  recours  contre  le  permis  de  construire  ,  un  délai  qui  expire  le  22  septembre  ""  ,  précisait  Brigitte  Debreu-Milon  .",marronnier
2019,"Mais  le  G  7  leur  procure  un  excellent  ""  marronnier  ""  :  reportage  en  période  creuse  ,  consacré  à  un  événement  peu  important  ,  récurrent  et  prévisible  .",marronnier
2019,"Selon  le  cadre  ,  d'  autres  projets  vont  de  l'  avant  dans  le  quartier  :  aux  rues  des  Tilleuls  1  (  rénovation  et  surélévation  de  l'  immeuble  de  18  logements  )  ,  du  Nord  4  (  construction  d'  un  immeuble  de  23  logements  )  et  des  Marronniers  20  à  26  (  réhabilitation  )  .",marronniers
2019,Déguster  une  bonne  bière  sous  les  marronniers ,marronniers
2019,"Si  vous  ne  l'  aviez  pas  remarqué  ,  sachez  qu'  un  vrai  Biergarten  est  toujours  ombragé  par  des  marronniers  d'  Inde  .",marronniers
2019,"Pour  augmenter  la  fraîcheur  ,  ils  ont  planté  des  marronniers  d'  Inde  .",marronniers
2019,"Les  marronniers  sont  attaqués  par  la  mineuse  ,  les  érables  par  la  suie  .",marronniers
2019,"Avez-vous  ,  enfant  ,  passé  du  temps  à  regarder  les  murs  pendant  les  leçons  et  les  exercices  ...  laissé  votre  regard  se  poser  sur  des  tableaux  de  conjugaisons  ,  des  cartes  ,  des  affiches  ,  ou  le  marronnier  de  la  cour  ?  Cela  constitue  aussi  une  expérience  de  la  vie  des  élèves  mais  ce  n'  est  pas  seulement  pour  cela  que  le  changement  à  venir  dans  l'  habillage  des  classes  nous  parait  important  ...",marronnier
2019,"L'  occasion  d'  évoquer  les  feuilles  des  marronniers  qui  vont  bientôt  se  ramasser  à  la  pelle  dans  les  cours  de  récré  ,  quand  il  y  a  encore  des  marronniers  dans  les  cours  de  récré  ...",marronniers
2019,"VIDEO-  Rentrée  scolaire  1965  à  Toulouse  ,  déjà  un  marronnier  pour  les  journalistes  de  l'  ORTF",marronnier
2019,Chaque  année  la  télévision  diffuse  ces  reportages  que  l'  on  appelle  des  marronniers  .,marronniers
2019,"Après  des  jeux  sous  le  grand  marronnier  qui  orne  la  cour  de  l'  école  pendant  la  récréation  ,  les  élèves  se  sont  rendus  sur  la  plage  pour  un  travail  sur  le  développement  durable  ,  qui  doit  durer  toute  l'  année  scolaire  .",marronnier
2019,"La  belle  saison  tirant  à  sa  fin  ,  les  jeux  d'  eau  ne  seront  pas  mis  en  service  en  même  temps  que  le  square  des  Marronniers  ,  mais  pour  l'  été  prochain  ....",marronniers
2019,"Quatre  ont  dû  être  abattus  :  deux  marronniers  sur  le  parking  du  Tribunal  ,  deux  hêtres  au  Parc  des  sports  .",marronniers
2019,"Autre  marronnier  du  discours  islamogauchiste  ,  la  référence  à  des  luttes  mythiques  dont  on  détourne  le  sens  pour  n'  en  conserver  que  le  prestige  .",marronnier
2019,"""  Effectivement  ,  c'  est  un  marronnier  ,  c'  est  quelque  chose  que  l'  on  entend  :  le  cinéma  français  est  moins  bon  ,  on  n'  a  plus  de  stars  ,  on  ne  sait  pas  les  préserver  ,  on  fait  un  cinéma  beaucoup  trop  intellectuel  ,  qui  s'  éloigne  du  public  .",marronnier
2019,"De  la  majestueuse  allée  de  marronniers  au  plan  d'  eau  intimiste  ,  le  silence  est  total  .",marronniers
2019,Un  vide  grenier  occupait  la  place  des  marronniers  tandis  qu'  une  exposition  de  vieux  matériel  agricole  avec  battage  se  tenait  plus  loin  .,marronniers
2019,"Les  plantes  des  haies  ou  certains  arbres  ,  tels  le  marronnier  d'  Inde  ,  l'  érable  ou  le  hêtre  ,  figurent  également  parmi  les  plantes  toxiques  répertoriées  dans  l'  application  Toxiplant  .",marronnier
2019,"Le  séquoia  géant  ,  le  marronnier  d'  Inde  et  le  figuier  sont  capables  ,  eux  aussi  ,  de  régénérer  un  nouvel  arbre  pour  peu  que  leurs  branches  basses  retombantes  viennent  en  contact  avec  le  sol  .",marronnier
2019,Cela  devient  un  marronnier  dans  les  lignes  de  cette  chronique  .,marronnier
2019,"Tout  comme  l'  oligarque  de  l'  Arkansas  Jackson  Stephens  avait  aidé  à  attirer  la  CIA  vers  son  État  natal  pendant  le  déroulement  de  l'  opération  Iran-Contra  ,  ce  fut  un  oligarque  de  l'  Ohio  et  son  proche  associé  qui  aidèrent  à  attirer  la  CIA  vers  le  ""  Buckeye  State  ""  [  ""  état  du  marronnier  ""  ,  surnom  de  l'  État  d'  Ohio  ,  NdT  ]  .",marronnier
2019,Deux  magnolias  et  un  marronnier  et  un  chêne  centenaires  sont  concernés  .,marronnier
2019,"Donc  ,  la  semaine  prochaine  ,  celle  ""  de  la  mobilité  ""  ,  on  va  se  reposer  la  question  marronnier  :  ""  comment  inciter  tous  ces  braves  gens  à  prendre  les  transports  en  commun  ,  à  enfourcher  un  vélo  ou  à  marcher  ?  """,marronnier
2019,"Les  Pèlerins  sont  aujourd  '  hui  moins  nombreux  ,  mais  la  messe  sous  les  marronniers  est  toujours  un  bel  évènement  lorsqu'  il  fait  beau  .",marronniers
2019,"Vous  lirez  probablement  ce  marronnier  dès  ce  soir  dans  la  presse  :  un  cabinet  d'  analyse  se  sera  rué  sur  les  catalogues  des  usines  chinoises  et  aura  fait  une  sorte  d'  addition  des  composants  dans  l'  iPhone  ,  pointant  du  doigt  le  prix  (  qui  sera  élevé  )  de  l'  iPhone  .",marronnier
2019,Contre  l'  abattage  de  marronniers ,marronniers
2019,Vent  debout  contre  l'  abattage  de  marronniers  ?  .,marronniers
2019,"Cette  information  ainsi  relayée  par  un  internaute  sur  la  page  Facebook  des  défenseurs  des  platanes  de  Gien  soulève  une  levée  de  boucliers  chez  ceux  qui  s'  émeuvent  du  sort  réservé  à  ces  arbres  ,  en  l'  occurrence  des  marronniers  .",marronniers
2019,"Une  allée  au  charme  indéniable  ,  ombragée  par  les  frondaisons  des  marronniers  ,  située  à  quelques  pas  de  la  basilique  .",marronniers
2019,"Pour  sa  première  édition  ,  le  BLUES  ROOTS  FESTIVAL  se  déroule  du  13  au  15  septembre  ,  Domaine  de  Valbrillant  à  Meyreuil  ,  au  pied  de  la  Sainte-Victoire  dans  les  jardins  d'  une  bastide  du  XVIIIème  siècle  posée  ,  parmi  les  marronniers  séculaires  ,  dans  cette  campagne  Aixoise  où  flâne  encore  l'  âme  de  Cézanne  .",marronniers
2019,"Cela  devient  un  marronnier  produit  chez  Apple  ,  la  conférence  de  septembre  n'  est  plus  seulement  focalisée  sur  la  gamme  iPhone  .",marronnier
2019,"Avec  la  lecture  des  noms  des  victimes  ,  les  prières  ,  et  les  cornemuses  dont  le  son  soulève  les  cœurs  ,  la  commémoration  du  11  Septembre  à  New  York  est  devenue  un  marronnier  ,  comme  les  bouchons  de  la  rentrée  .",marronnier
2019,La  rentrée  c'  est  un  marronnier  qui  a  des  feuilles  différentes  selon  les  années,marronnier
2019,"La  rentrée  c'  est  un  marronnier  qui  a  des  feuilles  différentes  selon  les  années  ""  .",marronnier
2019,Le  marronnier  d'  Inde  ne  sera  pas  coupé  (  Ouest-France  ),marronnier
2019,"Depuis  quelques  jours  ,  à  l'  approche  du  début  des  travaux  de  la  salle  multiservice  ,  des  rumeurs  circulent  à  propos  du  marronnier  d'  Inde  ,  situé  place  de  la  Précourerie  .",marronnier
2019,Mais  il  n'  est  pas  question  de  couper  le  marronnier  .,marronnier
2019,"Sur  les  conseils  du  CAUE  ,  Conseil  d'  architecture  ,  d'  urbanisme  et  de  l'  environnement  ,  le  marronnier  ,  ""  qui  a  un  beau  port  mais  qui  n'  est  pas  classé  ,  ni  remarquable  ""  ,  fera  l'  objet  d'  un  diagnostic  visuel  et  phytosanitaire  par  un  conseiller  de  l'  Office  national  des  forêts  (  ONF  )  .",marronnier
2019,L'  association  des  donneurs  de  sang  en  partenariat  avec  l'  APEAI  (  Association  de  Parents  d'  Élèves  et  d'  Animations  Intercommunales  )  vous  invite  à  les  soutenir  le  samedi  28  septembre  lors  de  la  première  édition  du  festival  Food  Truck  local  dans  une  ambiance  festive  et  rock  sous  les  marronniers  .,marronniers
2019,"De  fines  lamelles  de  bois  précieux  (  ébène  de  Macassar  ,  amarante  )  et  d'  essences  rares  (  poirier  jaune  ,  loupe  de  madrona  ,  marronnier  )  dessinent  ,  chacune  avec  leur  grain  et  leur  couleur  naturel  ,  un  motif  dont  les  veines  animent  le  dessin  pour  recréer  une  œuvre  d'  art  sur  le  cadran  de  la  montre  ,  qui  ne  fait  guère  que  39,5  mm  de  diamètre  ,  avec  un  mouvement  extra-plat  qui  permet  à  la  montre  de  ne  pas  dépasser  les  2,6  mm  d'  épaisseur  .",marronnier
2019,"Dans  son  affiche  ,  il  a  dessiné  un  marronnier  et  une  Gladiator  sur  le  circuit  d'  Angoulême  ,  comme  s'  il  y  était  ,  avec  toujours  ce  souci  du  décor  naturel  ,  son  dada  .",marronnier
2019,"Yasser  Rahal  est  désormais  régulièrement  présent  sur  les  deux  marchés  de  la  ville  ,  mercredi  après-midi  place  des  Marronniers  et  samedi  matin  place  des  Arts  et  s'  honore  d'  une  démarche  d'  autodidacte  en  cuisine  libanaise  :  ""  J'  avais  une  activité  dans  le  commerce  de  textile  ,  mais  depuis  toujours  j'  avais  une  passion  affirmée  pour  la  cuisine  libanaise  ,  apprise  auprès  de  ma  mère  ""  .",marronniers
2019,"Preuve  de  cette  sensibilité  ,  des  capteurs  placés  sur  un  marronnier  et  un  chêne  mesurent  en  temps  réel  ce  que  ressent  l'  arbre  à  chaque  pas  des  visiteurs  .",marronnier
2019,"Elle  hésite  un  instant  :  ""  Il  y  a  quelques  années  ,  sur  la  chaîne  Public  Sénat  ,  n'  ayant  pas  d'  idée  pour  traiter  ces  marronniers  que  sont  Noël  et  le  jour  de  l'  an  ,  je  l'  avais  sollicité  pour  venir  sur  mon  plateau  .",marronniers
2019,"Dans  son  recueil  de  nouvelles  ""  La  Pierre  du  marronnier  ""  ,  Marcel  Darnaud  retrace  une  réalité  autobiographique  de  son  enfance  avec  ses  mystères  et  ses  anecdotes  .",marronnier
2019,C'  est  avec  le  cœur  gros  que  Bruno  se  rend  sur  la  parcelle  de  son  beau-père  où  il  tente  de  faire  pousser  des  acacias  et  des  marronniers  .,marronniers
2019,"""  Depuis  plus  de  10  ans  ,  mes  marronniers  ne  grandissent  presque  pas  ""  ,  se  désole  Bruno  .",marronniers
2019,Un  majestueux  marronnier  ombrageait  le  site  .,marronnier
2019,"la  plaine  de  Plainpalais  ,  des  beaux  marronniers  sciés  pour  de  jeunes  arbres  en  poter  et  qui  meure  de  soif  .",marronniers
2019,"C'  est  d'ailleurs  finalement  un  vieux  marronnier  ,  il  avait  déjà  fait  une  telle  demande  en  2013  et  en  2014  et  Manuel  Valls  ,  le  ministre  de  l'  Intérieur  de  l'  époque  ,  avait  refusé  deux  fois  .",marronnier
2019,"On  pouvait  notamment  y  lire  le  12  septembre  dernier  la  publication  de  90  abattages  ,  souvent  accompagnés  de  la  formule  lapidaire  ""  L'  autorisation  d'  abattage  est  exécutoire  nonobstant  recours  ""  avec  une  triste  liste  à  la  Prévert  des  condamnés  :  bouleau  ,  charme  ,  chêne  ,  épicéa  ,  érable  ,  frêne  ,  hêtre  ,  liquidambar  ,  marronnier  ,  orme  ,  peuplier  ,  pin  ,  prunus  ,  robinier  ,  sapin  ,  savonnier  et  tilleul  .",marronnier
2019,"Dans  la  rue  des  Platanes  ,  seul  le  marronnier  a  survécu  aux  engins  de  chantier  .",marronnier
2019,"Au  total  ,  ce  ne  sont  pas  moins  de  424  arbres  de  diverses  essences  qui  sont  venus  remplacer  les  300  marronniers  et  tilleuls  qu'  il  a  fallu  couper  pour  mener  à  bien  le  projet  .",marronniers
2019,"Les  résidents  et  les  animateurs  des  Ehpad  audois  vous  invitent  à  partager  une  après-midi  spectacle  sur  le  thème  :  La  chorale  l'  air  de  rien  ,  le  jeudi  19  septembre  à  14  heures  ,  salle  de  L'  Élysée  2  sur  l'  allée  des  Marronniers  à  Limoux  .",marronniers
2019,"Ce  marronnier  ,  presque  centenaire  ,  s'  est  effondré  à  13  h  35  ,  très  précisément  .",marronnier
2019,"Voici  l'  emplacement  de  l'  arbre  ,  avant  sa  chute  (  marronnier  à  gauche  de  l'  image  )  Cet  incident  peut-il  se  répéter  avec  les  autres  arbres  de  la  place  ?  Apparemment  non  ,  mais  face  à  cette  crainte  ,  il  est  urgent  de  savoir  précisément  ce  qui  passé  .",marronnier
2019,"Par  ailleurs  ,  il  a  déjà  été  décidé  qu'  un  nouvel  arbre  remplacera  le  marronnier  .",marronnier
2019,"Peu  avant  14  heures  ce  jeudi  ,  un  des  marronniers  de  la  place  de  République  en  plein  centre  ville  de  Poitiers  est  tombé  .",marronniers
2019,"""  Le  système  racinaire  ,  la  période  de  canicule  et  donc  l'  assèchement  du  bois  plus  quelques  vents  tourbillonnants  sur  cette  place  là  ces  dernières  heures  ont  occasionné  la  chute  du  marronnier  ""  ,  explique  Vincent  Pellerin  .",marronnier
2019,Les  élagueurs  ont  rapidement  évacué  le  marronnier  et  a  laissé  place  à  un  grand  vide  sur  cette  place  de  la  République  très  fréquentée  à  l'  heure  du  déjeuner  et  en  soirée  .,marronnier
2019,Le  marronnier  le  plus  proche  a  été  élagué  à  son  tour  pour  éviter  tout  autre  accident  .,marronnier
2019,L'  annonce  par  l'  exécutif  de  la  création  de  ladite  commission  est  devenu  un  marronnier  après  chaque  publication  de  rapport  de  la  Cour  des  comptes  .,marronnier
2019,"Les  producteurs  ,  installés  à  l'  ombre  des  marronniers  de  la  place  des  Arcades  ,  faisaient  patienter  le  nombreux  public  venu  participer  à  cette  belle  tradition  .",marronniers
2019,"Demain  ,  de  14  heures  à  17  heures  :  Jeux  traditionnels  ,  au  jardin  des  Marronniers  (  tout  public  )  .",marronniers
2019,"Le  week-end  sur  la  place  des  Marronniers  sera  également  ponctué  par  l'  arrivée  de  la  Color  Loop  ,  course  pédestre  familiale  et  colorée  ,  le  samedi  21  à  19  heures  .",marronniers
2019,"Pour  la  troisième  année  consécutive  ,  une  cinquantaine  de  food  trucks  et  triporteurs  se  retrouvent  à  Saint-Maur  (  Val-de-Marne  )  sur  la  place  des  Marronniers  pour  le  Saint-Maur  Food  Trucks  Festival  ,  plus  grand  événement  de  street  food  de  France  .",marronniers
2019,"C'  est  presque  devenu  un  marronnier  ""  ,  avertit  Björn-Olav  Dozo  ,  directeur  du  Liège  Game  Lab  .",marronnier
2019,"Riche  de  2  hectares  plantés  de  feuillus  ,  dont  certains  sont  plus  que  centenaires  (  ormeaux  ,  tilleuls  ,  marronniers  )  ,  la  place  a  été  aménagée  en  1801  puis  classé  site  remarquable  en  1921  .",marronniers
2019,"Les  tilleuls  ,  marronniers  ,  hêtres  et  platanes  sont  plus  que  centenaires  .",marronniers
2019,"Rien  donc  des  personnages  loufoques  que  l'  écrivaine  de  31  ans  met  en  scène  dans  certains  de  ses  romans  comme  dans  la  saga  Pickwik  dont  le  quatrième  opus  sortira  en  janvier  chez  l'  éditeur  belge  Lily  '  s.  Pas  de  marronnier  non  plus  devant  la  petite  maison  de  Sotteville-lès-Rouen  qu'  elle  occupe  depuis  six  mois  avec  son  compagnon  ,  scénariste  et  réalisateur  .",marronnier
2019,"Pourquoi  un  marronnier  ?  Parce  que  c'  est  de  la  ""  rencontre  ""  avec  cet  arbre  ,  devant  l'  appartement  qu'  elle  habitait  en  colocation  à  Toulouse  lors  de  ses  études  en  BTS  Édition  ,  qu'  est  née  l'  inspiration  pour  le  premier  tome  de  cette  saga  ""  que  l'  on  classe  parmi  les  inclassables  ,  sourit  la  jeune  femme  .",marronnier
2019,"Le  marronnier  fait  partie  du  décor  ,  dans  le  jardin  des  protagonistes  de  cette  histoire  .",marronnier
2019,"Sous  son  marronnier  ""  mi-figue  mi-raisin  ""  ,  Pierre  se  réjouit  aussi  mais  s'  inquiète  de  voir  les  saisons  se  dérégler  :  ""  regardez  le  marronnier  !  Il  y  a  une  partie  avec  les  feuilles  qui  tombent  ,  une  autre  qui  est  en  train  de  fleurir  !  C'  est  pas  normal  tout  ça  !  """,marronnier
2019,"""  La  nostalgie  de  l'  homme  aux  cravates  mauves  est  l'  un  des  marronniers  depuis  huit  ans  et  celle-ci  a  toujours  été  complexe  ,  car  ambivalente  .",marronniers
2019,"Sur  les  flots  du  bassin  ,  à  l'  entrée  du  parc  du  château  de  Chaumont-sur-Loire  ,  dans  le  Loir-et-Cher  ,  des  rayons  de  soleil  se  faufilent  entre  les  feuilles  de  marronnier  et  viennent  réchauffer  des  grenouilles  s'  agitant  entre  les  pierres  ciselées  du  sculpteur  Vincent  Mauger  .",marronnier
2019,"Depuis  l'  an  dernier  ,  Céline  Hamon  ,  37  ans  ,  ingénieur  agronome  et  docteur  en  génétique  et  amélioration  des  plantes  chez  Végénov  ,  veille  sur  les  marronniers  du  couple  Macron  .",marronniers
2019,"C'  est  l'  un  d'  eux  ,  spécifique  au  chancre  bactérien  du  marronnier  blanc  ,  qui  a  fait  la  renommée  de  la  société  saint-politaine  .",marronnier
2019,"Un  des  marronniers  de  tous  les  programmes  électoraux  de  tous  les  candidats  à  une  élection  ,  est  le  logment  .",marronniers
2019,"L'  autre  phase  du  chantier  ,  entamée  sous  le  règne  de  l'  ancien  maire  de  Paris  Jean  Tiberi  --  et  qu'  on  ne  saurait  complètement  lui  reprocher  --  ,  a  consisté  à  élargir  les  trottoirs  pour  y  planter  des  marronniers  roses  ,  tout  en  interdisant  le  stationnement  des  autocars  .",marronniers
2019,Ah  le  fameux  marronnier  des  salles  /  stades  vides  au  Qatar  avant  chaque  grande  compétition  organisée  là-bas  .,marronnier
2019,Le  marronnier  a  déjà  égrené  des  bogues  de  marrons  sur  le  sol  .,marronnier
2019,"Le  marronnier  ,  lui  ,  est  importé  ,  et  c'  est  le  seul  représentant  de  sa  famille  en  France  .",marronnier
2019,"La  figure  du  banditisme  corse  sera  donc  rejugé  pour  subornation  de  témoin  dans  le  cadre  de  l'  affaire  connue  sous  le  nom  de  la  ""  tuerie  des  marronniers  ""  .",marronniers
2019,"Les  châtaignes  ,  qu'  elles  soient  cultivées  ou  sauvages  ,  sont  comestibles  ,  à  l'  inverse  des  marrons  d'  Inde  ,  qui  poussent  et  tombent  du  marronnier  .",marronnier
2019,"L'  Anses  précise  également  que  les  marronniers  sont  plutôt  implantés  dans  les  villes  ,  allées  ,  ou  parcs  alors  que  les  châtaigniers  se  trouvent  dans  les  bois  ou  les  vergers  .",marronniers
2019,"Les  feuilles  d'  un  marronnier  sont  composées  de  plusieurs  petites  feuilles  de  forme  ovale  ""  qui  donnent  à  l'  ensemble  de  la  feuille  un  aspect  palmé  ""  ,  celles  du  châtaigner  sont  simples  et  allongées  .",marronnier
2019,Le  grand  marronnier  de  mon  école  primaire  a  souvent  disparu  près  de  la  marelle  mais  on  le  réclame  à  nouveau  .,marronnier
2019,"Les  arbres  plantés  dans  les  parcs  ,  les  allées  et  les  cours  d'  école  sont  généralement  des  marronniers  ,  tandis  qu'  on  trouve  plutôt  les  châtaigniers  dans  les  bois  et  les  forêts  ,  ajoute  l'  agence  .",marronniers
2019,"Les  marronniers  sont  dans  les  villes  ,  les  parcs  ou  les  cours  d'  école  .",marronniers
2019,"Selon  l'  Anses  ,  dès  le  début  de  l'  automne  ,  ""  les  confusions  de  marrons  d'  Inde  ,  qui  poussent  et  tombent  du  marronnier  ,  avec  des  châtaignes  que  l'  on  ramasse  du  châtaignier  ,  sont  fréquentes  ""  .",marronnier
2019,"-  Les  feuilles  du  marronnier  sont  composées  chacune  de  plusieurs  ""  petites  feuilles  ""  (  folioles  )  de  forme  ovale  ,  qui  donnent  à  l'  ensemble  de  la  feuille  un  aspect  palmé  ,  alors  que  les  feuilles  du  châtaignier  sont  simples  sans  foliole  et  allongées  .",marronnier
2019,"En  revanche  ,  les  marrons  d'  Inde  ,  qui  poussent  et  tombent  du  marronnier  ,  sont  toxiques  et  peuvent  entraîner  des  troubles  digestifs  comme  des  douleurs  abdominales  ,  des  nausées  ,  des  vomissements  ou  des  irritations  de  la  gorge  .",marronnier
2019,"Autre  astuce  :  les  arbres  plantés  dans  les  parcs  ,  les  allées  ou  encore  les  cours  d'  école  sont  généralement  des  marronniers  ;  les  châtaigniers  se  trouvant  ,  quant  à  eux  ,  dans  les  bois  et  forêts  .",marronniers
2019,"Les  marrons  d'  Inde  ,  qui  sont  en  fait  la  graine  non  comestible  du  marronnier  ,  sont  toxiques  et  ""  peuvent  entraîner  des  troubles  digestifs  tels  que  des  douleurs  abdominales  ,  des  nausées  ,  des  vomissements  ,  ou  des  irritations  de  la  gorge  ""  .",marronnier
2019,"Au  contraire  ,  les  marronniers  se  trouvent  principalement  dans  les  villes  et  les  parcs  ,  avec  des  ""  petites  feuilles  ""  de  forme  ovale  qui  donnent  un  aspect  palmé  à  l'  arbre  .",marronniers
2019,"Préparé  ""  en  toute  transparence  ""  avec  une  concertation  locale  et  ""  validé  par  tous  les  services  de  l'  Etat  ""  ,  le  chantier  avait  commencé  en  février  avec  l'  abattage  de  18  marronniers  .",marronniers
2019,"Lors  de  la  séance  ,  Joël  Le  Jeune  ,  le  président  de  Lannion-Trégor  Communauté  ,  a  réaffirmé  sa  volonté  de  poursuivre  ce  projet  sans  épargner  les  quatre  arbres  défendus  :  un  marronnier  d'  Inde  ,  un  saule  pleureur  et  deux  magnolias  qui  doivent  disparaître  avec  la  réhabilitation  de  l'  ancien  tribunal  et  la  construction  d'  un  auditorium  de  130  places  .",marronnier
2019,"La  mise  en  garde  est  d'autant  plus  importante  que  souvent  ,  son  arbre  ,  le  marronnier  ,  est  généralement  planté  en  ville  à  titre  ornemental  ,  ou  dans  les  cours  d'  écoles  et  les  parcs  ,  même  s'  il  est  possible  de  le  trouver  ""  ailleurs  ""  ,  note  la  spécialiste  .",marronnier
2019,"Même  si  c'  est  un  phénomène  marronnier  ,  est-ce  une  raison  de  croiser  les  bras  et  attendre  ?  Non  ,  les  chefs  de  ces  établissements  doivent  agir  car  ,  le  constat  est  très  alarmant  .",marronnier
2019,"En  général  ,  ceux  plantés  en  ville  ,  dans  les  parcs  ,  les  allées  et  les  cours  d'  école  sont  des  marronniers  .",marronniers
2019,"Et  vous  aviez  ,  depuis  Lindenberg  ,  des  quotidiens  et  des  magazines  qui  refaisaient  comme  un  marronnier  leurs  listes  noires  tous  les  mois  .",marronnier
2019,"Le  marronnier  d'  Inde  (  marronnier  commun  )  ,  attaqué  par  la  mineuse  du  marronnier  ,  un  insecte  ravageur  venu  des  Balkans  ,  est  désormais  considéré  comme  ""  vulnérable  ""  .",marronnier
2019,"Selon  l'  agence  ""  les  confusions  de  marrons  d'  inde  ,  qui  poussent  et  tombent  du  marronnier  ,  avec  des  châtaignes  que  l'  on  ramasse  du  châtaignier  ,  sont  fréquentes  ""  .",marronnier
2019,L'  agence  sanitaire  souligne  également  la  différence  géographique  entre  les  marronniers  et  les  châtaigniers  .,marronniers
2019,"Les  marronniers  sont  principalement  situés  dans  les  villes  ,  notamment  dans  les  parcs  ou  les  cours  d'  école  .",marronniers
2019,"Le  très  commun  marronnier  d'  Inde  ,  attaqué  par  la  mineuse  du  marronnier  ,  un  insecte  ravageur  venu  des  Balkans  qui  s'  est  rapidement  répandu  sur  tout  le  continent  ,  est  désormais  considéré  comme  ""  vulnérable  ""  .",marronnier
