year,sentence,key_word
2020,"J'  ai  donc  passé  outre  au  bénéfice  d'  un  pays  qui  a  su  préserver  fièrement  son  territoire  depuis  1066  tout  en  ayant  la  courtoisie  de  renoncer  en  douce  à  sa  vieille  langue  pour  en  créer  une  nouvelle  ,  celle  de  son  bref  envahisseur  avec  le  puissant  renfort  de  mon  cher  français  (  car  l'  anglais  moderne  en  est  truffé  )  et  résista  plus  tard  au  nazisme  avec  un  héroïsme  d'  airain  ,  en  un  suprême  spectre  historique  .",airain
2020,"En  tout  état  de  cause  ,  la  loi  d'  airain  de  la  Ve  République  semble  être  celle-ci  :  le  49,3  sert  exclusivement  au  Gouvernement  à  agir  comme  organe  législatif  supérieur  (  même  si  ,  depuis  2008  ,  ce  droit  ,  naguère  absolu  ,  est  limité  à  un  texte  par  session  --  mais  à  plusieurs  reprises  si  nécessaires  --  ,  sans  compter  les  textes  financiers  )  .",airain
2020,"Faut-il  voir  dans  la  mise  à  l'  écart  de  Christian  Roger  Okemba  un  tournant  dans  la  gouvernance  de  ce  petit  pays  pétrolier  d'  Afrique  Centrale  dirigé  d'  une  main  d'  acier  dans  un  gant  d'  airain  par  le  khalife  d'  Oyo  ,  Denis  Sassou  Nguesso  ?",airain
2020,Cœur  d'  aryenne  (  Jean-Malonga  )  ou  cœur  d'  airain  ?,airain
2020,"Son  Excellence  Toumani  Djimé  Diallo  ,  ci-devant  ambassadeur  du  Mali  en  France  ,  a  brisé  un  tabou  en  assénant  contre  la  Légion  étrangère  française  des  vérités  d'  airain  qui  n'  ont  pas  plu  aux  autorités  françaises  .",airain
2020,"Le  musée  Lafage  a  la  chance  inestimable  de  présenter  aujourd  '  hui  un  dessin  remarquable  de  Raymond  Lafage  ,  intitulé  ""  Le  Serpent  d'  Airain  ""  ,  don  de  M.  Hemery  .",airain
2020,"Rodin  dessine  le  modèle  ,  sculpte  sa  Camille  ,  défend  son  Balzac  ;  se  souvient  de  l'  Italie  ,  Ghiberti  et  Michel-Ange  ;  de  L'  Age  d'  Airain  ,  de  l'  accusation  de  moulage  sur  nature  et  de  Victor  Hugo  qui  ne  veut  pas  poser  .",airain
2020,"La  violence  tombe  quand  la  loi  d'  airain  s'  efface  ,  laissant  transparaitre  que  le  bien  est  la  source  du  sacré  suivant  la  belle  expression  de  Simone  Weil  .",airain
2020,"""  La  fonderie  prélèvera  30  %  de  l'  airain  ,  l'  alliage  des  cloches  ,  pour  les  nouvelles  ,  avec  un  apport  de  70  %  de  matière  .",airain
2020,"Xavier  Raufer  :  De  Taubira  en  Belloubet  ,  une  constante  dans  la  justice  selon  Hollande-Macron  :  pleine  sollicitude  pour  les  malfaiteurs  ,  indifférence  d'  airain  pour  les  victimes  sans  nombre  du  crime  .",airain
2020,"Premier  résultat  ,  massif  ,  des  trois  enquêtes  ,  une  corrélation  d'  airain  :  plus  on  connait  de  sciences  et  moins  le  niveau  de  croyances  religieuses  est  élevé  ...  et  inversement  .",airain
2020,"Le  président  américain  a  choisi  de  conserver  l'  optimisme  d'  airain  dont  il  fait  preuve  depuis  le  début  de  l'  épidémie  ,  qui  a  fait  29  morts  aux  Etats-Unis  et  alors  que  le  cap  des  1  0  50  cas  avérés  de  Covid-  19  a  été  dépassé  mardi  soir  ,  selon  le  compteur  de  l'  université  Johns-Hopkins  ,  une  référence  en  la  matière  .",airain
2020,"On  peut  évoquer  le  serpent  d'  airain  attribué  à  Moïse  et  qui  était  censé  guérir  les  piqures  de  serpents  [  6  ]  .  Mais  ,  aujourd  '  hui  encore  ,  ne  sommes-nous  pas  idolâtres  lorsque  nous  pensons  et  agissons  comme  si  plus  de  marché  allait  nous  sauver  des  excès  du  marché  ,  notamment  concernant  la  pauvreté  et  la  crise  climatique  et  environnementale  ;  comme  si  la  recrudescence  de  la  violence  pouvait  être  réglée  par  un  surcroit  de  violence  de  la  part  des  ""  forces  de  l'  ordre  ""  .",airain
2020,"Notre  serpent  d'  airain  moderne  pourrait  être  tout  aussi  bien  la  bombe  atomique  qui  doit  nous  protéger  de  la  guerre  ,  ou  le  placement  financier  pour  nous  mettre  à  l'  abri  de  la  misère  .",airain
2020,"[  6  ]  ""  Moïse  fit  un  serpent  d'  airain  et  le  fixa  à  une  hampe  et  lorsqu'  un  serpent  mordait  un  homme  ,  celui-ci  regardait  le  serpent  d'  airain  et  il  avait  la  vie  sauve  .",airain
2020,"""  C'  est  la  loi  d'  airain  de  la  vie  politique  ,  plus  on  monte  dans  la  hiérarchie  ,  moins  il  y  a  de  femmes  ""  ,  résume  la  politologue  Mariette  Sineau  ,  autrice  de  Femmes  et  pouvoir  sous  la  V  République  (  Presses  de  Sciences  Po  )  ,  tout  en  notant  le  rôle  des  lois  de  parité  qui  se  sont  succédé  depuis  2000  pour  permettre  aux  femmes  de  combler  l'  écart  dans  les  assemblées  locales  .",airain
2020,"Et  c'  est  de  la  sorte  que  semble  se  conclure  la  parenthèse  libérale  initiée  ,  de  l'  autre  côté  de  la  Manche  et  de  l'  Atlantique  ,  par  Margaret  Thatcher  et  poursuivie  par  Ronald  Reagan  ,  avant  de  devenir  loi  d'  airain  sur  le  Vieux  continent  .",airain
2020,"Une  première  échéance  ,  dimanche  15  mars  ,  dont  le  bon  déroulement  repose  sur  une  règle  d'  airain  :  aucun  contact  entre  l'  électeur  et  le  personnel  du  bureau  de  vote  .",airain
2020,"Elle  évoque  les  clameurs  d'  airain  sur  les  berges  du  fleuve  Scamandre  ,  un  thrène  paléolithique  ,  un  muezzin  dans  les  sables  du  temps  ...",airain
2020,"Réélu  au  conseil  municipal  ,  il  sera  maire  adjoint  en  1983  et  maire  de  1985  à  2014  ,  ainsi  que  vice-président  du  syndicat  de  l'  Airain  de  2001  à  2014  .",airain
2020,"À  commencer  donc  par  le  maintien  des  municipales  ,  tellement  discutable  que  le  second  tour  doit  (  et  peut  )  être  reporté  ;  les  discours  à  géométrie  variable  depuis  le  début  de  cette  épidémie  ,  de  la  relativisation  à  l'  emballement  brutal  ;  ces  derniers  mois  ,  la  loi  d'  airain  de  l'  austérité  budgétaire  opposée  ,  entre  autres  ,  aux  revendications  insistantes  des  personnels  hospitaliers  ,  soudainement  caduque  .",airain
2020,"Et  nous  pourrions  multiplier  les  exemples  de  ce  type  ,  ces  certitudes  ,  ces  dogmes  ,  ces  lois  soi  disant  d'  airain  ,  intangibles  ,  que  le  virus  a  mis  en  pièce  .",airain
2020,"Cette  excellente  terre  ,  ""  pleine  de  ruisseaux  ,  d'  étangs  et  de  fontaines  ;  abondante  en  huile  et  en  miel  ,  où  les  pierres  sont  du  fer  et  les  montagnes  de  l'  airain  ""  ,  est  échue  aux  Libanais  qui  ,  seuls  ,  en  occupent  les  parties  les  plus  pittoresques  .",airain
2020,"Les  entreprises  spécialisées  dans  le  transport  de  marchandises  conteneurisées  ,  sont  livrées  ,  pieds  et  mains  liés  dans  la  gueule  des  compagnies  maritimes  qui  exercent  sur  eux  ,  l'  ordre  d'  airain  à  travers  des  contrats  où  l'  une  des  parties  (  le  transporteur  )  est  lésé  sur  tous  les  plans  mais  qui  se  résigne  à  l'  accepter  afin  d'  exercer  son  activité  .",airain
2020,"Le  signe  que  rien  n'  est  jamais  coulé  dans  l'  airain  !  ""  Notre  étude  souligne  la  montée  en  puissance  de  certains  outsiders  ,  comme  le  '  pure  player  '  Internet  bol  .  com  (  filiale  de  Ahold  Delhaize  )  dans  le  segment  de  l'  électronique  ,  ou  Rockwool  dans  le  domaine  du  do-it-yourself  ""  ,  analyse  Nancy  Delhalle  ,  CMO  de  Serviceplan  Benelux  .",airain
2020,"Si  l'  on  ignore  encore  tout  de  la  durée  de  la  crise  ,  le  débat  de  la  création  d'  une  fenêtre  dérogatoire  aux  règles  d'  airain  de  la  chronologie  des  médias  s'  invite  d'  ores  et  déjà  au  Centre  national  du  cinéma  (  CNC  )  .",airain
2020,"C'  est  la  première  fois  que  Benny  Gantz  ,  tout  en  enveloppant  ses  réponses  avec  prudence  a  tout  de  même  fait  comprendre  que  le  boycott  de  la  personne  du  Premier  ministre  n'  est  plus  une  règle  d'  airain  pour  lui  ,  allant  même  jusqu'  à  dire  que  la  situation  actuelle  passait  avant  ""  les  déclarations  qu'  il  ait  pu  faire  ici  ou  là  ""  .",airain
2020,"Dans  ces  circonstances  ,  les  masques  sont  donc  bien  évidemment  envoyés  aux  hôpitaux  en  priorité  ,  et  tandis  que  le  nombre  de  victimes  du  coronavirus  grimpe  jour  après  jour  ,  les  gestes  ""  barrière  ""  ,  comme  se  laver  les  mains  ,  et  le  respect  scrupuleux  des  règles  de  confinement  doivent  rester  des  lois  d'  airain  pour  les  particuliers  .",airain
2020,"En  France  ,  le  débat  se  poursuit  pour  assouplir  la  loi  d'  airain  de  la  chronologie  des  médias  en  cette  période  de  confinement  (  lire  :  Les  films  privés  de  salles  de  cinéma  pourraient  sortir  directement  en  VOD  )  .",airain
2020,"Car  la  racaille  ne  se  bat  jamais  en  un  contre  un  sans  son  troupeau  ,  c'  est  une  loi  d'  airain  .",airain
2020,"L'  Allemagne  met  ainsi  en  veilleuse  une  règle  budgétaire  d'  airain  qui  dicte  sa  conduite  depuis  des  années  :  en  vigueur  depuis  2011  ,  la  règle  constitutionnelle  du  ""  frein  à  l'  endettement  ""  n'  autorise  en  principe  qu'  un  déficit  pouvant  aller  jusqu'  à  0,35  %  du  PIB  .",airain
2020,C'  est  un  triton  d'  airain  .,airain
2020,"Les  politesses  se  termineront  devant  la  caisse  enregistreuse  du  comptoir  où  un  avant-bras  d'  une  fermeté  d'  airain  ,  comme  trempé  dans  une  marmite  de  potion  magique  ,  fera  physiquement  barrage  à  toute  tentative  d'  atteinte  à  son  savoir-vivre  .",airain
2020,"""  Est  qu'  un  huis  clos  tuerait  le  Tour  de  France  ?  Je  ne  le  pense  pas  car  le  Tour  restera  toujours  le  Tour  ,  bâti  sur  son  socle  d'  airain  ,  un  événement  qui  fait  partie  du  patrimoine  français  ,  une  grande  fête  de  la  France  en  juillet  .",airain
2020,"Comment  se  libérer  du  Carcan  ,  des  règles  d'  airain  imposées  par  un  créateur  qui  n'  est  plus  ?  Comment  réagir  à  la  découverte  d'  une  nouvelle  forme  de  vie  ?  Se  peut-il  que  ce  soit  le  dernier  Homme  ?  C'  est  l'  intrigue  du  passionnant  Latium  ,  de  Romain  Lucazeau  ,  un  Space  Opera  épique  ,  une  épopée  de  SF  qui  emprunte  à  la  tragédie  grecque  au  moment  où  The  Expanse  est  adapté  en  série  ,  et  avec  la  reprise  des  séries  Star  Trek  et  Star  Wars  au  cinéma  ,  le  Space  Opera  est-il  en  train  de  vivre  un  nouvel  âge  d'  or  ?",airain
2020,"Macron  connaît  la  loi  d'  airain  de  tout  gouvernement  depuis  deux  siècles  :  ""  Gouverner  ,  c'  est  prévoir  ""  .",airain
2020,"J'  applique  ce  que  l'  on  m'  a  enseigné  ,  une  loi  d'  airain  que  tous  les  traders  du  monde  entier  entendent  ,  on  investit  là  où  le  rendement  estimé  est  maximal  .",airain
2020,"Mais  leurs  protestations  se  heurtaient  toujours  au  même  mur  d'  airain  :  vouloir  envisager  un  autre  monde  ,  c'  était  bien  beau  ,  mais  totalement  utopiste  ,  il  fallait  être  réaliste  et  le  réalisme  consistait  à  admettre  la  dure  loi  du  marché  comme  un  processus  inexorable  contre  lequel  on  ne  pouvait  rien  .",airain
2020,"Les  cirques  réunionnais  ,  et  notamment  Mafate  qui  refuse  toute  route  à  l'  intérieur  de  ses  murailles  ,  sont  l'  endroit  idéal  pour  se  forger  des  mollets  d'  airain  .",airain
2020,"A  ce  jour  ,  les  gouvernements  ,  enfermés  dans  les  carcans  idéologiques  qu'  ils  se  sont  eux-mêmes  construits  ,  n'  ont  rien  fait  d'  autre  que  subir  la  loi  d'  airain  de  l'  économisme  ,  quitte  à  lui  servir  de  ""  voiture-balai  ""  par  la  multiplication  de  palliatifs  toujours  en  retard  sur  l'  événement  :  prolongation  de  la  scolarité  ,  avancement  de  l'  âge  de  la  retraite  ,  indemnisation  du  chômage  ,  stages-parking  ,  revenu  minimum  d'  insertion  (  RMI  )  ,  etc  .",airain
2020,"Aucune  leçon  ne  fut  durablement  retenue  car  les  puissances  d'  argent  -  pour  employer  un  terme  générique  -  savent  ,  veulent  et  peuvent  imposer  leur  loi  d'  airain  .",airain
2020,"Ils  doivent  certainement  avoir  un  cœur  d'  airain  ,  ces  hommes  et  ces  femmes  qui  ont  osé  ,  sans  vergogne  ,  faire  monter  en  flèche  les  prix  sous  le  fallacieux  prétexte  de  l'  apparition  du  coronavirus  au  Mali  .",airain
2020,"Amateurs  ou  musiciens  confirmés  ,  tous  se  plient  à  cette  règle  d'  airain  ,  les  titres  diffusés  ont  obligatoirement  été  composés  durant  ce  confinement  !  Les  ""  home  studios  ""  n'  ont  jamais  si  ben  porté  leur  nom  !  ""  On  accepte  les  reprises  qui  sont  enregistrées  durant  le  confinement  .",airain
2020,"Prenons  garde  cependant  de  ne  pas  trop  courir  le  risque  de  produire  paradoxalement  ce  que  l'  on  dénonce  ,  et  de  renforcer  ainsi  l'  édification  de  bustes  d'  airain  qui  ont  bon  dos  .",airain
2020,Les  achats  intégrés  dans  les  apps  distribuées  par  l'  App  Store  sont  en  effet  soumis  à  la  règle  d'  airain  des  30  %  prélevés  par  Apple  (  15  %  la  deuxième  année  pour  un  abonnement  )  .,airain
2020,"Pénicaud  ,  Thatcher  échappée  d'  une  couveuse  PS  ,  est  là  pour  les  menacer  les  réfractaires  à  la  loi  d'  airain  du  capital  .",airain
2020,"Et  sa  parole  ,  en  salle  ,  devenait  d'  or  ou  d'  airain  ,  selon  nos  besoins  .",airain
2020,La  loi  d'  airain  de  la  Real  Politik  et  du  marché,airain
2020,"Comme  il  n'  a  ni  appris  la  Realpolitik  ni  la  loi  d'  airain  du  marché  ,  il  ne  peut  pas  comprendre  que  le  monde  dans  lequel  il  a  grandi  s'  effondre  brutalement  .",airain
2020,Je  l'  ai  vu  devant  ma  cité  transpercée  par  l'  airain  aigu  .,airain
2020,"Un  pour  les  Troyens  dompteurs  de  chevaux  ,  un  pour  les  Grecs  bardés  d'  airain  ,",airain
2020,"Qu'  à  toi  ,  quand  l'  un  des  Grecs  à  la  cuirasse  d'  airain ",airain
2020,"Ainsi  il  tomba  là  ,  endormi  par  un  sommeil  d'  airain  ,",airain
2020,"L'  ouverture  non  orthodoxe  de  la  vanne  budgétaire  qui  vient  de  ruiner  une  règle  d'  airain  de  l'  U.E  ,  n'  est  pas  de  l'  argent  ""  magique  ""  !",airain
2020,Sans  parler  du  contexte  actuel  de  crise  sanitaire  lié  au  covid-  19  qui  laissera  des  traces  dans  la  construction  européenne  laquelle  pourrait  bien  ne  plus  avancer  sans  respecter  ces  deux  règles  d'  Airain  pour  asseoir  sa  légitimité  :  une  solidarité  exemplaire  entre  ses  membres  associée  à  un  volontarisme  doublé  d'  une  exigence  démocratique  renforcée  .,airain
2020,"Au-delà  du  sympathique  portrait  de  deux  sympathiques  octogénaires  à  âme  d'  enfant  bien  conservée  ,  un  docu  précieux  sur  le  métier  d'  animateur  ,  incarné  par  Ollie  Johnston  et  Frank  Thomas  (  dont  le  fils  signe  la  réalisation  )  ,  membres  emblématiques  des  Nine  Old  Men  qui  façonnèrent  l'  âge  d'  or  du  studio  et  édictèrent  des  lois  d'  airain  aujourd  '  hui  encore  respectées  dans  toute  l'  animation  mondiale  .",airain
2020,"""  Le  Premier  ministre  demande  à  son  gouvernement  et  à  la  haute  fonction  publique  de  respecter  une  discipline  d'  airain  dans  la  communication  de  crise  .",airain
2020,"Ceci  pour  dire  combien  les  appels  de  l'  ONU  ne  vont  pas  au-delà  du  vœu  pieux  ,  compte  tenu  de  la  détermination  de  Haftar  et  des  dirigeants  de  l'  est  d'  imposer  leur  loi  d'  airain  à  la  Tripolitaine  dont  les  habitants  nourrissent  ,  à  juste  titre  ,  une  défiance  de  plus  en  plus  grande  face  aux  ambitions  de  leurs  rivaux  .",airain
2020,On  est  fier  d'  être  animé  par  ce  plaisir  poétique  qui  demande  pourtant  une  organisation  d'  airain  et  une  discipline  immuable  .,airain
2020,"Pour  plier  les  plus  démunis  à  cette  loi  d'  airain  ,  il  n'  est  guère  conseillé  de  le  claironner  sous  cette  forme  .",airain
2020,"Afin  d'  éviter  des  désertions  à  l'  étrangers  ,  leurs  familles  sont  prises  en  otage  dans  l'  île  et  sont  soumis  à  des  règles  d'  airain  .",airain
2020,"En  conséquence  ,  les  cloches  en  chocolat  sont  plus  rares  dans  nos  contrées  que  celles  en  airain  ,  sonnantes  et  carillonnantes  .",airain
2020,"La  technique  de  la  fusion  de  l'  airain  ,  alliage  d'  étain  et  de  cuivre  ,  et  le  moulage  de  la  cloche  qui  peut  peser  plusieurs  tonnes  ,  n'  a  guère  évolué  depuis  des  siècles  .",airain
2020,La  statue  de  Kukai  armé  de  son  bâton  à  clochette  envisage  la  débandade  de  son  œil  d'  airain  .,airain
2020,"Les  cloches  ,  ""  voix  d'  airain  chantant  dans  des  flûtes  de  pierre  hautes  de  300  pieds  ""  ,  selon  Victor  Hugo  ;  les  sirènes  des  urgences  du  quai  des  Orfèvres  ou  de  l'  Hôtel-Dieu  ;  les  bateaux-mouches  tournant  autour  de  l'  île  de  la  Cité  au  son  grave  ,  très  lent  ,  ""  soixante  secondes  durant  lesquelles  les  chanteurs  se  figent  avant  de  reprendre  ""  ,  raconte  Henri  Chalet  ;  toute  une  symphonie  se  joue  à  Notre-Dame  .",airain
2020,L'  histoire  est  pleine  d'  experts  ayant  fait  des  prédictions  erronées  en  oubliant  cette  règle  d'  airain  .,airain
2020,"Fondu  en  1686  ,  en  partie  avec  l'  airain  de  la  cloche  médiévale  ,  il  pèse  13  tonnes  .",airain
2020,"""  Emmanuel  ""  ,  prénom  qui  désigne  le  Christ  et  signifie  ""  Dieu  avec  nous  ""  ,  a  été  fondu  en  1686  ,  en  partie  avec  l'  airain  de  la  cloche  médiévale  .",airain
2020,"Pendant  ce  temps-là  ,  en  France  ,  un  folliculaire  prenant  ses  rêves  pour  la  réalité  nous  raconte  dans  un  média  en  ligne  que  ""  la  parenthèse  libérale  initiée  de  l'  autre  côté  de  la  Manche  et  de  l'  Atlantique  ,  par  Margaret  Thatcher  et  Ronald  Reagan  ""  semble  se  conclure  ,  et  que  sur  ""  le  Vieux  Continent  ""  le  libéralisme  qui  serait  devenu  un  temps  ""  loi  d'  airain  ""  ,  cette  même  parenthèse  se  refermerait  aussi  .",airain
2020,"Loi  d'  airain  :  quand  les  riches  sont  gênés  ,  les  pauvres  basculent  dans  la  misère  et  le  chaos  n'  épargne  alors  plus  personne  .",airain
2020,"""  Il  y  a  cinq  ans  ,  The  Animen  s'  accomplissaient  en  rockers  solides  à  Nashville  ,  jurant  leurs  grands  dieux  que  jamais  ils  ne  dérogeraient  à  une  loi  d'  airain  :  enregistrer  une  chanson  ,  c'  est  le  faire  en  une  prise  live  ,  point  !",airain
2020,"Tout  est  d'  airain  ,  tout  est  de  fer  .",airain
2020,"En  somme  ,  selon  ces  règles  d'  airain  ,  bien  connues  ,  qui  doivent  guider  le  gouvernail  de  l'  acte  -  exclusivement  humain  -  d'  informer  les  humains  .",airain
2020,"Il  réclame  aussi  de  pouvoir  chahuter  ,  durant  cette  période  de  distanciation  observée  comme  une  règle  d'  airain  par  les  animateurs  soucieux  de  bien  faire  .",airain
2020,"En  Vème  République  ,  il  est  une  règle  d'  airain  ,  intangible  ,  résumée  d'  une  formule  mille  fois  ressassée  :  ""  le  Premier  ministre  est  un  fusible  ""  .",airain
2020,"Lucien  Chardon  (  de  Rubempré  )  ,  illustrent  par  leur  réussite  ou  leur  échec  (  Rubempré  )  ,  la  loi  d'  airain  du  capital  contemporain  de  la  Révolution  industrielle  .",airain
2020,"En  romantique  broyé  par  la  loi  d'  airain  du  capital  ,  les  larmes  de  Rastignac  sont  aussi  celle  de  son  créateur  .",airain
2020,"Sous  le  quinquennat  d'  airain  de  Nicolas  Sarkozy  ,  il  occupait  une  fonction  éminente  auprès  du  ministre  Chatel  ,  celle  de  directeur  général  de  l'  enseignement  scolaire  (  DGESCO  )  .",airain
2020,Sauf  que  Gaston  Reiff  va  colorer  d'  airain  cette  moche  journée  de  flotte  :  la  toute  première  médaille  d'  or  olympique  pour  un  athlète  de  chez  nous  .,airain
2020,"Il  faut  du  courage  pour  reconnaître  ses  torts  ,  et  l'  âme  du  boubou  n'  a  point  été  forgée  dans  l'  airain  .",airain
2020,"Les  règles  d'  airain  des  traités  européens  ,  particulièrement  celles  qui  prétendent  régir  l'  endettement  public  ,  la  concurrence  ,  le  commerce  ,  d'  autre  part  le  rôle  du  FMI  et  de  la  Banque  Mondiale  devront  être  profondément  modifiés  pour  répondre  aux  immenses  besoins  des  populations  .",airain
2020,"A  l'  aube  de  ses  80  ans  ,  il  a  enfin  clôturé  ce  chef-  d'œuvre  sur  l'  enfance  éreintée  par  la  loi  d'  airain  de  l'  Espagne  franquiste  .",airain
2020,Le  second  rôle  de  ce  plan  sera  de  rappeler  une  règle  d'  airain  de  notre  démocratie  :  le  politique  doit  primer  .,airain
2020,Le  monde  d'après  devra  se  défaire  définitivement  de  ce  double  carcan  imposant  à  l'  égal  d'  une  fatalité  sa  loi  d'  airain  orwellienne  .,airain
2020,Leur  suprématie  n'  est  pas  gravée  dans  l'  Airain  .,airain
2020,"De  ce  fait  ,  la  culture  chez  nos  ancêtres  ,  était  bâtie  sur  un  socle  d'  airain  .",airain
2020,"Leur  sang-froid  d'  airain  ,  la  motivation  des  ingénieurs  et  la  mobilisation  de  la  doublure  de  l'  équipage  qui  se  plongea  dans  leurs  conditions  réelles  avec  des  bouts  de  ficelle  ,  du  sparadrap  et  quelques  cartons  ;  et  cela  permit  de  les  sauver  .",airain
2020,"N'  y  a-t-il  pas  là  quelque  chose  d'  une  forme  d'  espérance  esthétique  pour  l'  avenir  ,  loin  de  la  grisaille  d'  une  certaine  mondialisation  avec  ses  produits  standardisés  ,  ses  aéroports  anonymes  ,  ses  entrées  de  ville  hideuses  et  toutes  semblables  ,  ses  lois  d'  airain  économiques  pour  les  moins  qualifiés  ,  ses  instincts  prédateurs  insensibles  au  poème  du  monde  ?",airain
2020,"La  préférence  du  marché  sur  la  régulation  publique  ,  la  préférence  pour  la  gestion  des  flux  à  la  gestion  de  stocks  de  toute  marchandises  (  de  masques  comme  de  lits  )  et  la  préférence  de  la  réduction  des  coûts  aux  investissements  pour  conduire  les  transitions  de  nos  modèles  économiques  à  bout  de  souffle  sont  les  soubassements  du  modèle  dominant  où  le  politique  devient  le  vassal  de  lois  d'  airain  qu'  impose  la  fameuse  loi  des  marchés  .",airain
2020,"Seulement  voilà  ,  certains  Européens  ont  poussé  le  modèle  à  son  paroxysme  pour  en  faire  leur  principe  cardinal  ,  jusqu'  à  conquérir  de  façon  permanente  près  de  la  moitié  de  la  planète  aux  dépens  des  Indigènes  qui  le  peuplaient  ,  et  où  leur  loi  d'  airain  continuent  de  les  mépriser  ,  de  les  exploiter  ,  parfois  encore  de  les  exterminer  .",airain
2020,"Toutefois  ,  même  si  les  divergences  au  sein  de  l'  UE  sont  encore  trop  criantes  et  fort  inquiétantes  pour  la  suite  ,  l'  Union  a  mis  en  place  une  stratégie  plutôt  tangible  pour  pallier  les  effets  économiques  et  sociaux  de  la  crise  ,  puis  pour  programmer  la  reprise  économique  que  l'  on  espère  rapide  :  comme  le  rappelle  justement  l'  article  du  Monde  ,  la  Commission  a  d'abord  décidé  de  sacrifier  deux  de  ces  lois  d'  airain  en  suspendant  le  Pacte  de  Stabilité  et  de  Croissance  (  PSC  )  et  en  autorisant  les  aides  d'  États  pour  éviter  de  nombreuses  faillites  d'  entreprises  .",airain
2020,"Dans  la  matinée  ,  des  mains  anonymes  avaient  mis  dans  celle  du  torero  ,  dont  la  statue  d'  airain  fait  face  aux  arènes  ,  brins  de  muguet  ,  roses  et  pivoines  .",airain
2020,"La  loi  d'  airain  du  marché  publicitaire  pèse  bien  plus  que  les  éventuelles  ingérences  des  actionnaires  :  en  la  matière  ,  les  impératifs  de  référencement  guident  peut-être  plus  les  lignes  éditoriales  de  la  nuée  numérique  que  les  préférences  de  leurs  propriétaires  .",airain
2020,"Etats  rattrapés  par  la  loi  d'  airain  budgétaire  ,  poussés  qu'  ils  sont  à  contracter  un  endettement  de  plus  en  plus  lourd  .",airain
2020,"Entre  ces  deux  pôles  ,  celui  d'  une  liberté  abstraite  qui  néglige  les  réalités  sociales  ou  culturelles  limitant  l'  autonomie  des  individus  ,  et  celui  d'  un  déterminisme  un  peu  mécanique  ,  qui  oublie  les  initiatives  individuelles  ou  les  luttes  collectives  capables  de  déjouer  les  lois  d'  airain  imposées  par  les  structures  sociales  ,  une  troisième  école  se  situe  ,  de  manière  plus  nuancée  ,  à  l'  intersection  de  l'  acteur  et  du  système  .",airain
2020,"Godard  me  fixe  ainsi  ,  à  chaque  nouveau  démarrage  ,  à  chaque  nouveau  réveil  ,  de  son  œil  d'  aigle  imperturbable  ,  dur  comme  l'  airain  .",airain
