year,sentence,key_word
2016,"Le  marronnier  blanc  (  White  Chestnut  )  est  adapté  aux  personnes  dont  l'  esprit  est  envahi  de  pensées  indésirables  ,  les  empêchant  de  se  concentrer  ,  de  trouver  le  sommeil  ,  et  de  profiter  de  la  vie  .",marronnier
2016,"Hier  ,  durant  trois  longues  minutes  ,  Barthès  en  a  remis  une  couche  sur  son  meilleur  ennemi  ,  Jean-Pierre  Pernaut  ,  et  ses  éternels  marronniers  qui  prennent  la  forme  des  cerisiers  de  Céret  .",marronniers
2016," Marronnier  cannois  fatal  ,  on  trouve  fréquemment  ,  pris  en  sandwich  entre  la  pile  d'  escabeaux  entassés  en  bas  du  tapis  rouge  et  la  dame  pipi  du  Carlton  ,  un  jeune-de-banlieue  qui  débarque  la  bouche  en  cœur  sur  la  Croisette  ,  avant  d'  être  présenté  sans  ménagement  à  la  presse  en  mal  de  sujets  .",marronnier
2016,Sous  les  marronniers  :  le  dernier  tango  à  Lille,marronniers
2016,"Après  vingt  ans  à  danser  le  tango  hors  des  sentiers  battus  ,  l'  association  Sous  les  marronniers  raccroche  .",marronniers
2016,"La  décision  de  Joëlle  Colcanap  de  mettre  un  terme  à  Sous  les  marronniers  est  ,  elle  ,  bien  réfléchie  .",marronniers
2016,"Premiers  pas  en  1997  ,  sous  les  marronniers  du  jardin  Vauban  (  ceci  explique  cela  )  .",marronniers
2016,"Et  Sous  les  marronniers  ,  ce  n'  était  pas  que  la  Vieille-Bourse  .",marronniers
2016,"Parce  qu'  il  est  ""  d'abord  une  danse  de  communication  entre  deux  êtres  ""  ,  une  rencontre  ,  rappelle-t-on  chez  Sous  les  marronniers  qui  referme  cette  parenthèse  de  vingt  ans  sans  regret  aucun  .",marronniers
2016,"La  Belgique  entière  a  été  tenue  informée  :  dans  les  JT  ,  la  Pride  est  devenue  un  marronnier  .",marronnier
2016,"Voisin  du  bâtiment  ""  la  maisonnette  ""  qui  sera  transformée  en  maison  des  parents  ,  le  bâtiment  administratif  ""  les  marronniers  ""  va  être  réhabilité  en  même  temps  ,  pour  un  coût  de  2,9  M  €  à  la  charge  de  la  Croix-Rouge  (  fonds  propres  et  emprunt  )  .",marronniers
2016,"La  fameuse  ""  sérénade  aux  beignets  ""  en  Zoug  ,  la  satire  en  Appenzell  ,  la  lutte  à  la  culotte  un  peu  partout  (  notre  photo  )  ou  le  marronnier  de  la  Treille  à  Genève  ...",marronnier
2016,"Il  y  a  deux  choses  drôles  dans  cette  chronique  hebdomadaire  de  l'  humoriste  Pierre-Emmanuel  Barré  en  date  du  13  mai  2016  :  d'abord  ,  son  texte  -  même  s'  il  s'  attaque  aux  marchands  d'  armes  ,  un  marronnier  de  la  gauche  -  ,  plutôt  féroce  avec  la  politique  extérieure  de  la  France  (  l'  axe  Hollande-Le  Drian  )  ;  mais  aussi  les  petits  cris  féminins  (  de  Dominique  Lavanant  )  dans  le  studio  .",marronnier
2016,"Des  marronniers  ,  des  tilleuls  ,  des  hêtres  pourpres  ,  des  érables  ,  des  charmes  ...",marronniers
2016,"Sur  la  question  de  rendre  le  vote  des  actionnaires  contraignant  ,  le  Medef  défend  le  bon  fonctionnement  de  l'  autorégulation  et  préfère  mettre  les  déclarations  du  président  de  la  République  sur  le  dos  d'  un  vieux  réflexe  bien  français  :  ""  C'  est  un  serpent  de  mer  ,  un  marronnier  ""  ,  plaide  ainsi  Thibault  Lanxade  .",marronnier
2016,"Au  début  ,  avant  d'  y  arriver  ,  rien  n'  a  changé  :  l'  épaisse  drève  des  marronniers  dissimulant  le  porche  à  grande  porte  de  ferme  rouge  .",marronniers
2016,"Beaucoup  de  cinéastes  auraient  été  ,  caméra  sur  l'  épaule  et  petite  fleur  au  bout  de  l'  objectif  ,  capter  un  bout  de  ""  réalité  brute  ""  (  ce  mensonge  )  ,  lénifier  sur  les  ""  territoires  perdus  de  la  République  ""  ou  ,  à  l'  inverse  ,  sur  le  ""  vivre  ensemble  ""  et  autres  fables  pour  20  h  en  manque  de  marronniers  .",marronniers
2016,"Après  avoir  appris  que  l'  association  Sous  les  marronniers  ,  organisatrice  (  entre  autres  événements  )  des  animations  tango  ,  chaque  été  depuis  1998  à  la  Vieille  Bourse  (  notre  édition  de  dimanche  )  ,  cessait  ses  activités  ,  la  ville  a  cherché  une  parade  .",marronniers
2016,"""  Ce  ne  sera  pas  la  même  chose  que  ce  que  faisait  Sous  les  marronniers  ,  chaque  association  ayant  ses  spécificités  ,  et  cela  permet  de  maintenir  une  animation  appréciée  des  Lillois  ""  ,  précise  l'  élu  .",marronniers
2016,"Au  départ  ,  en  1990  ,  il  y  avait  en  tout  et  pour  tout  quatre  arbres  autour  de  cette  ferme  ,  un  cerisier  ,  deux  marronniers  et  un  tilleul  .",marronniers
2016,"""  Un  serpent  de  mer  ,  un  marronnier  ""  ,  minimisait-on  .",marronnier
2016,Un  sujet  ?  Un  marronnier  plutôt  .,marronnier
2016,"Les  portes  du  Lycée  Gabriel-Fauré  viennent  d'  ouvrir  ,  des  petits  groupes  d'  élèves  se  sont  formés  ,  le  papier  Rizla  +  passe  de  main  en  main  et  des  volutes  se  perdent  dans  le  feuillage  des  marronniers  .",marronniers
2016,"Le  kiosque  à  musique  ,  détruit  par  la  guerre  ,  et  dont  l'  emplacement  originel  se  perd  dans  les  marronniers  ,  pourrait  renaître  de  ses  cendres  .",marronniers
2016,"Ça  me  rappelle  ce  vieux  marronnier  (  en  termes  journaleux  ,  un  marronnier  ,  c'  est  un  sujet  qui  revient  régulièrement  quand  on  n'  a  pas  trop  d'  idées  )  ,  du  troisième  aéroport  pour  Paris  .",marronnier
2016,"Des  vandales  s'  en  prennent  régulièrement  aux  volets  métalliques  de  l'  école  maternelle  des  Marronniers  ,  au  centre-ville  de  Moyeuvre-Grande  .",marronniers
2016,"Aménagement  de  la  place  de  l'  EgliseLes  tilleuls  seront  remplacés  ,  les  deux  marronniers  conservés  et  un  espace  vert  avec  jardins  botaniques  sera  aménagé  au  sud  ,  sur  le  côté  de  la  chapelle  .",marronniers
2016,Le  centre  hospitalier  a  en  effet  ouvert  un  parking  de  140  places  en  face  des  Marronniers  pour  son  personnel  (  accessible  avec  le  badge  )  et  un  parking  de  148  places  en  dessous  de  l'  hôpital  .,marronniers
2016," Marronniers  en  fleur  laisse  la  moitié  du  tableau  au  feuillage  hérissé  de  cônes  blancs  ,  le  reste  ne  semblant  qu'  accompagner  ,  qu'  encadrer  ce  jaillissement  .",marronniers
2016,"Le  parquet  de  Bruxelles  a  classé  sans  suite  la  plainte  déposée  le  24  juillet  2012  par  deux  ASBL  de  protection  des  oiseaux  et  de  la  nature  ,  après  l'  abattage  entrepris  quelque  temps  plus  tôt  des  19  marronniers  malades  de  l'  avenue  Louise  .",marronniers
2016,"Le  parquet  reste  hésitant  ,  comme  le  montrent  le  dossier  des  marronniers  de  l'  avenue  Louise  et  le  classement  de  la  plainte  qui  visait  Bruxelles  Mobilité  .",marronniers
2016,"Au  fil  de  ce  parcours  bucolique  ,  les  enfants  pourront  planter  à  l'  atelier  horticole  ,  sentir  ,  voir  et  toucher  différentes  essences  d'  arbres  (  châtaignier  ,  chêne  ,  épicéa  ,  hêtre  ,  marronnier  ,  noyer  ,  séquoia  ,  tilleul  ...  )  au  cours  d'  un  test  de  connaissance  ludique  .",marronnier
2016,"Quand  on  entre  sur  le  site  par  l'  allée  des  Marronniers  ,  devait  s'  ériger  sur  la  gauche  un  seul  immeuble  ,  en  rez-de-chaussée  +  trois  étages  ,  d'  environ  130  appartements  .",marronniers
2016,"Il  compte  plus  de  500  arbres  ,  essentiellement  des  marronniers  ,  des  frênes  ,  des  platanes  et  des  saules  pleureurs  .",marronniers
2016,Statu  quo  sous  les  marronniers  de  la  Treille  .,marronniers
2016,"Pour  lui  ,  ""  les  kiosques  à  journaux  font  partie  du  petit  patrimoine  qui  donne  son  cachet  à  Paris  et  ce  paysage  a  été  conçu  comme  un  tout  à  l'  époque  de  Haussmann  :  bâtiments  ,  chaussée  ,  trottoirs  ,  marronniers  ,  bancs  publics  ,  fontaines  et  kiosques  ""  .",marronniers
2016,C'  est  le  marronnier  du  mois  de  mai  .,marronnier
2016,"Juin  s'  annonce  avec  les  mêmes  marronniers  de  la  semaine  ,  en  plus  développé  !  Voici  le  programme  des  réjouissances  .",marronniers
2016,"Sur  les  hauteurs  de  Romainmôtier  ,  la  place  des  Marronniers  accueillera  la  16  e  édition  de  la  Fête  de  la  rose  ,  ce  samedi  ,  avec  une  vingtaine  d'  exposants  de  fleurs  ,  plantons  et  arbustes  ,  roses  en  tête  ,  notamment  les  variétés  anciennes  et  anglaises  du  rosiériste  Alain  Tschanz  .",marronniers
2016,"Il  s'  agit  d'  un  marronnier  centenaire  ,  faisant  parti  des  arbres  remarquables  du  parc  .",marronnier
2016,Le  centre  ferme  en  juillet  et  s'  installe  au  château  des  Marronniers  jusqu'  en  2018,marronniers
2016,"La  ville  y  a  installé  des  fauteuils  et  des  chaises  longues  en  bois  ,  mais  aussi  construit  un  ponton  en  bois  qui  le  traverse  dans  son  intégralité  ,  et  qui  dissimule  les  racines  de  ses  nombreux  marronniers  .",marronniers
2016,Organisée  en  partenariat  avec  l'  association  Sous  les  marronniers  .,marronniers
2016,"Patapim  ,  Patapam  le  groupe  Nadau  déboulera  à  Limoux  cet  été  en  compagnie  de  Mans  de  Breich  l'  audois  de  référence  en  matière  de  ""  cansus  d'  aicí  ""  chansons  d'  ici  ,  ce  dernier  sera  sur  scène  le  vendredi  12  août  après  la  grande  fricassée  sous  les  Marronniers  qui  rassemblent  chaque  année  plusieurs  centaines  de  convives  autour  d'  assiettes  de  mounjetos  accompagnées  d'  abats  en  sauce  ,  grâce  à  l'  association  des  Fins  Gourmets  présidé  par  Claude  Hortala  .",marronniers
2016,Suzanne  a  participé  au  projet  RP  /  com  autour  de  la  création  de  Par-delà  les  marronniers  .,marronniers
2016,"Christine  est  aussi  blogueuse  ,  elle  critique  activement  les  pièces  de  théâtre  qu'  elle  voit  sur  le-theatre-cote-coeur  .  blogspot  .  fr  ....  Elle  a  aussi  assisté  au  projet  autour  de  Par-delà  les  marronniers  .",marronniers
2016,"Comme  Christine  et  Suzanne  ,  Mélina  était  présente  lors  du  projet  RP  /  Com  autour  du  spectacle  Par-delà  les  marronniers  .",marronniers
2016,"""  Avec  Le  Refuge  qui  donne  sur  la  place  et  le  splendide  marronnier  ,  Le  Bougnat  propose  un  très  bel  ensemble  ,  argumente  Michel  Lebec  .",marronnier
2016,Cela  commence  à  relever  du  marronnier  .,marronnier
2016,"Sous  les  arbres  ,  à  proximité  de  la  Place  des  Marronniers  et  enbord  de  Loire  ,  les  anciens  profiteront  de  la  danse  .",marronniers
2016,"Mais  ce  qui  me  trouble  ,  c'  est  que  :  commencer  l'  école  à  7  h  40  ,  mettre  une  place  de  jeux  à  20  m  de  la  Sarine  et  à  l'  ombre  des  marronniers  ou  encore  faire  traverser  le  pont  de  Saint-Jean  par  les  élèves  dès  4  ans  ,  en  rangs  par  deux  ,  afin  de  relier  l'  école  à  l'  accueil  extrascolaire  ...",marronniers
2016,"À  partir  d'  aujourd  '  hui  jusqu'  à  dimanche  ,  les  Rendez-vous  au  jardin  seront  l'  occasion  de  voir  au  plus  près  ces  premières  transformations  et  de  découvrir  le  reste  du  parc  :  le  parcours  autour  de  l'  étang  et  ses  jardins  à  l'  anglaise  ,  les  marronniers  d'  Inde  ,  quelques  espèces  rares  ,  un  platane  tricentenaire  ,  les  différentes  statues  dont  celle  de  Diane  chasseresse  (  XIX  e  s.  )  æ",marronniers
2016,"Ouvert  aujourd  '  hui  et  demain  de  14  h  30  à  20  heures  .  2  ,  avenue  des  marronniers  à  Neuvic  .",marronniers
2016,"Au  programme  ,  musique  ancienne  ,  opéra  minute  au  théâtre  ,  et  tea  time  décalé  dans  l'  allée  des  marronniers  .",marronniers
2016,"Mentalement  ,  c'  est  un  dossier  plus  complexe  et  un  marronnier  :  les  Français  seraient  des  chiffes  molles  .",marronnier
2016,Les  84  marronniers  abattus  et  une  nouvelle  entrée  (  Ouest-France  ),marronniers
2016,"Mais  c'  est  surtout  la  nouvelle  entrée  et  l'  abattage  des  marronniers  qui  focaliseront  l'  attention  :  d'  ici  un  an  les  utilisateurs  et  le  public  de  l'  enceinte  sportive  pénétreront  à  Jacques-Fould  par  une  entrée  plus  à  l'  est  sur  l'  avenue  de  Quakenbrück  (  la  route  de  Paris  )  ,  actuellement  un  champ  appartenant  à  la  Ville  .",marronniers
2016,La  collectivité  devrait  procéder  dans  quelques  semaines  à  l'  abattage  des  84  marronniers  qui  bordent  le  stade  .,marronniers
2016,Plus  de  80  personnes  se  sont  laissées  captiver  par  des  histoires  drôles  et  parfois  un  peu  effrayantes  ...  tout  cela  entre  balades  et  pauses  sous  les  marronniers  ...,marronniers
2016,"C'  est  un  tsunami  ,  que  dis-je  ,  une  révolution  !  En  fait  ,  l'  éducation  numérique  est  juste  un  marronnier  qui  revient  chaque  année  dans  les  débats  .",marronnier
2016,Quelque  100  marronniers  centenaires  abattus  au  cimetière  de  Charleroi-Nord,marronniers
2016,Les  marronniers  du  cimetière  de  Charleroi-Nord  ne  sont  plus  .,marronniers
2016,C'  est  pour  des  raisons  sanitaires  et  de  sécurité  que  l'  administration  de  Charleroi  a  pris  la  grave  décision  d'  abattre  les  quelque  100  marronniers  centenaires  qui  trônaient  fièrement  dans  le  cimetière  de  Charleroi-Nord  .,marronniers
2016,"En  plus  de  son  mur  de  soutènement  ,  l'  édifice  a  aussi  perdu  le  marronnier  qui  dominait  la  cour  .",marronnier
2016,Le  chantier  devrait  commencer  fin  juin  avec  l'  abattage  des  marronniers  .,marronniers
2016,C'  est  devenu  un  marronnier  qui  se  répète  à  chaque  début  de  Ramadan  .,marronnier
2016,"La  Musique  municipale  de  la  Ville  de  Genève  est  partie  de  la  promenade  de  Saint-Antoine  pour  un  défilé  qui  s'  est  terminé  sans  excentricité  sous  les  marronniers  de  la  promenade  de  la  Treille  ,  entraînant  au  passage  le  magistrat  âgé  de  34  ans  devant  l'  Hôtel  de  Ville  .",marronniers
2016,"Au  fil  de  la  balade  ,  ils  ont  pu  découvrir  des  arbres  plus  que  bicentenaires  en  majorité  ,  notamment  des  hêtres  dont  un  marcotté  ,  visible  en  début  de  circuit  ,  un  merisier  qui  produit  encore  des  fruits  ,  un  gros  if  sur  une  butte  qui  pourrait  être  une  ancienne  motte  féodale  ,  un  tilleul  ,  un  hêtre  pourpre  qui  a  donné  naissance  à  un  rejeton  de  l'  autre  côté  du  parc  ,  une  grande  allée  de  peupliers  ,  des  tilleuls  ,  des  charmes  ,  des  érables-sycomores  ,  des  châtaigniers  et  marronniers  ,  des  sapins  et  des  mélèzes  .",marronniers
2016,"""  Le  web  est  divisé  ""  est  un  nouveau  marronnier  de  la  presse  web  .",marronnier
2016,"Comme  les  journalistes  ,  l'  ONU  a  aussi  ses  ""  marronniers  ""  ,  en  l'  occurrence  la  ""  protection  des  civils  ""  ,  qui  revient  quasiment  tous  les  mois  à  l'  agenda  du  Conseil  de  sécurité  pour  des  résultats  très  mesurés  sur  le  terrain  .",marronniers
2016,"À  l'  issue  de  la  conférence  ,  tous  les  collégiens  ,  accompagnés  à  la  guitare  par  leur  prof  de  musique  Romain  Ducamp  ,  ont  chanté  Imagine  de  John  Lennon  ,  chanson  qui  accompagnait  les  rassemblements  en  hommage  aux  victimes  des  attentats  terroristes  ,  devant  un  marronnier  du  jardin  public  élevé  au  rang  d'  arbre  de  la  laïcité  .",marronnier
2016,"Leila  ,  sa  sœur  de  11  ans  ,  a  la  tenue  des  perdants  du  jour  et  fait  la  moue  sous  les  marronniers  mouillés  par  la  pluie  :  ""  On  reste  nous-même  et  j'  espère  qu'  on  va  gagner  le  prochain  match  ""  ,  dit-elle  .",marronniers
2016,"Des  travaux  vont  démarrer  ce  lundi  à  Choisy  afin  de  créer  une  piste  cyclable  le  long  des  berges  de  Seine  ,  entre  l'  avenue  des  Marronniers  et  le  pont  de  la  Darse  à  Alfortville  .",marronniers
2016,Les  terrains  des  Marronniers  et  de  Bois-Gentil  sont  bien  drainés  .,marronniers
2016,"La  Fête  de  la  musique  a  mobilisé  450  personnes  des  Marronniers  ,  patients  et  personnel  confondus  .",marronniers
2016,"Aussi  ,  conscients  de  la  facilité  d'  enregistrer  sons  et  instruments  avec  de  légers  moyens  techniques  et  encouragés  par  Karima  Kaci  ,  ils  ont  demandé  à  la  direction  des  Marronniers  l'  autorisation  d'  acquérir  le  matériel  nécessaire  .",marronniers
2016,"Les  Marronniers  ,  ce  sont  quelque  850  patients  et  1.050  membres  du  personnel  .",marronniers
2016,"""  Les  supporters  belges  finissent  par  s'  engouffrer  dans  la  rue  des  Marronniers  où  se  succèdent  terrasses  de  restaurant  et  bars  .",marronniers
2016,"Quand  Najat  Vallaud-Belkacem  tacle  le  marronnier  du  bac  ""  qui  baisse  """,marronnier
2016,"Top  départ  des  épreuves  du  baccalauréat  2016  cette  semaine  ,  et  vous  savez  quoi  ?  Il  paraît  que  le  niveau  baisse  !  C'  est  ce  qu'  on  appelle  ""  un  marronnier  ""  dans  l'  argot  journalistique  :  c'  est  un  sujet  qui  revient  de  façon  cyclique  au  fil  des  saisons  (  comme  les  feuilles  des  arbres  ,  donc  --  comme  les  marrons  en  automne  .",marronnier
2016,"Et  la  fameuse  baisse  du  niveau  du  bac  ,  c'  est  un  sacré  marronnier  :  l'  examen  est  de  plus  en  plus  facile  ,  rendez-vous  compte  ,  et  depuis  le  temps  que  ce  déclin  est  en  marche  ,  vraiment  ,  le  diplôme  n'  a  plus  aucune  valeur  ,  on  le  passe  les  yeux  fermés  !",marronnier
2016,"Cette  critique  du  niveau-qui-baisse  est  un  marronnier  ,  qui  n'  a  rien  de  récent  !  C'  est  pourquoi  la  ministre  a  tenu  à  adresser  la  mauvaise  foi  de  cette  vieille  rengaine  :",marronnier
2016,Avis  de  grève  à  la  résidence  La  Roseraie  et  à  la  résidence  Les  Marronniers  -  Le  Tribunal  administratif  du  travail  juge  suffisants  les  services  essentiels  prévus  pour  assurer  la  santé  ou  la  sécurité  des  résidents  durant  la  grève,marronniers
2016,"Québec  ,  le  14  juin  2016  /  CNW  Telbec  /  -  Le  Syndicat  des  travailleuses  et  travailleurs  des  centres  d'  hébergement  privés  de  la  région  de  Québec  (  CSN  )  a  fait  parvenir  un  avis  de  grève  touchant  le  personnel  membre  de  ce  syndicat  oeuvrant  à  la  résidence  La  Roseraie  située  à  Sainte-Foy  et  à  la  résidence  Les  Marronniers  située  à  Lévis  .",marronniers
2016,(  Québec  )  Les  96  travailleurs  de  la  résidence  pour  personnes  âgées  La  Roseraie  de  Sainte-Foy  et  les  65  employés  de  la  résidence  Les  Marronniers  de  Lévis  seront  en  grève  générale  illimitée  dès  minuit  jeudi  matin  .,marronniers
2016,Ce  sont  97  %  des  employés  de  La  Roseraie  et  96  %  de  ceux  des  Marronniers  qui  ont  voté  pour  cette  première  grève  générale  .,marronniers
2016,"C'  est  un  marronnier  ,  depuis  toujours  !  On  entend  tout  le  temps  dire  que  le  journalisme  est  en  train  de  mourir  ,  et  ce  depuis  la  naissance  du  journalisme  .",marronnier
2016,"Dans  la  cour  de  la  maternelle  Les  Marronniers  ,  à  Magnanville  dans  les  Yvelines  ,  les  gamins  auraient  roulé  des  yeux  comme  des  billes  .",marronniers
2016,"Les  28  joueurs  se  sont  affrontés  amicalement  tout  au  long  de  la  journée  ,  à  l'  ombre  des  marronniers  pour  six  parties  endiablées  en  triplettes  et  doublettes  toutes  tirées  à  la  mêlée  .",marronniers
2016,"Comme  chaque  mercredi  soir  ,  ils  sont  là  ,  toutes  générations  confondues  ,  sous  les  marronniers  au  bord  de  la  Sarine  près  de  l'  école  du  quartier  .",marronniers
2016,Ajoutez-y  de  la  vigne  rouge  ou  du  marronnier  d'  Inde  (  sauf  si  vous  êtes  enceinte  )  pour  leurs  flavonoïdes  antioxydants  protecteurs  au  long  cours  .,marronnier
2016,"Les  visiteurs  pourront  aussi  ,  tout  simplement  ,  flâner  sur  la  place  des  Marronniers  transformée  pour  l'  occasion  en  véritable  marché  aux  livres  .",marronniers
2016,"Cette  absence  serait-elle  moins  le  fruit  d'  un  abandon  d'  une  célébration  folklorique  devenue  au  fil  des  ans  presque  un  marronnier  qu'  une  décision  éditoriale  de  ne  pas  évoquer  un  sujet  qui  peut  ,  sinon  cliver  du  moins  hérisser  quelques  poils  tendus  par  l'  atmosphère  islamophobe  qui  donne  le  ton  à  la  séquence  politique  que  vit  la  France  aujourd  '  hui  .",marronnier
2016,"C'  était  vendredi  soir  déjà  sur  la  rampe  de  la  Treille  ,  puis  samedi  à  nouveau  et  dimanche  encore  :  à  l'  enseigne  de  Sonopack  ,  association  du  cru  experte  en  nouba  silencieuse  ,  une  centaine  d'  individus  louvoient  entre  les  marronniers  ,  casques  audio  sur  les  oreilles  .",marronniers
2016,"Vers  les  sommets  du  grand  marronnier  des  séries-les-plus-attendues-de-  l'  année  ,  Preacher  revenait  en  2016  avec  régularité  dans  les  publications  spécialisées  outre-Atlantique  ,  d'  Indiewire  à  Variety  .",marronnier
2016,"Le  Triangle  des  Bermudes  ,  c'  était  l'  un  des  derniers  grands  mystères  non-résolus  ,  pour  lesquels  aucune  explication  scientifique  valable  n'  avait  encore  été  trouvée  ,  et  accessoirement  l'  un  des  marronniers  préférés  de  la  presse  .",marronniers
2016,"""  Mon  fils  est  passé  par  tous  les  pavillons  des  Marronniers  et  il  n'  est  pas  capable  de  vivre  en  autonomie  ,  bien  qu'  un  psychiatre  prétende  l'  inverse  .",marronniers
2016,"Véritable  marronnier  utilisé  par  les  différents  partis  pour  capter  le  maximum  d'  électeurs  ,  l'  affaire  du  Sahara  passionne  l'  opinion  publique  espagnole  .",marronnier
2016,"Pour  le  moment  ,  sous  les  marronniers  de  Vallecas  ,  on  refuse  d'  évoquer  le  dilemme  .",marronniers
2016,"La  fête  de  la  Musique  ,  c'  est  aussi  la  fête  des  danseurs  ,  non  ?  Sous  les  marronniers  ,  c'  est  à  la  fois  le  nom  d'  une  association  de  tango  et  de  tricot  urbain  ,  et  celui  du  lieu  où  ses  membres  ont  l'  habitude  de  danser  ,  jardin  Vauban  .",marronniers
2016,"L'  annonce  de  la  ""  mort  du  SEO  ""  revient  tel  un  marronnier  dans  le  petit  monde  des  référenceurs  .",marronnier
2016,"Plus  tard  ,  le  ""  rire  de  résistance  ""  emprunté  aux  dadaïstes  par  Jean-Michel  Ribes  (  ""  Par-delà  les  marronniers  /  Revu  (  e  )  ""  )  ,  les  rêves  d'  un  monde  meilleur  d'  un  enfant  martyrisé  devenu  grand  par  les  Chiliens  Pablo  Larraín  &  Roberto  Farías  (  ""  Acceso  ""  )  ,  l'  enfer  du  bureau  dans  une  scénographie  épatante  avec  tournage  en  temps  réel  signé  Cyril  Teste  (  ""  Nobody  ""  )  ...",marronniers
2016,"Chaque  média  fait  pousser  ses  marronniers  ,  qui  un  sujet  sur  le  cuistot  de  l'  équipe  de  France  ,  qui  un  débat  pour  savoir  s'  il  faut  mettre  Matuidi  ou  Sissoko  titulaire  en  huitième  (  alors  que  tout  le  monde  sait  que  c'  est  le  premier  qui  le  sera  )  ,  qui  un  entretien  avec  le  photographe  de  l'  AFP  qui  inonde  la  presse  mondiale  de  clichés  des  Bleus  .",marronniers
2016,"Ah  mince  ,  ça  ,  c'  est  notre  marronnier  à  nous  .",marronnier
2016,C'  est  désormais  un  marronnier  de  toute  campagne  politique  .,marronnier
2016,"Ce  mercredi  ,  vers  13  h  30  ,  une  branche  d'  une  dizaine  de  mètres  de  long  s'  est  détachée  d'  un  marronnier  ,  square  Foch  ,  rue  Nationale  à  Lille  ,  pour  une  raison  inconnue  .",marronnier
2016,"Il  s'  agit  d'  une  énorme  branche  d'  un  marronnier  :  selon  la  mairie  ,  elle  mesure  soixante  centimètres  de  diamètre  et  une  dizaine  de  mètres  de  long  .",marronnier
2016,"D'après  Arnaud  Deslandes  ,  directeur  de  cabinet  de  Martine  Aubry  ,  le  marronnier  avait  été  inspecté  en  janvier  ,  avec  les  autres  arbres  du  square  ,  dans  le  cadre  des  régulières  vérifications  menées  par  la  ville  :  ""  Il  ne  présentait  aucun  défaut  ""  .",marronnier
2016,"Comme  chaque  année  ,  le  mois  de  juin  est  marqué  par  le  marronnier  que  constitue  l'  organisation  du  baccalauréat  .",marronnier
2016,"Quelques  éclairs  de  bonheur  parisien  jaillissent  néanmoins  parfois  au  détour  de  sa  plume  :  une  jolie  fille  entrevue  sur  un  trottoir  ,  la  lumière  rouge  d'  un  crépuscule  sur  une  avenue  ,  les  marronniers  du  Luxembourg  ...",marronniers
2016,"Seule  éclaircie  dans  le  Paris  neurasthénique  de  Houellebecq  ,  les  allées  du  jardin  du  Luxembourg  ,  avec  ses  ""  marronniers  d'  une  extraordinaire  nuance  orangée  ""  au  couchant  .",marronniers
2016,"On  serait  plutôt  dans  la  mélancolie  automnale  ,  quand  passent  de  belles  touristes  allemandes  ,  comme  en  témoigne  ce  poème  de  Renaissance  :  ""  Les  marronniers  du  Luxembourg  /  Attrapent  un  soleil  manifeste  .  /  J'  ai  envie  de  faire  l'  amour  ;  /  Ordinairement  ,  je  me  déteste  .",marronniers
