year,sentence,key_word
2016,Les  commentaires  qui  ont  suivi  la  mort  de  Shimon  Pérès  ont  une  nouvelle  fois  témoigné  de  cette  loi  d'  airain  de  l'  information  .,airain
2016,"Le  terme  airain  désigne  aussi  le  bronze  ,  mais  est  plutôt  employé  en  poésie  et  dans  les  textes  littéraires  ,  ainsi  ...  )  en  1978  et  celle  d'  argent  (  L'  argent  ou  argent  métal  est  un  élément  chimique  de  symbole  Ag  --  du  latin  Argentum  --  et  de  numéro  atomique  47  .  )  du  CNRS  en  1988  .",airain
2016,"Et  ,  au  bout  du  compte  ,  la  loi  de  l'  entropie  demeure  une  loi  d'  airain  et  la  longévité  a  obligatoirement  une  limite  .",airain
2016,"Ce  que  fait  notre  ""  oint  du  Seigneur  ""  ,  c'  est  simplement  de  nous  resservir  le  vieux  brouet  marxiste  de  la  ""  paupérisation  inéluctable  du  prolétariat  ""  et  de  la  ""  loi  d'  airain  des  salaires  ""  .",airain
2016,"Giacometti  est  devenu  comme  ses  sculptures  ,  une  personnalité  d'  airain  à  l'  exigence  artistique  totale  .",airain
2016,"Roberto  Carlos  ,  ancien  de  la  Maison  Blanche  (  entre  1996  et  2007  )  aux  frappes  foudroyantes  et  aux  cuisses  d'  airain  ,  révèle  dans  un  entretien  à  As  ,  avoir  discuté  avec  les  responsables  du  Real  Madrid  en  vue  d'  occuper  un  éventuel  rôle  d'  entraîneur  mais  qu'  ils  n'  ont  pas  donné  suite  à  ses  aspirations  :  ""  J'  ai  discuté  avec  le  club  mais  ils  m'  ont  dit  ,  que  pour  le  moment  ,  ils  m'  imagionaient  mieux  dans  un  rôle  d'  ambassadeur  .",airain
2016,"Ancien  adjoint  de  Baup  ,  Anigo  ,  Bielsa  et  Michel  ,  Franck  Passi  ne  bénéficiait  pas  ,  auprès  de  son  ex-président  Vincent  Labrune  ,  d'  une  légitimité  d'  airain  .",airain
2016,Marie  NDiaye  se  tient  devant  nous  de  passage  à  Paris  et  sa  grâce  d'  airain  fait  parfois  écran  à  ses  mots  .,airain
2016,"C'  est  celui  du  bloc  de  Fajr  Libya  ,  une  milice  islamiste  qui  a  longtemps  fait  régner  sa  loi  d'  airain  sur  Tripoli  et  quelques  autres  régions  .",airain
2016,"Cette  loi  d'  airain  fait  du  comté  de  Sumter  le  plus  vieux  du  pays  (  63  ans  en  moyenne  )  et  de  The  Villages  une  résidence  géante  pour  retraités  ,  ponctuée  par  49  parcours  de  golf  ,  et  traversée  de  routes  à  la  propreté  hygiénique  et  de  rues  commerçantes  où  les  musiques  d'  ambiance  dépassent  rarement  les  standards  des  années  1970  .",airain
2016,"Plutôt  que  de  se  concentrer  sur  la  loi  d'  airain  d'  al-Qaïda  imposée  à  Alep-Est  ,  le  Times  disait  à  ses  lecteurs  ,  fin  septembre  ,  comment  interpréter  l'  offensive  russo-syrienne  pour  chasser  al-Qaïda  et  ses  alliés  .",airain
2016,Ainsi  le  veut  la  loi  d'  airain  que  le  roi  Gaudin  impose  depuis  toujours  à  ses  possibles  successeurs  .,airain
2016,"Quand  Maryse  Narcisse  défend  avec  une  loyauté  d'  airain  le  bilan  et  la  personnalité  visionnaire  d'  Aristide  ,  on  a  toujours  envie  de  se  mettre  au  garde  à  vous  .",airain
2016,"Ces  mannequins  d'  un  jour  ,  choisis  dans  tous  le  pays  lors  d'  une  pré-sélection  ,  ont  du  se  plier  aux  règles  d'  airain  du  podium  ,  en  apprenant  démarche  et  sens  du  spectacle  .",airain
2016,"""  La  question  de  sa  candidature  sera  tranchée  aux  alentours  de  décembre  ou  de  janvier  ""  ,  mais  ,  avertit  le  mag  ""  pour  réussir  ,  Emmanuel  Macron  doit  faire  mentir  deux  lois  d'  airain  de  la  vie  politique  française  :  1  )  On  ne  sort  de  l'  ambiguïté  qu'  à  ses  dépens  .  2  )  Sans  appareil  ,  on  n'  arrive  à  rien  ....",airain
2016,"""  Ses  oeuvres  précédentes  ,  L'  Age  d'  airain  et  le  Saint  Jean-Baptiste  ,  sont  finalement  assez  classiques  ,  rappelle  Alexis  Jenni  .",airain
2016,"De  nouveaux  environnements  seront  également  disponibles  ,  comme  l'  Airain  Rock  enneigé  ou  encore  les  étendues  arides  et  désolées  des  Sunbite  Wilds  ,  qui  sont  autant  de  contrées  mystérieuses  à  découvrir  pour  les  joueurs  d'  ArcheAge  .",airain
2016,"Il  n'  empêche  que  la  performance  exceptionnelle  réalisée  par  Décosterd  confirme  une  fois  de  plus  sa  présence  au  sein  de  l'  élite  mondiale  du  karaté  kyokushinkai  ,  un  art  martial  aux  exigences  d'  airain  .",airain
2016,"""  Il  y  a  rupture  de  confiance  avec  un  président  Hollande  qui  s'  est  révélé  trop  bavard  avec  des  journalistes  ,  un  chef  de  l'  État  qui  n'  a  pas  respecté  les  règles  d'  airain  de  la  confidentialité  et  du  secret  défense  et  politique  ""  ,  décrypte  le  journaliste  .",airain
2016,"Après  plus  de  trois  décennies  passées  dans  les  arcanes  du  pouvoir  ,  Ali  Bongo  découvre  subitement  une  loi  d'  airain  de  la  démocratie  :  la  fin  ne  justifie  pas  les  moyens  .",airain
2016,"On  retrouve  donc  un  certain  nombre  de  ces  caractéristiques  ,  à  la  différence  (  notoire  )  près  qu'  il  n'  y  a  aucune  règle  légale  établie  qui  empêche  quiconque  d'  aller  voter  à  cette  primaire  ,  hormis  les  règles  d'  airain  de  la  sociologie  électorale  qui  font  qu'  on  risque  d'  en  arriver  aujourd  '  hui  à  ce  résultat  .",airain
2016,Espérons  qu'  ils  offriront  au  public  le  duel  qu'  il  attend  et  qu'  ils  s'  approprieront  cette  loi  d'  airain  consubstantielle  à  la  beauté  du  sport  :  la  défaite  n'  est  pas  une  infamie  et  mieux  vaut  un  revers  glorieux  qu'  un  triomphe  sans  péril  .,airain
2016,"""  Né  en  1  883  à  Etampes  ,  d'  origine  modeste  ,  il  est  mobilisé  dès  1914  ,  après  avoir  publié  en  1909  ""  Le  tribut  d'  Airain  ""  ,  un  recueil  de  poèmes  .",airain
2016,"Sont  ainsi  présentées  des  reproductions  miniatures  poinçonnées  du  Penseur  ,  de  l'  Âge  d'  Airain  ou  de  l'  Eternel  Printemps  .",airain
2016,"Surtout  si  on  éclaire  les  zones  d'  ombre  et  les  nébuleuses  de  ses  méthodes  ,  en  utilisant  les  nouvelles  données  scientifiques  qui  permettent  de  disséquer  dans  les  dimensions  psychologiques  ,  pédagogiques  ,  psychanalytiques  ,  ethnographiques  ,  sociales  ,  politiques  et  polémologiques  l'  homme  d'  airain  .",airain
2016,La  fameuse  obligation  pour  les  pays  de  la  zone  euro  de  maintenir  leur  déficit  sous  la  barre  des  3  %  du  PIB  apparaît  de  moins  en  moins  comme  une  loi  d'  airain  .,airain
2016,"La  candidature  du  maire  de  Bordeaux  s'  est  également  appuyée  sur  une  cote  de  popularité  d'  airain  qui  a  fait  de  lui  ,  dès  2012  ,  la  personnalité  de  l'  opposition  préférée  des  Français  .",airain
2016,"Un  joueur  réputé  pour  sa  volonté  d'  airain  ,  son  goût  du  détail  ,  promenant  sous  son  inséparable  casquette  un  double  visage  :  exécrable  sur  scène  ,  adorable  à  la  ville  .",airain
2016,"Il  a  les  yeux  d'  un  prophète  ,  des  petits  pieds  ,  des  poings  d'  airain  ,  et  une  bouche  de  racaille  .",airain
2016,"Mais  il  existait  une  loi  d'  airain  ,  surnommée  la  ""  règle  de  trahison  intime  ""  ,  qui  pesait  sur  eux  comme  une  épée  de  Damoclès  :  si  deux  agents  se  mariaient  et  que  l'  un  des  deux  découvrait  que  l'  autre  divulguait  des  renseignements  à  l'  ennemi  ,  il  était  censé  ,  la  mort  dans  l'  âme  ,  éliminer  son  conjoint  immédiatement  ...  sous  peine  d'  être  condamné  à  la  pendaison  pour  haute  trahison  .",airain
2016,"Comme  Anna  Fotyga  ,  les  partisans  du  rapport  demeurent  engoncés  dans  une  loi  d'  airain  de  l'  histoire  :  ""  reconnaissons  que  l'  histoire  est  susceptible  de  se  reproduire  ""  ,  poursuivait  Macoveï  .",airain
2016,Barry  est  en  train  de  forger  sa  personnalité  d'  airain  .,airain
2016,"Curieusement  ,  l'  absence  presque  parfaite  de  tout  programme  crédible  ou  de  tout  candidat  solide  dans  le  camp  socialiste  (  même  en  comptant  Juppé  )  ne  semble  pas  gêner  le  gouvernement  dont  on  imagine  alors  qu'  il  prend  les  décisions  avec  une  sérénité  d'  airain  pour  les  prochaines  années  .",airain
2016,"Nous  avions  fixé  des  règles  strictes  ,  ce  qui  ,  je  crois  ,  sera  le  standard  des  prochains  débats  :  égalité  du  temps  de  parole  ,  bien  sûr  ,  mais  surtout  une  règle  d'  airain  inspirée  par  le  modèle  américain  :  une  minute  ,  pas  plus  par  intervention  .",airain
2016,"Elle  est  incarnée  par  Cécile  Garcia-Fogel  ,  figure  gracile  à  la  volonté  d'  airain  ,  qui  lance  bras  et  jambes  en  l'  air  dans  un  tressautement  de  tout  le  corps  lorsque  la  pression  est  trop  forte  .",airain
2016,"Les  autres  -  la  plupart  -  s'  accordent  quelques  années  d'  un  parcours  plus  sécurisé  au  sein  d'  une  école  ,  à  la  fois  lieu  de  formation  ,  sas  de  protection  -  on  y  tisse  des  liens  ,  les  erreurs  y  sont  moins  fatales  -  et  espace  de  relative  liberté  où  l'  on  peut  encore  s'  abstraire  des  lois  d'  airain  du  marché  ,  explorer  des  formes  et  des  langages  sans  se  soucier  outre  mesure  de  reconnaissance  ou  de  commercialisation  .",airain
2016,"Dans  ce  contexte  ,  seules  les  multinationales  spécialisées  dans  l'  extraction  de  nos  minerais  sont  capables  d'  imposer  leurs  lois  d'  airains  sur  nos  gouvernants  ,  et  peuvent  prospérer  sans  risque  ,  alors  que  leur  impact  sur  l'  économie  est  limité  .",airains
2016,"A  l'  image  de  Pouchkine  ,  les  Semianyki  aiment  les  quais  de  granit  ,  les  grilles  d'  airain  et  les  dômes  d'  or  de  leur  ville  .",airain
2016,"Toutefois  ,  Camarade  Président  Macky  Sall  ,  Très  chers  Camarades  ,  cette  5  ème  édition  revêt  un  cachet  exceptionnel  ,  dès  lors  que  les  langues  de  la  postérité  diront  que  ce  0  3  Décembre  2016  ,  tous  les  jeunes  de  notre  Parti  ,  tous  vos  jeunes  ,  se  sont  retrouvés  pour  sceller  une  unité  d'  airain  ,  telle  que  vous  la  voulez  .",airain
2016,"Le  terme  airain  désigne  aussi  le  bronze  ,  mais  est  plutôt  employé  en  poésie  et  dans  les  textes  littéraires  ,  ainsi  qu'  en  campanologie  ,  ...  )  .",airain
2016,"Si  le  résultat  d'  une  pratique  électorale  ,  aussi  soutenue  soit-elle  ,  n'  a  pas  pour  effet  de  lui  conférer  l'  airain  de  la  règle  de  constitutionnelle  ,  une  rapide  évocation  du  passé  éclaire  ce  paradoxe  ,  donne  corps  à  la  malédiction  présidentielle  et  aide  à  comprendre  l'  avenir  ,  au-delà  du  présent  de  l'  annonce  du  1  er  décembre  2016  .",airain
2016,"Selon  cette  mécanique  sociale  ,  la  loi  d'  airain  du  marché  et  la  compétition  sans  merci  règnent  .",airain
2016,"A  l'  évidence  ,  le  tribunal  correctionnel  a  voulu  marquer  les  esprits  et  établir  une  jurisprudence  d'  airain  ,  en  France  ,  mais  aussi  à  destination  des  établissements  bancaires  qui  pourraient  encore  être  tentés  de  mettre  leur  ""  technicité  ""  au  service  de  clients  désireux  avant  tout  de  tenir  leurs  comptes  à  distance  du  fisc  de  leur  pays  d'  origine  .",airain
2016,"Cette  œuvre  s'  ouvre  aussi  aux  lèvres  du  théâtre  ,  avecparfois  des  personnages  encodés  :  l'  homme  à  la  voix  d'  airain  ,  L  (  peut-être  Liberté  )  ,  I  (  peut-être  Indépendance  )  ,  P  (  peut-être  Professeur  ,  comme  un  certain  Zaourou  )  .",airain
2016,"Pascal  ,  cette  intelligence  d'  airain  .",airain
2016,"Cinq  nouvelles  zones  seront  également  disponibles  ,  comme  l'  Airain  Rock  enneigé  ou  encore  les  étendues  arides  et  désolées  des  Sunbite  Wilds  ,  qui  sont  autant  de  contrées  mystérieuses  à  découvrir  pour  les  joueurs  d'  ArcheAge  .",airain
2016,"Cinq  nouveaux  environnements  :  Airain  Rock  (  la  capitale  des  Nains  ,  dont  la  cité  légendaire  d'  Andelph  )  ,  Aubre  Cradle  ,  Subite  Wilds  ,  Rokhala  Mountains  et  Ahnimar  (  les  terres  natales  de  la  race  Daru  )  ,  cinq  nouvelles  zones  à  explorer  et  à  coloniser  .",airain
2016,"Le  terme  airain  désigne  aussi  le  bronze  ,  mais  est  plutôt  employé  en  poésie  et  dans  les  textes  littéraires  ,  ainsi  ...  )  ,  fut  l'  une  des  plus  puissantes  des  10  0  0  0  dernières  années  (  30  -  80  km  de  magma  et  de  roches  )  et  eu  peut  être  des  conséquences  sur  le  déclin  de  la  civilisation  minoenne  en  Crête  .",airain
2016,"Même  pour  les  diamants  ,  que  l'  on  dit  éternels  ,  la  règle  est  d'  airain  :  le  temps  reste  de  l'  argent  .",airain
2016,"[  ...  ]  Les  roues  ,  les  scies  ,  les  chaudières  ,  les  laminoirs  ,  les  cylindres  ,  les  balanciers  ,  tous  ces  monstres  de  cuivre  ,  de  tôle  et  d'  airain  que  nous  nommons  des  machines  et  que  la  vapeur  fait  vivre  d'  une  vie  effrayante  et  terrible  ,  mugissent  ,  sifflent  ,  grincent  ,  râlent  ,  reniflent  ,  aboient  ,  glapissent  ,  déchirent  le  bronze  ,  tordent  le  fer  ,  mâchent  le  granit  ,  et  ,  par  moments  ,  au  milieu  des  ouvriers  noirs  et  enfumés  qui  les  harcèlent  ,  hurlent  avec  douleur  dans  l'  atmosphère  ardente  de  l'  usine  ,  comme  des  hydres  et  des  dragons  tourmentés  par  des  démons  dans  un  enfer  .",airain
2016,"Cette  loi  d'  airain  est  appliquée  au  cas  par  cas  par  le  mécanisme  de  surveillance  unique  (  MSU  )  à  Francfort  ,  logé  depuis  2014  au  sein  de  la  BCE  ,  dans  le  sillage  de  la  crise  financière  .",airain
2016,Mais  ce  n'  est  pas  une  règle  d'  airain  .,airain
2016,"Cette  règle  d'  airain  des  campagnes  vertes  ,  ainsi  que  le  curseur  fatidique  des  5  %  des  suffrages  nécessaires  pour  être  remboursé  ,  Jadot  l'  a  déjà  intégrée  .",airain
2016,Ceux  qui  résisteront  à  l'  appel  irrésistible  de  la  trame  sonore  sont  forgés  dans  l'  airain  ;  les  autres  s'  abandonneront  bien  vite  à  son  plaisir  immense  .,airain
2016,"Elena  Ferrante  rappelle  que  l'  écriture  exige  une  ambition  d'  airain  ,  une  absence  de  préjugés  ,  un  goût  de  la  désobéissance  .",airain
2017,Le  titre  :  L'  Age  d'  airain  .,airain
2017,"Avant  toute  chose  cette  loi  d'  airain  :  boire  ou  conduire  ,  il  faut  choisir  et  rouler  alors  que  l'  on  a  abusé  de  l'  alcool  est  impardonnable  .",airain
2017,"Elles  rebondissent  ,  bien  sûr  ,  sur  mon  torse  d'  airain  ,  car  même  s'  ils  me  piquent  mes  trois  maisons  ,  j'  en  ai  au  moins  dix  autres  sous  le  pied  .",airain
2017,"Autrement  ,  l'  histoire  se  chargera  de  leur  rappeler  cette  règle  d'  airain  de  la  démocratie  :  tout  détenteur  de  l'  autorité  publique  est  ,  tôt  au  tard  ,  tenu  de  rendre  des  comptes  .",airain
2017,"C'  est  l'  Union  européenne  qui  est  son  espace  ,  avec  une  politique  douanière  commune  comme  loi  d'  airain  .",airain
2017,"À  20  ans  ,  son  mental  d'  airain  s'  est  forgé  sur  les  zones  de  VTT  trial  (  catégorie  20  pouces  )  .",airain
2017,"Elle  s'  amuse  à  les  rendre  fous  d'  amour  ,  puis  quand  elle  s'  en  lasse  ,  elle  les  transforme  en  statues  d'  airain  .",airain
2017,"Elles  m'  ont  constitué  trop  souvent  ,  dans  les  dîners  ,  dans  les  scènes  de  la  vie  quotidienne  à  la  vocation  douce  ,  familière  et  sans  apprêt  ,  comme  un  personnage  abrupt  ,  rogue  ,  trop  franc  ,  vite  énervé  ,  ne  supportant  pas  la  longueur  des  récits  ni  l'  insignifiance  d'  anecdotes  interminables  ,  prétendant  couper  court  par  une  phrase  d'  airain  au  désordre  ennuyeux  d'  échanges  s'  enivrant  de  leur  platitude  .",airain
2017,"Et  pour  appeler  l'  attention  des  citoyens  bernés  par  le  méga-mensonge  et  la  loi  d'  airain  de  l'  omerta  ,  puisqu  '  il  ne  faut  pas  compter  sur  le  mainstream  de  France  Désinfo  et  de  leurs  abonnés  politiques  ,  il  sera  utile  de  clore  la  chronique  du  temps  qui  passe  en  livrant  deux  ou  trois  menues  nouvelles  que  vous  apprendrez  peut-être  ,  en  Syrie  par  exemple  ,  comme  viennent  de  le  faire  trois  députés  courageux  ,  dont  on  doit  saluer  le  franc-parler  ..",airain
2017,"Le  terme  airain  désigne  aussi  le  bronze  ,  mais  est  plutôt  employé  en  poésie  et  dans  les  textes  littéraires  ,  ainsi  qu'  en  campanologie  ,  ...  )  du  CNRS  (  Le  Centre  national  de  la  recherche  scientifique  ,  plus  connu  sous  son  sigle  CNRS  ,  est  le  plus  grand  organisme  de  recherche  scientifique  public  français  ...  )  en  2016  ,  le  projet  (  Un  projet  est  un  engagement  irréversible  de  résultat  incertain  ,  non  reproductible  a  priori  à  l'  identique  ,  nécessitant  le  concours  et  ...  )  s'  est  vu  remettre  une  bourse  ERC  Consolidator  Grants  2016  .",airain
2017,La  filière  dans  laquelle  on  est  inscrit  au  lycée  est  une  loi  d'  airain  .,airain
2017,"Il  faudra  des  subventions  de  l'  État  ,  une  décision  compliquée  alors  que  les  établissements  de  santé  sont  soumis  à  la  loi  d'  airain  de  la  T  2  A  ,  la  tarification  à  l'  activité  .",airain
2017,C'  est  une  loi  qu'  on  croyait  d'  airain  :  à  chaque  élection  sa  métamorphose  .,airain
2017,"Au  lieu  de  lui  restituer  le  pouvoir  usurpé  par  les  riches  ,  vous  lui  imposez  le  carcan  d'  une  Union  européenne  qui  tue  la  délibération  démocratique  ,  sanctuarise  le  dogme  monétariste  et  asservit  les  travailleurs  à  la  loi  d'  airain  du  capital  .",airain
2017,"apocalypse  -  la  femme  réglée  n'  est-elle  pas  ,  du  coup  ,  une  sorte  de  sorcière  aux  pouvoirs  inquiétants  ?  ""  Une  femme  qui  a  ses  règles  fait  aigrir  le  vin  doux  par  son  approche  ,  en  les  touchant  frappe  de  stérilité  les  céréales  ,  de  mort  les  greffes  ,  brûle  les  plants  des  jardins  ;  les  fruits  de  l'  arbre  contre  lequel  elle  est  assise  tombe  ;  son  regard  ternit  le  poli  des  miroirs  ,  attaque  l'  acier  et  l'  éclat  de  l'  ivoire  ;  les  abeilles  meurent  dans  leur  ruche  ;  la  rouille  s'  empare  aussitôt  de  l'  airain  et  du  fer  ,  et  une  odeur  fétide  s'  en  exhale  ""  .",airain
2017,"C'  est  une  loi  d'  airain  en  politique  ,  les  batailles  les  plus  violentes  se  déroulent  toujours  à  l'  intérieur  d'  une  même  famille  ,  d'  un  même  clan  .",airain
2017,"C'  est  un  fait  ;  il  me  semble  même  c'  est  de  cet  amour  qu'  il  est  écrit  :  ""  on  peut  parler  les  langues  des  hommes  et  des  anges  ""  mais  ,  si  on  n'  a  pas  l'  amour  ,  ""  être  comme  airain  qui  résonne  ,  une  cymbale  qui  retentit  .",airain
2017,"Depuis  2010  ,  la  zone  euro  tient  grâce  au  quantitative  easing  (  mais  qui  profite  aux  banques  ,  non  aux  populations  )  et  à  la  loi  d'  airain  budgétaire  imposée  par  les  gouvernements  de  la  zone  euro  à  leurs  sociétés  .",airain
2017,"S'  affinant  comme  une  lame  ,  arborant  en  permanence  son  sourire  d'  airain  .",airain
2017,"À  Melbourne  ,  il  a  ,  dimanche  en  finale  ,  apprivoisé  les  coups  venimeux  et  dompté  le  physique  d'  airain  de  Rafael  Nadal  ,  6  -  4  ,  3  -  6  ,  6  -  1  ,  3  -  6  ,  6  -  3  en  3  h  37  ,  pour  s'  inscrire  ,  à  35  ans  ,  comme  le  lauréat  le  plus  âgé  depuis  45  ans  en  Grand  Chelem  .",airain
2017,"Voilà  en  effet  qu'  un  jeune  homme  ,  moins  de  quarante  ans  donc  encore  inscrit  à  la  pouponnière  de  la  politique  ,  ose  prétendre  à  casser  les  règles  élémentaires  ,  celles  qui  constituent  le  bloc  d'  airain  du  ""  politiquement  convenable  ""  ,  ce  code  de  soi-disant  ""  bonne  conduite  ""  que  partagent  les  responsables  politiques  chenus  et  les  journalistes  consacrés  :  pour  prétendre  à  de  hautes  responsabilités  ,  l'  impétrant  doit  avoir  subi  le  parcours  imposé  du  combattant  ,  soit  la  vie  de  parti  ,  les  élections  intermédiaires  ,  les  bancs  de  l'  Assemblée  nationale  ,  une  entrée  forcément  discrète  au  sein  du  gouvernement  ,  tôt  ou  tard  un  nécessaire  échec  électoral  ...",airain
2017,"Un  exercice  pratique  a  été  mené  par  deux  ""  officiers  de  l'  armée  de  Sa  Majesté  ""  qui  ont  expliqué  la  formation  militaire  et  la  discipline  d'  airain  qui  y  régnait  à  l'  époque  .",airain
2017,"Car  la  règle  d'  airain  d'  un  droit  d'  asile  européen  très  imparfait  ,  consigné  dans  les  règlements  de  Dublin  ,  prévoit  que  tout  demandeur  d'  asile  doit  enregistrer  sa  demande  de  protection  dans  le  premier  pays  d'  arrivée  .",airain
2017,"S'  il  a  soigné  les  têtes  de  ses  joueurs  ,  Eddie  Jones  n'  a  pas  changé  les  vieilles  recettes  du  XV  de  la  Rose  :  un  pack  d'  airain  et  quelques  piques  bien  senties  en  attaque  .",airain
2017,"Elle  requerrait  non  seulement  une  détermination  d'  airain  ,  mais  également  le  soutien  de  la  population  .",airain
2017,"Bien  que  son  ""  timing  ""  soit  serré  et  précieux  ,  Laâradji  Nourredine  s'  est  imposé  une  discipline  d'  airain  .",airain
2017,"Pour  des  raisons  politiques  ,  pour  satisfaire  l'  appétence  des  ""  Européens  ""  pour  une  dureté  d'  airain  vis  à  vis  d'  Athènes  ,  la  direction  du  FMI  aurait  sciemment  désinformé  son  Conseil  d'  administration  et  conduit  l'  institution  de  Washington  à  opérer  un  renflouement  là  où  il  aurait  fallu  pratiquer  un  ""  haircut  ""  (  une  coupe  dans  la  dette  )  .",airain
2017,Cette  loi  d'  airain  des  trois  ans  et  des  dix  ans  est  restée  gravée  dans  le  marbre  depuis  deux  siècles  et  son  inscription  par  Napoléon  dans  le  code  d'  instruction  criminelle  de  1808  .,airain
2017,Mais  une  telle  relance  se  heurterait  à  un  plafond  de  verre  :  celui  du  taux  d'  endettement  par  rapport  à  la  production  intérieure  brute  devenue  une  espèce  de  loi  d'  airain  budgétaire  depuis  Maastricht  .,airain
2017,"""  L'  Âge  d'  airain  ""  ,  en  1877  ,  est  jugé  ""  trop  beau  ""  .",airain
2017,"Dans  le  débat  politique  suisse  ,  c'  est  la  loi  d'  airain  .",airain
2017,"Il  faut  dire  que  nos  terrains  au  bord  de  l'  Airain  ne  permettaient  pas  grand-chose  d'  autre  ""  ,  ajoute-t-il  avec  modestie  .",airain
2017,"Quand  l'  Américain  Robert  Mayer  publie  Superfolks  ,  en  1977  (  ce  roman  aujourd  '  hui  enfin  traduit  sous  le  titre  Supernormal  )  ,  les  héros  de  bande  dessinée  ,  et  notamment  les  super-héros  ,  sont  soumis  à  une  loi  d'  airain  :  ils  ne  vieillissent  pas  .",airain
2017,"Vêtue  de  son  soprano  radieux  et  ductile  ,  l'  enchanteresse  Anne-Catherine  Gillet  a  paré  la  cuirasse  de  Minerve  d'  un  airain  lumineux  .",airain
2017,"Installée  sur  des  palettes  ,  Angélique  a  dévoilé  la  beauté  de  sa  robe  d'  airain  (  alliage  de  cuivre  et  d'  étain  )  sur  laquelle  se  trouve  gravée  la  phrase  qui  raconte  son  histoire  .",airain
2017,"Le  premier  film  d'  Anne  Gaëlle  Daval  ,  qui  jusqu'  ici  était  costumière  (  entre  autres  de  la  série  Kaamelott  )  se  soumet  ensuite  aux  règles  d'  airain  qui  forcent  les  comédies  françaises  à  renoncer  à  leur  saveur  propre  .",airain
2017,"C'  est  ce  qu'  il  appelle  la  loi  d'  airain  de  l'  oligarchie  ,  c'est-à-dire  la  tendance  de  toute  organisation  à  sécréter  une  élite  oligarchique  .",airain
2017,"Sur  terre  ,  dans  les  airs  et  sur  les  océans  ,  navigatrices  toujours  solitaires  ,  elles  ont  démontré  leur  endurance  ,  leur  compétence  ,  leur  ambition  Elles  n'  ont  pas  failli  à  la  loi  d'  airain  de  cette  vallée  de  larmes  :  vivre  c'  est  se  battre  .",airain
2017,"Derrière  la  façade  d'  airain  de  son  personnage  ,  la  comédienne  parvient  à  laisser  entrevoir  les  failles  ou  les  conflits  de  Miss  Sloane  ,  femme  sans  attache  ni  vie  privée  ,  qui  calcule  jusqu'  à  la  moindre  relation  amicale  et  ne  recourt  qu'  au  sexe  tarifé  dans  ses  rares  moments  de  détente  -  même  là  ,  sa  garde  ne  baisse  jamais  .",airain
2017,Une  suggestion  subliminale  qui  installerait  une  règle  d'  airain  dans  nos  mentalités  :  celle  du  mâle  dominant  .,airain
2017,"Comme  Trump  a  été  élu  ,  que  les  Anglais  ont  dit  oui  au  Brexit  et  que  l'  élection  présidentielle  française  donne  dans  la  bouteille  à  l'  encre  ,  on  se  gardera  de  toute  certitude  d'  airain  .",airain
2017,Il  abolit  la  différence  d'  airain  entre  la  vérité  et  le  mensonge  qui  permet  l'  expérience  quotidienne  de  la  confiance  .,airain
