year,sentence,key_word
2019,"""  Au-delà  de  la  dot  qui  est  de  15  0  0  0  Fcfa  (  certains  continuent  de  toujours  payer  10  0  0  0  Fcfa  )  pour  les  filles  ,  certains  parents  n'  hésitent  plus  à  faire  pression  sur  leur  gendre  pour  acquérir  un  trousseau  très  cher  sous  peine  du  report  de  la  date  du  mariage  ,  voire  l'  annulation  pure  et  simple  ""  .  à  défaut  d'  avoir  beaucoup  de  tasses  et  de  nombreux  tissus  ,  les  parents  et  la  nouvelle  mariée  s'  exposent  à  l'  humiliation  .",trousseau
2019,"Et  pourtant  ,  les  religieux  sont  unanimes  sur  la  question  :  le  trousseau  n'  est  pas  obligatoire  .",trousseau
2019,"Pour  débarrasser  les  Maliens  de  l'  obligation  de  collecter  un  trousseau  de  mariage  ,  l'  artiste  Maïmouna  Dembélé  vient  de  créer  l'  association  ""  Hami  Ban  Kan  ""  .",trousseau
2019,Le  trousseau  n'  est  pas  réuniseulement  dans  les  villes  .,trousseau
2019,Elles  économisent  l'  argent  nécessaire  à  l'  achat  du  trousseau  .,trousseau
2019,"D'  autres  louent  même  des  tasses  et  autres  ustensiles  de  cuisine  ,  voire  des  objets  d'  ornement  juste  le  temps  d'  une  présentation  de  leur  trousseau  de  mariage  .",trousseau
2019,"La  vieille  ,  Mme  Coulibaly  Tiha  Diarra  ,  estime  que  le  trousseau  de  mariage  a  une  grande  valeur  symbolique  .",trousseau
2019,La  qualité  ou  la  quantité  des  composants  du  trousseau  de  mariage  signifiait  peu  .,trousseau
2019,"Le  jour  de  son  mariage  le  trousseau  de  celle-  ci  comptait  deux  pagnes  traditionnels  ,  une  paire  de  chaussures  ,  quelques  ustensiles  de  cuisine  et  quelques  parures  .",trousseau
2019,"Des  cérémonies  folkloriques  et  grandioses  sont  organisées  pour  exposer  ce  trousseau  ,  fruit  d'  une  grande  capacité  financière  .",trousseau
2019,L'  entêtement  à  réunir  un  trousseau  riche  et  volumineux  entraîne  des  conséquences  fâcheuses  .,trousseau
2019,Les  difficultés  de  réunir  le  trousseau  allongent  la  durée  du  célibat  .,trousseau
2019,"Elle  œuvre  à  sauver  des  mariages  ,  à  alléger  les  souffrances  des  parents  pendant  la  préparation  des  trousseaux  .",trousseaux
2019,"De  toute  évidence  ,  Toutânkhamon  a  donc  usurpé  une  grande  partie  du  trousseau  funéraire  de  celle  qui  l'  a  précédé  au  pouvoir  .",trousseau
2019,"La  verquelure  ,  ce  tissu  traditionnel  en  chanvre  ,  présentant  des  carreaux  de  couleur  bleue  ou  rouge  qui  servait  à  faire  du  linge  de  maison  (  que  toutes  les  filles  de  bonne  famille  se  devaient  d'  avoir  dans  leur  trousseau  )  .",trousseau
2019,"A  l'  en  croire  ,  elle  a  quitté  son  village  dans  la  région  de  Ségou  pour  joindre  Bamako  à  la  recherche  de  trousseau  de  mariage  .",trousseau
2019,"De  là  ,  s'  organise  la  distribution  :  un  trousseau  contient  le  nécessaire  par  enfant  et  pour  une  année  .",trousseau
2019,"Une  sacoche  noire  de  l'  ADMR  ,  30  steaks  hachés  et  un  trousseau  de  clés  du  CCAS  ,  une  paire  de  gants  ...",trousseau
2019,"La  victime  ,  âgée  de  68  ans  ,  qui  dénonçait  aussi  le  vol  de  son  portefeuille  et  d'  un  trousseau  de  clés  ,  avait  obtenu  un  huis  clos  .",trousseau
2019,"Une  porte  à  double  battant  ,  dont  Frédéric  Lacaille  ,  conservateur  ,  s'  est  procuré  le  trousseau  de  clés  bleu  turquoise  ,  et  voici  la  salle  du  Congrès  ,  hémicycle  de  mille  places  ,  où  la  lumière  pénètre  à  travers  la  verrière  embuée  du  plafond  .",trousseau
2019,"Leur  idée  est  de  transformer  votre  smartphone  en  porte-clefs  numérique  ,  grâce  à  une  application  supprimant  ainsi  les  inconvénients  de  transporter  ou  de  perdre  un  lourd  trousseau  .",trousseau
2019,La  non  attribution  des  bourses  et  Trousseaux  aux  étudiants  ;,trousseaux
2019,Ismaïl  qui  fréquentait  l'  école  de  l'  association  des  oulémas  algériens  à  Constantine  arborait  ce  jour-là  le  drapeau  national  que  cette  nonagénaire  affirme  avoir  elle-même  cousu  en  utilisant  les  robes  de  son  trousseau  de  mariage  qu'  elle  avait  célébré  deux  années  auparavant  (  1943  )  .,trousseau
2019,"Le  trousseau  pédagogique  sera  pour  le  moment  à  25  0  0  0  FCFA  ,  l'  objectif  étant  d'  avoir  une  base  légale  .",trousseau
2019,"Je  viens  d'  avoir  55  ans  ,  je  suis  journaliste  depuis  près  de  trente  ans  et  je  suis  au  chômage  depuis  la  fin  novembre  parce  qu'  on  m'  a  privée  de  mon  emploi  ;  je  ne  l'  ai  pas  perdu  comme  on  égare  un  trousseau  de  clefs  .",trousseau
2019,"Attaque  au  cours  de  laquelle  ,  les  bandits  ont  emporté  la  somme  de  72  0  0  0  F  Cfa  ,  un  téléphone-portable  ,  des  documents  administratifs  ,  un  trousseau  de  clés  et  un  morceau  de  pagne  .",trousseau
2019,"Il  faut  les  voir  déambuler  dans  le  grand  cloître  de  ""  leur  ""  chartreuse  ,  un  trousseau  de  clés  à  la  main  ,  pour  me  faire  visiter  les  anciennes  cellules  des  moines  -  aujourd  '  hui  utilisées  pour  des  retraites  spirituelles  de  huit  jours  minimum  .",trousseau
2019,Mais  il  constitue  un  efficace  trousseau  de  clés  .,trousseau
2019,"Pendant  la  rentrée  scolaire  ,  nous  avons  distribué  des  trousseaux  et  des  enveloppes  financières  aux  orphelins  .",trousseaux
2019,"Il  se  montre  alors  pour  les  policiers  d'  un  précieux  secours  :  bon  dessinateur  ,  il  les  aide  à  établir  le  plan  du  magasin  ,  et  ,  très  à  propos  ,  leur  indique  que  l'  ensemble  des  clés  du  magasin  se  trouve  sur  un  trousseau  autour  du  cou  de  son  patron  blessé  à  la  main  qui  se  trouve  non  loin  .",trousseau
2019,"Comme  le  trousseau  en  comporte  beaucoup  ,  il  leur  indique  précisément  celles  qui  leur  seront  utiles  ,  en  particulier  la  clé  du  rideau  de  fer  défendant  l'  entrée  du  magasin  .",trousseau
2019,"L'  écran  d'  un  téléphone  qui  éclate  ,  un  trousseau  de  clé  qui  se  plante  dans  l'  artère  fémorale  et  c'  est  l'  hémorragie  .",trousseau
2019,Il  s'  est  rendu  compte  que  c'  était  l'  accès  au  trousseau  d'  accès  -  le  gestionnaire  des  mots  de  passe  et  des  certificats  Apple  -  était  ralentit  à  cause  de  l'  utilisation  de  Siri  .,trousseau
2019,Cet  utilisateur  a  donc  expliqué  que  l'  assistant  numérique  rafraîchit  à  intervalle  régulier  son  accès  au  trousseau  et  causait  un  ralentissement  plus  ou  moins  conséquent  sur  de  nombreux  logiciels  .,trousseau
2019,"Comme  toute  famille  ordinaire  ,  ce  jour  23  janvier  2016  ,  le  couple  FALL  devait  assister  à  deux  cérémonies  de  mariage  dont  la  première  consistait  à  rassembler  les  trousseaux  de  la  nouvelle  mariée  à  Badalabougou  ,  et  la  seconde  un  peu  plus  tard  dans  l'  après  -  midi  à  Lafiabougou  ,  au  domicile  du  Président  Dioncounda  TRAORE  où  l'  une  des  filles  de  ce  dernier  devait  se  marier  .",trousseaux
2019,R  est  par  ailleurs  en  possession  d'  un  trousseau  de  clés  qui  attire  l'  attention  des  policiers  .,trousseau
2019,"Des  serrures  anciennes  ,  des  clés  forgées  ,  des  trousseaux  ,  des  heurtoirs  ,  des  crémones  ,  des  verrous  ,  des  targettes  ,  des  cadenas  ,  des  loquets  ,  des  poignées  de  bronze  seront  proposés  à  la  vente  ainsi  que  des  chenets  et  plaques  de  cheminées  .",trousseaux
2019,"''  Une  douille  de  calibre  12  millimètres  a  été  découverte  en  plus  d'  un  trousseau  contenant  trois  autres  cartouches  de  même  calibre  dans  une  chambre  de  la  maison  familiale  ''  ,  a  fait  savoir  le  commissaire  Diédhiou  .",trousseau
2019,"Le  premier  jeudi  de  la  rentrée  fut  le  jour  de  la  distribution  du  trousseau  par  l'  économe  ,  en  la  présence  du  Directeur  .",trousseau
2019,"Ce  n'  est  pas  tout  ,  puisqu  '  ""  un  trousseau  contenant  trois  autres  cartouches  de  calibre  12  mm  sera  ensuite  découvert  .",trousseau
2019,"Dans  nos  recherches  ,  on  a  trouvé  un  trousseau  contenant  trois  autres  cartouches  de  calibre  12  mm  dans  une  chambre  .",trousseau
2019,"Elle  continue  d'ailleurs  ,  en  me  constituant  patiemment  un  trousseau  chiné  avec  mes  initiales  AS  brodées  sur  des  torchons  ,  des  serviettes  ,  des  chemises  qu'  elle  m'  offre  fièrement  à  Noël  .",trousseau
2019,L'  APC  de  Bab  Ezzouar  s'  engage  à  fournir  pour  ces  enfants  des  trousseaux  complets  de  circoncision  .,trousseaux
2019,"Qui  dit  trousseau  de  clé  séparé  ,  dit  aussi  charges  séparés  .",trousseau
2019,*  La  définition  d'  un  contenu  du  trousseau  pédagogique  ;,trousseau
2019,"""  Mais  comment  se  fait-il  qu'  il  ne  retrouve  jamais  ses  clés  de  voiture  alors  qu'  elles  sont  juste  sous  son  nez  !  ""  Combien  de  compagnes  agacées  ont  un  jour  poussé  ce  cri  de  désarroi  en  découvrant  l'  homme  de  leur  vie  désemparé  face  à  la  perte  de  son  trousseau  ?  Un  peu  d'  indulgence  ,  mesdames  :  en  tant  que  digne  représentant  de  la  gent  masculine  ,  votre  cher  et  tendre  dispose  d'  un  angle  de  vision  périphérique  bien  inférieur  au  vôtre  !  En  revanche  ,  au  jeu  de  celui  qui  voit  le  plus  loin  ,  il  pourrait  bien  vous  battre  à  plates  coutures  .",trousseau
2019,"On  se  souvient  du  sacristain  trottant  dans  l'  édifice  ,  son  immense  trousseau  de  clés  de  la  cathédrale  à  la  main  ,  saluant  chaque  paroissien  d'  un  petit  signe  de  tête  discret  .",trousseau
2019,"""  Elle  est  réalisée  à  partir  d'  un  jeté  de  lit  en  dentelle  brodé  provenant  du  trousseau  de  mariage  de  sa  mère  ""  .",trousseau
2019,"Voilà  ,  comment  de  nombreuses  servantes  ,  venues  en  ville  ,  à  la  recherche  des  trousseaux  de  mariage  ,  se  retrouvent  avec  des  grossesses  non-désirées  dont  les  auteurs  ,  dans  la  plupart  des  cas  ,  ne  sont  pas  connus  .",trousseaux
2019,"menu  servi  aux  présents  ,  on  servit  de  la  chamia  et  du  thé  avant  que  Madame  Kouaki  prenne  la  parole  pour  remercier  l'  assistance  d'  être  là  ,  tout  en  faisant  l'  historique  de  la  construction  de  cet  espace  destiné  à  accueillir  l'  enfance  en  détresse  et  a  tenu  à  remercier  les  nombreux  donateurs  qui  viennent  toujours  proposer  leurs  aides  matérielles  pour  les  besoins  du  centre  qui  doit  être  ouvert  prochainement  Incha  Allah  ,  pendant  ce  mois  sacré  ,  l'  association  de  madame  Kouaki  s'  est  lancé  dans  d'  autres  activités  comme  la  circoncision  des  enfants  et  la  distribution  du  trousseau  de  l'  Aïd  pour  les  enfants  démunis  .",trousseau
2019,"On  a  beau  y  plonger  la  main  ,  on  n'  y  retrouve  plus  rien  ,  même  pas  son  trousseau  de  clés  !  La  tendance  des  sacs  Anna  Morellini  est  donc  résolument  pratique  .",trousseau
2019,"Le  wali  ,  Toufik  Mezhoud  ,  a  présidé  la  cérémonie  de  remise  d'  une  dizaine  de  trousseaux  de  l'  Aïd  el-Fitr  à  titre  symbolique  à  des  enfants  orphelins  dans  une  ambiance  conviviale  et  de  fraternité  .",trousseaux
2019,"Le  directeur  des  Affaires  religieuses  et  des  Wakfs  de  wilaya  ,  Djamel  Ammi  ,  a  indiqué  que  l'  opération  ''  trousseaux  de  l'  Aïd  el-Fitr  ''  vient  d'  être  lancée  depuis  deux  semaines  dans  la  perspective  de  rendre  le  sourire  à  plus  de  3.000  enfants  orphelins  issus  des  12  communes  que  compte  Annaba  .  2.000  tenues  vestimentaires  de  l'  Aïd  el-Fitr  ont  été  déjà  distribuées  jusqu'  à  présent  ,  a  tenu  à  préciser  le  même  responsable  .",trousseaux
2019,"Alors  qu'  elle  rejoignait  sa  voiture  garée  dans  le  parking  souterrain  de  la  rue  de  la  République  (  2  e  )  ,  trousseau  de  clés  en  main  ,  un  homme  ,  surgi  de  nulle  part  ,  s'  est  dressé  de",trousseau
2019,"Sans  carte  d'  identité  ,  sans  argent  ,  juste  un  trousseau  de  clés  .",trousseau
2019,"Qui  un  jour  n'  a  pas  été  confronté  à  une  telle  mésaventure  :  perdre  ses  clés  ?  Oubliées  ,  volées  ,  perdues  ,  et  généralement  avec  toutes  les  clés  sur  le  même  trousseau  ?",trousseau
2019,"Le  moindre  trousseau  de  production  locale  coûte  environ  4000  DA  ,  que  faire  pour  un  fonctionnaire  qui  perçoit  juste  un  peu  plus  que  le  SNMG  .",trousseau
2019,"L'  histoire  retient  les  noms  de  près  d'  une  soixantaine  de  types  d'  habit  féminin  que  le  Maroc  a  connus  ,  comme  en  témoigne  leur  récurrence  dans  les  actes  de  mariage  où  ils  sont  cités  parmi  les  présents  fournis  au  trousseau  de  la  mariée  ,  a-t-elle  expliqué  .",trousseau
2019,"""  Le  chef  d'  Israël  Beytenu  était  la  dernière  clé  du  trousseau  pour  avoir  la  majorité  à  la  Knesset  .",trousseau
2019,"Une  fois  les  plus  belles  grappes  de  chardonnay  ,  poulsard  et  savagnin  (  mais  aussi  trousseau  )  récoltées  et  soigneusement  sélectionnées  ,  il  les  entrepose  sur  des  claies  -cagettes  perforées-  afin  de  les  laisser  sécher  3  à  5  mois  (  6  semaines  minimum  pour  la  mention  traditionnelle  )  dans  un  lieu  bien  aéré  .",trousseau
2019,SIDI  BEL  ABBES  /  NUIT  DU  DESTIN  :  Distribution  de  trousseaux  vestimentaires  aux  enfants  nécessiteux,trousseaux
2019,"Ainsi  l'  association  ""  Faraj  El  Khirya  ""  a  procédé  à  la  distribution  de  150  trousseaux  d'  effets  vestimentaires  d'  un  montant  unitaire  variant  entre  4500  DA  et  7000  DA  ,  selon  l'  âge  de  l'  enfant  nécessiteux  ciblés  dont  des  Syriens  et  Palestiniens  ,  afin  de  leur  permettre  de  passer  la  célébration  de  l'  Aïd  ,  dans  la  joie  et  la  dignité  .",trousseaux
2019,"Ainsi  50  trousseaux  ont  été  offert  aux  enfants  nécessiteux  de  la  commune  de  Sidi  bel  abbés  compte  tenu  du  nombre  d'  habitants  et  100  autres  trousseaux  ont  été  réparties  entre  20  communes  de  la  wilaya  à  savoir  :  (  Marhoum  ,  Ras  El  ma  ,  Tenira  ,  Tabia  ,  Sidi  Ali  Benyoub  ,  Tenezara  ,  Moulay  Slissen  ,  Sefioun  ,  Sfisef  ,  Mcid  ,  Ain  El  BERD  ,  Idi  Lahcen  ,  Sidi  Brahim  ,  Ouled  Bendida  ,  Amarnas  ,  Hassi  Daho  ,  Belouladi  ,  Boukhanefis  ,  Tirman  )  ..",trousseaux
2019,"Durant  les  seize  mois  où  il  est  en  famille  d'  accueil  ,  cette  dernière  doit  lui  apprendre  30  commandes  comme  ,  par  exemple  ,  ouvrir  des  portes  ,  des  placards  ,  des  tiroirs  ou  encore  ramasser  un  trousseau  de  clé  tombé  au  sol  .",trousseau
2019,"""  Il  fait  tourner  son  trousseau  de  clés  autour  de  son  index  .",trousseau
2019,"Au  cours  des  discours  qui  ont  suivi  la  cérémonie  ,  le  général  Bertrand  François  a  remis  symboliquement  au  général  Pascal  Hurtault  le  trousseau  de  clés  de  l'  école  ,  comme  le  précise  ""  Le  Bien  public  ""  .",trousseau
2019,"La  porte  a  claqué  dans  votre  dos  en  vous  laissant  sur  le  seuil  ?  Vous  avez  perdu  votre  trousseau  de  clés  ?  La  serrure  s'  est  grippée  et  ,  en  forçant  ,  la  clé  s'  est  cassée  net  dans  le  barillet  ?  Autant  de  raisons  d'  appeler  un  serrurier  .",trousseau
2019,La  future  belle-famille  rapportait  à  la  future  belle-fille  un  cadeau  qui  était  en  général  un  coupon  de  tissus  que  la  jeune  fiancée  ajoutait  à  son  trousseau  .,trousseau
2019,"Pendant  ses  quarts  de  travail  ,  il  lui  arrive  souvent  de  s'  amuser  en  reproduisant  le  cliché  des  gardiens  de  sécurité  qui  sifflent  en  secouant  leur  trousseau  de  clés  .",trousseau
2019,L'  appli  peut  interroger  le  trousseau  de  clés  et  vous  pourrez  vous  loguer  grâce  à  Touch  ID  ou  Face  ID  .,trousseau
2019,"Parce  qu'  elle  a  osé  dire  à  une  maîtresse  surveillante  qu'  elle  ne  parlait  pas  bambara  ,  elle  a  été  violemment  prise  à  partie  par  cette  dernière  qui  l'  a  fait  sortir  du  rang  où  les  jeunes  filles  attendaient  sous  le  soleil  leurs  trousseaux  .",trousseaux
2019,"À  ceux  de  ses  amis  qui  refusaient  un  tel  trousseau  ,  la  campagne  Bellamy  a  été  livrée  clé  en  main  .",trousseau
2019,"Mieux  ,  en  lui  remettant  même  le  trousseau  de  clés  des  portes  encore  fermées  aujourd  '  hui  .",trousseau
2019,"Jake  se  penche  vers  une  glacière  posée  en  plein  milieu  de  son  pallier  ,  soulève  le  couvercle  et  en  retire  un  trousseau  de  clefs  coincé  aux  milieux  de  quelques  bouteilles  d'  alcool  .",trousseau
2019,"Si  la  prison  a  pris  feu  quelques  secondes  après  ,  tout  laisse  présager  que  Bonnet  s'  en  est  sorti  indemne  grâce  au  trousseau  de  clés  ...",trousseau
2019,Le  preneur  d'  otages  aurait  enfermé  les  deux  surveillants  dans  sa  cellule  et  aurait  subtilisé  leur  trousseau  de  clés  .,trousseau
2019,"Chaque  joueur  ayant  ,  de  plus  ,  droit  à  un  trousseau  et  des  médailles  .",trousseau
2019,"Le  deuxième  pilier  de  l'  User  Enrollment  est  la  séparation  des  données  .  iOS  crée  un  volume  APFS  géré  à  part  entière  où  sont  stockées  les  données  professionnelles  (  notes  ,  documents  iCloud  Drive  ,  trousseau  ,  mails  ...  )  .",trousseau
2019,"Pour  la  grand-mère  du  moins  ,  qui  a  dû  prendre  la  charge  de  préparer  le  trousseau  sans  le  moindre  appui  de  l'  auteur  ,  lequel  aurait  pris  la  clé  des  champs  une  fois  informé  que  sa  semence  allait  germer  ...",trousseau
2019,"Ultime  péripétie  de  l'  affaire  :  l'  échographie  montrait  un  seul  bébé  ,  et  c'  est  sur  la  base  de  cette  information  que  le  trousseau  a  été  apprêté  .",trousseau
2019,"Son  trousseau  avec  casquette  ,  polo  ,  chaussure  et  chasuble  sur  le  dos  ,  Maud  se  rendra  dès  le  16  juin  2019  ,  et  pour  six  semaines  ,  dans  les  Ardennes  .",trousseau
2019,Mais  plus  tard  la  grand-mère  a  été  contrainte  de  préparer  le  trousseau  sans  un  quelconque  appui  de  l'  auteur  de  la  grossesse  .,trousseau
2019,"Par  ailleurs  ,  elles  corrigent  une  vulnérabilité  de  sécurité  en  empêchant  intentionnellement  les  connexions  entre  Windows  et  les  périphériques  Bluetooth  qui  ne  sont  pas  sécurisés  et  en  utilisant  des  clés  bien  connues  pour  crypter  les  connexions  ,  y  compris  les  trousseaux  de  sécurité  .",trousseaux
2019,"Le  bastardo  est  un  cépage  portugais  autochtone  ,  cousin  germain  de  notre  trousseau  cultivé  dans  le  Jura  ,  que  certains  vignerons  du  Douro  s'  attachent  à  faire  renaître  .",trousseau
2019,"Un  homme  tentait  en  vain  toutes  les  clés  qu'  il  avait  dans  son  trousseau  ,  mais  son  ami  restait  coincé  par  le  cou  .",trousseau
2019,"Ils  avaient  les  clés  ,  mes  clés  avaient  été  saisies  lors  de  l'  inspection  ,  nous  sommes  arrivés  à  l'  appartement  ,  un  des  policiers  avait  un  gros  trousseau  d'  environ  20  clés  ,  il  a  rapidement  identifié  la  bonne  clé  ,  et  a  ouvert  la  porte  du  premier  coup  .",trousseau
2019,"Malheureusement  ,  cela  ne  fonctionne  coque  iphone  x  kickstand  magnetique  iphone  6  coque  pastel  pas  toujours  si  le  mot  de  passe  du  trousseau  est  différent  de  votre  mot  de  passe  utilisateur  .",trousseau
2019,"Lorsqu'  il  ne  le  fait  pas  ,  vous  coque  iphone  x  camouflage  silicone  ne  pouvez  coque  iphone  x  liquid  glitter  que  recommencer  en  supprimant  coque  champion  du  monde  iphone  x  l'  ancien  et  en  créant  un  nouveau  trousseau  .",trousseau
2019,"Il  faut  souligner  que  chaque  enfant  stabilisé  à  son  départ  du  centre  ,  a  bénéficié  d'  un  trousseau  contenant  des  effets  d'  habillement  ,  couvertures  ,  moustiquaires  ,  kits  d'  hygiène  .",trousseau
2019,"La  perquisition  chez  O.  D  a  permis  la  saisie  d'  un  trousseau  de  clés  de  treize  motos  ,  quinze  factures  d'  achat  motos  taxi  et  sept  factures  de  motos  Djakarta  .",trousseau
2019,"Conséquence  ,  des  trousseaux  à  foison  ,  des  clés  qui  s'  égarent  et  disparaissent  ,  et  des  difficultés  de  gestion  pour  les  serruriers  de  l'  hôpital  .",trousseaux
2019,"Il  lui  a  ensuite  jeté  un  trousseau  de  clés  sur  le  visage  ,  avant  de  quitter  les  lieux  .",trousseau
2019,"Ce  qui  signifie  que  les  premiers  ""  trousseaux  ""  seront  offerts  en  2025  .",trousseaux
2019,"En  revanche  ,  chaque  année  ,  le  petit  Cannois  recevra  un  courrier  lui  souhaitant  un  joyeux  anniversaire  et  sera  informé  de  l'  ouvrage  ajouté  à  son  trousseau  .",trousseau
2019,"Ce  Camerounais  escaladait  les  murs  ,  brisait  les  vitres  ou  utilisait  des  trousseaux  de  fausses  clés  ,  afin  de  pénétrer  dans  le  domicile  des  Marocains  résidant  à  l'  Étranger  (  MRE  )  ,  profitant  de  leur  absence  .",trousseaux
2019,"Dans  ses  poches  ont  été  retrouvés  un  trousseau  avec  une  clef  ,  deux  porte-clefs  en  forme  de  cuillère  et  de  la  Martinique  ainsi  qu'  un  décapsuleur  (  photo  )  .",trousseau
2019,"Manteau  peignoir  en  mohair  ,  pantalon  de  satin  porté  avec  un  tricot  de  corps  ultra-fin  ,  chemise  en  voile  de  coton  plissé  évoquent  le  trousseau  pour  homme  à  l'  ancienne  ,  un  esprit  cocooning  pour  la  ville  raffiné  et  moderne  .",trousseau
2019,"La  croissance  s'  explique  par  d'  excellentes  ventes  dans  le  secteur  des  accessoires  -  en  particulier  le  ""  Chiquito  ""  ,  minuscule  sac  à  main  qui  ne  peut  contenir  que  des  cartes  ou  un  trousseau  de  clé  .",trousseau
2019,Les  voyous  ont  alors  dérobé  le  trousseau  de  clés  de  la  victime  avant  de  repartir  avec  son  véhicule  .,trousseau
2019,"Muni  de  sa  fiche  de  contrôle  et  d'  un  trousseau  de  clés  ,  Rodolphe  s'  apprête  monter  dans  sa  rame  de  tramway  .",trousseau
2019,"Les  deux  amis  ont  été  délestés  ,  notamment  ,  de  leurs  portables  ,  de  leur  argent  liquide  et  de  leurs  trousseaux  de  clés  ,  relatent  nos  confrères  de  La  Dépêche  .",trousseaux
2019,"En  termes  plus  clairs  ,  il  s'  agit  de  permettre  à  chaque  nouveau  bachelier  d'  avoir  sa  carte  bancaire  pour  recevoir  facilement  son  trousseau  et  sa  bourse  .",trousseau
2019,"Sur  les  traces  de  la  bohème  ,  il  lui  arrive  même  de  se  prêter  avec  sa  fille  à  un  jeu  de  pistes  entre  les  tombes  du  cimetière  du  Montparnasse  ,  à  la  recherche  de  Charles  Baudelaire  ;  ou  de  fureter  ,  un  trousseau  de  clés  de  facteur  en  main  ,  dans  l'  ancien  immeuble  de  Chaïm  Soutine  ,  son  peintre  préféré  .",trousseau
2019,"Confirmez  votre  mot  de  passe  principal  ,  et  conservez-le  précieusement  dans  un  coin  de  votre  tête  :  si  vous  l'  oubliez  ,  vous  ne  pourrez  plus  consulter  les  données  du  trousseau  d'  accès  du  navigateur  .",trousseau
2019,"Désormais  ,  à  chaque  nouvelle  session  de  navigation  avec  Firefox  ,  le  navigateur  vous  invitera  à  saisir  le  mot  de  passe  principal  pour  déverrouiller  l'  accès  au  trousseau  .",trousseau
2019,Cliquez  sur  l'  icône  figurant  un  œil  pour  dévoiler  un  mot  de  passe  stocké  dans  le  trousseau  du  navigateur  .,trousseau
2019,Vous  pourrez  mettre  en  place  cette  solution  très  facilement  en  important  tout  le  trousseau  stocké  dans  votre  navigateur  Web  .,trousseau
2019,"Dotés  de  trousseaux  de  vacances  ,  ils  ont  tous  pris  le  départ  à  bord  de  bus  ,  a  précisé  le  DJS  ,  Akli  Mohamed  Moucheref  .",trousseaux
2019,"La  police  a  publié  également  plusieurs  clichés  d'  effets  retrouvés  lorsque  son  corps  a  été  découvert  :  vêtements  ,  baskets  ,  mais  aussi  un  sac  à  dos  et  un  trousseau  de  clés  susceptibles  de  lui  appartenir  .",trousseau
2019,"Elle  pourrait  être  la  propriétaire  d'  un  sac  à  dos  de  marque  Zara  Man  ,  en  bon  état  ,  en  simili  cuir  ,  effet  peau  de  crocodile  ,  d'  un  débardeur  de  marque  H  &  M  troué  ,  avec  une  tête  de  mort  grise  et  un  papillon  jaune  ,  d'  un  tee-shirt  Airness  rouge  et  bleu  ,  de  baskets  Nike  (  pointure  45  )  et  d'  un  trousseau  de  clés  supportant  trois  clés  identiques  de  marque  Thirard  ,  une  clé  Maeur  BJ  145  et  deux  clés  de  boîte  aux  lettres  .",trousseau
2019,"C'  est  en  tout  une  dizaine  de  trousseaux  qui  ont  été  offerts  à  ces  nouvelles  mères  ,  qui  très  heureuses  ont  fait  des  bénédictions  au  parrain  .",trousseaux
2019,"Parce  que  le  Jura  ne  fait  rien  comme  les  autres  ,  voici  un  rosé  unique  ,  qui  sent  le  trousseau  et  le  poulsard  ,  des  cépages  qu'  on  ne  trouve  nulle  part  ailleurs  .",trousseau
