year,sentence,key_word
2019,"L'  État  s'  est  en  effet  engagé  par  sa  signature  dans  la  Convention  canne  ,  le  gouvernement  doit  respecter  l'  engagement  écrit  de  l'  État  et  inscrire  dans  ses  dépenses  pour  2020  les  38  millions  d'  euros  ,  dont  28  millions  reviennent  à  La  Réunion  ;",canne
2019,"Lire  aussi  :  sans  les  28  millions  du  gouvernement  ,  la  filière  canne  -  sucre  est  menacée  de  disparition",canne
2019,"De  quoi  affoler  Tereos  océan  Indien  ,  l'  unique  industriel  du  sucre  à  la  Réunion  ,  qui  reverse  une  grande  partie  de  cette  aide  aux  planteurs  :  elle  permet  de  racheter  l'  ensemble  de  la  production  de  canne  et  de  garantir  un  prix  fixe  ,  celui  négocié  dans  le  cadre  de  l'  avenant  à  la  convention  canne  en  2017  .",canne
2019,"En  février  2016  ,  une  note  de  l'  Etat  part  donc  à  Bruxelles  pour  expliquer  pourquoi  cette  subvention  est  vitale  pour  la  survie  de  la  filière  canne  à  sucre  .",canne
2019,Le  volet  B  de  la  convention  canne  2015  -  2021  est  négocié  dans  la  douleur  .,canne
2019,"Pour  l'  industriel  réunionnais  ,  une  telle  posture  est  désastreuse  pour  la  filière  canne  ,  mais  au-delà  pour  toute  l'  agriculture  réunionnaise  qui  dépend  de  cette  culture  centrale  .",canne
2019,"La  convention  canne  du  11  juin  2015  a  fait  l'  objet  d'  un  avenant  signé  le  10  juillet  2017  ,  après  des  semaines  de  conflit  entre  usinier  et  planteurs  .",canne
2019,"En  témoigne  le  communiqué  commun  diffusé  hier  sous  les  signatures  de  la  Confédération  paysanne  ,  de  la  CGPER  et  de  l'  UPG  de  Guadeloupe  ,  demandant  au  gouvernement  de  respecter  l'  engagement  de  l'  État  quant  au  versement  annuel  d'  une  aide  d'  État  de  38  millions  d'  euros  aux  filières  canne  de  La  Réunion  et  de  Guadeloupe  .",canne
2019,"Hier  ,  date  de  l'  ouverture  de  la  campagne  sucrière  à  La  Réunion  ,  et  au  lendemain  de  l'  assemblée  générale  de  la  CGPER  à  laquelle  a  participé  une  délégation  de  la  Confédération  paysanne  ,  la  Confédération  paysanne  ,  la  CGPER  et  l'  UPG  ont  adressé  un  communiqué  commun  aux  médias  ,  appelant  l'  État  à  respecter  son  engagement  à  soutenir  les  filières  canne  de  La  Réunion  et  de  Guadeloupe  ,  menacées  par  la  non-inscription  par  le  gouvernement  dans  le  prochain  Budget  de  l'  État  d'  une  aide  compensatoire  à  la  suppression  des  quotas  sucriers  d'  un  montant  de  38  millions  d'  euros  .",canne
2019,"La  convention  canne  ,  signée  pour  la  période  2015  -  2021  ,  a  été  actualisé  en  2017  par  avenant  .",canne
2019,"Or  ,  aujourd  '  hui  ,  les  planteurs  découvrent  que  le  gouvernement  s'  apprête  à  les  trahir  puisqu  '  il  n'  a  pas  inscrit  la  poursuite  du  soutien  à  la  filière  canne  dans  le  projet  de  loi  de  finances  pour  2020  !",canne
2019,"Infused  a  ensuite  lancé  des  élixirs  d'  endurance  et  de  récupération  dans  la  gamme  de  produits  d'  action  sportive  Canna  Hemp  Xtm  et  a  engagé  Sarah  Moras  ,  athlète  professionnelle  et  combattante  des  arts  martiaux  mixtes  ,  en  tant  qu'  ambassadrice  de  la  marque  et  athlète  parrainée  .",canna
2019,"La  crème  apaisante  Canna  Hemptm  CBD  a  été  nommée  ""  Meilleure  crème  topique  ""  par  Leafy  dans  la  catégorie  Best  in  State  :  The  Top  State  Specific  Products  and  Experiences  of  2018  .",canna
2019,"Concernant  leur  rapport  avec  la  filière  canne  ,  Pascal  Langeron  explique  qu'  ils  ont  toujours  travaillé  avec  les  sucriers  pour  augmenter  la  part  de  fibre  dans  la  canne  ,  tout  en  précisant  que  cette  décision  n'  est  pas  de  leur  ressort  .",canne
2019,Cette  demande  est  d'autant  plus  justifiée  que  cette  somme  est  inscrite  dans  un  document  signé  par  l'  État  avec  les  planteurs  et  l'  industriel  Tereos  :  la  Convention  canne  .,canne
2019,"Il  nous  faut  définir  une  nouvelle  politique  ,  c'  est  dans  ce  contexte  que  se  déroulent  les  graves  problèmes  sur  la  filière  canne  et  l'  agriculture  en  général  ""  ,  conclut  Yvan  Dejean  .",canne
2019,"L'  accord  avec  le  Mercosur  confirme  un  quota  de  180.000  tonnes  de  sucre  brésilien  ,  une  concurrence  supplémentaire  pour  la  filière  canne  réunionnaise  qui  vient  à  peine  de  commencer  sa  campagne  sucrière  .",canne
2019,"D'  où  un  sentiment  largement  partagé  :  de  quelle  stratégie  discuter  si  l'  essentiel  ,  la  survie  de  la  filière  canne  ,  n'  est  pas  assuré  ?",canne
2019,"Organisé  hier  au  Crédit  agricole  ,  le  COSDA  a  vu  la  présentation  de  plusieurs  documents  stratégiques  par  Philippe  Simon  ,  Directeur  de  l'  agriculture  et  de  la  forêt  ,  notamment  celui  relatif  à  l'  avenir  de  la  filière  canne  .",canne
2019,"Florent  Thibault  ,  co-président  industriel  du  CPCS  a  alors  interpellé  le  chef  de  service  de  l'  État  ,  demandant  en  substance  si  des  mesures  sont  prévues  pour  faire  face  aux  ""  cyclones  politiques  et  économiques  ""  que  sont  les  incertitudes  sur  l'  aide  d'  État  de  28  millions  d'  euros  due  à  la  filière  canne  jusqu'  en  2021  ,  et  sur  les  fonds  du  CIOM  d'  un  montant  de  40  millions  d'  euros  .",canne
2019,"Vos  projets  on  peut  les  faire  ,  mais  y  aura-t-il  une  filière  canne  l'  année  prochaine  ?  ""  Un  autre  dirigeant  de  la  CGPER  ,  Jean-Michel  Moutama  ,  a  abondé  dans  le  même  sens  :  ""  les  planteurs  peuvent-ils  commander  leur  engrais  ?  Que  faut-il  faire  en  2020  ?  """,canne
2019,"Il  précise  aussi  qu'  en  contrepartie  des  28  millions  d'  euros  ,  l'  industriel  s'  engage  à  acheter  toutes  les  cannes  ""  saines  ,  loyales  et  marchandes  ""  livrées  selon  un  prix  défini  par  la  Convention  canne  .",canne
2019,"Si  vous  êtes  à  la  recherche  d'  une  poussette  canne  ,  la  poussette  Recaro  Easylife  vendue  au  prix  de  349,09  €  sur  Amazon  est  celle  qu'  il  vous  faut  .",canne
2019,"Et  se  référant  la  Convention  canne  ,  elle  précise  que  ce  prix  est  fixe  ""  en  tenant  compte  de  la  recette  sucre  et  mélasse  des  industriels  et  des  aides  compensatoires  nationales  et  communautaires  ""  .",canne
2019,"La  semaine  dernière  lors  de  la  conférence  de  presse  de  la  Production  locale  réunie  ,  Philippe  Labro  ,  président  de  Tereos  Océan  Indien  ,  a  annoncé  que  si  l'  aide  n'  était  pas  versée  comme  écrit  dans  la  Convention  canne  ,  alors  soit  Tereos  déduirait  28  millions  du  prix  d'  achat  des  cannes  aux  planteurs  (  ce  qui  correspondrait  à  une  baisse  de  14  euros  par  tonne  en  cas  de  récolte  de  2  millions  de  tonnes  de  cannes  -  NDLR  )  ,  soit  il  fermerait  les  deux  usines  sucrières  de  La  Réunion  l'  année  prochaine  .",canne
2019,"""  On  a  beaucoup  d'  espèces  (  châtaigniers  de  Guyane  ,  Canna  jaune  ,  palmacées  ,  aromatiques  ,  bégonias  ...  )  .",canna
2019,"J'  ai  insisté  pour  que  cette  aide  soit  maintenue  ,  au  moins  jusqu'  au  terme  de  la  convention  canne  ,  c'est-à-dire  en  2021  ""  .",canne
2019,"La  campagne  sucrière  vient  de  débuter  dans  le  Nord  et  l'  Est  ,  dans  un  contexte  d'  incertitudes  :  l'  attente  de  la  réponse  du  gouvernement  quant  au  maintien  des  aides  à  la  filière  canne  inquiète  .",canne
2019,La  CCIR  aux  côtés  des  transporteurs  de  la  filière  canne ,canne
2019,"Ibrahim  Patel  ,  président  de  la  CCIR  ,  a  reçu  hier  matin  des  représentants  de  la  vingtaine  de  transporteurs  routiers  de  la  filière  canne  .",canne
2019,"Au  président  de  la  CCIR  ,  les  transporteurs  ont  rappelé  l'  importance  de  la  filière  canne  dans  l'  économie  réunionnaise  avec  ses  30  0  0  0  emplois  .",canne
2019,"""  L'  avenir  de  la  filière  canne  n'  est  pas  à  l'  ordre  du  jour  avec  le  président  de  la  CCI  de  Guadeloupe  nous  nous  ferons  les  porte-paroles  de  la  filière  .",canne
2019,"Dans  l'  immédiat  ,  que  le  gouvernement  inscrive  dans  le  projet  de  budget  la  somme  de  38  millions  d'  euros  pour  la  filière  canne  .",canne
2019,"Il  s'  agit  d'  une  poussette  canne  ,  ce  qui  veut  dire  qu'  une  fois  pliée  ,  sa  forme  fait  penser  à  une  canne  .",canne
2019,"Aide  de  28  millions  d'  euros  à  la  filière  canne  :  ""  Le  gouvernement  doit  sortir  de  son  silence  """,canne
2019,"Téréos  pourrait  se  retirer  de  la  Convention  canne  ,  soustraire  les  28  millions  d'  euros  de  la  recette  des  planteurs  ou  fermer  les  usines  du  Gol  et  de  Bois  Rouge  ,  alarme-t-il  rappelant  que  la  filière  représente  18  0  0  0  emplois  directs  et  indirects  .",canne
2019,Une  rencontre  qui  a  mis  exergue  un  manque  d'  anticipation  des  problèmes  rencontrés  aujourd  '  hui  par  la  filière  canne  .,canne
2019,A  cette  occasion  Madame  la  Ministre  tient  à  les  rassurer  sur  les  intentions  du  gouvernement  sur  la  question  des  28  millions  d'  aide  à  la  filière  canne  .,canne
2019,Elle  demande  au  gouvernement  de  respecter  l'  engagement  de  l'  État  à  verser  les  28  millions  d'  euros  prévus  dans  la  Convention  canne  signée  en  2017  .,canne
2019,"La  direction  de  la  CGPER  y  a  tenu  une  conférence  de  presse  pour  accentuer  la  mobilisation  en  faveur  de  la  survie  de  la  filière  canne  ,  menacée  par  la  non-inscription  de  l'  aide  compensatoire  à  la  suppression  des  quotas  sucriers  dans  le  Budget  2020  de  la  France  .",canne
2019,"""  Nous  demandons  que  l'  État  tienne  sa  parole  et  verse  les  28  millions  d'  euros  à  la  filière  canne  .",canne
2019,"Le  dirigeant  syndical  a  rappelé  que  si  l'  incertitude  persiste  ,  ""  Tereos  menace  de  dénoncer  la  Convention  canne  .",canne
2019,"Face  à  l'  inquiétude  des  salariés  des  usines  de  Bois  Rouge  et  du  Gol  ,  la  CGTR  exige  que  l'  état  assume  ""  ses  engagements  quant  au  versement  des  28  millions  d'  euros  promis  à  la  filière  canne  ,  lors  de  la  disparition  des  quotas  en  2017  ""  .",canne
2019,"La  ministre  a  tenu  à  rassurer  le  président  de  la  CCIR  ainsi  que  la  filière  sur  les  ""  intentions  ""  du  gouvernement  sur  le  versement  des  28  millions  d'  euros  d'  aide  à  la  filière  canne  .",canne
2019,"Compte  tenu  de  la  situation  sociale  de  l'  ile  de  La  Réunion  (  taux  de  chômage  30  %  ,  illettrisme  ,  pauvreté  ..  )  ,  la  CGTR  exige  que  l'  Etat  assume  pleinement  sa  signature  et  sa  responsabilité  dans  ses  engagements  quant  au  versement  des  28  millions  d'  euros  promis  à  la  filière  canne  ,  lors  de  la  disparition  des  quotas  en  2017  .",canne
2019,"Aide  compensatoire  à  la  filière  canne  en  2020  ,  la  réponse  connue  ""  très  prochainement  """,canne
2019,L'  aide  de  28  millions  d'  euros  allouée  à  la  filière  canne  sucre  est  toujours  en  réflexion  du  côté  du  gouvernement  ...,canne
2019,"Dans  cette  mention  ,  la  délégation  des  transporteurs  ,  signataire  du  document  ,  évoque  une  aide  absente  du  plan  de  finances  :  ""  Le  projet  de  loi  de  finances  doit  être  présenté  dans  quelques  jours  par  Bercy  (  ...  )  La  filière  canne  ne  figure  pas  ,  à  notre  connaissance  ,  dans  ce  projet  .",canne
2019,Lire  aussi  :  La  CCI  remet  une  motion  sur  la  filière  canne  à  Annick  Girardin,canne
2019,"Son  président  ,  Dominique  Clain  ,  est  catégorique  :  sans  aide  ,  les  18.300  emplois  directs  issus  de  la  filière  canne  sucre  sont  plus  que  menacés  ,  et  les  usines  de  Tereos  ""  mettront  la  clé  sous  la  porte  ""  .",canne
2019,"Ce  17  juillet  ,  date  de  l'  ouverture  de  la  campagne  sucrière  dans  le  Sud  et  l'  Ouest  ,  le  PCR  a  demandé  le  lancement  d'  une  concertation  associant  tous  les  acteurs  de  la  filière  canne  pour  travailler  à  un  projet  pour  préparer  l'  après  2021  ,  date  de  fin  de  l'  actuelle  Convention  canne  qui  fixe  les  revenus  des  planteurs  .",canne
2019,"L'  État  avait  alors  signé  une  Convention  canne  ,  où  une  aide  compensatoire  de  28  millions  d'  euros  par  an  avait  été  inscrite  .",canne
2019,"On  cannait  le  casting  quasi  complet  ,  le  voici  .",cannait
2019,"En  revanche  ,  toujours  rien  sur  les  38  millions  d'  euros  attendus  par  la  filière  canne  ,  aide  qu'  Emmanuel  Macron  s'  était  engagé  à  maintenir  .",canne
2019,"Les  ministres  ont  confirmé  le  maintien  des  aides  nationales  aux  filières  canne-sucre  dans  les  départements  d'  outre-mer  ,  pour  la  durée  des  conventions  canne  signées  en  Guadeloupe  et  à  La  Réunion  .",canne
2019,Le  gouvernement  vient  d'  annoncer  le  maintien  de  l'  enveloppe  destinée  à  la  filière  canne  .,canne
2019,"Pour  La  Réunion  ,  il  suffisait  en  effet  que  le  gouvernement  respecte  dès  le  départ  la  signature  de  l'  État  dans  la  Convention  canne  .",canne
2019,"Dans  la  foulée  ,  professionnels  et  élus  ont  été  reçus  par  Didier  Guillaume  qui  a  donc  confirmé  hier  ""  le  maintien  ,  pour  la  durée  des  conventions  canne  signées  en  Guadeloupe  et  à  La  Réunion  ,  des  aides  nationales  aux  filières  canne-sucre  dans  les  départements  d'  outre-mer  ""  .",canne
2019,Soulagement  à  La  Réunion  :  les  28  millions  d'  euros  d'  aide  maintenus  pour  la  filière  canne ,canne
2019,"Car  sans  les  28  millions  ,  les  planteurs  l'  ont  dit  très  clairement  :  c'  est  la  catastrophe  assurée  ,  et  assurément  la  fin  de  la  filière  canne  .",canne
2019,Un  parcours  canne  à  l'  aveugle  pour  tous  avec  l'  association  des  paralysés  de  France  est  mis  en  place  .,canne
2019,"Syndicats  ,  chambres  consulaires  dont  la  CCIR  ,  parlementaires  sont  montés  au  créneau  pour  demander  le  maintien  d'  une  aide  vitale  non  seulement  pour  la  filière  canne  mais  pour  toute  l'  économie  locale  .",canne
2019,Maintien  des  aides  nationales  pour  la  filière  canne  :  Le  ouf  de  soulagement  du  monde  économique  et  politique,canne
2019,"L'  impact  de  cette  disparition  sur  la  filière  canne  ,  les  transporteurs  et  ,  par  ricochet  ,  sur  l'  économie  locale  aurait  été  catastrophique  .",canne
2019,Maintien  de  aides  pour  la  filière  canne  :  Nadia  Ramassamy  satisfaite,canne
2019,Filière  canne  :  le  PCR  renouvelle  sa  demande  d'  une  conférence  extraordinaire,canne
2019,"Dès  ce  moment  ,  le  PCR  a  proposé  de  ""  Réunir  d'  urgence  une  conférence  extraordinaire  pour  préparer  l'  échéance  de  2017  et  ouvrir  de  nouvelles  perspectives  pour  la  filière  canne  par  la  recherche  ,  l'  innovation  et  la  valorisation  de  tous  les  produits  issus  de  la  canne  et  par  un  nouveau  partage  des  richesses  découlant  de  ces  valorisations  ""  .",canne
2019,L'  aide  va  être  inscrite  au  budget  2020  :  la  Réunion  va  bien  bénéficier  des  28  millions  d'  euros  prévus  depuis  2017  selon  les  termes  de  la  convention  canne  .,canne
2019,Nous  portons  le  projet  de  la  canne  énergie  depuis  2017  :  une  étude  est  en  cours  sur  la  faisabilité  d'  une  filière  canne  fibre  .,canne
2019,"En  2018  ,  le  segment  sucre  et  éthanol  d'  Omnicane  a  accusé  des  pertes  de  Rs  365,8  millions  contre  des  pertes  de  Rs  318,2  millions  l'  année  d'  avant  alors  que  le  cluster  canne  d'  Alteo  a  enregistré  des  pertes  opérationnelles  de  Rs  271,9  millions  pour  l'  année  dernière  .",canne
2019,Elle  reste  le  principal  acteur  de  la  filière  canne  à  sucre  à  La  Réunion  .,canne
2019,Aide  à  la  filière  canne  :  La  Production  Locale  Réunie  circonspecte,canne
2019,"""  Nous  avons  saisi  une  opportunité  ,  sans  aucune  volonté  de  nous  désengager  de  la  filière  canne  ,  explique  aux  ""  Echos  ""  son  président  Henri  Bédier  .",canne
2019,"Quatre  jours  après  un  communiqué  du  gouvernement  annonçant  le  maintien  pour  la  durée  de  la  Convention  canne  de  l'  aide  de  28  millions  d'  euros  à  la  filière  ,  et  demandant  aux  acteurs  concernés  de  faire  des  propositions  d'  ici  juillet  2020  pour  ""  bâtir  un  modèle  agricole  ""  ,  des  professionnels  de  l'  agroalimentaire  regroupés  dans  Production  locale  réunie  ont  réagi  de  manière  assez  virulente  .",canne
2019,"Le  18  juillet  dernier  ,  après  plusieurs  semaines  d'  incertitudes  ,  le  gouvernement  annonçait  la  reconduction  pour  la  filière  canne  de  l'  aide  annuelle  de  28  millions  d'  euros  dans  les  conditions  prévues  par  la  Convention  canne  signée  par  l'  État  .",canne
2019,Rappelons  que  la  Convention  canne  s'  applique  jusqu'  en  2021  .,canne
2019,"Parmi  ses  propositions  ,  le  PCR  préconisait  le  développement  des  énergies  renouvelables  ainsi  que  la  mise  à  contribution  de  la  filière  canne  dans  la  recherche  de  solutions  pour  aller  vers  l'  autonomie  énergétique  .",canne
2019,Colère  des  planteurs  et  réunion  d'  une  CMU  (  commission  mixte  d'  usine  )  en  fin  de  matinée  au  Pôle  canne  de  Bois-Rouge  .,canne
2019,La  CGPER  s'  interroge  sur  l'  avenir  de  la  filière  canne ,canne
2019,Les  28  millions  d'  aide  compensatoire  à  la  suppression  des  quotas  sucriers  en  outre-mer  seront  finalement  versés  l'  année  prochaine  à  la  filière  canne  réunionnaise  .,canne
2019,"Dans  un  communiqué  en  date  du  18  juillet  ,  le  ministère  de  l'  Agriculture  a  annoncé  le  maintien  de  l'  aide  compensatoire  à  la  suppression  des  quotas  sucriers  outre-mer  .  28  millions  d'  euros  seront  donc  versés  l'  année  prochaine  à  la  filière  canne  .",canne
2019,"""  Puis  il  faut  absolument  prendre  en  compte  son  équipement  :  quelle  canne  à  pêche  possède-t-on  ?  ""  ,  ajoute  Olivier  Frigon  .",canne
2019,"Un  communiqué  de  la  CGPER  diffusé  le  23  juillet  donne  la  position  du  syndicat  sur  le  communiqué  du  gouvernement  annonçant  le  maintien  de  l'  aide  de  28  millions  d'  euros  à  la  filière  canne  et  donnant  des  orientations  pour  un  ""  modèle  agricole  ""  .",canne
2019,"Le  18  juillet  dernier  ,  le  gouvernement  a  présenté  sa  position  sur  la  filière  canne  outre-mer  .",canne
2019,"A  la  Belle  Époque  (  1896  -  1914  )  ,  la  chaise  de  bistro  créée  par  Michael  Thonet  ,  en  bois  courbé  avec  assise  cannée  ,  va  démocratiser  la  technique  .",cannée
2019,"Les  Bretons  auraient  déjà  fait  le  voyage  pour  le  joueur  estimé  à  4,5  M  €  (  selon  Transfermarkt  )  et  entamé  les  négociations  avec  leurs  homologues  cannais  .",cannais
2019,"Là-bas  ,  ça  cannait  pas  mal  ,  on  buvait  dès  10  heures  le  matin  .",cannait
2019,"En  légende  de  cette  publication  ,  le  joueur  n'  a  pas  hésité  à  tacler  son  ex-compagne  :  ""  Déjeuner  avec  Mr  @  jeanpaulbelmondo_  #  classe  #  sagesse  #  mentor  #  legend  #  respect  #  n  1  #  jesuischanceux  #  amis  #  famille  #  goodvibes  #  only  #  paca  #  cannes  merci  @  jeffdomenech  80  le  sang  ...  s'  entourer  seulement  de  personnes  avec  des  bonnes  énergies  et  de  bons  conseils  #  merci  ☝  ️  ☝  ️  ""  ,  a-t-il  écrit  .",cannes
2019,"Birkenstock  ça  veut  dire  quoi  déjà  ?  Ça  veut  dire  ""  étage  de  bouleau  ""  ,  donc  rien  ,  ou  ""  bâton  de  bouleau  ""  ,  mieux  déjà  ,  ou  ""  canne  en  -  ou  de  -  bouleau  ""  ,  ce  qui  serait  déjà  plus  proche  de  la  vérité  :  ta  Birkenstock  ,  semelle  moelleuse  et  ergonomique  ,  elle  te  porte  ,  te  supporte  avec  sa  petite  semelle  intérieure  creuse  ,  la  voûte  plantaire  délicieusement  soutenue  par  le  fameux  bourrelet  ,  et  les  orteils  ont  aussi  un  petit  bourrelet  qui  les  soutient  ,  c'  est  que  du  bourrelet  ,  on  est  au  pays  du  bourrelet  décomplexé  du  cul  nu  ,  mais  ça  n'  a  rien  à  voir  avec  le  naturisme  si  ,  cette  affaire  de  bourrelet  ?  Si  ,  tu  vas  voir",canne
2019,"Dans  son  projet  Agri  Péi  2030  ,  le  Département  évoque  la  canne-énergie  (  canne  fibre  )  comme  une  ""  expérimentation  ""  à  mener  .",canne
2019,"D'  ici  là  ,  une  première  étude  macroéconomique  de  6  mois  doit  être  lancé  début  2020  sous  la  houlette  du  Cirad  avec  des  financements  de  l'  Etat  ,  du  Département  et  de  La  Région  pour  jauger  de  la  faisabilité  de  créer  une  filière  canne  énergie  (  canne  mixte  ou  canne  fibre  )  ,  pour  l'  instant  déployée  nulle  part  dans  le  monde  .",canne
2019,"Trois  scénarios  seront  étudiés  :  une  optimisation  du  modèle  actuel  avec  augmentation  de  la  part  fibre  /  bagasse  (  canne  mixte  )  sans  construction  d'  unité  spécifique  ,  la  création  partielle  d'  une  filière  canne  énergie  en  complément  de  la  filière  canne-sucre  avec  possible  centrale  dédiée  (  ordre  de  grandeur  :  2000  ha  pour  10  MW  correspondant  à  l'  alimentation  de  22  0  0  0  foyers  )  ou  un  scénario  ""  tout  énergie  ""  .",canne
2019,"Si  un  scénario  100  %  canne  énergie  semble  difficile  (  voir  par  ailleurs  )  ,  une  expérimentation  est  jugée  nécessaire  par  les  élus  concernant  le  déploiement  de  petites  usines  de  production  canne  énergie  (  canne  fibre  )  ,  sur  le  modèle  de  l'  usine  biomasse  de  Quadran  devant  sortir  de  terre  en  Guadeloupe  .",canne
2019,"Quadran  entend  les  poursuivre  afin  de  valider  la  faisabilité  de  développer  une  filière  canne  énergie  qui  pourrait  d'abord  prendre  la  forme  d'  une  usine  ""  test  ""  (  une  usine  de  4  MW  est  inscrite  dans  la  PPE  à  l'  horizon  2028  )  .",canne
2019,"Alors  que  l'  Etat  a  appelé  la  filière  à  ""  s'  adapter  ""  ,  une  étude  doit  déterminer  la  faisabilité  de  développer  une  filière  canne  énergie  dans  l'  île  .",canne
2019,L'  avenir  de  la  filière  canne  fait  également  la  Une  du  JIR  .,canne
2019,"""  Trois  scénarios  pour  la  canne  ""  ,  dont  le  développement  de  la  filière  canne  /  énergie  .",canne
2019,Son  agilité  et  sa  puissance  seront  des  atouts  majeurs  pour  le  RC  CANNES  la  saison  prochaine  informe  le  club  sur  son  site  .,cannes
2019,"Entre  le  retard  pris  dans  l'  inscription  de  l'  aide  de  28  millions  d'  euros  pour  la  filière  canne  ,  l'  incertitude  sur  la  déclinaison  financée  par  l'  État  du  POSEIDOM  ,  et  la  concurrence  des  importations  ,  l'  agriculture  est  au  bord  de  l'  explosion  ,  avait  souligné  Patrick  Hoarau  ,  représentant  de  la  Fédération  réunionnaise  des  coopératives  agricoles  .",canne
2019,"C'  est  aussi  un  important  employeur  ,  avec  près  de  18.000  emplois  directs  et  indirects  rien  que  pour  la  filière  canne  .",canne
2019,"La  crème  apaisante  Canna  Hemptm  CBD  a  été  nommée  ""  Meilleure  crème  topique  ""  par  Leafy  dans  la  catégorie  Best  in  State  :  The  Top  State  Specific  Products  and  Experiences  of  2018  .  http://www.cannahemp.com",canna
2019,"Je  ne  cannais  pas  ses  publications  et  son  mode  de  travail  ""  .",cannais
2019,"La  poussette  canne  Lara  de  chez  Bébé  Confort  est  à  retrouver  en  5  coloris  et  au  prix  de  189,99  €  sur  Amazon  .",canne
2019,"En  effet  ,  l'  agriculture  biologique  est  voué  à  s'  étendre  ,  l'  autonomie  alimentaire  de  l'  îl  doit  être  assurer  ,  le  développement  des  jardins  partagés  et  la  prochaine  révolution  de  la  filière  canne  énergie  nécessite  des  besoins  supplémentaire  en  surface  agricole  .",canne
2019,"Pour  promener  bébé  en  toute  tranquillité  lorsqu'  il  /  elle  ne  sait  pas  encore  marcher  ou  qu'  il  /  elle  en  a  marre  de  trainer  des  pieds  ,  avoir  une  poussette  canne  ,  c'  est  parfait  !  Compacte  ,  légère  et  facile  à  transporter  ,  la  poussette  canne  est  la  meilleure  alliée  durant  les  premières  années  de  bébé  .",canne
2019,"Retrouvez  la  poussette  canne  London  Up  Chicco  sur  Amazon  en  rouge  ,  noir  et  bleu  .",canne
2019,"La  poussette  canne  Shopper  Neo  II  ,  c'  est  la  poussette  parfaite  pour  les  balades  en  ville  et  pour  les  parents  accros  du  shopping  .",canne
2019,"La  poussette  canne  de  voyage  de  la  marque  Bersey  est  à  shopper  sur  Amazon  pour  139,99  €  .",canne
