year,sentence,key_word
2018,"Au-dessus  du  parc  ,  il  y  a  d'ailleurs  une  rangée  de  marronniers  célèbres  appelée  La  Treille  :  depuis  1818  je  crois  ,  l'  un  de  ces  arbres  sert  officiellement  à  indiquer  le  premier  jour  du  printemps  qui  est  consigné  dans  un  registre  de  la  ville  .",marronniers
2018,"Cela  se  passe  ainsi  :  la  sautière  de  la  République  examine  chaque  jour  ,  dès  avril  ,  le  marronnier  en  question  puis  annonce  officiellement  la  première  feuille  ,  et  il  y  a  toute  une  cérémonie  dont  les  journaux  parlent  .",marronnier
2018,"Le  restaurant  ""  Les  Marronniers  ""  ouvert",marronniers
2018,"Les  politiques  publiques  ont  aussi  leurs  marronniers  ,  ces  chantiers  rouverts  tous  les  quatre  ou  cinq  ans  ,  mais  qui  donnent  l'  impression  de  ne  jamais  avancer  :  les  retraites  ,  l'  Education  nationale  ,  le  droit  du  travail  ,  la  formation  professionnelle  .",marronniers
2018,"Il  s'  agit  de  ce  que  l'  on  peut  appeler  un  ""  marronnier  diplomatique  ""  ,  qui  réside  dans  l'  imminente  présentation  du  rapport  périodique  du  secrétaire  général  de  l'  ONU  sur  la  situation  au  Sahara  marocain  .",marronnier
2018,"Le  logement  étant  situé  dans  une  tour  de  la  rue  des  Marronniers  ,  impossible  pour  elle  de  s'  échapper  .",marronniers
2018,"Vers  9  heures  ,  un  marronnier  d'  Inde  du  square  des  Martyrs  de  la  Déportation  ,  s'  était  brisé  de  la  même  façon  et  abattu  en  travers  de  la  promenade  piétonne  et  l'  une  des  voies  de  circulation  de  la  rue  Sommeiller  .",marronnier
2018,"Du  café  de  1900  au  bar  d'  aujourd  '  hui  ,  des  bals  d'  alors  aux  soirées  actuelles  ,  Les  Marronniers  ,  baptisés  ainsi  en  1783  ,  traversent  l'  histoire  .",marronniers
2018,"C'  est  en  1783  que  le  cocher  d'  un  colonel  napoléonien  nomme  les  lieux  Les  Marronniers  ,  en  raison  d'  un  beau  parc  situé  derrière  la  bâtisse  et  orné  de  nombreux  et  majestueux  marronniers  .",marronniers
2018,"À  partir  de  1900  ,  le  café  Les  Marronniers  abrite  un  relais  de  fiacre  .",marronniers
2018,"En  1969  ,  la  famille  Gaudié  reprend  l'  affaire  dans  son  jus  et  procède  à  une  rénovation  complète  ,  tant  à  l'  intérieur  qu'  à  l'  extérieur  ,  en  abattant  les  marronniers  pour  favoriser  le  stationnement  .",marronniers
2018,"Viennent  ensuite  les  pins  ,  les  platanes  ,  les  marronniers  et  surtout  la  pariétaire  une  petite  plante  qui  pousse  partout  sur  bassin  Méditerranéen  .",marronniers
2018,"La  limitation  à  80  kilomètres-heure  ?  ""  Sans  oublier  le  racket  des  radars  automatiques  ,  un  autre  marronnier  du  13  heures  .",marronnier
2018,"Le  marronnier  du  Small  Business  Act  revient  aussi  régulièrement  ,  et  avec  lui  ,  celui  de  la  commande  publique  .",marronnier
2018,"Car  le  20  h  de  France  2  remplit  le  bingo  des  marronniers  sur  les  grèves  :  usagers  ""  exaspérés  ""  ,  étudiants  privés  d'  examens  ,  entreprises  pénalisées  ...",marronniers
2018,Pierre  Desproges  est  lui-même  un  marronnier  .,marronnier
2018,"Les  élus  ont  décidé  d'  organiser  des  réunions  de  travail  regroupant  diverses  commissions  (  fleurissement  ,  travaux  ,  cimetière  )  afin  d'  envisager  un  aménagement  durable  des  entrées  de  la  commune  ,  du  cimetière  et  de  la  place  des  marronniers  .",marronniers
2018,"En  journalisme  ,  on  appelle  ça  un  marronnier  :  une  information  qui  revient  chaque  année  à  la  même  période  .",marronnier
2018,"Le  marronnier  en  question  est  ,  en  fait  ,  le  bouleau  .",marronnier
2018,"Joliane  Plante  ,  20  ans  ,  habite  depuis  janvier  dans  un  trois  et  demi  ,  chauffé  ,  éclairé  et  câblé  ,  à  la  résidence  Les  Marronniers  de  Trois-Rivières  .",marronniers
2018,"Les  marronniers  ont  déjà  leurs  grandes  feuilles  ,  alors  qu'  elles  sont  encore  toute  petites  sur  les  platanes  .",marronniers
2018,"Toutes  ces  données  sont  disponibles  depuis  2014  sur  le  portail  Parisdata  ,  qui  présente  la  localisation  précise  de  tous  les  arbres  recensés  dans  les  espaces  publics  ,  correspondant  à  près  de  190  espèces  différentes  (  80  %  de  feuillus  et  20  %  de  conifères  )  ,  dont  les  plus  importantes  sont  des  platanes  ,  marronniers  ,  tilleuls  ,  érables  ,  sophoras  ,  etc  .",marronniers
2018,"Depuis  le  mois  de  février  ,  l'  étudiante  loge  gratuitement  à  la  résidence  Les  Marronniers  à  Trois-Rivières  ,  en  échange  de  10  heures  de  bénévolat  par  semaine  .",marronniers
2018,"En  terres  vaudoises  ,  c'  est  devenu  un  marronnier  comptable  .",marronnier
2018,Les  restes  d'  un  marronnier  .,marronnier
2018,La  soirée-concert  organisée  par  le  bar  Les  marronniers  a  plongé  l'  assistance  dans  l'  ambiance  des  plus  grandes  chansons  française  des  années  70  -  80  samedi  soir  .,marronniers
2018,"Les  marronniers  souhaitent  instaurer  des  soirées  concerts  variées  à  l'  image  de  la  prochaine  ,  samedi  5  mai  ,  à  partir  de  20  heures  ,  avec  une  spéciale  Claude  François  par  Franck  Ralliard  .",marronniers
2018,"Une  quantité  incroyable  d'  arbres  produisent  des  fleurs  blanches  :  pommiers  ,  cerisiers  ,  marronniers  ,  cornus  ,  aubépine  ,  magnolias  .",marronniers
2018,"(  ...  )  Attention  ,  ne  confondez  pas  avec  le  marronnier  !  Aux  forêts  et  bois  ,  le  châtaignier  ,  aux  arbres  isolés  ,  le  marronnier  .",marronnier
2018,"Les  marronniers  se  parent  de  fleurs  aux  teintes  de  roses  ,  les  seringas  font  éclore  des  parfums  subtils  ,  les  genêts  resplendissent  de  couleurs  chaleureuses  ...",marronniers
2018,"L'  encouragement  à  la  vente  avec  un  objectif  de  parvenir  à  40.000  ventes  annuelles  dans  le  parc  social  aux  locataires  ou  autres  bailleurs  est  un  objectif  ambitieux  (  mais  aussi  un  marronnier  )  ,  étant  donné  toutes  les  contraintes  qui  reposent  sur  ces  ventes  et  en  premier  lieu  le  respect  des  25  %  de  logements  sociaux  dans  les  zones  urbaines  ,  sur  lequel  le  gouvernement  ,  à  tort  ,  ne  souhaite  pas  revenir  .",marronnier
2018,"""  Je  voulais  éviter  les  marronniers  ,  on  a  déjà  beaucoup  entendu  parler  du  gâchis  d'  argent  .",marronniers
2018,"On  pourrait  presque  parler  de  marronnier  tant  l'  information  revient  souvent  :  Facebook  censure  régulièrement  des  œuvres  d'  art  comportant  de  la  nudité  ,  à  l'  image  de  La  Liberté  guidant  le  peuple  de  Delacroix  .",marronnier
2018,"Parmi  les  activités  du  sautier  de  la  République  ,  l'  inscription  de  l'  éclosion  de  la  première  feuille  de  marronnier  est  la  seule  connue  du  grand  public  .",marronnier
2018,"""  Depuis  2016  ,  le  marronnier  officiel  se  trouve  devant  la  tour  Baudet  ,  ce  qui  rend  l'  observation  plus  aisée  ""  ,  explique  le  sautier  .",marronnier
2018,Le  marronnier  officiel  est  reconnaissable  à  sa  barrière  protectrice  munie  d'  une  plaque  explicative  .,marronnier
2018,"C'  est  bien  de  botanique  qu'  il  s'  agit  ,  car  le  marronnier  n'  est  pas  n'  importe  quel  arbre  .",marronnier
2018,"Sur  la  Treille  ,  il  y  a  des  marronniers  depuis  1720  .",marronniers
2018,"On  appelle  souvent  ces  arbres  ""  marronniers  d'  Inde  ""  ,  mais  c'  est  une  vieille  bourde  du  ""  Dictionnaire  de  l'  Académie  française  ""  ,  qui  avait  confondu  le  marronnier  acclimaté  chez  nous  avec  son  lointain  cousin  du  nord  de  l'  Inde  .",marronniers
2018,"""  On  a  doublé  sa  capacité  ce  qui  nous  permet  de  proposer  35  couverts  devant  plutôt  que  sous  le  seul  marronnier  ,  à  l'  arrière  ""  ,  avec  40  couverts  ,  poursuit  le  chef  .",marronnier
2018,"En  journalisme  ,  c'  est  ce  qu'  on  appelle  un  marronnier  ,  c'est-à-dire  un  sujet  qui  revient  systématiquement  chaque  année  .",marronnier
2018,"En  ce  1  er  mai  ,  le  marronnier  du  jour  ,  c'  est  évidemment  le  muguet  .",marronnier
2018,"Le  1  er  mai  ,  c'  est  aussi  et  toujours  le  Front  national  ,  le  père  ,  la  fille  ,  et  Jeanne  d'  Arc  ,  mais  cette  fois-ci  ,  Yael  Goosz  ,  on  sort  du  marronnier  politique  ...",marronnier
2018,"Il  privilégie  les  cerisiers  ,  les  marronniers  et  les  pommiers  des  jardins  .",marronniers
2018,Mai  68  :  le  beau  marronnier ,marronnier
2018,"Vous  faites  défiler  les  sujets  marronniers  du  JT  de  20  h  :  les  fournitures  scolaire  ,  les  compteurs  électriques  ,  le  baccalauréat  .",marronniers
2018,"En  bon  marronnier  ,  elle  revient  d'ailleurs  tous  les  dix  ans  ,  à  chaque  commémoration  de  Mai  68  .",marronnier
2018,Les  marronniers  de  l'  avenue  de  Madrid  sont  en  fleurs  .,marronniers
2018,"De  ma  poussette  ,  je  vois  la  cime  des  marronniers  qui  forme  un  toit  :  les  feuilles  vertes  sont  des  pointillés  abstraits  qui  clignotent  dans  la  blancheur  .",marronniers
2018,"Tous  les  dix  ans  ,  c'  est  presque  devenu  un  marronnier  journalistique  .",marronnier
2018,"C'  est  un  marronnier  qui  fonctionne  systématiquement  :  vos  enfants  risquent  un  grand  danger  avec  les  tablettes  ,  les  ordinateurs  et  les  smartphones  ;  les  écrans  les  font  courir  à  leur  perte  ;  cette  génération  va  exploser  en  vol  .",marronnier
2018,"Les  Marronniers  se  sont  transformés  en  salle  de  concert  ,  samedi  soir  ,  pour  la  soirée  spéciale  Claude  François  .",marronniers
2018,"Les  marronniers  programment  une  prochaine  soirée  musicale  le  samedi  16  juin  ,  à  partir  de  20  heures  ,  avec  une  prestation  de  variétés  françaises  .",marronniers
2018,"On  exclura  donc  les  arbres  de  haut  jet  ,  à  fort  enracinement  (  marronnier  ,  cèdre  ,  érable  à  feuille  de  platane  ...  )  ,  à  l'  exception  de  formes  naines  comme  ce  hêtre  pleureur  très  rare  qui  trône  sur  le  balcon  de  Pierre-Alexandre  avec  d'  autres  arbustes  à  feuillage  caduc  situés  côté  nord  .",marronnier
2018,"Au  point  que  certains  profitent  de  leur  position  pour  proposer  des  chambres  contre  des  services  sexuels  (  c'  est  presque  devenu  un  marronnier  de  la  presse  ,  lire  par  exemple  l'  Express  ou  Néon  )  .",marronnier
2018,"La  course  cycliste  est  prévue  le  samedi  21  juillet  et  ,  tout  en  partant  allée  des  marronniers  ,  elle  fera  cette  fois  le  tour  de  la  gare  pour  passer  ensuite  par  la  Chapelle  ,  devant  la  mairie  et  remonter  au  point  de  départ  .",marronniers
2018,Cela  en  devient  un  marronnier  .,marronnier
2018,"Un  soir  tard  ,  il  fait  tiède  ,  et  les  marronniers  sont  en  fleur  autour  de  Denfert-Rochereau  ,  j'  ai  quitté  le  Quartier  latin  pour  rejoindre  à  pied  Montrouge  ,  où  se  trouvaient  les  studios  de  la  Radio-télévision  scolaire  .",marronniers
2018,"La  mise  en  commun  des  moyens  de  l'  Igloo  ,  du  foyer  des  Marronniers  et  du  Cllaj  permet  à  l'  association  Sillage  ,  de  proposer  430  logements  à  destination  de  jeunes  de  moins  de  30  ans  ,  étudiants  ,  travailleurs  ,  en  recherche  d'  emploi  ,  ou  parents  isolés  ,  à  Saint-Brieuc  et  dans  ses  environs  .",marronniers
2018,"Le  foyer  de  jeunes  travailleurs  l'  Igloo  ,  le  foyer  des  Marronniers  ,  et  le  Comité  local  pour  le  logement  autonome  des  jeunes  mettaient  en  commun  leurs  moyens  :  430  logements  ,  37  salariés  ,  une  restauration  à  même  de  fournir  330  repas  par  jour  ...",marronniers
2018,"Les  jeunes  sont  invités  à  participer  à  la  vie  de  la  résidence  quand  ils  sont  hébergés  à  l'  Igloo  ou  aux  Marronniers  ,  comme  Esteban  Gontier  ,  qui  travaille  actuellement  à  l'  Ehpad  des  Capucins  :  il  a  été  élu  délégué  et  représente  les  résidents  lors  des  réunions  avec  la  direction  .",marronniers
2018,"Dans  le  milieu  du  journalisme  ,  on  appelle  ça  un  marronnier  .",marronnier
2018,"Rivaux  ligotés  aux  marronniers  de  la  Porte  d'  Auteuil  ,  us  et  coutumes  vestimentaires  dépoussiérés  ,  il  promenait  à  la  vitesse  de  l'  éclair  son  short  corsaire  et  ses  tee-shirts  sans  manches  laissant  dorer  ses  biceps  solides  comme  des  câbles  d'  acier  ,  faisait  claquer  bruyamment  ses  coups  droits  lasso  et  tonner  ses  retours  flipper  .",marronniers
2018,Autre  marronnier  des  questions  posées  aux  Gafa  :  celle  des  impôts  .,marronnier
2018,"Vaste  sujet  en  France  ,  avec  un  marronnier  qui  revient  régulièrement  :  renforcer  le  Parlement  dans  son  rôle  constitutionnel  d'  évaluation  des  politiques  publiques  .",marronnier
2018,"C'  est  un  peu  comme  un  marronnier  pour  nous  ""  ,  explique  le  cabinet  de  Jean-Michel  Blanquer  ,  en  référence  à  ces  sujets  qui  fleurissent  périodiquement  dans  les  médias  .",marronnier
2018,"Mais  Bernard  Tournois  n'  a  pas  fini  de  nous  étonner  :  il  vient  de  sortir  son  premier  polar  aux  éditions  ""  Le  lys  bleu  ""  ,  intitulé  ""  Le  marronnier  ""  .",marronnier
2018,"Après  8  années  d'  absence  ,  Mylène  revient  dans  sa  ville  ,  suite  à  la  découverte  d'  un  bout  de  papier  trouvé  dans  la  cheminée  :  son  père  disparu  serait  enterré  sous  le  marronnier  du  jardin  .",marronnier
2018,"En  variant  avec  des  ornes  ,  des  marronniers  ,  des  noisetiers  ,  des  micocouliers  ,  on  diminue  la  quantité  de  pollen  ,  ce  qui  atténue  les  allergies  ""  .",marronniers
2018,"Tant  pis  pour  les  platanes  ,  les  hêtres  ,  les  chênes  ,  les  marronniers  .",marronniers
2018,"L'  occasion  de  se  balader  au  milieu  des  dix-sept  pièces  d'  eau  alimentées  par  les  quatorze  sources  du  jardin  et  d'  admirer  les  grandes  allées  de  pelouse  bordées  de  massifs  d'  arbres  (  marronniers  ,  chênes  ,  tilleuls  )  ,  ainsi  que  le  platane  remarquable  ""  Samuel  ""  ,  âgé  de  plus  de  240  ans  .",marronniers
2018,"C'  est  un  peu  comme  un  marronnier  pour  nous  ""  explique  le  ministère  de  Jean-Michel  Blanquer  .",marronnier
2018,"Les  costumes  somptueux  ,  les  chansons  pleines  de  fantaisie  ,  de  gaieté  ,  le  cadre  verdoyant  du  jardin  ,  les  marronniers  environnants  ,  le  soleil  contribuent  à  cette  ambiance  de  fête  ...",marronniers
2018,"Tout  autour  ,  les  marronniers  ,  les  tilleuls  offrent  un  décor  de  verdure  somptueux  à  cette  fête  des  couleurs  .",marronniers
2018,"Vide-greniers  organisé  par  la  commune  ,  avenue  des  Marronniers  et  place  du  Château  .",marronniers
2018,"Par  les  temps  jupitériens  ,  voici  un  classique  ,  Versailles  ,  et  un  marronnier  ,  Paris  .",marronnier
2018,"Endroit  romantique  par  excellence  ,  les  amoureux  peuvent  déambuler  en  se  tenant  par  la  main  ,  découvrir  les  diverses  espèces  d'  arbres  (  marronniers  ,  tilleuls  argentés  ,  noyers  ,  saules  pleureurs  )  et  admirer  la  vue  sur  le  Musée  du  Louvre  (  rive  droite  )  et  l'  hôtel  de  la  Monnaie  (  rive  gauche  )  .",marronniers
2018,Plusieurs  marronniers  dangereux  vont  être  abattus  à  Villefranche,marronniers
2018,"Sur  les  quatre-vingts  marronniers  expertisés  ,  huit  doivent  être  abattus  ,  sans  délai  ,  pour  des  raisons  de  sécurité  publique  .",marronniers
2018,"Au  pied  des  marronniers  ,  il  ne  fait  plus  donc  bon  vivre  .",marronniers
2018,"D'ailleurs  ,  l'  étude  de  l'  ONF  souligne  en  préambule  le  caractère  inadapté  des  marronniers  en  milieu  urbain  ,  ""  l'  arbre  étant  une  essence  à  croissance  rapide  et  peu  longévive  ,  compartimentant  peu  face  aux  agents  de  dégradation  du  bois  et  présentant  en  général  une  grande  inertie  dans  sa  réponse  à  un  stress  ou  à  une  blessure  ""  .",marronniers
2018,"Devant  la  mairie  ,  le  marronnier  gênait  pour  le  stationnement  (  il  porte  d'ailleurs  les  stigmates  de  plusieurs  accrochages  )  et  l'  espace  libéré  sera  conservé  tel  quel  .",marronnier
2018,"En  tout  cas  ,  ce  ne  sont  pas  des  marronniers  qui  seront  replantés  .",marronniers
2018,Le  Huffington  Post  Maghreb  considère  les  histoires  de  citoyens  arrêtés  ou  condamnés  pour  une  cigarette  ou  de  verres  d'  eau  ou  de  jus  d'  orange  consommés  en  pleine  journée  comme  étant  un  des  marronniers  de  la  presse  marocaine  .,marronniers
2018,"Raconter  les  énarques  est  un  marronnier  :  soit  des  journalistes  se  penchent  sur  la  jeunesse  des  Présidents  (  Giscard  ,  Chirac  ,  Hollande  et  Macron  )  ;  soit  des  sociologues  ,  qui  ne  se  lassent  pas  de  décortiquer  les  rites  ,  les  codes  et  les  fameux  ""  réseaux  ""  .",marronnier
2018,"À  Trois-Rivières  ,  la  résidence  Les  Marronniers  a  poussé  cette  idée  de  lieu  de  rencontre  encore  plus  loin  .",marronniers
2018,"Sur  le  même  sujet  :  Jack  Ma  (  Alibaba  Group  )  :  ""  Seulement  6  %  des  entreprises  ont  profité  de  la  mondialisation  ""  La  Banque  Mondiale  :  ""  La  mondialisation  a  mené  à  des  inégalités  ""  La  courbe  de  l'  éléphant  :  Le  marronnier  de  Davos",marronnier
2018,"Ce  jour-à  deux  équipes  de  tournage  opèreront  toute  la  journée  ,  d'abord  au  lieu  de  rassemblement  qui  est  la  place  des  Marronniers  à  Varaire  à  8  h  30  ,  ensuite  sur  les  4  sites  qui  ont  été  retenus  lors  du  repérage  (  Mas  Dalat  et  Joncas  à  Limogne  ,  Lac  de  Ju  à  Varaire  /  Limogne  et  du  ruisseau  de  Valses  au  ruisseau  de  Coubot  à  Vaylats  /  Lalbenque  /  Escamps  )  .",marronniers
2018," Marronniers  gigantesques  ,  pins  ,  chênes  et  séquoias  séculaires  peuplent  le  parc  .",marronniers
2018,"Ou  comme  le  résume  l'  ancien  ministre  Brice  Hortefeux  :  ""  L'  union  des  droites  ,  c'  est  le  marronnier  (  NDLR  :  un  sujet  qui  revient  régulièrement  dans  les  médias  )  ,  sauf  qu'  il  ne  fleurit  jamais  ""  .",marronnier
2018,C'  est  un  marronnier  médiatique  qui  repousse  tous  les  quatre  ans  :  la  science  du  foot  .,marronnier
2018,"Tout  le  défi  ,  pour  ne  pas  augmenter  la  facture  ,  était  de  mettre  en  valeur  le  patrimoine  existant  et  de  ne  changer  que  ce  qui  était  en  mauvais  état  explique  Donatien  Senly  ,  architecte  du  projet  :  ""  La  cour  était  saturée  ,  on  a  abattu  le  marronnier  qui  était  malade  pour  mettre  en  valeur  l'  arbre  de  Judée  .",marronnier
2018,"Parmi  les  solutions  naturelles  qui  marchent  pour  vous  débarrasser  des  araignées  ,  on  compte  le  marronnier  d'  inde  .",marronnier
2018,"En  réalité  ,  c'  est  l'  un  des  marronniers  du  mois  du  juin  .",marronniers
2018,Le  reportage  à  Clisson  est  devenu  un  marronnier  des  JT  .,marronnier
2018,Le  monument  aux  morts  quitte  les  Marronniers  en  1972  contre  l'  avis  des  anciens  combattants,marronniers
2018,"Dans  les  années  1970  ,  le  maire  ,  Jean-Marie  Comperat  ,  soucieux  d'  améliorer  l'  environnement  ,  souhaite  libérer  la  place  des  Marronniers  pour  l'  organisation  des  fêtes  de  village  .",marronniers
2018,"Dans  un  genre  qui  fait  recette  surtout  à  la  veille  de  l'  été  ,  unisexe  et  transgénérationnel  ,  un  marronnier  de  la  parfumerie  :  l'  eau  légère  aux  notes  d'  agrumes  et  de  fleurs  fraîchement  coupées  .",marronnier
2018,"Une  dizaine  de  platanes  ont  été  abattus  le  long  de  l'  avenue  de  Lausanne  ,  comme  les  marronniers  centenaires  de  la  rue  du  Prieuré  .",marronniers
2018,"La  question  du  système  ,  c'  est  un  peu  le  marronnier  de  l'  équipe  de  France  depuis  un  an  .",marronnier
2018,"Le  bac  donc  ,  un  marronnier  ,  comme  on  dit  dans  notre  jargon  journalistique  ,  abordé  sous  tous  les  angles  ,  y  compris  celui  incontournable  des  conseils  .",marronnier
2018,Un  trou  est  vite  repéré  au  pied  d'  un  grand  marronnier  .,marronnier
2018,"Un  accident  a  eu  lieu  ce  samedi  ,  vers  7  h  30  du  matin  ,  avenue  des  Marronniers  à  Fontaines-sur-Saône  .",marronniers
2018,SUD-Rail  a  décidé  de  participer  au  grand  marronnier  du  bac  .,marronnier
2018,"L'  enseignement  est  fait  de  routines  ,  le  journalisme  de  marronniers  .",marronniers
2018,"Contrairement  aux  grands  médias  pour  qui  une  information  chasse  l'  autre  et  qui  ""  oublient  ""  de  revenir  sur  les  sujets  traités  antérieurement  ...  excepté  pour  les  ""  marronniers  ""  qu'  ils  affectionnent  ,  je  vous  aide  à  nourrir  une  réflexion  sur  un  ""  temps  long  ""  et  reviens  donc  régulièrement  sur  des  points  que  j'  ai  déjà  abordés  .",marronniers
2018,"Capital  a  perdu  de  sa  superbe  depuis  l'  avènement  de  la  TNT  ,  tout  le  monde  vulgarise  l'  économie  du  coup  on  apprend  plus  grand  chose  ,  ça  plus  les  marronniers  habituels  ,  pas  sur  que  ça  soit  un  super  bon  plan  pour  Courbet",marronniers
2018,"""  Cet  arbre-là  que  vous  voyez  derrière  moi  ,  c'  est  un  arbre  tochi  (  marronnier  )  .",marronnier
2018,"J'  ai  grandi  avec  les  JT  de  20  h  et  leur  défilé  de  news  pendant  30  ou  45  minutes  ,  j'  ai  grandi  avec  les  marronniers  de  la  rentrée  des  classes  qui  durent  plus  longtemps  que  le  sujet  sur  la  guerre  en  Irak  ,  j'  ai  grandi  avec  ce  choix  complètement  arbitraire  des  nouvelles  ""  importantes  ""  et  celles  reléguées  en  fin  de  journal  .",marronniers
2018,"Sont  notamment  prévus  dans  ce  programme  la  rénovation  d'  un  parking  (  49  places  dont  9  nouvelles  )  avenue  Victor-Hugo  ,  en  face  du  petit  Jard  ,  la  mise  en  valeur  du  patrimoine  architectural  grâce  ŕ  un  îlot  végétalisé  et  ŕ  la  suppression  des  points  de  collecte  (  verres  et  cartons  )  ,  ou  encore  la  plantation  de  marronniers  et  le  revętement  des  trottoirs  par  des  pavés  en  granit  rose  et  gris  .",marronniers
2018,"À  tout  seigneur  tout  honneur  ,  commençons  par  évacuer  les  ""  marronniers  ""  de  l'  exercice  que  constituent  les  statistiques  relatives  à  la  pédopornographie  et  à  la  diffusion  de  contenus  faisant  l'  apologie  du  terrorisme  .",marronniers
2018,"L'  association  3  PA  Formation  vous  invite  à  la  cinquième  édition  du  Festival  AgitaTerre  Nous  vous  donnons  rendez-vous  le  dimanche  1  er  juillet  au  coeur  du  village  de  Poucharramet  (  31  )  ,  entre  la  place  des  Marronniers  et  La  Maison  de  la  Terre",marronniers
2018,Une  grosse  branche  se  détache  d'  un  marronnier  mort  (  Ouest-France  ),marronnier
2018,"Il  était  environ  13  h  ,  dimanche  ,  quand  cette  branche  est  tombée  d'  un  marronnier  mort  ,  sur  lequel  ne  pousse  plus  aucune  feuille  .",marronnier
2018,"Encore  un  visage  ,  ce  sont  toujours  des  visages  ,  là  toutes  les  phrases  marronniers  peuvent  s'  écrire  :  tenter  la  lumière  Renaissance  ,  la  photo  qui  se  prend  pour  une  peinture  de  quelques  siècles  en  arrière  ,  étrange  modernité  dans  la  répétition  d'  un  passé  académique  .",marronniers
2018,"Une  grosse  branche  d'  un  marronnier  s'  est  brusquement  rompue  peu  après  13  h  ,  tombant  sur  le  bord  de  l'  étang  .",marronnier
2018,"Des  marronniers  ,  une  place  gravillonnée  ,  une  belle  fontaine  et  un  muret  qui  s'  étire  en  arc  de  cercle  au-dessus  des  rochers  du  Léman  semblaient  attendre  depuis  des  décennies  une  raison  de  faire  s'  arrêter  les  promeneurs  .",marronniers
2018,"Parmi  ces  critères  ,  l'  un  nourrit  les  marronniers  des  journalistes  :  il  s'  agit  de  l'  apparence  physique  .",marronniers
2018,"Des  arbres  ,  plus  que  centenaires  ,  tels  que  marronniers  blancs  et  roses  ,  ifs  ,  magnolias  ,  charmes  hêtres  ,  noyers  ,  cèdres  ,  offrent  un  paysage  harmonieux  et  paisible  .",marronniers
2018,"Comme  les  marronniers  ,  ce  problème  refleurit  toujours  à  la  même  saison  .",marronniers
2018,"Dans  la  nuit  de  mardi  à  mercredi  ,  un  ou  plusieurs  individus  ont  cambriolé  le  bar-restaurant  Les  Marronniers  ,  situé  boulevard  de  Plaisance  à  Villeréal  .",marronniers
2018,"Alors  même  que  la  presse  papier  est  en  souffrance  ,  la  marronnier  continue  de  pousser  à  l'  achat  .",marronnier
2018,"Ce  n'  est  pas  leur  saison  ,  mais  les  ""  marronniers  ""  vont  bon  train  à  la  veille  des  grands  départs  en  vacances  .",marronniers
2018,"Remue-ménage  sur  la  place  du  Collège  ,  autour  du  fameux  marronnier  de  22  m  !",marronnier
